Authors,Author(s) ID,Title,Year,Source title,Volume,Issue,Art. No.,Page start,Page end,Page count,Cited by,DOI,Link,Affiliations,Authors with affiliations,Abstract,Author Keywords,Index Keywords,Document Type,Publication Stage,Access Type,Source,EID
"Rivals F., Mihlbachler M.C., Solounias N.","22136269300;6508245460;6602481505;","Effect of ontogenetic-age distribution in fossil and modern samples on the interpretation of ungulate paleodietes using the mesowear method",2007,"Journal of Vertebrate Paleontology","27","3",,"763","767",,86,"10.1671/0272-4634(2007)27[763:EOODIF]2.0.CO;2","https://www.scopus.com/inward/record.uri?eid=2-s2.0-34848902857&doi=10.1671%2f0272-4634%282007%2927%5b763%3aEOODIF%5d2.0.CO%3b2&partnerID=40&md5=93f59d10162caa332d144c924ecd9904","ICREA-IPHES Institut Catala de Paleoecologia Humana i Evolucio Social, Àrea de Prehistòria - Universitat Rovira i Virgili, Plaça Imperial Tarraco 1, 43005 Tarragona, Spain; Department of Anatomy, New York College of Osteopathic Medicine, Old Westbury, NY 11568, United States; Division of Vertebrate Paleontology, American Museum of Natural History, Central Park West at 79th Street, New York, NY 10024, United States","Rivals, F., ICREA-IPHES Institut Catala de Paleoecologia Humana i Evolucio Social, Àrea de Prehistòria - Universitat Rovira i Virgili, Plaça Imperial Tarraco 1, 43005 Tarragona, Spain; Mihlbachler, M.C., Department of Anatomy, New York College of Osteopathic Medicine, Old Westbury, NY 11568, United States, Division of Vertebrate Paleontology, American Museum of Natural History, Central Park West at 79th Street, New York, NY 10024, United States; Solounias, N., Department of Anatomy, New York College of Osteopathic Medicine, Old Westbury, NY 11568, United States, Division of Vertebrate Paleontology, American Museum of Natural History, Central Park West at 79th Street, New York, NY 10024, United States",[No abstract available],,"age structure; diet; fossil record; ontogeny; paleontology; tooth; ungulate; wear; Ungulata",Article,"Final",,Scopus,2-s2.0-34848902857
"Cucchi T., Hulme-Beaman A., Yuan J., Dobney K.","6506822509;36627224600;56988201600;6602595568;","Early Neolithic pig domestication at Jiahu, Henan Province, China: Clues from molar shape analyses using geometric morphometric approaches",2011,"Journal of Archaeological Science","38","1",,"11","22",,79,"10.1016/j.jas.2010.07.024","https://www.scopus.com/inward/record.uri?eid=2-s2.0-78049286754&doi=10.1016%2fj.jas.2010.07.024&partnerID=40&md5=0084c30bbeb6a2069f8cc45945a729b3","CNRS-Muséum National d'Histoire Naturelle, UMR 7209, Archéoozoologie, histoire des sociétés humaines et de peuplements animaux, 55 rue Buffon, 75005 Paris, France; Department of Archaeology, University of Aberdeen, St.Mary's Building, Elphinstone Road, United Kingdom; Department of Archaeology, University of Durham, South Road, Durham DH1 3LE, United Kingdom; Chinese Academy of Social Sciences, Institute of Archaeology, 27 Wangfujing Street, Beijing 100710, China","Cucchi, T., CNRS-Muséum National d'Histoire Naturelle, UMR 7209, Archéoozoologie, histoire des sociétés humaines et de peuplements animaux, 55 rue Buffon, 75005 Paris, France, Department of Archaeology, University of Aberdeen, St.Mary's Building, Elphinstone Road, United Kingdom; Hulme-Beaman, A., Department of Archaeology, University of Durham, South Road, Durham DH1 3LE, United Kingdom; Yuan, J., Chinese Academy of Social Sciences, Institute of Archaeology, 27 Wangfujing Street, Beijing 100710, China; Dobney, K., Department of Archaeology, University of Aberdeen, St.Mary's Building, Elphinstone Road, United Kingdom","The zooarchaeology of pig domestication in China is a challenging task due to its wild boar ancestors being widespread throughout Eurasia. However using geometric morphometric approaches on molar tooth (M2), shape and size variations, from modern and Neolithic suids, using Yangshao pigs as a surrogate for the Neolithic domestic form, we have addressed the identification of morphological change during the early step of domestication in three early Neolithic sites where claims of pig domestication have been made. Phenetic relationships here have revealed clear and interpretable phenotypic signatures in the samples of modern and Neolithic pigs; which provide evidence for pig domestication at the site of Jiahu from at least 6600 BC cal., re-establishing the Yellow River region as one of the earliest centre of independent Chinese pig domestication. © 2010 Elsevier Ltd.","Domestication; Geometric morphometrics; Morphology; Sliding semilandmarks; Sus scrofa; Teeth; Zooarchaeology","dentition; domestication; identification method; livestock farming; morphology; morphometry; Neolithic; phenotype; pig; tooth; China; Henan; Jiahu; Yellow River; Suidae; Sus scrofa",Article,"Final",,Scopus,2-s2.0-78049286754
"Baylac M.","","Rmorph: A R geometric and multivariate morphometrics library.",2012,"Rmorph: A R Geometric and Multivariate Morphometrics Library",,,,"","",,57,,,,"Baylac, M.",[No abstract available],,,,"Final",,Scopus,2-s2.0-55349130219
"Cucchi T., Fujita M., Dobney K.","6506822509;18041913000;6602595568;","New insights into pig taxonomy, domestication and human dispersal in Island South East Asia: Molar shape analysis of Sus remains from Niah Caves, Sarawak",2009,"International Journal of Osteoarchaeology","19","4",,"508","530",,55,"10.1002/oa.974","https://www.scopus.com/inward/record.uri?eid=2-s2.0-70349639859&doi=10.1002%2foa.974&partnerID=40&md5=22fe65c34585469109ab81e658b57e75","Department of Archaeology, University of Durham, South Road, Durham DH1 3LE, United Kingdom; UMR 5197, Département Ecologie et Gestion de la Biodiversité, Muséum National d'Histoire Naturelle, 55 rue Buffon, 75231 Paris Cedex 05, France","Cucchi, T., Department of Archaeology, University of Durham, South Road, Durham DH1 3LE, United Kingdom, UMR 5197, Département Ecologie et Gestion de la Biodiversité, Muséum National d'Histoire Naturelle, 55 rue Buffon, 75231 Paris Cedex 05, France; Fujita, M., Department of Archaeology, University of Durham, South Road, Durham DH1 3LE, United Kingdom; Dobney, K., Department of Archaeology, University of Durham, South Road, Durham DH1 3LE, United Kingdom","Despite the almost ubiquitous presence of Holocene Sus remains in Island South East Asia (ISEA), the domestication of pigs and their dispersal in this region remains somewhat confused. Using molar shape geometric morphometric analysis, archaeological Sus dental series from the Sarawak caves of Niah (Aceramic, Neolithic) and Lobang Kudih (Ming period), are compared with extant ISEA wild pigs to establish their taxonomic status and to further explore the evidence for local domestication or introduction of allochthonous populations. Results on modern data-sets show that outline analysis of the third lower molar achieves highly significant inter- and intra-specific differentiation among ISEA wild pigs, with a phenotypic divergence structure displaying congruence with molecular phylogenies. Both tooth shape and mtDNA evidence strongly suggest the so-called wild pigs of New Guinea to be the descendants of pigs domesticated in mainland South East Asia and introduced by early farmers to ISEA. None of our data provide clear evidence for a Neolithic introduction of domesticated pigs, or for the local domestication of indigenous bearded pigs, since all Aceramic and Neolithic pigs from Niah cave have been identified as indigenous bearded pig (Sus barbatus). Local domestication experiments by foragers have not been ruled out, since evidence of hypoplasia as a marker of domestication processes has been observed. Introduction of allochthonous domestic pigs between the Late Neolithic and the Metal Age is suggested, since this small domestic breed from Lobang Kudih cave displays strong phenetic relationships with S. scrofa of New Guinea, recognised by molecular phylogeography as part of the 'Pacific Clade' linked both with Lapita and Polynesian dispersals. Introduction of celebensis-like species has also been suggested. Future studies should incorporate broader time-scale and geographical framework data-sets to strengthen these assumptions. Copyright © 2008 John Wiley & Sons, Ltd.","Elliptic Fourier transform; Geometric morphometrics; Island South East Asia; Neolithic; Teeth; Zooarchaeology",,Article,"Final",,Scopus,2-s2.0-70349639859
"Olsen S.L.","7202565798;","Early horse domestication on the Eurasian steppe",2006,"Documenting Domestication: New Genetic and Archaeological Paradigms",,,,"245","269",,51,,"https://www.scopus.com/inward/record.uri?eid=2-s2.0-84887750834&partnerID=40&md5=492df58f64749409606f8816e2600a3a","Section of Anthropology, O'Neil Research Center, Carnegie Museum of Natural History, Pittsburgh, PA, United States","Olsen, S.L., Section of Anthropology, O'Neil Research Center, Carnegie Museum of Natural History, Pittsburgh, PA, United States",[No abstract available],,,Book Chapter,"Final",,Scopus,2-s2.0-84887750834
"McGahern A., Bower M.A.M., Edwards C.J., Brophy P.O., Sulimova G., Zakharov I., Vizuete-Forster M., Levine M., Li S., MacHugh D.E., Hill E.W.","14622787600;8968563800;7403062043;7102932802;7005532469;7202049481;6504048641;7404034828;8558285700;6602729818;7202000866;","Evidence for biogeographic patterning of mitochondrial DNA sequences in Eastern horse populations",2006,"Animal Genetics","37","5",,"494","497",,48,"10.1111/j.1365-2052.2006.01495.x","https://www.scopus.com/inward/record.uri?eid=2-s2.0-33748794498&doi=10.1111%2fj.1365-2052.2006.01495.x&partnerID=40&md5=c191f11e9d154c39b36b98fca97bf84c","Animal Genomics Laboratory, School of Agriculture, Food Science and Veterinary Medicine, University College Dublin, Belfield, Dublin 4, Ireland; McDonald Institute for Archaeological Research, Downing Street, Cambridge, CB2 3ER, United Kingdom; Smurfit Institute of Genetics, Trinity College, Dublin 2, Ireland; Vavilov Institute of General Genetics, Russian Academy of Sciences, Moscow V-333, 117809, Russian Federation; Department of Archaeology, Peking University, Beijing, 100871, China","McGahern, A., Animal Genomics Laboratory, School of Agriculture, Food Science and Veterinary Medicine, University College Dublin, Belfield, Dublin 4, Ireland; Bower, M.A.M., McDonald Institute for Archaeological Research, Downing Street, Cambridge, CB2 3ER, United Kingdom; Edwards, C.J., Smurfit Institute of Genetics, Trinity College, Dublin 2, Ireland; Brophy, P.O., Animal Genomics Laboratory, School of Agriculture, Food Science and Veterinary Medicine, University College Dublin, Belfield, Dublin 4, Ireland; Sulimova, G., Vavilov Institute of General Genetics, Russian Academy of Sciences, Moscow V-333, 117809, Russian Federation; Zakharov, I., Vavilov Institute of General Genetics, Russian Academy of Sciences, Moscow V-333, 117809, Russian Federation; Vizuete-Forster, M., McDonald Institute for Archaeological Research, Downing Street, Cambridge, CB2 3ER, United Kingdom; Levine, M., McDonald Institute for Archaeological Research, Downing Street, Cambridge, CB2 3ER, United Kingdom; Li, S., Department of Archaeology, Peking University, Beijing, 100871, China; MacHugh, D.E., Animal Genomics Laboratory, School of Agriculture, Food Science and Veterinary Medicine, University College Dublin, Belfield, Dublin 4, Ireland; Hill, E.W., Animal Genomics Laboratory, School of Agriculture, Food Science and Veterinary Medicine, University College Dublin, Belfield, Dublin 4, Ireland","Equine mitochondrial DNA (mtDNA) phylogeny reconstruction reveals a complex pattern of variation unlike that seen in other large domesticates. It is likely that this pattern reflects a process of multiple and repeated, although not necessarily independent, domestication events. Until now, no clear geographic affiliation of clades has been apparent. In this study, amova analyses have revealed a significant non-random distribution of the diversity among equine populations when seven newly sequenced Eurasian populations were examined in the context of previously published sequences. The association of Eastern mtDNA types in haplogroup F was highly significant using Fisher's exact test of independence (P = 0.00000). For the first time, clear biogeographic partitioning has been detected in equine mtDNA sequence. © 2006 The Authors.","Genetic diversity; Horse domestication; Mitochondrial DNA; Phylogeography; Polymorphism","mitochondrial DNA; animal; article; Asia; chemistry; DNA sequence; Europe; genetic variability; genetics; geography; haplotype; horse; phylogeny; Animals; Asia; DNA, Mitochondrial; Europe; Genetic Variation; Geography; Haplotypes; Horses; Phylogeny; Sequence Analysis, DNA; Variation (Genetics); Equidae; Equus caballus",Article,"Final",,Scopus,2-s2.0-33748794498
"Eisenmann V.","","Sur quelques caractères adaptatifs du squelette d'Equus (Mammalia, Perissodactyla) et leurs implications paléoécologiques",1984,"Bulletin Du Muséum National D'Histoire Naturelle",,"2",,"185","195",,38,,,,"Eisenmann, V.",[No abstract available],,,,"Final",,Scopus,2-s2.0-0004945133
"Bignon O., Baylac M., Vigne J.-D., Eisenmann V.","15135083300;6701570331;7006603465;6701396464;","Geometric morphometrics and the population diversity of Late Glacial horses in Western Europe (Equus caballus arcelini): Phylogeographic and anthropological implications",2005,"Journal of Archaeological Science","32","3",,"375","391",,37,"10.1016/j.jas.2004.02.016","https://www.scopus.com/inward/record.uri?eid=2-s2.0-14744301135&doi=10.1016%2fj.jas.2004.02.016&partnerID=40&md5=630477e2bd2a492c349532456c8998f7","CNRS UMR 5197, Museum Natl. d'Hist. Nat. Anatomie, 55 rue Buffon, F-75005 Paris, France; CNRS ESA 8043 MNHN, Departamento de Entomologie, 45 rue Buffon, F-75005 Paris, France; CNRS UMR 5143, UMR 5197, MNHN, 8 rue Buffon, F-75005 Paris, France","Bignon, O., CNRS UMR 5197, Museum Natl. d'Hist. Nat. Anatomie, 55 rue Buffon, F-75005 Paris, France; Baylac, M., CNRS ESA 8043 MNHN, Departamento de Entomologie, 45 rue Buffon, F-75005 Paris, France; Vigne, J.-D., CNRS UMR 5197, Museum Natl. d'Hist. Nat. Anatomie, 55 rue Buffon, F-75005 Paris, France; Eisenmann, V., CNRS UMR 5143, UMR 5197, MNHN, 8 rue Buffon, F-75005 Paris, France","In order to test the possibility of large migrations of wild horses between the North and the South of Western Europe during the Late Glacial, we addressed the population diversity in this area, especially during the Bölling/Alleröd periods. We based this appreciation upon the detailed morphology of the distal part of the metapodials. Landmark approaches were applied to archaeological and palaeontological samples from three distinct areas: Switzerland Plateau, Paris Basin, and Charente (France). Little differences of isometric size characterized the three regional samples. Multivariate analyses of shape (principal component analysis, discriminant, canonical variates and neural network analyses) revealed similar sets of complex shape features on both metacarpals and metatarsals. In addition, regional groups appeared clearly differentiated by well defined shape patterns, the functional implications of which remain to be established. These results evidence the existence of a regional structuration of populations (particularly clear on the CVA of both metacarpals and metatarsals) suggesting the absence of long distance migrations. Finally, it appears that the distinction between size and shape systematically operated by geometric morphometrics can provide better insights into the study of the mobility of ancient populations. Geometric morphometrics approaches such as 3D Procrustes superimpositions, appear therefore to be of great interest for archaeological purposes. © 2004 Elsevier Ltd. All rights reserved.","3D geometric morphometrics; Equus; Late Glacial; Magdalenian; Size and shape analyses; Western Europe","horse; late glacial; morphometry; Eastern Hemisphere; Eurasia; Europe; Western Europe; World; Equidae; Equus; Equus caballus; Procrustes",Article,"Final",,Scopus,2-s2.0-14744301135
"Lei C.Z., Su R., Bower M.A., Edwards C.J., Wang X.B., Weining S., Liu L., Xie W.M., Li F., Liu R.Y., Zhang Y.S., Zhang C.M., Chen H.","8648663300;57206381370;8968563800;7403062043;55736903800;57204594391;56688831000;55604915700;57214075538;57200962309;36055547400;56459166200;57050550100;","Multiple maternal origins of native modern and ancient horse populations in China",2009,"Animal Genetics","40","6",,"933","944",,35,"10.1111/j.1365-2052.2009.01950.x","https://www.scopus.com/inward/record.uri?eid=2-s2.0-70449411581&doi=10.1111%2fj.1365-2052.2009.01950.x&partnerID=40&md5=4f33610995ce3989e9ffa6056fecf1a1","Shaanxi Key Laboratory of Molecular Biology for Agriculture, College of Animal Science and Technology, Northwest A and F University, Yangling, Shaanxi 712100, China; Henan Veterinary Medicine Engineering and Technology Center, Luoyang, Henan 471000, China; Glyn Daniel Laboratory for Archaeogenetics, McDonald Institute for Archaeological Research, Downing Street, Cambridge CB2 3ER, United Kingdom; Smurfit Institute of Genetics, Trinity College, Dublin 2, Ireland; College of Agronomy, Northwest A and F University, Yangling, Shaanxi 712100, China; Archaeology Program, La Trobe University, Melbourne, VIC 3086, Australia; College of Animal Science and Technology, Guizhou University, Guiyang, Guizhou 550025, China; Institute of Cellular and Molecular Biology, Xuzhou Normal University, Xuzhou, Jiangsu 221116, China; RLAHA, University of Oxford, Dyson Perrins Building, South Parks Road, Oxford OX1 3QY, United Kingdom","Lei, C.Z., Shaanxi Key Laboratory of Molecular Biology for Agriculture, College of Animal Science and Technology, Northwest A and F University, Yangling, Shaanxi 712100, China; Su, R., Henan Veterinary Medicine Engineering and Technology Center, Luoyang, Henan 471000, China; Bower, M.A., Glyn Daniel Laboratory for Archaeogenetics, McDonald Institute for Archaeological Research, Downing Street, Cambridge CB2 3ER, United Kingdom; Edwards, C.J., Smurfit Institute of Genetics, Trinity College, Dublin 2, Ireland, RLAHA, University of Oxford, Dyson Perrins Building, South Parks Road, Oxford OX1 3QY, United Kingdom; Wang, X.B., Shaanxi Key Laboratory of Molecular Biology for Agriculture, College of Animal Science and Technology, Northwest A and F University, Yangling, Shaanxi 712100, China; Weining, S., College of Agronomy, Northwest A and F University, Yangling, Shaanxi 712100, China; Liu, L., Archaeology Program, La Trobe University, Melbourne, VIC 3086, Australia; Xie, W.M., Shaanxi Key Laboratory of Molecular Biology for Agriculture, College of Animal Science and Technology, Northwest A and F University, Yangling, Shaanxi 712100, China; Li, F., Shaanxi Key Laboratory of Molecular Biology for Agriculture, College of Animal Science and Technology, Northwest A and F University, Yangling, Shaanxi 712100, China; Liu, R.Y., College of Animal Science and Technology, Guizhou University, Guiyang, Guizhou 550025, China; Zhang, Y.S., Shaanxi Key Laboratory of Molecular Biology for Agriculture, College of Animal Science and Technology, Northwest A and F University, Yangling, Shaanxi 712100, China; Zhang, C.M., Shaanxi Key Laboratory of Molecular Biology for Agriculture, College of Animal Science and Technology, Northwest A and F University, Yangling, Shaanxi 712100, China; Chen, H., Shaanxi Key Laboratory of Molecular Biology for Agriculture, College of Animal Science and Technology, Northwest A and F University, Yangling, Shaanxi 712100, China, Institute of Cellular and Molecular Biology, Xuzhou Normal University, Xuzhou, Jiangsu 221116, China","To obtain more knowledge of the origin and genetic diversity of domestic horses in China, this study provides a comprehensive analysis of mitochondrial DNA (mtDNA) D-loop sequence diversity from nine horse breeds in China in conjunction with ancient DNA data and evidence from archaeological and historical records. A 247-bp mitochondrial D-loop sequence from 182 modern samples revealed a total of 70 haplotypes with a high level of genetic diversity. Seven major mtDNA haplogroups (A-G) and 16 clusters were identified for the 182 Chinese modern horses. In the present study, nine 247-bp mitochondrial D-loop sequences of ancient remains of Bronze Age horse from the Chifeng region of Inner Mongolia in China (c. 4000-2000a bp) were used to explore the origin and diversity of Chinese modern horses and the phylogenetic relationship between ancient and modern horses. The nine ancient horses carried seven haplotypes with rich genetic diversity, which were clustered together with modern individuals among haplogroups A, E and F. Modern domestic horse and ancient horse data support the multiple origins of domestic horses in China. This study supports the argument that multiple successful events of horse domestication, including separate introductions of wild mares into the domestic herds, may have occurred in antiquity, and that China cannot be excluded from these events. Indeed, the association of Far Eastern mtDNA types to haplogroup F was highly significant using Fisher's exact test of independence (P = 0.00002), lending support for Chinese domestication of this haplogroup. High diversity and all seven mtDNA haplogroups (A-G) with 16 clusters also suggest that further work is necessary to shed more light on horse domestication in China. © 2009 Stichting International Foundation for Animal Genetics.","Archaeology; Chinese horse; Haplogroup; Mitochondrial DNA D-loop; Origin","mitochondrial DNA; animal; article; China; classification; genetics; horse; mitochondrion; phylogeny; Animals; China; DNA, Mitochondrial; Horses; Mitochondria; Phylogeny; Equidae; Equus caballus",Article,"Final",,Scopus,2-s2.0-70449411581
"Eronen J.T., Evans A.R., Fortelius M., Jernvall J.","8910859500;55245839900;6701375676;6603722003;","The impact of regional climate on the evolution of mammals: A case study using fossil horses",2010,"Evolution","64","2",,"398","408",,25,"10.1111/j.1558-5646.2009.00830.x","https://www.scopus.com/inward/record.uri?eid=2-s2.0-75149165776&doi=10.1111%2fj.1558-5646.2009.00830.x&partnerID=40&md5=c0c01b4150e2b9bfd3ee6d51c35d70c5","Department of Geology, University of Helsinki, P.O. Box 64, FIN-00014, Finland; Institute of Biotechnology, University of Helsinki, P.O. Box 56, FIN-00014, Finland; School of Biological Sciences, Monash University, VIC 3800, Australia; Department of Ecology and Evolution, Stony Brook University, Stony Brook, NY 11794, United States","Eronen, J.T., Department of Geology, University of Helsinki, P.O. Box 64, FIN-00014, Finland; Evans, A.R., Institute of Biotechnology, University of Helsinki, P.O. Box 56, FIN-00014, Finland, School of Biological Sciences, Monash University, VIC 3800, Australia; Fortelius, M., Department of Geology, University of Helsinki, P.O. Box 64, FIN-00014, Finland, School of Biological Sciences, Monash University, VIC 3800, Australia; Jernvall, J., School of Biological Sciences, Monash University, VIC 3800, Australia, Department of Ecology and Evolution, Stony Brook University, Stony Brook, NY 11794, United States","One of the classic examples of faunal turnover in the fossil record is the Miocene transition from faunas dominated by anchitheriine horses with low-crowned molar teeth to faunas with hipparionine horses characterized by high-crowned teeth. The spread of hipparionine horses is associated with increased seasonality and the expansion of open habitats. It is generally accepted that anchitheriine horses did not display an evolutionary increase in tooth crown height prior to their extinction. Nevertheless, to test whether anchitheriines showed any changes interpretable as adaptation to local conditions, we analyzed molar teeth from multiple populations of Anchitherium in three dimensions. Our results show differences in tooth morphology that suggest incipient hypsodonty in Spain, the first region experiencing increasingly arid conditions in the early Miocene of Europe. Furthermore, analyses of tooth wear show that Spanish specimens cluster with present ungulates that eat foliage together with grasses and shrubs, whereas German specimens cluster with present-day ungulates that eat mostly foliage. Taken together, even a taxon such as Anchitherium, with a long and successful history of forest adaptation, did respond to regional environmental changes in an adaptive manner. © 2009 The Society for the Study of Evolution.","Anchitherium; Dental durability; GIS; Miocene; Palaeodiet; Three-dimensional (3D) scanning; Tooth crown height; Tooth wear","adaptation; arid environment; climatic region; foliage; fossil record; GIS; grass; horse; Miocene; shrub; tooth; animal; article; climate; evolution; fossil; genetics; horse; tooth; Animals; Climate; Evolution; Fossils; Horses; Tooth; Spain; Anchitheriinae; Anchitherium; Equidae; Mammalia; Poaceae; Ungulata",Article,"Final",,Scopus,2-s2.0-75149165776
"FORSTEN A.","6701485437;","The small caballoid horse of the upper Pleistocene and Holocene",1988,"Journal of Animal Breeding and Genetics","105","1-6",,"161","176",,23,"10.1111/j.1439-0388.1988.tb00288.x","https://www.scopus.com/inward/record.uri?eid=2-s2.0-85017265192&doi=10.1111%2fj.1439-0388.1988.tb00288.x&partnerID=40&md5=c2f44c3fa9595884f5fda62146166afe","Zoological Institute, University of Helsinki, Finland","FORSTEN, A., Zoological Institute, University of Helsinki, Finland",[No abstract available],,,Article,"Final",,Scopus,2-s2.0-85017265192
