Authors,Author(s) ID,Title,Year,Source title,Volume,Issue,Art. No.,Page start,Page end,Page count,Cited by,DOI,Link,Affiliations,Authors with affiliations,Abstract,Author Keywords,Index Keywords,Document Type,Publication Stage,Access Type,Source,EID
"Bookstein F.L.","",[No title available],1991,"Morphometric Tools for Landmark Data: Geometry and Biology",,,,"","",,3980,,,,"Bookstein, F.L.",[No abstract available],,,,,,Scopus,2-s2.0-0003597817
"Dryden I.L., Mardia K.V.","",[No title available],1998,"Statistical Shape Analysis",,,,"","",,2639,,,,"Dryden, I.L.; Mardia, K.V.",[No abstract available],,,,,,Scopus,2-s2.0-0003489720
"Rohlf F.J., Slice D.","7003281107;6603334019;","Extensions of the procrustes method for the optimal superimposition of landmarks",1990,"Systematic Zoology","39","1",,"40","59",,2394,"10.2307/2992207","https://www.scopus.com/inward/record.uri?eid=2-s2.0-84860428591&doi=10.2307%2f2992207&partnerID=40&md5=74ce7a85fe27c8da218b0b8e0fbb6d49","Department of Ecology and Evolution, State University of New York at Stony Brook, Stony Brook, NY, 11794-5245, United States","Rohlf, F.J., Department of Ecology and Evolution, State University of New York at Stony Brook, Stony Brook, NY, 11794-5245, United States; Slice, D., Department of Ecology and Evolution, State University of New York at Stony Brook, Stony Brook, NY, 11794-5245, United States","Superimposition methods for comparing configurations of landmarks in two or more specimens are reviewed. These methods show differences in shape among specimens as residuals after rotation, translation, and scaling them so that they align as well as possible. A new method is presented that generalizes Siegel and Benson's (1982) resistant-fit theta-rho analysis so that more than two objects can be compared at the same time. Both least-squares and resistant-fit approaches are generalized to allow for affine transformations (uniform shape change). The methods are compared, using artificial data and data on 18 landmarks on the wings of 127 species of North American mosquitoes. Graphical techniques are also presented to help summarize the patterns of differences in shape among the objects being compared. © 1990 Society of Systematic Zoology.",,,Article,"Final",,Scopus,2-s2.0-84860428591
"Klingenberg C.P.","7004588456;","MorphoJ: An integrated software package for geometric morphometrics",2011,"Molecular Ecology Resources","11","2",,"353","357",,1769,"10.1111/j.1755-0998.2010.02924.x","https://www.scopus.com/inward/record.uri?eid=2-s2.0-78650839801&doi=10.1111%2fj.1755-0998.2010.02924.x&partnerID=40&md5=d30b5ebcfc053aa3854553146529e97f","Faculty of Life Sciences, University of Manchester, Michael Smith Building, Manchester M13 9PT, United Kingdom","Klingenberg, C.P., Faculty of Life Sciences, University of Manchester, Michael Smith Building, Manchester M13 9PT, United Kingdom","Increasingly, data on shape are analysed in combination with molecular genetic or ecological information, so that tools for geometric morphometric analysis are required. Morphometric studies most often use the arrangements of morphological landmarks as the data source and extract shape information from them by Procrustes superimposition. The MorphoJ software combines this approach with a wide range of methods for shape analysis in different biological contexts. The program offers an integrated and user-friendly environment for standard multivariate analyses such as principal components, discriminant analysis and multivariate regression as well as specialized applications including phylogenetics, quantitative genetics and analyses of modularity in shape data. MorphoJ is written in Java and versions for the Windows, Macintosh and Unix/Linux platforms are freely available from © 2010 Blackwell Publishing Ltd.","Geometric morphometrics; Multivariate statistics; Phylogeny; Procrustes superimposition; Quantitative genetics; Shape","article; computer interface; computer program; genetic procedures; instrumentation; multivariate analysis; phylogeny; Genetic Techniques; Multivariate Analysis; Phylogeny; Software; User-Computer Interface",Article,"Final",,Scopus,2-s2.0-78650839801
"James Rohlf F., Marcus L.F.","24518567800;7005305240;","A revolution morphometrics",1993,"Trends in Ecology and Evolution","8","4",,"129","132",,1268,"10.1016/0169-5347(93)90024-J","https://www.scopus.com/inward/record.uri?eid=2-s2.0-0242462501&doi=10.1016%2f0169-5347%2893%2990024-J&partnerID=40&md5=14afd83efbc93ae5f62d49a4829a5597","Dept of Ecology and Evolution, State University of New York, Stony Brook, NY 11794-5245, United States; Dept of Biology, Queen's College, CUNY, Flushing, NY 11367, United States","James Rohlf, F., Dept of Ecology and Evolution, State University of New York, Stony Brook, NY 11794-5245, United States; Marcus, L.F., Dept of Biology, Queen's College, CUNY, Flushing, NY 11367, United States","We are now in the midst of a revolution in morphometric methodology. The new approaches are more effective in capturing information about the shape of an organism and result in more powerful statistical procedures for testing for differences in s shape. They are also more effective in enabling a researcher to visualize differences in shape and in suggesting simple traditional measurements that could be used in future studies. In this review we emphasize applications to exploratory studies in taxonomy and evolution. © 1993.",,,Review,"Final",,Scopus,2-s2.0-0242462501
"Wolff J.","","The law of bone remodelling",1986,"The Law of Bone Remodelling",,,,"","",,903,,,,"Wolff, J.",[No abstract available],,,,,,Scopus,2-s2.0-0003474880
"Mitteroecker P., Gunz P.","6507135382;6506472733;","Advances in Geometric morphometrics",2009,"Evolutionary Biology","36","2",,"235","247",,576,"10.1007/s11692-009-9055-x","https://www.scopus.com/inward/record.uri?eid=2-s2.0-69449097227&doi=10.1007%2fs11692-009-9055-x&partnerID=40&md5=b3ed371cd9636aa0a4ab33d0e92745b7","Konrad Lorenz Institute for Evolution and Cognition Research, Adolf Lorenz Gasse 2, Altenberg A-3422, Austria; Department of Theoretical Biology, University of Vienna, Althanstrasse 14, Vienna A-1091, Austria; Department of Human Evolution, Max-Planck-Institute for Evolutionary Anthropology, Deutscher Platz 6, Leipzig D-04103, Germany","Mitteroecker, P., Konrad Lorenz Institute for Evolution and Cognition Research, Adolf Lorenz Gasse 2, Altenberg A-3422, Austria, Department of Theoretical Biology, University of Vienna, Althanstrasse 14, Vienna A-1091, Austria; Gunz, P., Department of Human Evolution, Max-Planck-Institute for Evolutionary Anthropology, Deutscher Platz 6, Leipzig D-04103, Germany","Geometric morphometrics is the statistical analysis of form based on Cartesian landmark coordinates. After separating shape from overall size, position, and orientation of the landmark configurations, the resulting Procrustes shape coordinates can be used for statistical analysis. Kendall shape space, the mathematical space induced by the shape coordinates, is a metric space that can be approximated locally by a Euclidean tangent space. Thus, notions of distance (similarity) between shapes or of the length and direction of developmental and evolutionary trajectories can be meaningfully assessed in this space. Results of statistical techniques that preserve these convenient properties-such as principal component analysis, multivariate regression, or partial least squares analysis-can be visualized as actual shapes or shape deformations. The Procrustes distance between a shape and its relabeled reflection is a measure of bilateral asymmetry. Shape space can be extended to form space by augmenting the shape coordinates with the natural logarithm of Centroid Size, a measure of size in geometric morphometrics that is uncorrelated with shape for small isotropic landmark variation. The thin-plate spline interpolation function is the standard tool to compute deformation grids and 3D visualizations. It is also central to the estimation of missing landmarks and to the semilandmark algorithm, which permits to include outlines and surfaces in geometric morphometric analysis. The powerful visualization tools of geometric morphometrics and the typically large amount of shape variables give rise to a specific exploratory style of analysis, allowing the identification and quantification of previously unknown shape features. © The Author(s) 2009.","Asymmetry; Form space; Kendall shape space; Procrustes; Semilandmarks; Thin-plate spline",,Article,"Final",Open Access,Scopus,2-s2.0-69449097227
"Hillson S.","",[No title available],2005,"Teeth",,,,"","",,496,,,,"Hillson, S.",[No abstract available],,,,"Final",,Scopus,2-s2.0-33747187288
"Vilà C., Leonard J.A., Götherström A., Marklund S., Sandberg K., Lidén K., Wayne R.K., Ellegren H.","7005843645;7402283113;6602916497;57213377399;7005946002;7003643642;7103101948;7006386997;","Widespread origins of domestic horse lineages",2001,"Science","291","5503",,"474","477",,311,"10.1126/science.291.5503.474","https://www.scopus.com/inward/record.uri?eid=2-s2.0-0035910491&doi=10.1126%2fscience.291.5503.474&partnerID=40&md5=f0335a98fc292cc05111cdd3f03a4878","Department of Evolutionary Biology, Uppsala University, Norbyvägen 18D, S-75236 Uppsala, Sweden","Vilà, C., Department of Evolutionary Biology, Uppsala University, Norbyvägen 18D, S-75236 Uppsala, Sweden; Leonard, J.A., Department of Evolutionary Biology, Uppsala University, Norbyvägen 18D, S-75236 Uppsala, Sweden; Götherström, A., Department of Evolutionary Biology, Uppsala University, Norbyvägen 18D, S-75236 Uppsala, Sweden; Marklund, S., Department of Evolutionary Biology, Uppsala University, Norbyvägen 18D, S-75236 Uppsala, Sweden; Sandberg, K., Department of Evolutionary Biology, Uppsala University, Norbyvägen 18D, S-75236 Uppsala, Sweden; Lidén, K., Department of Evolutionary Biology, Uppsala University, Norbyvägen 18D, S-75236 Uppsala, Sweden; Wayne, R.K., Department of Evolutionary Biology, Uppsala University, Norbyvägen 18D, S-75236 Uppsala, Sweden; Ellegren, H., Department of Evolutionary Biology, Uppsala University, Norbyvägen 18D, S-75236 Uppsala, Sweden","Domestication entails control of wild species and is generally regarded as a complex process confined to a restricted area and culture. Previous DNA sequence analyses of several domestic species have suggested only a limited number of origination events. We analyzed mitochondrial DNA (mtDNA) control region sequences of 191 domestic horses and found a high diversity of matrilines. Sequence analysis of equids from archaeological sites and late Pleistocene deposits showed that this diversity was not due to an accelerated mutation rate or an ancient domestication event. Consequently, high mtDNA sequence diversity of horses implies an unprecedented and widespread integration of matrilines and an extensive utilization and taming of wild horses. However, genetic variation at nuclear markers is partitioned among horse breeds and may reflect sex-biased dispersal and breeding.",,"mitochondrial DNA; allele; article; biodiversity; breeding; cell lineage; DNA sequence; gene mutation; genetic analysis; genetic variability; horse; mitochondrion; nonhuman; nucleotide sequence; priority journal; sequence analysis; species difference; Alleles; Animal Husbandry; Animals; Animals, Domestic; Animals, Wild; Breeding; DNA, Mitochondrial; Evolution; Female; Fossils; Genetics, Population; Haplotypes; Horses; Male; Microsatellite Repeats; Pedigree; Variation (Genetics); Equidae; Equus caballus",Article,"Final",,Scopus,2-s2.0-0035910491
"Adams D.C., Rohlf F.J., Slice D.E.","7404054540;7003281107;6603334019;","A field comes of age: Geometric morphometrics in the 21st century",2013,"Hystrix","24","1",,"","",,306,"10.4404/hystrix-24.1-6283","https://www.scopus.com/inward/record.uri?eid=2-s2.0-84875767161&doi=10.4404%2fhystrix-24.1-6283&partnerID=40&md5=4749c949d41fa0fce54c2e237c53f71c","Department of Ecology, Evolution, and Organismal Biology, Department of Statistics, Iowa State University, Ames IA, 50011, United States; Department of Ecology and Evolution, Stony Brook University, Stony Brook, NY, 11794-5245, United States; Department of Scientific Computing, Florida State University, Tallahassee, FL 32306, United States","Adams, D.C., Department of Ecology, Evolution, and Organismal Biology, Department of Statistics, Iowa State University, Ames IA, 50011, United States; Rohlf, F.J., Department of Ecology and Evolution, Stony Brook University, Stony Brook, NY, 11794-5245, United States; Slice, D.E., Department of Scientific Computing, Florida State University, Tallahassee, FL 32306, United States","Twenty years ago, Rohlf and Marcus proclaimed that a ""revolution in morphometrics"" was underway, where classic analyses based on sets of linear distances were being supplanted by geometric approaches making use of the coordinates of anatomical landmarks. Since that time the field of geometric morphometrics has matured into a rich and cohesive discipline for the study of shape variation and covariation. The development of the field is identified with the Procrustes paradigm, a methodological approach to shape analysis arising from the intersection of the statistical shape theory and analytical procedures for obtaining shape variables from landmark data. In this review we describe the Procrustes paradigm and the current methodological toolkit of geometric morphometrics. We highlight some of the theoretical advances that have occurred over the past ten years since our prior review (Adams et al., 2004), what types of anatomical structures are amenable to these approaches, and how they extend the reach of geometric morphometrics to more specialized applications for addressing particular biological hypotheses. We end with a discussion of some possible areas that are fertile ground for future development in the field. © 2013 Associazione Teriologica Italiana.","Morphology; Procrustes analysis; Shape analysis; Statistics",,Article,"Final",,Scopus,2-s2.0-84875767161
"Outram A.K., Stear N.A., Bendrey R., Olsen S., Kasparov A., Zaibert V., Thorpe N., Evershed R.P.","8954776500;24345454300;23096867700;7202565798;7005085553;57200796696;26323401100;7005538923;","The earliest horse harnessing and milking",2009,"Science","323","5919",,"1332","1335",,290,"10.1126/science.1168594","https://www.scopus.com/inward/record.uri?eid=2-s2.0-62149112479&doi=10.1126%2fscience.1168594&partnerID=40&md5=417fcc50814c3a994ccdaef0577490cb","Department of Archaeology, University of Exeter, Exeter, EX4 4QE, United Kingdom; School of Chemistry, University of Bristol, Bristol, BS8 1TS, United Kingdom; CNRS UNR 5197, Muséum Nationale d'Histoire Naturelle, Paris 75005, France; Carnegie Museum of Natural History, Pittsburgh, PA 15206-3706, United States; Institute for the History of Material Culture, RAS, St. Petersburg 191186, Russian Federation; Kokshetau University, 020000 Kokshetau, Akmolinsk Oblast, Kazakhstan; Department of Archaeology, University of Winchester, Winchester SO22 4NR, United Kingdom","Outram, A.K., Department of Archaeology, University of Exeter, Exeter, EX4 4QE, United Kingdom; Stear, N.A., School of Chemistry, University of Bristol, Bristol, BS8 1TS, United Kingdom; Bendrey, R., CNRS UNR 5197, Muséum Nationale d'Histoire Naturelle, Paris 75005, France, Department of Archaeology, University of Winchester, Winchester SO22 4NR, United Kingdom; Olsen, S., Carnegie Museum of Natural History, Pittsburgh, PA 15206-3706, United States; Kasparov, A., Department of Archaeology, University of Exeter, Exeter, EX4 4QE, United Kingdom, Institute for the History of Material Culture, RAS, St. Petersburg 191186, Russian Federation; Zaibert, V., Kokshetau University, 020000 Kokshetau, Akmolinsk Oblast, Kazakhstan; Thorpe, N., Department of Archaeology, University of Winchester, Winchester SO22 4NR, United Kingdom; Evershed, R.P., School of Chemistry, University of Bristol, Bristol, BS8 1TS, United Kingdom","Horse domestication revolutionized transport, communications, and warfare in prehistory, yet the identification of early domestication processes has been problematic. Here, we present three independent lines of evidence demonstrating domestication in the Eneolithic Botai Culture of Kazakhstan, dating to about 3500 B.C.E. Metrical analysis of horse metacarpals shows that Botai horses resemble Bronze Age domestic horses rather than Paleolithic wild horses from the same region. Pathological characteristics indicate that some Botai horses were bridled, perhaps ridden. Organic residue analysis, using δ13C and δD values of fatty acids, reveals processing of mare's milk and carcass products in ceramics, indicating a developed domestic economy encompassing secondary products.",,"carbon 13; fatty acid; Bronze Age; carbon isotope; ceramics; domestication; horse; milk; Paleolithic; pathology; article; Bronze Age; carcass; ceramics; domestication; horse; Kazakhstan; mare; mathematical computing; metacarpal bone; milk; Neolithic; nonhuman; Paleolithic; priority journal; Agriculture; Animal Husbandry; Animals; Animals, Domestic; Female; History, Ancient; Horses; Kazakhstan; Lipids; Metacarpal Bones; Milk; Molar; Seasons; Asia; Eurasia; Kazakhstan; West Asia; Equidae; Equus caballus",Article,"Final",,Scopus,2-s2.0-62149112479
"Bökönyi S.","",[No title available],1974,"History of Domestic Mammals in Central and Eastern Europe",,,,"","",,270,,,,"Bökönyi, S.",[No abstract available],,,,"Final",,Scopus,2-s2.0-0003688095
"Mitteroecker P., Bookstein F.","6507135382;7004606384;","Linear Discrimination, Ordination, and the Visualization of Selection Gradients in Modern Morphometrics",2011,"Evolutionary Biology","38","1",,"100","114",,258,"10.1007/s11692-011-9109-8","https://www.scopus.com/inward/record.uri?eid=2-s2.0-79952312407&doi=10.1007%2fs11692-011-9109-8&partnerID=40&md5=a203885ed176c161d1e98b742aeefbfc","Department of Theoretical Biology, University of Vienna, Althanstrasse 14, 1091 Vienna, Austria; Department of Anthropology, University of Vienna, Althanstrasse 14, 1091 Vienna, Austria; Department of Statistics, University of Washington, Padelford B-207, Seattle, WA 98195-4322, United States","Mitteroecker, P., Department of Theoretical Biology, University of Vienna, Althanstrasse 14, 1091 Vienna, Austria; Bookstein, F., Department of Anthropology, University of Vienna, Althanstrasse 14, 1091 Vienna, Austria, Department of Statistics, University of Washington, Padelford B-207, Seattle, WA 98195-4322, United States","Linear discriminant analysis (LDA) is a multivariate classification technique frequently applied to morphometric data in various biomedical disciplines. Canonical variate analysis (CVA), the generalization of LDA for multiple groups, is often used in the exploratory style of an ordination technique (a low-dimensional representation of the data). In the rare case when all groups have the same covariance matrix, maximum likelihood classification can be based on these linear functions. Both LDA and CVA require full-rank covariance matrices, which is usually not the case in modern morphometrics. When the number of variables is close to the number of individuals, groups appear separated in a CVA plot even if they are samples from the same population. Hence, reliable classification and assessment of group separation require many more organisms than variables. A simple alternative to CVA is the projection of the data onto the principal components of the group averages (between-group PCA). In contrast to CVA, these axes are orthogonal and can be computed even when the data are not of full rank, such as for Procrustes shape coordinates arising in samples of any size, and when covariance matrices are heterogeneous. In evolutionary quantitative genetics, the selection gradient is identical to the coefficient vector of a linear discriminant function between the populations before vs. after selection. When the measured variables are Procrustes shape coordinates, discriminant functions and selection gradients are vectors in shape space and can be visualized as shape deformations. Except for applications in quantitative genetics and in classification, however, discriminant functions typically offer no interpretation as biological factors. © 2011 Springer Science+Business Media, LLC.","Canonical variate analysis; Linear discriminant function; Ordination; Principal component analysis; Procrustes; Selection gradient",,Article,"Final",,Scopus,2-s2.0-79952312407
"Monteiro L.R.","7103010498;","Multivariate regression models and geometric morphometrics: The search for causal factors in the analysis of shape",1999,"Systematic Biology","48","1",,"192","199",,257,"10.1080/106351599260526","https://www.scopus.com/inward/record.uri?eid=2-s2.0-0033084978&doi=10.1080%2f106351599260526&partnerID=40&md5=d5de5cdefa57c1656189788e005fb8b9","Departamento de Zoologia, UNESP, caixa postal 199, Rio Claro, Sao Paulo, cep 13506-900, Brazil","Monteiro, L.R., Departamento de Zoologia, UNESP, caixa postal 199, Rio Claro, Sao Paulo, cep 13506-900, Brazil",[No abstract available],,"age; animal; article; body constitution; bone; histology; multivariate analysis; rat; regression analysis; statistical model; Age Factors; Animals; Body Constitution; Bone and Bones; Models, Statistical; Multivariate Analysis; Rats; Regression Analysis",Article,"Final",Open Access,Scopus,2-s2.0-0033084978
"Drake A.G., Klingenberg C.P.","23008538800;7004588456;","The pace of morphological change: Historical transformation of skull shape in St Bernard dogs",2008,"Proceedings of the Royal Society B: Biological Sciences","275","1630",,"71","76",,235,"10.1098/rspb.2007.1169","https://www.scopus.com/inward/record.uri?eid=2-s2.0-36349010900&doi=10.1098%2frspb.2007.1169&partnerID=40&md5=3cb68d1bf34d718e5f2de5e1b09bb978","Faculty of Life Sciences, University of Manchester, Michael Smith Building, Oxford Road, Manchester M13 9PT, United Kingdom; Institute of Evolutionary Biology, University of Edinburgh, West Mains Road, Edinburgh EH9 3JT, United Kingdom","Drake, A.G., Faculty of Life Sciences, University of Manchester, Michael Smith Building, Oxford Road, Manchester M13 9PT, United Kingdom, Institute of Evolutionary Biology, University of Edinburgh, West Mains Road, Edinburgh EH9 3JT, United Kingdom; Klingenberg, C.P., Faculty of Life Sciences, University of Manchester, Michael Smith Building, Oxford Road, Manchester M13 9PT, United Kingdom","Owing to the great morphological diversity of domestic dogs (Canis familiaris), the study of historical shape change in dog skulls provides an excellent opportunity for investigating the dynamics of morphological evolution. Breed standards make known which features were selected by breeders. Here we use the methods of geometric morphometrics to study change of skull shape in a series of purebred St Bernard dogs spanning nearly 120 years. A regression of shape on time was highly significant and revealed a consistent trend of shape change that corresponded to the features deemed desirable by the breed standard. Historical shape change in St Bernards involves a broadening of the skull and a tilting of the palate and upper jaw relative to the rest of the skull. This trend appears to be linear throughout the entire period and appears to be continuing. Allometry was ruled out as a contributing factor to this change because there was no consistent trend of historical change in skull size and because neither the patterns of static nor ontogenetic allometry corresponded to the historical shape change. The dramatic modification of the St Bernard skull demonstrates that selection can achieve sustained and substantial change and can completely overcome constraints such as allometry. © 2007 The Royal Society.","Allometry; Canis familiaris; Evolutionary rate; Geometric morphometrics; Procrustes analysis","allometry; canid; evolution; geometry; morphology; morphometry; skull; allometry; animal tissue; article; breed; controlled study; dog; geometry; history; maxilla; morphology; morphometrics; nonhuman; ontogeny; palate; priority journal; skull; Canis familiaris",Article,"Final",,Scopus,2-s2.0-36349010900
