Authors,Author(s) ID,Title,Year,Source title,Volume,Issue,Art. No.,Page start,Page end,Page count,Cited by,DOI,Link,Affiliations,Authors with affiliations,Abstract,Author Keywords,Index Keywords,Document Type,Publication Stage,Access Type,Source,EID
"Muttoni G., Scardia G., Kent D.V., Swisher C.C., Manzi G.","55945362800;15063403000;7202552559;35499926000;7003844476;","Pleistocene magnetochronology of early hominin sites at Ceprano and Fontana Ranuccio, Italy",2009,"Earth and Planetary Science Letters","286","1-2",,"255","268",,65,"10.1016/j.epsl.2009.06.032","https://www.scopus.com/inward/record.uri?eid=2-s2.0-69749104685&doi=10.1016%2fj.epsl.2009.06.032&partnerID=40&md5=bc3d95f9846547cc1f26a73351415914","Department of Earth Sciences, University of Milan, via Mangiagalli 34, I-20133 Milan, Italy; Istituto Nazionale di Geofisica e Vulcanologia, Sezione di Milano-Pavia, via Bassini 15, I-20133 Milano, Italy; Department of Earth and Planetary Sciences, Rutgers University, Piscataway, NJ 08854, United States; Lamont-Doherty Earth Observatory, Palisades, NY 10964, United States; Department of Animal and Human Biology, Università di Roma La Sapienza, Piazzale Aldo Moro 5, 00185 Roma, Italy","Muttoni, G., Department of Earth Sciences, University of Milan, via Mangiagalli 34, I-20133 Milan, Italy; Scardia, G., Istituto Nazionale di Geofisica e Vulcanologia, Sezione di Milano-Pavia, via Bassini 15, I-20133 Milano, Italy; Kent, D.V., Department of Earth and Planetary Sciences, Rutgers University, Piscataway, NJ 08854, United States, Lamont-Doherty Earth Observatory, Palisades, NY 10964, United States; Swisher, C.C., Department of Earth and Planetary Sciences, Rutgers University, Piscataway, NJ 08854, United States; Manzi, G., Department of Animal and Human Biology, Università di Roma La Sapienza, Piazzale Aldo Moro 5, 00185 Roma, Italy","Paleomagnetic analyses were conducted on two cores drilled at Ceprano in central Italy where an incomplete hominin cranium was discovered in 1994, as well as on two additional cores from the nearby site of Fontana Ranuccio that yielded hominin remains associated with an Acheulean industry. No evidence for the 0.78 Ma Brunhes-Matuyama boundary was found at Ceprano down to 45 m below the level that yielded the hominin cranium. The Ceprano lithostratigraphy and the paleomagnetic age constraints are broadly consistent with the stratigraphy of the Liri lacustrine sequence of the Latina Valley, constrained by published K-Ar ages between ~ 0.6 and ~ 0.35 Ma, and according to an age model with magnetic susceptibility supported by pollen facies data, suggest that the level that yielded the hominin cranium has an age of ~ 0.45 (+ 0.05, - 0.10) Ma. Evidence for the Brunhes-Matuyama boundary was found at Fontana Ranuccio about 40 m below the hominin level, consistent with a K-Ar age of ~ 0.46 Ma reported for this level. Hence the Ceprano and Fontana Ranuccio hominin occurrences may be of very similar mid-Brunhes age. © 2009 Elsevier B.V. All rights reserved.","Ceprano; Fontana Ranuccio; hominins; Italy; magnetostratigraphy; Pleistocene","Ceprano; Fontana Ranuccio; hominins; Italy; magnetostratigraphy; Pleistocene; Magnetic susceptibility; Stratigraphy; Brunhes chron; core analysis; cranium; hominid; human settlement; lacustrine environment; lithostratigraphy; magnetic susceptibility; magnetostratigraphy; paleomagnetism; Pleistocene; potassium-argon dating; Ceprano; Eurasia; Europe; Frosinone; Italy; Latina; Lazio; Southern Europe",Article,"Final",,Scopus,2-s2.0-69749104685
"Bräuer G.","","The 'Afro-European sapiens hypothesis' and hominid evolution in East Asia during the late Middle and Upper Pleistocene",1984,"Cour. Forsch.-Inst. Senckenberg","69",,,"145","165",,63,,,,"Bräuer, G.",[No abstract available],,,,"Final",,Scopus,2-s2.0-0000326903
"Bastir M., Rosas A., Lieberman D.E., O'Higgins P.","6603088960;7005126537;7202460412;7004722122;","Middle cranial fossa anatomy and the origin of modern humans",2008,"Anatomical Record","291","2",,"130","140",,61,"10.1002/ar.20636","https://www.scopus.com/inward/record.uri?eid=2-s2.0-41949133442&doi=10.1002%2far.20636&partnerID=40&md5=2b7e2b924a872ed4b65c2887459cf3e5","Department of Paleobiology, Museo Nacional de Ciencias Naturales, CSIC, c/Jose Gutierrez Abascal 2, 28006 Madrid, Spain; Department of Anthropology and Organismic, Department of Evolutionary Biology, Harvard University, Cambridge, MA, United States; Functional Morphology and Evolution Unit, Hull York Medical School, The University of York, Heslington, York, United Kingdom","Bastir, M., Department of Paleobiology, Museo Nacional de Ciencias Naturales, CSIC, c/Jose Gutierrez Abascal 2, 28006 Madrid, Spain; Rosas, A., Department of Paleobiology, Museo Nacional de Ciencias Naturales, CSIC, c/Jose Gutierrez Abascal 2, 28006 Madrid, Spain; Lieberman, D.E., Department of Anthropology and Organismic, Department of Evolutionary Biology, Harvard University, Cambridge, MA, United States; O'Higgins, P., Functional Morphology and Evolution Unit, Hull York Medical School, The University of York, Heslington, York, United Kingdom","Anatomically, modern humans differ from archaic forms in possessing a globular neurocranium and a retracted face and in cognitive functions, many of which are associated with the temporal lobes. The middle cranial fossa (MCF) interacts during growth and development with the temporal lobes, the midface, and the mandible. It has been proposed that evolutionary transformations of the MCF (perhaps from modification of the temporal lobes) can have substantial influences on craniofacial morphology. Here, we use three-dimensional (3D) geometric morphometrics and computer reconstructions of computed tomography-scanned fossil hominids, fossil and recent modern humans and chimpanzees to address this issue further. Mean comparisons and permutation analyses of scaled 3D basicranial landmarks confirm that the MCF of Homo sapiens is highly significantly different (P < 0.001) from H. neanderthalensis, H. heidelbergensis, and Pan troglodytes. Modern humans have a unique configuration with relatively more anterolateral projection of the MCF pole relative to the optic chiasm and the foramen rotundum. These findings are discussed in the context of evolutionary changes in craniofacial morphology and the origins of modern human autapomorphies. In particular, the findings of this study point to variations in the temporal lobe, which, through effects on tbe MCF and face, are central to the evolution of modern human facial form. © 2008 Wiley-Liss, Inc.","3D reconstructions; Geometric morphometrics; Human evolution; Lateral cranial base; Sphenoid; Temporal lobes","animal; anthropometry; article; comparative study; evolution; fossil; histology; human; middle cranial fossa; Pan troglodytes; Animals; Anthropometry; Cranial Fossa, Middle; Evolution; Fossils; Humans; Pan troglodytes",Article,"Final",,Scopus,2-s2.0-41949133442
"Rosas A.","7005126537;","Seventeen new mandibular specimens from the Atapuerca/Ibeas Middle Pleistocene Hominids sample (1985-1992)",1995,"Journal of Human Evolution","28","6",,"533","559",,60,"10.1006/jhev.1995.1041","https://www.scopus.com/inward/record.uri?eid=2-s2.0-0028870901&doi=10.1006%2fjhev.1995.1041&partnerID=40&md5=450425807e7f7958ecbf712f6c9d690a","Department of Palaeontology, Natural History Museum, Cromwell Road, London SW7 5BD, United Kingdom","Rosas, A., Department of Palaeontology, Natural History Museum, Cromwell Road, London SW7 5BD, United Kingdom","Seventeen newly discovered fossil hominid mandibular specimens from the Sima de los Hucsos site in Sierra de Atapuerca (Spain) are presented in this paper. All come from the same stratigraphic level. Analysis of variability within the sample identifies three categories of traits: invariant traits, size-related traits and size-independent traits. Its strong morphological uniformity suggests that the sample most likely derives from a single biological population. Variation in mandibular morphology is primarily related to size and the associated change in shape. Features previously considered to be of phylogenetic importance are found to be variable in the Atapuerca sample. © 1995 Academic Press. All rights reserved.","Atapuerca/Ibeas; Mandibles; Middle Pleistocene","hominid; mandible; phylogeny; Pleistocene; Spain, Sierra de Atapuerca",Article,"Final",,Scopus,2-s2.0-0028870901
"Harvati K., Gunz P., Grigorescu D.","57203032637;6506472733;6603519979;","Cioclovina (Romania): affinities of an early modern European",2007,"Journal of Human Evolution","53","6",,"732","746",,59,"10.1016/j.jhevol.2007.09.009","https://www.scopus.com/inward/record.uri?eid=2-s2.0-36549048374&doi=10.1016%2fj.jhevol.2007.09.009&partnerID=40&md5=8e7316ee4649a06089456e515d6476f5","Department of Human Evolution, Max Planck Institute for Evolutionary Anthropology, Deutscher Platz 6, Leipzig, Germany; Department of Paleontology, University of Bucharest, Bucharest, Romania","Harvati, K., Department of Human Evolution, Max Planck Institute for Evolutionary Anthropology, Deutscher Platz 6, Leipzig, Germany; Gunz, P., Department of Human Evolution, Max Planck Institute for Evolutionary Anthropology, Deutscher Platz 6, Leipzig, Germany; Grigorescu, D., Department of Paleontology, University of Bucharest, Bucharest, Romania","The current modern human origins debate centers on the possibility and degree of admixture between indigenous archaic humans and modern human populations migrating out of Africa into Europe and Asia in the Late Pleistocene. Evidence for such admixture must be sought in the earliest fossil record of modern humans outside Africa, as it is those populations that would have encountered, and possibly interbred with, archaic hominins. In the case of Europe, the recent application of direct dating techniques has eliminated several specimens from the Upper Paleolithic fossil record, while confirming early ages for others. Among these earliest reliably dated specimens is the Cioclovina calvaria from Romania. This individual is of highest importance for the understanding of modern human origins in Europe, and has recently been proposed to represent a Neanderthal-modern human hybrid. We present a short description and a three-dimensional (3D) geometric morphometric analysis of the Cioclovina specimen using a large geographic sample of recent humans, Neanderthals and Middle and Late Pleistocene fossil hominins from Europe, Africa, and the Levant, in order to establish its phenetic affinities and to evaluate its morphology for evidence of admixture between Neanderthals and early modern Europeans. Our results show Cioclovina to be entirely modern in its cranial shape, and do not support the hypothesis that it represents a hybrid. © 2007 Elsevier Ltd. All rights reserved.","Admixture; Early modern humans; Geometric morphometrics; Hybrids; Modern human origins; Neanderthals; Upper Paleolithic","fossil record; human evolution; hybrid; indigenous population; morphology; morphometry; Neanderthal; Paleolithic; Africa; Asia; Eurasia; Europe; Romania; Southern Europe",Article,"Final",,Scopus,2-s2.0-36549048374
"Haile-Selassie Y., Asfaw B., White T.D.","6508101067;7004420438;35427764800;","Hominid Cranial Remains from Upper Pleistocene Deposits at Aduma, Middle Awash, Ethiopia",2004,"American Journal of Physical Anthropology","123","1",,"1","10",,59,"10.1002/ajpa.10330","https://www.scopus.com/inward/record.uri?eid=2-s2.0-0348050050&doi=10.1002%2fajpa.10330&partnerID=40&md5=8a184e88c6944e907c00f45235bd6cec","Cleveland Museum of Natural History, Cleveland, OH 44106, United States; Rift Valley Research Service, Addis Ababa, Ethiopia; Lab. for Human Evolutionary Studies, Department of Integrative Biology, University of California at Berkeley, Berkeley, CA 94720, United States; Cleveland Museum of Natural History, 1 Wade Oval Drive, Cleveland, OH 44106, United States","Haile-Selassie, Y., Cleveland Museum of Natural History, Cleveland, OH 44106, United States, Cleveland Museum of Natural History, 1 Wade Oval Drive, Cleveland, OH 44106, United States; Asfaw, B., Rift Valley Research Service, Addis Ababa, Ethiopia; White, T.D., Lab. for Human Evolutionary Studies, Department of Integrative Biology, University of California at Berkeley, Berkeley, CA 94720, United States","The Upper Pleistocene localities of Aduma and Bouri have yielded hominid fossils and extensive Middle Stone Age (MSA) archaeological assemblages. The vertebrate fossils recovered include parts of four hominid crania from Aduma and a complete right parietal from Bouri. Archaeological associations and radiometric techniques suggest an Upper Pleistocene age for these hominids. The more complete cranium from Aduma (ADU-VP-1/3) comprises most of the parietals, the occipital, and part of the frontal. This cranium is compared to late Middle and Upper Pleistocene hominid crania from Africa and the Middle East. The Aduma cranium shows a mosaic of cranial features shared with ""premodern"" and anatomically modern Homo sapiens. However, the posterior and lateral cranial dimensions, and most of its anatomy, are centered among modern humans and resemble specimens from Omo, Skhul, and Qafzeh. As a result, the Aduma and Bouri Upper Pleistocene hominids are assigned to anatomically modern Homo sapiens. © 2004 Wiley-Liss, Inc.","Aduma; Cranium; Homo sapiens; Middle Awash; Pleistocene","anatomy; archeology; article; cultural anthropology; Ethiopia; fossil; geographic distribution; hominid; human; occipital bone; skull; Animals; Ethiopia; Evolution; Fossils; Geography; Hominidae; Humans; Skull",Article,"Final",,Scopus,2-s2.0-0348050050
"Bermúdez de Castro J.","7003670066;","Dental remains from Atapuerca/Ibeas (Spain) II. Morphology",1988,"Journal of Human Evolution","17","3",,"279","304",,58,"10.1016/0047-2484(88)90072-3","https://www.scopus.com/inward/record.uri?eid=2-s2.0-0000590556&doi=10.1016%2f0047-2484%2888%2990072-3&partnerID=40&md5=bdb5863e80566b6761c3dd8e60dfe3fb","Museo Nacional de Ciencias Naturales, Consejo Superior de Investigaciones Científicas, J. Gutiérrez Abascal 2, 28006 Madrid, Spain","Bermúdez de Castro, J., Museo Nacional de Ciencias Naturales, Consejo Superior de Investigaciones Científicas, J. Gutiérrez Abascal 2, 28006 Madrid, Spain","A morphological and comparative study of 68 human fossil teeth from the ""Sima de los Huesos"" (Sierra de Atapuerca, Ibeas de Juarros, Burgos, Spain) is presented. The Ibeas teeth share certain morphological traits with those of other western European, northwest African and eastern Asian Middle Pleistocene hominids. However, the dental morphology of the European group, in which the Ibeas human fossils are included, presents remarkable differences from that of the other groups, especially in the postcanine teeth. This fact supports the thesis that an independent hominid line was established in Europe during the Middle Pleistocene. Furthermore, the Ibeas teeth present new evidence favouring the hypothesis of a close phylogenetic relationship between the European Middle Pleistocene population and the Neandertals, and of local evolutionary continuity in Europe during the Middle and early Upper Pleistocene. © 1988.","Atapuerca/Ibeas; human teeth; Middle Pleistocene; morphology",,Article,"Final",,Scopus,2-s2.0-0000590556
"Frayer D.W.","7006490063;","The persistence of Neanderthal features in post-Neanderthal europeans",1992,"Continuity or replacement: controversies in Homo sapiens evolution",,,,"179","188",,56,,"https://www.scopus.com/inward/record.uri?eid=2-s2.0-0026447966&partnerID=40&md5=4d41ec122878b01c37aabf78d1443047","Dept. of Anthropology, Univ. of Kansas, Lawrence, Kansas, USA, United States","Frayer, D.W., Dept. of Anthropology, Univ. of Kansas, Lawrence, Kansas, USA, United States","In the features reviewed here, Upper Paleolithic hominids, possess, albeit in lower frequencies, some of the same morphological characteristics which have been used to define Neanderthals as unique. These data, then, support arguments for a frequency shift explanation for the morphological differences between Neanderthal and later Europeans, rather than models requiring complete replacement. -from Author",,"evolution; frequency shift; hominid; morphology; Neanderthal; Quaternary",Article,"Final",,Scopus,2-s2.0-0026447966
"Stringer C.B.","7005875885;","Some further notes on the morphology and dating of the Petralona hominid",1983,"Journal of Human Evolution","12","8",,"731","742",,53,"10.1016/S0047-2484(83)80128-6","https://www.scopus.com/inward/record.uri?eid=2-s2.0-0010100197&doi=10.1016%2fS0047-2484%2883%2980128-6&partnerID=40&md5=353783367ad72657fc583053c7152b45","Department of Palaeontology, British Museum (Natural History), Cromwell Road, London, SW7 5BD England, United Kingdom","Stringer, C.B., Department of Palaeontology, British Museum (Natural History), Cromwell Road, London, SW7 5BD England, United Kingdom","Further study of the prepared hominid cranium has provided new data. Morphological and metrical comparisons still relate the Petralona specimen to Middle Pleistocene hominids, rather than to those of the Lower or Upper Pleistocene. The fossil, like specimens such as Arago 21 and Broken Hill, may represent a form not far removed from the common ancestor of Neanderthals and ""modern"" humans, which explain difficulties in the classification of these hominids. Evidence for a Lower Pleistocene [>730,000 years (730 ky)] or late Middle Pleistocene (c.200 ky) age for the hominid is discussed, but an age of somewhat more than 350ky, but certainly less than 730 ky, is favoured by the author. © 1983 Academic Press Inc. (London) Limited.","classification; cranium; dating; fossil hominid; Greece; Petralona; Pleistocene",,Article,"Final",,Scopus,2-s2.0-0010100197
"Trinkaus E., Howells W.W.","7005369128;35505921500;","The Neanderthals.",1979,"Scientific American","241","6",,"118","133",,52,"10.1038/scientificamerican1279-118","https://www.scopus.com/inward/record.uri?eid=2-s2.0-0018722319&doi=10.1038%2fscientificamerican1279-118&partnerID=40&md5=2555c03a2e8aaa603d524357d06fd90e",,"Trinkaus, E.; Howells, W.W.","The discovery of new bones and techniques has increased our knowledge of Neanderthal. The fossils can be studied with a greater knowledge of anatomical functions. Recent archaeological work is adding additional knowledge. Neanderthal lived from western Europe to central Asia between 75 000 and about 35 000 years ago. They can be differentiated from other human beings who lived in other parts of the world during the 40 000-35 000 year period. There are some differences between Neanderthal and modern man. The brain of Neanderthal is larger. The Neanderthal population declined for a number of reasons. They may have found it hard to compete with the Upper Paleolithic people with their better stoneworking techniques and a more highly developed sociocultural system. -Forrest McElhoe Jr.",,"archaeological work; Asia; bones; brain of Neanderthal; Europe; fossils; techniques",Article,"Final",,Scopus,2-s2.0-0018722319
"Hublin J.J.","","Quelques caractères apomorphes du crâne néandertalien et leur interprétation phylogénétique",1978,"C R Acad Sci Paris","287",,,"923","926",,52,,,,"Hublin, J.J.",[No abstract available],,,,"Final",,Scopus,2-s2.0-0000552149
"Harvati K., Weaver T.D.","57203032637;57214027910;","Reliability of cranial morphology in reconstructing Neanderthal phylogeny",2006,"Vertebrate Paleobiology and Paleoanthropology",,"9781402051203",,"239","254",,48,"10.1007/978-1-4020-5121-0_13","https://www.scopus.com/inward/record.uri?eid=2-s2.0-84937991635&doi=10.1007%2f978-1-4020-5121-0_13&partnerID=40&md5=f8cb5ef14ab2ae2dcebff26ffd98f0bb","Max-Planck-Institut für Evolutionäre Anthropologie, Leipzig, D-04103, Germany","Harvati, K., Max-Planck-Institut für Evolutionäre Anthropologie, Leipzig, D-04103, Germany; Weaver, T.D., Max-Planck-Institut für Evolutionäre Anthropologie, Leipzig, D-04103, Germany","The usefulness of cranial morphology in reconstructing the phylogeny of closely related taxa is often questioned due to the possibility of convergence or parallelism and epigenetic response to the environment. However, it has been suggested that different cranial regions preserve phylogenetic information differentially. Some parts of the face and neurocranium are thought to be relatively developmentally flexible, and therefore to be subject to the epigenetic influence of the environment. Other parts are thought to be particularly responsive to selection for adaptation to local climate. The basicranium, on the other hand, and in particular the temporal bone, is thought to be largely genetically determined and has been argued to preserve a strong phylogenetic signal with little possibility of homoplasy. Here we test the hypotheses that cranial morphology is related to population history among recent humans, and that different cranial regions reflect population history and local climate differentially. Morphological distances among ten recent human populations were calculated from the face, vault and temporal bone using three-dimensional geometric morphometrics methods. The distance matrices obtained were then compared to neutral genetic distances and to climatic differences among the same or closely matched groups. Results indicated a stronger relationship of the shape of the vault and the temporal bone with neutral genetic distances, and a stronger association of facial shape with climate. Vault and temporal bone centroid sizes were associated with climate and particularly temperature; facial centroid size was associated with genetic distances. Temporal bone shape was more successful in tracking older population history than vault shape. Of the three cranial regions, it is therefore most appropriate for phylogenetic reconstructions among fossil humans. Analysis of temporal bone shape of both recent and Middle-Late Pleistocene humans showed Neanderthals to be morphologically very distant from both recent and fossil modern humans, indicating that Neanderthals represent a distinct evolutionary lineage. © 2008 Springer.","Climate; Craniofacial morphology; Genetics; Neanderthals; Phylogeny; Population history",,Book Chapter,"Final",,Scopus,2-s2.0-84937991635
"Holt B.M., Formicola V.","","Hunters of the Ice Age: The biology of Upper Paleolithic people",2008,"Yearbook of Physical Anthropology","51",,,"70","99",,45,,,,"Holt, B.M.; Formicola, V.",[No abstract available],,,,"Final",,Scopus,2-s2.0-85057634443
"Cook J., Stringer C.B., Currant A.P., Schwarcz H.P., Wintle A.G.","7404185077;7005875885;6602426151;7005926560;7005930050;","A review of the chronology of the European Middle Pleistocene hominid record",1982,"American Journal of Physical Anthropology","25","3 S",,"19","65",,45,"10.1002/ajpa.1330250504","https://www.scopus.com/inward/record.uri?eid=2-s2.0-0020445619&doi=10.1002%2fajpa.1330250504&partnerID=40&md5=39bffac2e49dfb7735e3cabbabfbd0f3","Donald Baden-Powell Quaternary Research Centre, Oxford, United Kingdom; Department of Palaeontology, British Museum, London, United Kingdom; Department of Geology, McMaster University, Hamilton, Ontario, Canada; Godwin Laboratory, Subdepartment of Quaternary Research, Cambridge, United Kingdom","Cook, J., Donald Baden-Powell Quaternary Research Centre, Oxford, United Kingdom; Stringer, C.B., Department of Palaeontology, British Museum, London, United Kingdom; Currant, A.P., Department of Palaeontology, British Museum, London, United Kingdom; Schwarcz, H.P., Department of Geology, McMaster University, Hamilton, Ontario, Canada; Wintle, A.G., Godwin Laboratory, Subdepartment of Quaternary Research, Cambridge, United Kingdom","Over the last seventy years, European hominid fossils and associated archaeological remains have been dated by reference to the classical, fourfold glacial/interglacial subdivision of the Pleistocene. This method seemed relatively straightforward and precise especially as new discoveries were fitted into the schemes, apparently strengthening the correlations and increasing their validity. However, recent studies of deep‐sea cores and terrestrial deposits, combined with new developments in relative and absolute dating, have shown that the fourfold schemes are oversimplified. This paper critically reviews some of the dating evidence from sites with hominid remains generally considered as Middle Pleistocene (ca. 700,000–128,000 BP). The hominid and archaeological remains are shown to require independent dating and a cautious approach is adopted towards the use of mammalian faunal remains as chronological indicators. The techniques and results of absolute dating are discussed with reference to present problems and future prospects. At a time of transition from an old framework to new correlations, it is inevitable that some conclusions seem tentative and others rather negative. Nevertheless, the Middle Pleistocene in Europe is more fully understood and better dated than the equivalent period in other parts of the world. Copyright © 1982 Wiley‐Liss, Inc., A Wiley Company","Absolute dating; Archaeology; Chronology; Europe; Fauna; Middle Pleistocene hominids","ethnic or racial aspects; europe; evolution; geographic distribution; hominid; human",Article,"Final",,Scopus,2-s2.0-0020445619
"Roebroeks W., Tuffreau A.","","Palaeoenvironment and settlement patterns of the Northwest European Middle Palaeolithic",1999,"The Middle Palaeolithic Occupation of Europe",,,,"121","138",,43,,,,"Roebroeks, W.; Tuffreau, A.",[No abstract available],,,,"Final",,Scopus,2-s2.0-0008565943
