Authors,Author(s) ID,Title,Year,Source title,Volume,Issue,Art. No.,Page start,Page end,Page count,Cited by,DOI,Link,Affiliations,Authors with affiliations,Abstract,Author Keywords,Index Keywords,Document Type,Publication Stage,Access Type,Source,EID
"Dean D., Hublin J.-J., Holloway R., Ziegler R.","24922555700;6602606027;7103241626;35394457500;","On the phylogenetic position of the pre-Neandertal specimen from Reilingen, Germany",1998,"Journal of Human Evolution","34","5",,"485","508",,113,"10.1006/jhev.1998.0214","https://www.scopus.com/inward/record.uri?eid=2-s2.0-0032071342&doi=10.1006%2fjhev.1998.0214&partnerID=40&md5=919850c2657f917e7b61beac99c71ca7","Department of Neurological Surgery, Case Western Reserve University, 10900 Euclid Avenue, Cleveland, OH 44106, United States; Laboratoire d'Anthropologie, Musée de l'Homme, Palais du Chailot, Paris 75116, France; Department of Anthropology, Columbia University, New York, NY 10025, United States; Staatliches Museum für Naturkunde, Rosenstein 1, 70191 Stuttgart, Germany","Dean, D., Department of Neurological Surgery, Case Western Reserve University, 10900 Euclid Avenue, Cleveland, OH 44106, United States; Hublin, J.-J., Laboratoire d'Anthropologie, Musée de l'Homme, Palais du Chailot, Paris 75116, France; Holloway, R., Department of Anthropology, Columbia University, New York, NY 10025, United States; Ziegler, R., Staatliches Museum für Naturkunde, Rosenstein 1, 70191 Stuttgart, Germany","This paper describes the morphology and phylogenetic significance of a well-preserved fossil human cranium found near Reilingen, Germany in 1978. The specimen consists of two complete parietals, most of the right temporal, and 70% of the occipital. The specimen displays several features characteristic of early 'archaic' Homo sapiens: maximum breadth at the supramastoid crests, roughly pentagonal occipital view, an angular torus, superoinferiorly elongate/anteroposterior shortened aquamous temporal, strong masteroid, and separation of the tympanic and mastoid temporal portions. Other features align the Reilingen cranium with the 'classic' Neandertals: developed suprainiac fossa, bilaterally protuberant occipital torus, strong juxtamastoid eminence, a highly convex occipital plane, and lambdoid flattening. This morphology and our cephalometric analysis support the assignment of this specimen to a Stage 2 'pre-Neandertal' group (e.g., Steinheim, Swanscombe, and Atapuerca [SH site]). Following an 'Accretion Model' of European hominid evolution, Stage 2 succeeds Strage 1 European 'early-pre-Neandertals' (e.g., Mauer and Petralona), and precedes both the Saale-Eem Stage 3 'early Neandertals' (e.g., Biache 1), which present greater platycephaly, a reduced mastoid process, an enlarged juxtamastoid eminence, and true 'en-bombe' (parieto-occipital form), and Weichsel Stage 4 'Neandertals' (sensu stricto, i.e., 'classic' Neadertals).",,"evolution; Homo sapiens; Neanderthal; phylogeny; Baden-Wurttemberg; Germany; Reilingen; Animalia; Hominidae; Homo sapiens; Primates",Article,"Final",,Scopus,2-s2.0-0032071342
"Von Cramon-Taubadel N.","23471109300;","Congruence of individual cranial bone morphology and neutral molecular affinity patterns in modern humans",2009,"American Journal of Physical Anthropology","140","2",,"205","215",,107,"10.1002/ajpa.21041","https://www.scopus.com/inward/record.uri?eid=2-s2.0-70349102576&doi=10.1002%2fajpa.21041&partnerID=40&md5=023263f75de9132d6dbe251733b39936","Department of Anthropology, University of Kent, Canterbury, CT2 7NR, United Kingdom","Von Cramon-Taubadel, N., Department of Anthropology, University of Kent, Canterbury, CT2 7NR, United Kingdom","Recent studies have demonstrated that the shape of the human temporal bone is particularly strongly correlated with neutral genetic expectation, when compared against other cranial regions, such as the vault, face, and basicranium. In turn, this has led to suggestions that the temporal bone is particularly reliable in analyses of primate phylogeny and human population history. While several reasons have been suggested to explain the temporal bone's strong fit with neutral expectation, the temporal bone has never systematically been compared against other individual cranial bones defined using the same biological criteria. Therefore, it is currently unknown whether the shapes of all cranial bones possess reliable information regarding neutral genetic evolution, or whether the temporal bone is unique in this respect. This study tests the hypothesis that the human temporal bone is more congruent with neutral expectation than six other individual cranial bones by correlating population affinity matrices generated using neutral genetic and 3D craniometric data. The results demonstrate that while the temporal bone shows the absolute strongest correlation with neutral genetic data compared with all other bones, it is not statistically differentiated from the sphenoid, frontal, and parietal bones in this regard. Potential reasons for the temporal bone's consistently strong fit with neutral expectation, such as its overall anatomical complexity and/or its contribution to the architecture of the basicranium, are examined. The results suggest that future phylogenetic and taxonomic studies would benefit from considering the shape of the entire cranium minus those regions that deviate most from neutrality. ©2009 Wiley-Liss, Inc.","Geometric morphometrics; Neutral evolution; Population history; Temporal bone","article; comparative anatomy; controlled study; craniofacial morphology; craniometry; frontal bone; human; molecular evolution; nonhuman; phylogeny; physical anthropology; population genetics; primate; skull; sphenoid; temporal bone; Bone Development; Classification; Fossils; Gene Frequency; Genetic Markers; Humans; Microsatellite Repeats; Phylogeny; Skull; Temporal Bone; Primates",Article,"Final",,Scopus,2-s2.0-70349102576
"Gunz P., Harvati K.","6506472733;57203032637;","The Neanderthal ""chignon"": Variation, integration, and homology",2007,"Journal of Human Evolution","52","3",,"262","274",,105,"10.1016/j.jhevol.2006.08.010","https://www.scopus.com/inward/record.uri?eid=2-s2.0-33846913250&doi=10.1016%2fj.jhevol.2006.08.010&partnerID=40&md5=ab0b2ee90ec16bd5cfd11cd9c3d844c6","Department of Human Evolution, Max Planck Institute for Evolutionary Anthropology, Deutscher Platz 6, D-04103 Leipzig, Germany","Gunz, P., Department of Human Evolution, Max Planck Institute for Evolutionary Anthropology, Deutscher Platz 6, D-04103 Leipzig, Germany; Harvati, K., Department of Human Evolution, Max Planck Institute for Evolutionary Anthropology, Deutscher Platz 6, D-04103 Leipzig, Germany","The occipital bun (""chignon"") is cited widely as a Neanderthal derived trait. It encompasses the posterior projection/convexity of the occipital squama and is associated with lambdoid flattening on the parietal. A 'hemibun' in some Upper Paleolithic Europeans is thought by some authors to indicate interbreeding between Neanderthals and early modern Europeans. However, 'bunning' is difficult to measure, and the term has been applied to a range of morphological patterns. Furthermore, its usefulness in phylogenetic reconstruction and its homologous status across modern and fossil humans have been disputed. We present a geometric morphometric study that quantitatively evaluates the chignon, assesses its usefulness in separating Neanderthals from modern humans, and its degree of similarity to Upper Paleolithic 'hemibuns.' We measured the three-dimensional coordinates of closely spaced points along the midsagittal plane from bregma to inion and of anatomical landmarks in a large series of recent human crania and several Middle and Late Pleistocene European and African fossils. These coordinate data were processed using the techniques of geometric morphometrics and analyzed with relative warps, canonical variates, and singular warps. Our results show no separation between Neanderthals and modern humans, including early modern Europeans, when the shape of the occipital plane midsagittal-profile is considered alone. On the other hand, Neanderthals are well separated from both recent and fossil modern humans when information about the occipital's relative position and relative size are also included. Furthermore, the occurrence of a highly convex and posteriorly projecting midline occipital profile (interpreted as the occipital bun) is highly correlated (>0.8) with a flat parietal midsagittal profile and with antero-superiorly positioned temporal bones across both our recent and our fossil human samples. We conclude that the shape of the occipital profile alone should not be considered an independent trait, as it is very tightly integrated with braincase shape. Our analysis does not support differences in integration of the posterior midsagittal profile and the cranial base in Pleistocene and recent humans. © 2006 Elsevier Ltd. All rights reserved.","Cranial architecture; Geometric morphometrics; Human variation; Middle Pleistocene; Semilandmarks","bone; cranium; fossil; homology; human evolution; morphometry; Neanderthal; Paleolithic; phylogenetics; Crania",Article,"Final",,Scopus,2-s2.0-33846913250
"Hay R.L.","","Geology of the Laetoli area",1987,"Laetoli: A Pliocene Site in Northern Tanzania",,,,"23","47",,105,,,,"Hay, R.L.",[No abstract available],,,,"Final",,Scopus,2-s2.0-0003359191
"Smith H.F.","9740963700;","Which cranial regions reflect molecular distances reliably in humans? Evidence from three-dimensional morphology",2009,"American Journal of Human Biology","21","1",,"36","47",,103,"10.1002/ajhb.20805","https://www.scopus.com/inward/record.uri?eid=2-s2.0-59549091063&doi=10.1002%2fajhb.20805&partnerID=40&md5=f40214e367568d8e609cb456c7ba2925","Department of Basic Medical Sciences, College of Medicine, University of Arizona, Building ABC1, 425 N. 5th St., Phoenix, AZ 85004-2157, United States","Smith, H.F., Department of Basic Medical Sciences, College of Medicine, University of Arizona, Building ABC1, 425 N. 5th St., Phoenix, AZ 85004-2157, United States","Knowledge of the degree to which various subsets of morphological data reflect molecular relationships is crucial for studies attempting to estimate genetic relationships from patterns of morphological variation. This study assessed the phylogenetic utility of six different human cranial regions, plus the entire cranium. Three-dimensional landmark data were collected for 83 landmarks from samples of skulls from 14 modern human populations. The data were subsequently divided into anatomical regions: basicranium, upper face, mandible, temporal bone, upper jaw, cranial vault, and a subset of points from around the entire cranium. Depictions of population molecular distances were calculated using published data on microsatellites for the same or closely related populations. Distances based on morphological variation of each of the anatomical regions were compared with molecular distances, and the correlations assessed. The morphology of the basicranium, temporal bone, upper face, and entire cranium demonstrated the highest correlations with molecular distances. The morphology of the mandible, upper jaw, and cranial vault, as measured here, were not significantly correlated with molecular distances. As the three-dimensional morphology of the temporal bone, upper face, basicranium, and entire cranium appear to consistently reflect genetic relationships in humans, especially with more reliability than the cranial vault, it would be preferable to focus on these regions when attempting to determine the genetic relationships of human specimens with no molecular data. © 2008 Wiley-Liss, Inc.",,"anatomical variation; article; craniofacial morphology; epigenetics; human; maxilla; microsatellite marker; molecular biology; morphological trait; phylogeny; physical anthropology; population genetics; priority journal; reliability; temporal bone; three dimensional imaging; Anthropology, Physical; Continental Population Groups; Data Interpretation, Statistical; Genetic Variation; Genetics, Population; Humans; Phylogeny; Skull",Article,"Final",,Scopus,2-s2.0-59549091063
"Bräuer G.","7101650530;","The origin of modern anatomy: By speciation or intraspecific evolution?",2008,"Evolutionary Anthropology","17","1",,"22","37",,103,"10.1002/evan.20157","https://www.scopus.com/inward/record.uri?eid=2-s2.0-41549121971&doi=10.1002%2fevan.20157&partnerID=40&md5=2777d9558208ec6e32a4a4742615f6a7","Department of Human Biology, University of Hamburg, Germany; Department of Human Biology, University of Hamburg, Allende-Platz 2, 20146 Hamburg, Germany","Bräuer, G., Department of Human Biology, University of Hamburg, Germany, Department of Human Biology, University of Hamburg, Allende-Platz 2, 20146 Hamburg, Germany","Over the last thirty years, great progress has been made regarding our understanding of Homo sapiens evolution in Africa and, in particular, the origin of anatomically modern humans. However, in the mid-1970s, the whole process of Homo sapiens evolution in Africa was unclear and confusing. At that time it was widely assumed that very archaic-looking hominins, also called the ""Rhodesioids,"" which included the specimens from Kabwe (Zambia), Saldanha (South Africa), and Eyasi (Tanzania), were spread over wide parts of the continent as recently as 30,000 or 40,000 years ago. Yet, at the same time, there were also indications from the Omo Kibish skeletal remains (Ethiopia) and the Border Cave specimens (South Africa) that anatomically modern humans had already been present somewhat earlier than 100,000 years B.P.2,3 Thus, it was puzzling how such early moderns could fit in with the presence of very archaic humans still existing in Eastern and Southern Africa only 30,000 years ago.","Africa; Archaic Homo sapiens; Cladistics; Homo heidelbergensis; Neandertals; Species","Homo heidelbergensis; Homo sapiens",Article,"Final",,Scopus,2-s2.0-41549121971
"Nicholson E., Harvati K.","9746053500;15843691500;","Quantitative analysis of human mandibular shape using three-dimensional geometric morphometrics",2006,"American Journal of Physical Anthropology","131","3",,"368","383",,101,"10.1002/ajpa.20425","https://www.scopus.com/inward/record.uri?eid=2-s2.0-33750063463&doi=10.1002%2fajpa.20425&partnerID=40&md5=979e312bf77dbdf256b2f6311f52e449","Department of Cell and Molecular Biology, Northwestern University Feinberg School of Medicine, Chicago, IL 60611-3008, United States; Department of Human Evolution, Max Planck Institute for Evolutionary Anthropology, D-04103 Leipzig, Germany; Department of Human Evolution, Max Planck Institute for Evolutionary Anthropology, Deutscher Platz 6, D-04103 Leipzig, Germany","Nicholson, E., Department of Cell and Molecular Biology, Northwestern University Feinberg School of Medicine, Chicago, IL 60611-3008, United States; Harvati, K., Department of Human Evolution, Max Planck Institute for Evolutionary Anthropology, D-04103 Leipzig, Germany, Department of Human Evolution, Max Planck Institute for Evolutionary Anthropology, Deutscher Platz 6, D-04103 Leipzig, Germany","Human mandibular morphology is often thought to reflect mainly function, and to be of lesser value in studies of population history. Previous descriptions of human mandibles showed variation in ramal height and breadth to be the strongest difference among recent human groups. Several mandibular traits that differentiate Neanderthals from modern humans include greater robusticity, a receding symphysis, a large retromolar space, a rounder gonial area, an asymmetric mandibular notch, and a posteriorly positioned mental foramen in Neanderthals. Nevertheless, the degree to which these differences are part of modern human variation and/or are related to size and function remains unclear. The aim of this study was to document geographic and functional patterning in the mandibular shape of recent humans, to assess the effects of allometry on mandibular form, and to quantitatively evaluate proposed ""Neanderthai"" mandibular traits through comparison with samples of geographically diverse recent humans. Data were collected in the form of three-dimensional coordinates of 28 landmarks. Unlike previous studies, this analysis found that modern human mandibular shape exhibits considerable geographic patterning, with some aspects of mandibular morphology reflecting a climatic gradient, and others, a functional specialization. Population history is also reflected in mandibular form, albeit relatively weakly. Proposed ""Neanderthal"" traits were found to separate Neanderthal from modern human mandibles successfully in the statistical analysis. Of these, the retromolar gap was found to be related to increased mandibular size in modern humans. The status of this trait as a Neanderthal autapomorphy should therefore be treated with caution. © 2006 Wiley-Liss, Inc.","Climate; Modern human variation; Neanderthals; Paramasticatory behavior","allometry; article; bone structure; geometry; history; human; mandible; morphometrics; physical anthropology; population biology; quantitative analysis; three dimensional imaging; Anatomy, Comparative; Animals; Arctic Regions; Asia; Europe; Fossils; History, Ancient; Hominidae; Humans; Imaging, Three-Dimensional; Mandible; Paleodontology",Article,"Final",,Scopus,2-s2.0-33750063463
"Relethford J.H.","7005172819;","Boas and beyond: Migration and craniometric variation",2004,"American Journal of Human Biology","16","4",,"379","386",,100,"10.1002/ajhb.20045","https://www.scopus.com/inward/record.uri?eid=2-s2.0-3442883983&doi=10.1002%2fajhb.20045&partnerID=40&md5=f8e534e71f9333d092243aed4600669f","Department of Anthropology, State Univ. of NY College at Oneonta, Oneonta, NY 13820, United States","Relethford, J.H., Department of Anthropology, State Univ. of NY College at Oneonta, Oneonta, NY 13820, United States","Migration is expected to affect craniometric variation in three ways: 1) movement into a different environment leading to developmental plasticity; 2) movement into a different environment followed by in situ adaptation through natural selection; and 3) changes in among-group differentiation and genetic distance through the action of gene flow. The relative influence of these three factors has been argued in the literature, most recently in a series of articles debating the statistical and biological significance of Boas's immigration studies as they relate to cranial plasticity. The Boas debate is discussed within the broader context of debate over genetic and environmental influences on craniometric variation. Additional examples are provided from an ongoing study of global craniometric variation. Although developmental plasticity and climatic adaptation have had an impact on craniometric variation, these factors tend not to erase, or even obscure greatly, underlying patterns of population structure and history that fit a neutral model of quantitative variation. Thus, craniometric data can be used to explore questions of gene flow and genetic affinity. © 2004 Wiley-Liss, Inc.",,"anatomical variation; anthropometry; article; climate change; craniometry; environmental change; evolutionary adaptation; gene flow; genetic association; genetic distance; human; immigration; morphological adaptation; natural selection; population differentiation; population genetics; population migration; population model; population movement pattern; population structure; priority journal; quantitative analysis; statistical analysis; Adult; Anthropology, Physical; Cephalometry; Child; Emigration and Immigration; Europe; Female; Genetics, Population; Geography; Humans; Male; Models, Genetic; Selection (Genetics); Temperature; United States; World Health; Boa (genus)",Article,"Final",,Scopus,2-s2.0-3442883983
"Rink W.J., Schwarcz H.P., Smith F.H., Radovĉić J.","7006790780;7005926560;35560394800;6507687978;","ESR ages for krapina hominids",1995,"Nature","378","6552",,"24","",,97,"10.1038/378024a0","https://www.scopus.com/inward/record.uri?eid=2-s2.0-84988045002&doi=10.1038%2f378024a0&partnerID=40&md5=c29eafbe49502afdbb77ca5025f96bfa","Department of Geology, McMaster University, Hamilton, ON, L8S 4M1, Canada; Department of Anthropology, Northern Illinois University, Dekalb, IL, 60115, United States; Croatian Natural History Museum, Demetrova 1, Zagreb, 1000, Croatia","Rink, W.J., Department of Geology, McMaster University, Hamilton, ON, L8S 4M1, Canada; Schwarcz, H.P., Department of Geology, McMaster University, Hamilton, ON, L8S 4M1, Canada; Smith, F.H., Department of Anthropology, Northern Illinois University, Dekalb, IL, 60115, United States; Radovĉić, J., Croatian Natural History Museum, Demetrova 1, Zagreb, 1000, Croatia",[No abstract available],,"radioisotope; uranium; archeology; electron spin resonance; enamel; evolution; hominid; letter; paleoanthropology; priority journal; Animal; Dental Enamel; Electron Spin Resonance Spectroscopy; Evolution; Hominidae; Human; Yugoslavia",Article,"Final",,Scopus,2-s2.0-84988045002
"Carretero J.M., Arsuaga J.L., Lorenzo C.","7101919497;6506247114;35346371000;","Clavicles, scapulae and humeri from the Sima de los Huesos site (Sierra de Atapuerca, Spain)",1997,"Journal of Human Evolution","33","2-3",,"357","408",,96,"10.1006/jhev.1997.0128","https://www.scopus.com/inward/record.uri?eid=2-s2.0-0031205894&doi=10.1006%2fjhev.1997.0128&partnerID=40&md5=260d2268cacfc9059b4485c12a44dd95","Lab. for Human Evolutionary Studies, 3101 Valley Life Sciences Building, University of California, Berkeley, CA 94720-3160, United States; Departamento de Paleontología, Fac. de Ciencias Gelógicas, Ciudad Universitaria, 28040 Madrid, Spain","Carretero, J.M., Lab. for Human Evolutionary Studies, 3101 Valley Life Sciences Building, University of California, Berkeley, CA 94720-3160, United States, Departamento de Paleontología, Fac. de Ciencias Gelógicas, Ciudad Universitaria, 28040 Madrid, Spain; Arsuaga, J.L., Departamento de Paleontología, Fac. de Ciencias Gelógicas, Ciudad Universitaria, 28040 Madrid, Spain; Lorenzo, C., Departamento de Paleontología, Fac. de Ciencias Gelógicas, Ciudad Universitaria, 28040 Madrid, Spain","The scapulae, clavicles and humeri recovered from the Sima de los Huesos (SH) site between 1976 and 1994 are studied. All elements are briefly described anatomically with metrics and compared with other fossil hominids in order to establish the morphological pattern of the SH hominids. A minimum of 13 individuals are represented by the humeri in the SH sample. Almost all of them can be classified as adolescents and young adults. The morphology of the SH hominid shoulder girdle and humeri indicates that much of the shoulder morphology recognized in the later true Neandertal was present in Europe long before they appeared. Thus, this morphological pattern is not exclusive to Neandertals alone. The SH clavicles, scapulae and humeri share with the Neandertals many traits usually considered to be Neandertal specializations. The comparative analysis of the SH evidence suggests that most of the SH and Neandertal shared traits are either primitive features within the genus Homo or even for all hominids, or display high variability within different hominid samples. These traits must be used with caution, or not used at all, in phylogenetic analysis. There are, however, traits that to date have only been detected in the SH hominids and the Neandertals, which could be exclusive to the European phyletic lineage (clade) of Homo. © 1997 Academic Press Limited.","Human evolution; Middle Pleistocene; Sima de los Huesos; Upper limb","Hominidae; Animalia; Hominidae; Primates; clavicle; hominid; humerus; Pleistocene; scapula; adolescent; adult; animal; article; axilla; clavicle; comparative study; Europe; female; fossil; histology; hominid; human; humerus; longevity; male; paleontology; scapula; sexual development; Spain; time; Adolescent; Adult; Animals; Axilla; Clavicle; Europe; Female; Fossils; Hominidae; Humans; Humerus; Longevity; Male; Paleontology; Scapula; Sex Characteristics; Spain; Time; Spain, Castilla y Leon, Burgos, Sierra de Atapuerca",Article,"Final",,Scopus,2-s2.0-0031205894
