Authors,Author(s) ID,Title,Year,Source title,Volume,Issue,Art. No.,Page start,Page end,Page count,Cited by,DOI,Link,Affiliations,Authors with affiliations,Abstract,Author Keywords,Index Keywords,Document Type,Publication Stage,Access Type,Source,EID
"Schlanger N.","56031262700;","Understanding Levallois: Lithic technology and cognitive archaeology",1996,"Cambridge Archaeological Journal","6","2",,"231","254",,98,,"https://www.scopus.com/inward/record.uri?eid=2-s2.0-0000537339&partnerID=40&md5=f4f62df8a351a980448dfc423036d682","St. Anne's College, University of Oxford, Oxford OX2 6HS, United Kingdom","Schlanger, N., St. Anne's College, University of Oxford, Oxford OX2 6HS, United Kingdom","The Levallois technique has attracted much 'cognitive' attention in the past decades. Many archaeologists argue that both the products and the procedure of this Palaeolithic technique have been clearly predetermined by the prehistoric flintknappers. Attempts have recently been made to challenge this notion of predetermination by reference to raw material and 'technological' constraints. The aim of this article is to assess the grounds on which these claims have been advanced, and then work towards a better establishment of the cognitive implications of Levallois manufacture. Latest developments in the technological understanding of Levallois are presented in their context, and then put to work through a detailed case study: the analysis, in quantitative and qualitative terms, of a comprehensively refitted Levallois core from the 250,000 year-old site of Maastricht-Belvédère, in the Netherlands. By reconstructing and following the sequence of work on this highly productive core, it can be shown that its knapping did not simply entail the execution of a pre-set program, nor did it respond in an adventitious manner to external constraints. Rather, it is argued that the course of action was a structured and goal-oriented one, a generative interplay between the mental and material activities of the ancient flintknapper.",,,Article,"Final",,Scopus,2-s2.0-0000537339
"Sharon G.","23976599500;","Acheulian giant-core technology: A worldwide perspective",2009,"Current Anthropology","50","3",,"335","367",,96,"10.1086/598849","https://www.scopus.com/inward/record.uri?eid=2-s2.0-69249114230&doi=10.1086%2f598849&partnerID=40&md5=935768ea3fc3e590108d9065c46c2958","Institute of Archaeology, Hebrew University of Jerusalem, Mount Scopus, Jerusalem 91905, Israel","Sharon, G., Institute of Archaeology, Hebrew University of Jerusalem, Mount Scopus, Jerusalem 91905, Israel","The ability to detach large (larger than 10 cm) flakes from giant cores and use them as blanks for the production of handaxes and cleavers is a technological hallmark distinguishing the Acheulian culture from its African predecessor, the Developed Oldowan, approximately 1.5 million years ago. Acheulian knappers applied a variety of fundamentally different, innovative, and sophisticated methods to large-flake production that were perfectly suited to the size and shape of the naturally available raw materials. Yet the end products of all these methods were astonishingly similar across the geographical and chronological distribution of the Acheulian techno-complex: large flakes that were suitable in size and morphology for the production of handaxes and cleavers. © 2009 by The Wenner-Gren Foundation for Anthropological Research. All rights reserved.",,,Article,"Final",,Scopus,2-s2.0-69249114230
"O'Higgins P., Jones N.","","Tools for statistical shape analysis",2006,"Tools for Statistical Shape Analysis",,,,"","",,95,,,,"O'Higgins, P.; Jones, N.",[No abstract available],,,,"Final",,Scopus,2-s2.0-33846536610
"Dibble H.L., Bar-Yosef O.","","The Definition and Interpretation of Levallois Technology",1995,"The Definition and Interpretation of Levallois Technology",,,,"","",,88,,,,"Dibble, H.L.; Bar-Yosef, O.",[No abstract available],,,,"Final",,Scopus,2-s2.0-0003505362
"Lockwood C.A., Lynch J.M., Kimbel W.H.","7102516713;25934906700;6603930109;","Quantifying temporal bone morphology of great apes and humans: An approach using geometric morphometrics",2002,"Journal of Anatomy","201","6",,"447","464",,87,"10.1046/j.1469-7580.2002.00122.x","https://www.scopus.com/inward/record.uri?eid=2-s2.0-18744389738&doi=10.1046%2fj.1469-7580.2002.00122.x&partnerID=40&md5=7adca44c6aae11a24a0570152de7bf94","Department of Anthropology, Institute of Human Origins, Arizona State University, Tempe, AZ 85287, United States; Barrett Honors College, Institute of Human Origins, Arizona State University, Tempe, AZ 85287, United States","Lockwood, C.A., Department of Anthropology, Institute of Human Origins, Arizona State University, Tempe, AZ 85287, United States; Lynch, J.M., Barrett Honors College, Institute of Human Origins, Arizona State University, Tempe, AZ 85287, United States; Kimbel, W.H., Department of Anthropology, Institute of Human Origins, Arizona State University, Tempe, AZ 85287, United States","The hominid temporal bone offers a complex array of morphology that is linked to several different functional systems. Its frequent preservation in the fossil record gives the temporal bone added significance in the study of human evolution, but its morphology has proven difficult to quantify. In this study we use techniques of 3D geometric morphometrics to quantify differences among humans and great apes and discuss the results in a phylogenetic context. Twenty-three landmarks on the ectocranial surface of the temporal bone provide a high level of anatomical detail. Generalized Procrustes analysis (GPA) is used to register (adjust for position, orientation and scale) landmark data from 405 adults representing Homo, Pan, Gorilla and Pongo. Principal components analysis of residuals from the GPA shows that the major source of variation is between humans and apes. Human characteristics such as a coronally orientated petrous axis, a deep mandibular fossa, a projecting mastoid process, and reduced lateral extension of the tympanic element strongly impact the analysis. In phenetic cluster analyses, gorillas and orangutans group together with respect to chimpanzees, and all apes group together with respect to humans. Thus, the analysis contradicts depictions of African apes as a single morphotype. Gorillas and orangutans lack the extensive preglenoid surface of chimpanzees, and their mastoid processes are less medially inflected. These and other characters shared by gorillas and orangutans are probably primitive for the African hominid clade.","Geometric morphometrics; Hominids; Hominoids; Relative warp analysis; Thin-plate spline analysis","Africa; analytic method; Anthropoidea; ape; article; bone structure; chimpanzee; cladistics; cluster analysis; comparative anatomy; controlled study; craniofacial morphology; evolution; fossil; geographical variation (species); geometry; gorilla; hominid; human; human versus animal comparison; mandible; mastoid; middle ear; morphometrics; morphotype; nonhuman; orang utan; Pan paniscus; petrous bone; phylogeny; priority journal; register; structure analysis; temporal bone; Adult; Animals; Gorilla gorilla; Hominidae; Humans; Pan troglodytes; Phylogeny; Pongo pygmaeus; Temporal Bone; Alocasia macrorrhizos; Animalia; Anthropoidea; Hominidae; Homo; Pan (ape); Pan paniscus; Pan troglodytes; Paniscus; Pongo; Pongo pygmaeus; Procrustes",Article,"Final",,Scopus,2-s2.0-18744389738
"Reyes-García V., Broesch J., Calvet-Mir L., Fuentes-Peláez N., McDade T.W., Parsa S., Tanner S., Huanca T., Leonard W.R., Martínez-Rodríguez M.R.","6507160889;23391699100;24830251800;26429448200;6701774420;26429992200;15844373900;57193485329;7102219583;26429715200;","Cultural transmission of ethnobotanical knowledge and skills: an empirical analysis from an Amerindian society",2009,"Evolution and Human Behavior","30","4",,"274","285",,86,"10.1016/j.evolhumbehav.2009.02.001","https://www.scopus.com/inward/record.uri?eid=2-s2.0-67349216749&doi=10.1016%2fj.evolhumbehav.2009.02.001&partnerID=40&md5=ce7de900a865106cfb412ab3e33df0f1","Institució Catalana de Recerca i Estudis Avançats (ICREA), Passeig Lluís Companys 23, 08010 Barcelona, Spain; Institut de Ciència i Tecnologia Ambientals, Universitat Autònoma de Barcelona, 08193 Bellatera, Barcelona, Spain; Department of Anthropology, Emory University, Atlanta, GA, United States; Departament de Mètodes d'Investigació i Diagnòstic en Educació, Universitat de Barcelona, 08035 Barcelona, Spain; Department of Anthropology, Northwestern University, Evanston, IL 60208, United States; Graduate Group in Ecology, University of California, Davis, CA 95616, United States; Department of Anthropology, University of Georgia, Athens, GA 30602, United States; Centro Boliviano de Investigación y de Desarrollo Socio Integral, Correo Central, San Borja, Beni, Bolivia","Reyes-García, V., Institució Catalana de Recerca i Estudis Avançats (ICREA), Passeig Lluís Companys 23, 08010 Barcelona, Spain, Institut de Ciència i Tecnologia Ambientals, Universitat Autònoma de Barcelona, 08193 Bellatera, Barcelona, Spain; Broesch, J., Department of Anthropology, Emory University, Atlanta, GA, United States; Calvet-Mir, L., Institut de Ciència i Tecnologia Ambientals, Universitat Autònoma de Barcelona, 08193 Bellatera, Barcelona, Spain; Fuentes-Peláez, N., Departament de Mètodes d'Investigació i Diagnòstic en Educació, Universitat de Barcelona, 08035 Barcelona, Spain; McDade, T.W., Department of Anthropology, Northwestern University, Evanston, IL 60208, United States; Parsa, S., Graduate Group in Ecology, University of California, Davis, CA 95616, United States; Tanner, S., Department of Anthropology, University of Georgia, Athens, GA 30602, United States; Huanca, T., Centro Boliviano de Investigación y de Desarrollo Socio Integral, Correo Central, San Borja, Beni, Bolivia; Leonard, W.R., Department of Anthropology, Northwestern University, Evanston, IL 60208, United States; Martínez-Rodríguez, M.R., Department of Anthropology, University of Georgia, Athens, GA 30602, United States","The modeling of cultural transmission is of great importance for understanding the maintenance, erosion, and spread of cultural traits and innovations. Researchers have hypothesized that, unlike biological transmission, cultural transmission occurs through at least three different, non-mutually exclusive paths: (1) from parents (vertical); (2) from age peers (horizontal); and (3) from older generations (oblique). We used data from 270 adults in a society in the Bolivian Amazon to estimate the association between a person's knowledge and skills and the knowledge and skills of the (1) same-sex parent, (2) age peers (or individuals born in the same village as the subject within ±4 years of the subject's year of birth), and (3) parental cohort (excluding parents). We found a statistically significant association between personal and parental and old cohort knowledge. The magnitude of the association is larger for old cohort knowledge than for parental knowledge, suggesting that, for the studied population, the transmission of ethnobotanical knowledge and skills is mostly oblique. © 2009 Elsevier Inc. All rights reserved.","Bolivia; Ethnobotanical knowledge; Oblique transmission; Transmission of knowledge; Tsimane'",,Article,"Final",,Scopus,2-s2.0-67349216749
"Yravedra J., Domínguez-Rodrigo M., Santonja M., Pérez-González A., Panera J., Rubio-Jara S., Baquedano E.","56962776200;6603679662;6507934601;55148343400;36438531500;36438705600;36237883200;","Cut marks on the Middle Pleistocene elephant carcass of Áridos 2 (Madrid, Spain)",2010,"Journal of Archaeological Science","37","10",,"2469","2476",,83,"10.1016/j.jas.2010.05.007","https://www.scopus.com/inward/record.uri?eid=2-s2.0-77955268885&doi=10.1016%2fj.jas.2010.05.007&partnerID=40&md5=de1c32d55c41d1402d97f1c50a1f5f61","Department of Prehistory, Complutense University of Madrid, Ciudad Universitaria s/n, 28040 Madrid, Spain; IDEA (Instituto de Evolución en África), Museo de los Orígenes, Plaza de San Andrés 2, 28005 Madrid, Spain; CENIEH (Centro Nacional de Investigación sobre la Evolución Humana), Paseo Sierra de Atapuerca s/n, 9002 Burgos, Spain; Department of Prehistory, UNED, Senda del Rey s/n, 28040 Madrid, Spain; Museo Arqueológico Regional de Madrid, Alcalá de Henares, Plaza de las Bernardas, Madrid, Spain","Yravedra, J., Department of Prehistory, Complutense University of Madrid, Ciudad Universitaria s/n, 28040 Madrid, Spain; Domínguez-Rodrigo, M., Department of Prehistory, Complutense University of Madrid, Ciudad Universitaria s/n, 28040 Madrid, Spain, IDEA (Instituto de Evolución en África), Museo de los Orígenes, Plaza de San Andrés 2, 28005 Madrid, Spain; Santonja, M., CENIEH (Centro Nacional de Investigación sobre la Evolución Humana), Paseo Sierra de Atapuerca s/n, 9002 Burgos, Spain; Pérez-González, A., CENIEH (Centro Nacional de Investigación sobre la Evolución Humana), Paseo Sierra de Atapuerca s/n, 9002 Burgos, Spain; Panera, J., Department of Prehistory, UNED, Senda del Rey s/n, 28040 Madrid, Spain; Rubio-Jara, S., Department of Prehistory, UNED, Senda del Rey s/n, 28040 Madrid, Spain; Baquedano, E., IDEA (Instituto de Evolución en África), Museo de los Orígenes, Plaza de San Andrés 2, 28005 Madrid, Spain, Museo Arqueológico Regional de Madrid, Alcalá de Henares, Plaza de las Bernardas, Madrid, Spain","Áridos 1 and Áridos 2 (Madrid, Spain) are two Middle Pleistocene sites belonging to the isotopic stages 9-11. Both places contain partial carcasses of Elephas (Paleoxodon) antiquus associated to Acheulian stone tools. In this work, the taphonomic study of the elephant remains of Áridos 2 is presented. This study has documented several cut marks on different bones, which indicate bulk flesh and viscerae extraction by Middle Pleistocene hominins. Several arguments are provided to support that at least some of the cut marks were made with handaxes, further suggesting that some of these artifacts were butchering tools in this stage of human evolution. Although cut marks on elephant carcasses have been documented at some Middle Pleistocene sites, very few have been published in detail to allow consideration of their status as hominin-imparted marks. By doing so, the present study provides more evidence of large carcass exploitation by hominins during this period. © 2010 Elsevier Ltd.","Butchery; Cut marks; Elephant; Middle Pleistocene; Taphonomy","bone; elephant; hominid; human evolution; Pleistocene; skeletal remains; taphonomy; Madrid [Spain]; Spain; Elephas antiquus",Article,"Final",,Scopus,2-s2.0-77955268885
"Brantingham P.Jeffrey, Kuhn S.L.","15519359400;7103392233;","Constraints on levallois core technology: A mathematical model",2001,"Journal of Archaeological Science","28","7",,"747","761",,83,"10.1006/jasc.2000.0594","https://www.scopus.com/inward/record.uri?eid=2-s2.0-0034944672&doi=10.1006%2fjasc.2000.0594&partnerID=40&md5=4526d927c68f879a68ead1b7fcd43f3a","Department of Anthropology, University of Arizona, Tucson, AZ 85721, United States","Brantingham, P.Jeffrey, Department of Anthropology, University of Arizona, Tucson, AZ 85721, United States; Kuhn, S.L., Department of Anthropology, University of Arizona, Tucson, AZ 85721, United States","Recent volumetric definitions of Levallois core technology are amenable to mathematical modelling. We present a simple geometric model that permits controlled manipulation of a few of the key parameters defining Levallois core morphology. The models indicate that Levallois cores are relatively efficient at minimizing raw material waste while at the same time maximizing productivity in terms of total number of tool blanks and amount of cutting edge produced. Deviations from an ideal Levallois geometry produce significant declines in both efficiency and productivity. These results implicate mechanical and economic constraints as factors underlying the broad geographic distribution and temporal persistence of Levallois core technologies during the Middle and Late Pleistocene. © 2001 Academic Press.","Archaeology; Core reduction strategies; Initial upper paleolithic; Levallois; Lithic technology; Material economy; Mathematical models; Middle paleolithic","innovation; modeling; Paleolithic; productivity",Article,"Final",,Scopus,2-s2.0-0034944672
"Chapman R.E.","","Conventional Procrustes approaches",1990,"Proceedings of the Michigan Morphometrics Workshop",,,,"251","267",,83,,,,"Chapman, R.E.",[No abstract available],,,,,,Scopus,2-s2.0-0000253064
"Eren M.I., Lycett S.J.","23975681200;9434693200;","Why Levallois? A morphometric comparison of experimental 'preferential' Levallois flakes versus debitage flakes",2012,"PLoS ONE","7","1", e29273,"","",,81,"10.1371/journal.pone.0029273","https://www.scopus.com/inward/record.uri?eid=2-s2.0-84856112566&doi=10.1371%2fjournal.pone.0029273&partnerID=40&md5=6f86dd90408d39a185a8ff9d0449f3fc","Department of Anthropology, University of Kent, Canterbury, Kent, United Kingdom","Eren, M.I., Department of Anthropology, University of Kent, Canterbury, Kent, United Kingdom; Lycett, S.J., Department of Anthropology, University of Kent, Canterbury, Kent, United Kingdom","Background: Middle Palaeolithic stone artefacts referred to as 'Levallois' have caused considerable debate regarding issues of technological predetermination, cognition and linguistic capacities in extinct hominins. Their association with both Neanderthals and early modern humans has, in particular, fuelled such debate. Yet, controversy exists regarding the extent of 'predetermination' and 'standardization' in so-called 'preferential Levallois flakes' (PLFs). Methodology/Principal Findings: Using an experimental and morphometric approach, we assess the degree of standardization in PLFs compared to the flakes produced during their manufacture. PLFs possess specific properties that unite them robustly as a group or 'category' of flake. The properties that do so, relate most strongly to relative flake thicknesses across their surface area. PLFs also exhibit significantly less variability than the flakes generated during their production. Again, this is most evident in flake thickness variables. A further aim of our study was to assess whether the particular PLF attributes identified during our analyses can be related to current knowledge regarding flake functionality and utility. Conclusions/Significance: PLFs are standardized in such a manner that they may be considered 'predetermined' with regard to a specific set of properties that distinguishes them statistically from a majority of other flakes. Moreover, their attributes can be linked to factors that, based on current knowledge, are desirable features in flake tools (e.g. durability, capacity for retouch, and reduction of torque). As such, our results support the hypothesis that the lengthy, multi-phase, and hierarchically organized process of Levallois reduction was a deliberate, engineered strategy orientated toward specific goals. In turn, our results support suggestions that Levallois knapping relied on a cognitive capacity for long-term working memory. This is consistent with recent evidence suggesting that cognitive distinctions between later Pleistocene hominins such as the Neanderthals and anatomically modern humans were not as sharp as some scholars have previously suggested. © 2012 Eren, Lycett.",,"article; controlled study; fossil hominin; materials testing; morphometrics; paleoanthropology; standardization; structure analysis; animal; archeology; biological model; classification; comparative study; histology; history; hominid; Homo neanderthalensis; human; instrumentation; kitchen; laboratory diagnosis; methodology; morphometrics; physiology; standard; tool use; validation study; weapon; Animals; Archaeology; Body Weights and Measures; Cooking and Eating Utensils; History, Ancient; Hominidae; Humans; Models, Biological; Neanderthals; Specimen Handling; Tool Use Behavior; Validation Studies as Topic; Weapons",Article,"Final",Open Access,Scopus,2-s2.0-84856112566
"Wynn T., Tierson F.","7007026851;24384855600;","Regional Comparison of the Shapes of Later Acheulean Handaxes",1990,"American Anthropologist","92","1",,"73","84",,80,"10.1525/aa.1990.92.1.02a00050","https://www.scopus.com/inward/record.uri?eid=2-s2.0-0025109462&doi=10.1525%2faa.1990.92.1.02a00050&partnerID=40&md5=db752e6bf854f0f37f266915c466dc9f","University of Colorado at Colorado Springs, United States","Wynn, T., University of Colorado at Colorado Springs, United States; Tierson, F., University of Colorado at Colorado Springs, United States","This article documents an unexpected regional difference in the shapes of later Acheulean hand‐axes. Almost 1,200 handaxes from 17 sites located in Europe, East Africa, India, and the Near East were measured using a polar coordinate technique and compared using discriminant analysis and analysis of variance. One group of handaxes, those from Israel, clearly stood apart. The reasons for this distinction are unclear but may relate to raw material, time, or, perhaps, cultural tradition. 1990 American Anthropological Association",,"Acheulean Age; artefact; field evidence; geographical distribution; handaxe; regional homogeneity; shape",Article,"Final",,Scopus,2-s2.0-0025109462
"Bordes F.","","Principes d'une méthode d'étude des techniques de débitage et de la typologie du Paléolithique ancien et moyen",1950,"L'Anthropologie","54","1-2",,"19","34",,79,,,,"Bordes, F.",[No abstract available],,,,"Final",,Scopus,2-s2.0-0008034806
"Lycett S.J.","9434693200;","Why is there a lack of Mode 3 Levallois technologies in East Asia? A phylogenetic test of the Movius-Schick hypothesis",2007,"Journal of Anthropological Archaeology","26","4",,"541","575",,78,"10.1016/j.jaa.2007.07.003","https://www.scopus.com/inward/record.uri?eid=2-s2.0-35848932778&doi=10.1016%2fj.jaa.2007.07.003&partnerID=40&md5=4d44126a7dd6ca5e5d853a1c28705574","Leverhulme Centre for Human Evolutionary Studies, University of Cambridge, Fitzwilliam Street, Cambridge, CB2 1QH, United Kingdom","Lycett, S.J., Leverhulme Centre for Human Evolutionary Studies, University of Cambridge, Fitzwilliam Street, Cambridge, CB2 1QH, United Kingdom","The 'Movius-Schick hypothesis' claims that an absence of Levallois (Mode 3) technologies in East Asia is due to the lack of a strong ancestral Acheulean (Mode 2) tradition in that region. Hence, this hypothesis is based on the assumption that similarities between Acheulean handaxes and Levallois cores can be interpreted as being phylogenetically homologous (i.e. due to common technological ancestry) as opposed to being homoplasic (i.e. due to convergent technological evolution). Here, the phylogenetic basis of this hypothesis is tested using a formal cladistic procedure. Under the framework of an 'iterative' approach to phylogenetic analysis, a series of post-hoc tests and re-evaluations of results follow the initial cladistic analysis. Results of these combined analyses indicate that morphological similarities between Mode 2 Acheulean handaxes and Mode 3 Levallois cores can, most parsimoniously, be seen as phylogenetically homologous. Hence, these results support the tenets of the 'Movius-Schick' hypothesis in suggesting that a lack of Levallois industries in East Asia may be due to the paucity of an ancestral Acheulean tradition in that region. The implications of these phylogenetic analyses for the concept of Palaeolithic 'Modes' are discussed. It is further suggested that low demographic levels (i.e. small effective population sizes) in East Asia may have constrained the technological phylogenetic trajectory of East Asia compared with that seen in other regions of the Old World during the Lower Palaeolithic. In addition, it is hoped that several methodological issues discussed here will contribute to the growing field of cultural phylogenetic analysis. © 2007 Elsevier Inc. All rights reserved.","Acheulean; Cladistics; Cultural evolution; Levallois; Lithics; Mode 1; Mode 2; Mode 3; Movius Line; Phylogenetics",,Article,"Final",,Scopus,2-s2.0-35848932778
