Authors,Author(s) ID,Title,Year,Source title,Volume,Issue,Art. No.,Page start,Page end,Page count,Cited by,DOI,Link,Affiliations,Authors with affiliations,Abstract,Author Keywords,Index Keywords,Document Type,Publication Stage,Access Type,Source,EID
"Bookstein F.L.","",[No title available],1991,"Morphometric Tools for Landmark Data: Geometry and Biology",,,,"","",,3980,,,,"Bookstein, F.L.",[No abstract available],,,,,,Scopus,2-s2.0-0003597817
"Tomasello M.","","The cultural origins of human cognition",1999,"The Cultural Origins of Human Cognition",,,,"","",,3339,,,,"Tomasello, M.",[No abstract available],,,,,,Scopus,2-s2.0-0003943906
"Dryden I.L., Mardia K.V.","",[No title available],1998,"Statistical Shape Analysis",,,,"","",,2639,,,,"Dryden, I.L.; Mardia, K.V.",[No abstract available],,,,,,Scopus,2-s2.0-0003489720
"Thompson D.W.","",[No title available],1917,"On Growth and Form",,,,"","",,2265,,,,"Thompson, D.W.",[No abstract available],,,,,,Scopus,2-s2.0-0003720769
"Bookstein Fred L.","7004606384;","Principal warps: Thin-plate splines and the decomposition of deformations",1992,"IEEE Transactions on Pattern Analysis and Machine Intelligence","v","n",,"567","585",,1644,,"https://www.scopus.com/inward/record.uri?eid=2-s2.0-34250830971&partnerID=40&md5=fa6e9678132442da34d318864bc4f57e","Univ of Michigan, Cent for Human, Growth & Dev, Ann Arbor, MI, USA","Bookstein, Fred L., Univ of Michigan, Cent for Human, Growth & Dev, Ann Arbor, MI, USA","The decomposition of deformations by principal warps is demonstrated. The method is extended to deal with curving edges between landmarks. This formulation is related to other applications of splines current in computer vision. How they might aid in the extraction of features for analysis, comparison, and diagnosis of biological and medical images is indicated.",,"Biomedical Engineering--Imaging Techniques; Vision--Artificial; Computer Vision; Decomposition of Deformations; Principal Warps; Thin Plate Splines; Image Processing",Article,"Final",,Scopus,2-s2.0-34250830971
"Gower J.C.","26643448300;","Generalized procrustes analysis",1975,"Psychometrika","40","1",,"33","51",,1620,"10.1007/BF02291478","https://www.scopus.com/inward/record.uri?eid=2-s2.0-0001886818&doi=10.1007%2fBF02291478&partnerID=40&md5=c7113fae6e77ffaebc62f66ce8c103be","Rothamsted Experimental Station, Harpenden, Herts, United Kingdom","Gower, J.C., Rothamsted Experimental Station, Harpenden, Herts, United Kingdom","Suppose Pi(i) (i = 1, 2, ..., m, j = 1, 2, ..., n) give the locations of mn points in p-dimensional space. Collectively these may be regarded as m configurations, or scalings, each of n points in p-dimensions. The problem is investigated of translating, rotating, reflecting and scaling the m configurations to minimize the goodness-of-fit criterion Σi=1m Σi=1n Δ2(Pj(i)Gi), where Gi is the centroid of the m points Pi(i) (i = 1, 2, ..., m). The rotated positions of each configuration may be regarded as individual analyses with the centroid configuration representing a consensus, and this relationship with individual scaling analysis is discussed. A computational technique is given, the results of which can be summarized in analysis of variance form. The special case m = 2 corresponds to Classical Procrustes analysis but the choice of criterion that fits each configuration to the common centroid configuration avoids difficulties that arise when one set is fitted to the other, regarded as fixed. © 1975 Psychometric Society.",,,Article,"Final",,Scopus,2-s2.0-0001886818
"Clarke D.L.","",[No title available],1968,"Analytical Archaeology",,,,"","",,751,,,,"Clarke, D.L.",[No abstract available],,,,,,Scopus,2-s2.0-0004131192
"Byrne R.W., Russon A.E., Bauer P.J., Chen M., Chartrand T.L., Lee-Chai A.Y., Bargh J.A., Colman A.M., Cummins D.D., Decety J., Grezes J., De Waal F.B.M., Fishbein H.D., Gardner M., Heyes C., Gattis M., Bekkering H., Wohlschlager A., Hayne H., Heimann M., Huber L., Jorion P.J.M., Kuczai II S.A., Gory J.D., Xitco M.J. Jr., Mac Aogain E., Matheson M.D., Fragaszy D.M., Midford P.E., Miklosi A., Mitchell R.W., Motomora N., Roitblat H.L., Todt D., Tomasello M., Vereijken B., Whiting H.T.A., Vogt S., Carey D., Want S.C., Harris P.L., Whiten A., Zentall T.R.","56969100600;6603182200;7203018930;56134480600;6602090842;6506136412;7003636643;7005337320;20133635300;57203106154;6602098335;7006497218;6701853697;7401638489;7007120930;6602507217;55154252600;6603705410;7003550311;57203077493;7102868913;57152726100;6504678230;6507891922;55664893600;6506448992;57202599100;7004271317;6603048400;7003466993;7403973858;6504586460;6603714080;7004208544;7004816726;6603601384;7003960887;7101896584;7101938313;6701781521;7403636494;7004657792;7006063404;","Learning by imitation: A hierarchical approach",1998,"Behavioral and Brain Sciences","21","5",,"667","721",,464,"10.1017/S0140525X98001745","https://www.scopus.com/inward/record.uri?eid=2-s2.0-0032426663&doi=10.1017%2fS0140525X98001745&partnerID=40&md5=74b429bcd3ec85fb170439d8713b253c","Scottish Primate Research Group, School of Psychology, University of St. Andrews, Fife KY16 9JU, United Kingdom","Byrne, R.W., Scottish Primate Research Group, School of Psychology, University of St. Andrews, Fife KY16 9JU, United Kingdom; Russon, A.E., Scottish Primate Research Group, School of Psychology, University of St. Andrews, Fife KY16 9JU, United Kingdom; Bauer, P.J., Scottish Primate Research Group, School of Psychology, University of St. Andrews, Fife KY16 9JU, United Kingdom; Chen, M., Scottish Primate Research Group, School of Psychology, University of St. Andrews, Fife KY16 9JU, United Kingdom; Chartrand, T.L., Scottish Primate Research Group, School of Psychology, University of St. Andrews, Fife KY16 9JU, United Kingdom; Lee-Chai, A.Y., Scottish Primate Research Group, School of Psychology, University of St. Andrews, Fife KY16 9JU, United Kingdom; Bargh, J.A., Scottish Primate Research Group, School of Psychology, University of St. Andrews, Fife KY16 9JU, United Kingdom; Colman, A.M., Scottish Primate Research Group, School of Psychology, University of St. Andrews, Fife KY16 9JU, United Kingdom; Cummins, D.D., Scottish Primate Research Group, School of Psychology, University of St. Andrews, Fife KY16 9JU, United Kingdom; Decety, J., Scottish Primate Research Group, School of Psychology, University of St. Andrews, Fife KY16 9JU, United Kingdom; Grezes, J., Scottish Primate Research Group, School of Psychology, University of St. Andrews, Fife KY16 9JU, United Kingdom; De Waal, F.B.M., Scottish Primate Research Group, School of Psychology, University of St. Andrews, Fife KY16 9JU, United Kingdom; Fishbein, H.D., Scottish Primate Research Group, School of Psychology, University of St. Andrews, Fife KY16 9JU, United Kingdom; Gardner, M., Scottish Primate Research Group, School of Psychology, University of St. Andrews, Fife KY16 9JU, United Kingdom; Heyes, C., Scottish Primate Research Group, School of Psychology, University of St. Andrews, Fife KY16 9JU, United Kingdom; Gattis, M., Scottish Primate Research Group, School of Psychology, University of St. Andrews, Fife KY16 9JU, United Kingdom; Bekkering, H., Scottish Primate Research Group, School of Psychology, University of St. Andrews, Fife KY16 9JU, United Kingdom; Wohlschlager, A., Scottish Primate Research Group, School of Psychology, University of St. Andrews, Fife KY16 9JU, United Kingdom; Hayne, H., Scottish Primate Research Group, School of Psychology, University of St. Andrews, Fife KY16 9JU, United Kingdom; Heimann, M., Scottish Primate Research Group, School of Psychology, University of St. Andrews, Fife KY16 9JU, United Kingdom; Huber, L., Scottish Primate Research Group, School of Psychology, University of St. Andrews, Fife KY16 9JU, United Kingdom; Jorion, P.J.M., Scottish Primate Research Group, School of Psychology, University of St. Andrews, Fife KY16 9JU, United Kingdom; Kuczai II, S.A., Scottish Primate Research Group, School of Psychology, University of St. Andrews, Fife KY16 9JU, United Kingdom; Gory, J.D., Scottish Primate Research Group, School of Psychology, University of St. Andrews, Fife KY16 9JU, United Kingdom; Xitco M.J., Jr., Scottish Primate Research Group, School of Psychology, University of St. Andrews, Fife KY16 9JU, United Kingdom; Mac Aogain, E., Scottish Primate Research Group, School of Psychology, University of St. Andrews, Fife KY16 9JU, United Kingdom; Matheson, M.D., Scottish Primate Research Group, School of Psychology, University of St. Andrews, Fife KY16 9JU, United Kingdom; Fragaszy, D.M., Scottish Primate Research Group, School of Psychology, University of St. Andrews, Fife KY16 9JU, United Kingdom; Midford, P.E., Scottish Primate Research Group, School of Psychology, University of St. Andrews, Fife KY16 9JU, United Kingdom; Miklosi, A., Scottish Primate Research Group, School of Psychology, University of St. Andrews, Fife KY16 9JU, United Kingdom; Mitchell, R.W., Scottish Primate Research Group, School of Psychology, University of St. Andrews, Fife KY16 9JU, United Kingdom; Motomora, N., Scottish Primate Research Group, School of Psychology, University of St. Andrews, Fife KY16 9JU, United Kingdom; Roitblat, H.L., Scottish Primate Research Group, School of Psychology, University of St. Andrews, Fife KY16 9JU, United Kingdom; Todt, D., Scottish Primate Research Group, School of Psychology, University of St. Andrews, Fife KY16 9JU, United Kingdom; Tomasello, M., Scottish Primate Research Group, School of Psychology, University of St. Andrews, Fife KY16 9JU, United Kingdom; Vereijken, B., Scottish Primate Research Group, School of Psychology, University of St. Andrews, Fife KY16 9JU, United Kingdom; Whiting, H.T.A., Scottish Primate Research Group, School of Psychology, University of St. Andrews, Fife KY16 9JU, United Kingdom; Vogt, S., Scottish Primate Research Group, School of Psychology, University of St. Andrews, Fife KY16 9JU, United Kingdom; Carey, D., Scottish Primate Research Group, School of Psychology, University of St. Andrews, Fife KY16 9JU, United Kingdom; Want, S.C., Scottish Primate Research Group, School of Psychology, University of St. Andrews, Fife KY16 9JU, United Kingdom; Harris, P.L., Scottish Primate Research Group, School of Psychology, University of St. Andrews, Fife KY16 9JU, United Kingdom; Whiten, A., Scottish Primate Research Group, School of Psychology, University of St. Andrews, Fife KY16 9JU, United Kingdom; Zentall, T.R., Scottish Primate Research Group, School of Psychology, University of St. Andrews, Fife KY16 9JU, United Kingdom","To explain social learning without invoking the cognitively complex concept of imitation, many learning mechanisms have been proposed. Borrowing an idea used routinely in cognitive psychology, we argue that most of these alternatives can be subsumed under a single process, priming, in which input increases the activation of stored internal representations. Imitation itself has generally been seen as a 'special faculty.' This has diverted much research towards the all-or-none question of whether an animal can imitate, with disappointingly inconclusive results. In the great apes, however, voluntary, learned behaviours is organized hierarchically. This means that imitation can occur at various levels, of which we single out two clearly distinct ones: the 'action level,' a rather detailed and linear specification of sequential acts, and the 'program level,' a broader description of subroutine structure and the hierarchical layout of a behavioural 'program.' Program level imitation is a high-level, constructive mechanism, adapted for the efficient learning of complex skills and thus not evident in the simple manipulations used to test for imitation in the laboratory. As examples, we describe the food-preparation techniques of wild mountain gorillas and the imitative behaviour of orangutans undergoing 'rehabilitation' to the wild. Representing and manipulating relations between objects seems to be one basic building block in their hierarchical programs. There is evidence that great apes suffer from a stricter capacity limit than humans in the hierarchical depth of planning. We re-interpret some chimpanzee behaviour previously described as 'emulation' and suggest that all great apes may be able to imitate at the program level. Action level imitation is seldom observed in great ape skill learning, and may have a largely social role, even in humans.","Emulation; Great apes; Hierarchical organisation; Imitation; Priming","article; behavior; human; imitation; learning; psychology; psychophysiology; Animals; Behavior, Animal; Humans; Imitative Behavior; Learning; Rats; Social Perception",Article,"Final",,Scopus,2-s2.0-0032426663
"Gamble C.","",[No title available],1999,"The Palaeolithic Societies of Europe",,,,"","",,411,,,,"Gamble, C.",[No abstract available],,,,,,Scopus,2-s2.0-0003946692
"Slice D.E.","6603334019;","Geometric morphometrics",2007,"Annual Review of Anthropology","36",,,"261","281",,330,"10.1146/annurev.anthro.34.081804.120613","https://www.scopus.com/inward/record.uri?eid=2-s2.0-36048942133&doi=10.1146%2fannurev.anthro.34.081804.120613&partnerID=40&md5=5f0b0e37354cef031f810f2f68366c4a","Department of Anthropology, University of Vienna, A-1091 Vienna, Austria","Slice, D.E., Department of Anthropology, University of Vienna, A-1091 Vienna, Austria","Morphometrics, the field of biological shape analysis, has undergone major change in recent years. Most of this change has been due to the development and adoption of methods to analyze the Cartesian coordinates of anatomical landmarks. These geometric morphometric (GM) methods focus on the retention of geometric information throughout a study and provide efficient, statistically powerful analyses that can readily relate abstract, multivariate results to the physical structure of the original specimens. Physical anthropology has played a central role in both the development and the early adoption of these methods, just as it has done in the realm of general statistics, where it has served as a major motivating and contributing force behind much innovation. This review surveys the current state of GM, the role of authropologists in its development, recent applications of GM in physical anthropology, and GM-based methods newly introduced to, or by, anthropology, which are likely to impact future research. Copyright © 2007 by Annual Reviews. All rights reserved.","Allometry; Asymmetry; HTU; Landmarks; Procrustes analysis; Shape","allometry; anthropology; geometry; morphometry; multivariate analysis",Review,"Final",,Scopus,2-s2.0-36048942133
"Mellars P.","6603609789;","The Neanderthal legacy: An archaeological perspective from western Europe",1995,"The Neanderthal Legacy: An Archaeological Perspective from Western Europe",,,,"1","471",,293,,"https://www.scopus.com/inward/record.uri?eid=2-s2.0-84995468326&partnerID=40&md5=19ff3a696ef8e92346cdc30c6e341708","Department of Archaeology, Cambridge University, United Kingdom","Mellars, P., Department of Archaeology, Cambridge University, United Kingdom","The Neanderthals populated western Europe from nearly 250,000 to 30,000 years ago when they disappeared from the archaeological record. In turn, populations of anatomically modern humans, Homo sapiens, came to dominate the area. Seeking to understand the nature of this replacement, which has become a hotly debated issue, Paul Mellars brings together an unprecedented amount of information on the behavior of Neanderthals. His comprehensive overview ranges from the evidence of tool manufacture and related patterns of lithic technology, through the issues of subsistence and settlement patterns, to the more controversial evidence for social organization, cognition, and intelligence. Mellars argues that previous attempts to characterize Neanderthal behavior as either ""modern"" or ""ape-like"" are both overstatements. We can better comprehend the replacement of Neanderthals, he maintains, by concentrating on the social and demographic structure of Neanderthal populations and on their specific adaptations to the harsh ecological conditions of the last glaciation. Mellars's approach to these issues is grounded firmly in his archaeological evidence. He illustrates the implications of these findings by drawing from the methods of comparative socioecology, primate studies, and Pleistocene paleoecology. The book provides a detailed review of the climatic and environmental background to Neanderthal occupation in Europe, and of the currently topical issues of the behavioral and biological transition from Neanderthal to fully ""modern"" populations. © 1996 by Princeton University Press. All Rights Reserved.",,,Book,"Final",,Scopus,2-s2.0-84995468326
"O'Higgins P., Jones N.","7004722122;57199321878;","Facial growth in Cercocebus torquatus: An application of three-dimensional geometric morphometric techniques to the study of morphological variation",1998,"Journal of Anatomy","193","2",,"251","272",,277,"10.1017/S0021878298003975","https://www.scopus.com/inward/record.uri?eid=2-s2.0-0031724058&doi=10.1017%2fS0021878298003975&partnerID=40&md5=06ba008cc284c3597335154d2f2920d8","Evolutionary Anatomy Unit, Dept. of Anat. and Devmtl. Biology, University College, London, United Kingdom; Dept. of Anat. and Devmtl. Biology, University College London, Rockefeller Building, University Street, London WC1E 6JJ, United Kingdom","O'Higgins, P., Evolutionary Anatomy Unit, Dept. of Anat. and Devmtl. Biology, University College, London, United Kingdom, Dept. of Anat. and Devmtl. Biology, University College London, Rockefeller Building, University Street, London WC1E 6JJ, United Kingdom; Jones, N., Evolutionary Anatomy Unit, Dept. of Anat. and Devmtl. Biology, University College, London, United Kingdom","This paper presents a study of 3-dimensional growth in the facial skeleton of the mangabey, Cercocebus torquatus. The pattern of facial cortical remodelling in this species is already well mapped from an earlier study. In this paper we consider the extent to which these remodelling maps relate to ontogenetic changes in size and shape of the face. This study is based on 31 facial landmarks taken from 49 adult and subadult faces. Our analysis draws on some of the tools of geometric morphometrics and we take this opportunity to describe our implementation of these tools for 3D data. The geometric analysis permits the known remodelling maps to be interpreted in the context of the general pattern of facial growth in this species. We are also able to examine sexual dimorphism in the face of this species and consider the extent to which males and females share similar ontogenetic allometries. Our findings indicate that the general pattern of size-related shape variation during facial growth is more or less identical for males and females up to eruption of the third permanent maxillary molar (M3). After this, ontogenetic allometries appear to diverge. The finding of a common growth allometry that is well approximated for younger specimens by a simple linear model is consistent with the earlier findings of a consistent pattern of facial remodelling up to M3 eruption. We consider the implications of these findings in terms of the potential for these approaches in the study of comparative growth in related species.","Facial remodelling; Geometric morphometrics; Thin plate spline analysis","age; allometry; article; cercocebus; controlled study; craniofacial morphology; face growth; female; geometry; male; molar tooth; nonhuman; ontogeny; priority journal; sex difference; statistical model; three dimensional imaging; Animals; Anthropometry; Bone Remodeling; Cercocebus; Facial Bones; Female; Male; Models, Anatomic; Sex Characteristics; Cercocebus; Cercocebus torquatus",Article,"Final",,Scopus,2-s2.0-0031724058
"Hublin J.J.","6602606027;","The origin of Neandertals",2009,"Proceedings of the National Academy of Sciences of the United States of America","106","38",,"16022","16027",,254,"10.1073/pnas.0904119106","https://www.scopus.com/inward/record.uri?eid=2-s2.0-70349482681&doi=10.1073%2fpnas.0904119106&partnerID=40&md5=04735670537d47e81dbad46933b80279","Max Planck Institute for Evolutionary Anthropology, 04103 Leipzig, Germany","Hublin, J.J., Max Planck Institute for Evolutionary Anthropology, 04103 Leipzig, Germany","Western Eurasia yielded a rich Middle (MP) and Late Pleistocene (LP) fossil record documenting the evolution of the Neandertals that can be analyzed in light of recently acquired paleogenetical data, an abundance of archeological evidence, and a well-known environmental context. Their origin likely relates to an episode of recolonization of Western Eurasia by hominins of African origin carrying the Acheulean technology into Europe around 600 ka. An enhancement of both glacial and interglacial phases may have played a crucial role in this event, as well as in the subsequent evolutionary history of the Western Eurasian populations. In addition to climatic adaptations and an increase in encephalization, genetic drift seems to have played a major role in their evolution. To date, a clear speciation event is not documented, and the most likely scenario for the fixation of Neandertal characteristics seems to be an accretion of features along the second half of the MP. Although a separation time for the African and Eurasian populations is difficult to determine, it certainly predates OIS 11 as phenotypic Neandertal features are documented as far back as and possibly before this time. It is proposed to use the term ""Homo rhodesiensis"" to designate the large-brained hominins ancestral to H. sapiens in Africa and at the root of the Neandertals in Europe, and to use the term ""Homo neanderthalensis"" to designate all of the specimens carrying derived metrical or non-metrical features used in the definition of the LP Neandertals.","Acheulean; Climate; Homo heidelbergensis; Homo sapiens; Pleistocene","Africa; climate; Europe; evolution; evolutionary adaptation; genetic drift; hominid; Homo antecessor; homo erectus; Homo heidelbergensis; Homo neanderthalensis; homo sapiens; human; paleontology; phenotypic variation; phylogenetic tree; priority journal; review; species differentiation; Upper Pleistocene; animal; article; classification; fossil; histology; methodology; physical anthropology; population dynamics; time; Homo heidelbergensis; Homo sapiens; Homo sapiens neanderthalensis; Africa; Animals; Anthropology, Physical; Europe; Evolution; Fossils; Hominidae; Humans; Population Dynamics; Time Factors",Review,"Final",Open Access,Scopus,2-s2.0-70349482681
"O'Higgins P.","7004722122;","The study of morphological variation in the hominid fossil record: Biology, landmarks and geometry",2000,"Journal of Anatomy","197","1",,"103","120",,235,"10.1017/S0021878299006330","https://www.scopus.com/inward/record.uri?eid=2-s2.0-0033852603&doi=10.1017%2fS0021878299006330&partnerID=40&md5=03b8f6fba018e4b662962bc2b6808828","Evolutionary Anatomy Unit, Department of Anatomy and Developmental Biology, University College London, United Kingdom; Department of Anatomy and Developmental Biology, University College London, Rockefeller Building, University Street, London WC1E 6JJ, United Kingdom","O'Higgins, P., Evolutionary Anatomy Unit, Department of Anatomy and Developmental Biology, University College London, United Kingdom, Department of Anatomy and Developmental Biology, University College London, Rockefeller Building, University Street, London WC1E 6JJ, United Kingdom","This review considers some recent advances in shape analysis based on landmark data, and focuses on the application of these methods to the study of skeletal evolution in primates. These advances have provoked some controversy. The major aims of this review are to put these debates in context and to provide an overview for the nonmathematician. The purpose of morphometric studies is considered, together with issues relating to the nature, significance and identification of landmarks before turning to a review of available technologies for the analysis of morphological variation. These are considered in terms of underlying models and assumptions in order to clarify when each is appropriate. To illustrate the application of these methods, 3 example studies are presented. The first examines differences amongst ancient and modern adult human crania using 2-dimensional data. The second illustrates the extension of these methods into 3 dimensions in a study of facial growth in monkeys. The third presents an application to the analysis of the form of the hominoid talus. The review ends with an account of available software resources for shape analysis.","Facial variation; Geometric morphometrics; Sexual dimorphism; Shape analysis; Talus","bone development; bone scintiscanning; comparative anatomy; compartment model; computer assisted tomography; craniofacial morphology; evolution; fossil; geometry; human; image analysis; image reconstruction; monkey; morphometrics; nonhuman; priority journal; review; sex difference; species difference; talus; Adult; Animals; Evolution; Fossils; Haplorhini; Hominidae; Humans; Models, Anatomic; Paleontology; Sex Characteristics; Skull; Talus; Crania; Hominidae; Hominoidea; Primates",Review,"Final",,Scopus,2-s2.0-0033852603
