Authors,Author(s) ID,Title,Year,Source title,Volume,Issue,Art. No.,Page start,Page end,Page count,Cited by,DOI,EID
"Adams D.C., Rohlf F.J., Slice D.E.","7404054540;7003281107;6603334019;","A field comes of age: Geometric morphometrics in the 21st century",2013,"Hystrix","24","1",,"","",,304,"10.4404/hystrix-24.1-6283",2-s2.0-84875767161
"Anthony D.W.","","The horse, the wheel and language: How Bronze-Age riders from the Eurasian steppes shaped the modern world",2007,"The Horse, the Wheel, and Language",,,,"","",,182,,2-s2.0-44449096330
"Baylac M., Friess M.","","Fourier descriptors, Procrustes superimposition, and data dimensionality: An example of cranial shape analysis in modern human populations",2005,"Modern Morphometrics in Physical Anthropology",,,,"145","165",,90,,2-s2.0-14744301944
"Baylac M.","","Rmorph: A R geometric and multivariate morphometrics library.",2012,"Rmorph: A R Geometric and Multivariate Morphometrics Library",,,,"","",,57,,2-s2.0-55349130219
"Benecke N.","6507420597;","The Krabbe Collection of Icelandic horses and its significance for archaeozoological research",1990,"Journal of Archaeological Science","17","2",,"161","185",,2,"10.1016/0305-4403(90)90057-C",2-s2.0-33744461750
"Bignon O., Baylac M., Vigne J.-D., Eisenmann V.","15135083300;6701570331;7006603465;6701396464;","Geometric morphometrics and the population diversity of Late Glacial horses in Western Europe (Equus caballus arcelini): Phylogeographic and anthropological implications",2005,"Journal of Archaeological Science","32","3",,"375","391",,37,"10.1016/j.jas.2004.02.016",2-s2.0-14744301135
"Bökönyi S.","",[No title available],1974,"History of Domestic Mammals in Central and Eastern Europe",,,,"","",,270,,2-s2.0-0003688095
"Bookstein F.L.","",[No title available],1991,"Morphometric Tools for Landmark Data: Geometry and Biology",,,,"","",,3975,,2-s2.0-0003597817
"Collins W.B., Brooks J.","","Performance of Icelandic horses in North-western Alaska",1984,"Rangelands","6",,,"253","256",,1,,2-s2.0-85030433675
"Cucchi T., Fujita M., Dobney K.","6506822509;18041913000;6602595568;","New insights into pig taxonomy, domestication and human dispersal in Island South East Asia: Molar shape analysis of Sus remains from Niah Caves, Sarawak",2009,"International Journal of Osteoarchaeology","19","4",,"508","530",,55,"10.1002/oa.974",2-s2.0-70349639859
"Cucchi T., Bǎlǎşescu A., Bem C., Radu V., Vigne J.-D., Tresset A.","6506822509;26033049400;54796493000;16064424400;7006603465;6506727552;","New insights into the invasive process of the eastern house mouse (Mus musculus musculus): Evidence from the burnt houses of Chalcolithic Romania",2011,"Holocene","21","8",,"1195","1202",,19,"10.1177/0959683611405233",2-s2.0-82855163897
"Cucchi T., Hulme-Beaman A., Yuan J., Dobney K.","6506822509;36627224600;56988201600;6602595568;","Early Neolithic pig domestication at Jiahu, Henan Province, China: Clues from molar shape analyses using geometric morphometric approaches",2011,"Journal of Archaeological Science","38","1",,"11","22",,79,"10.1016/j.jas.2010.07.024",2-s2.0-78049286754
"Drake A.G., Klingenberg C.P.","23008538800;7004588456;","The pace of morphological change: Historical transformation of skull shape in St Bernard dogs",2008,"Proceedings of the Royal Society B: Biological Sciences","275","1630",,"71","76",,234,"10.1098/rspb.2007.1169",2-s2.0-36349010900
"Dryden I.L., Mardia K.V.","",[No title available],1998,"Statistical Shape Analysis",,,,"","",,2639,,2-s2.0-0003489720
"Eisenmann V.","","Sur quelques caractères adaptatifs du squelette d'Equus (Mammalia, Perissodactyla) et leurs implications paléoécologiques",1984,"Bulletin Du Muséum National D'Histoire Naturelle",,"2",,"185","195",,37,,2-s2.0-0004945133
"Eisenmann V.","","Quaternary horses: Possible candidates to domestication",1996,"Proc. XIII Congr. International Union of Prehistoric and Protohistoric Sciences",,,,"27","36",,15,,2-s2.0-44449134396
"Eronen J.T., Evans A.R., Fortelius M., Jernvall J.","8910859500;55245839900;6701375676;6603722003;","The impact of regional climate on the evolution of mammals: A case study using fossil horses",2010,"Evolution","64","2",,"398","408",,25,"10.1111/j.1558-5646.2009.00830.x",2-s2.0-75149165776
"Evander R.L.","8407146000;","A revised dental nomenclature for fossil horses",2004,"Bulletin of the American Museum of Natural History",,"285",,"209","218",,12,,2-s2.0-17144373354
"Evin A., Cucchi T., Cardini A., Strand Vidarsdottir U., Larson G., Dobney K.","23977570900;6506822509;21933368100;55349385000;8280762100;6602595568;","The long and winding road: Identifying pig domestication through molar size and shape",2013,"Journal of Archaeological Science","40","1",,"735","743",,87,"10.1016/j.jas.2012.08.005",2-s2.0-84867907430
"FORSTEN A.","6701485437;","The small caballoid horse of the upper Pleistocene and Holocene",1988,"Journal of Animal Breeding and Genetics","105","1-6",,"161","176",,23,"10.1111/j.1439-0388.1988.tb00288.x",2-s2.0-85017265192
"Gidley J.W.","","Tooth characters and revision of the North American species of the genus Equus",1901,"Bulletin of the American Museum of Natural History","14",,,"91","142",,19,,2-s2.0-0009465744
"Gingerich P.D.","","Size variability of the teeth in living mammals and the diagnosis of closely related sympatric fossil species",1974,"Journal of Paleontology","48","5",,"895","903",,170,,2-s2.0-0001288067
"Hillson S.","",[No title available],2005,"Teeth",,,,"","",,496,,2-s2.0-33747187288
"Isenbügel E.","",[No title available],1966,"Das Isländischen Pony",,,,"","",,1,,2-s2.0-84888032181
"Jansen T., Forster P., Levine M.A., Oelke H., Hurles M., Renfrew C., Weber J., Olek K.","35945559100;35725329700;7404034828;22948673600;6603410789;7003474970;57213136563;16186574200;","Mitochondrial DNA and the origins of the domestic horse",2002,"Proceedings of the National Academy of Sciences of the United States of America","99","16",,"10905","10910",,224,"10.1073/pnas.152330099",2-s2.0-0036679199
"Klingenberg C.P.","7004588456;","MorphoJ: An integrated software package for geometric morphometrics",2011,"Molecular Ecology Resources","11","2",,"353","357",,1766,"10.1111/j.1755-0998.2010.02924.x",2-s2.0-78650839801
"Larson G., Cucchi T., Fujita M., Matisoo-Smith E., Robins J., Anderson A., Rolett B., Spriggs M., Dolman G., Kim T.-H., Thuy N.T.D., Randi E., Doherty M., Due R.A., Bollt R., Djubiantono T., Griffin B., Intoh M., Keane E., Kirch P., Li K.-T., Morwood M., Pedriña L.M., Piper P.J., Rabett R.J., Shooter P., Van Den Bergh G., West E., Wickler S., Yuan J., Cooper A., Dobney K.","8280762100;6506822509;18041913000;6602155766;8584142300;7403368938;7801352204;7006979012;8503359500;57056659000;55411746900;7004109837;16244419800;6603592395;14029823600;18041582200;18041547400;6507870060;16244992500;6603913279;16245092000;6603099496;16245718700;15849018500;15849163500;16246322000;6602575711;16246584000;36764443800;56988201600;35263632400;6602595568;","Phylogeny and ancient DNA of Sus provides insights into neolithic expansion in Island Southeast Asia and Oceania",2007,"Proceedings of the National Academy of Sciences of the United States of America","104","12",,"4834","4839",,181,"10.1073/pnas.0607753104",2-s2.0-34247626810
"Lei C.Z., Su R., Bower M.A., Edwards C.J., Wang X.B., Weining S., Liu L., Xie W.M., Li F., Liu R.Y., Zhang Y.S., Zhang C.M., Chen H.","8648663300;57206381370;8968563800;7403062043;55736903800;57204594391;56688831000;55604915700;57214075538;57200962309;36055547400;56459166200;57050550100;","Multiple maternal origins of native modern and ancient horse populations in China",2009,"Animal Genetics","40","6",,"933","944",,35,"10.1111/j.1365-2052.2009.01950.x",2-s2.0-70449411581
"Ludwig A., Pruvost M., Reissmann M., Benecke N., Brockmann G.A., Castaños P., Cieslak M., Lippold S., Llorente L., Malaspinas A.-S., Slatkin M., Hofreiter M.","55587432100;8643057900;36678065800;6507420597;7004913957;26533865100;26533824400;24766950900;26534699000;36772368200;57203643592;6701450663;","Coat color variation at the beginning of Horse domestication",2009,"Science","324","5926",,"485","",,170,"10.1126/science.1172750",2-s2.0-65449148743
"McGahern A., Bower M.A.M., Edwards C.J., Brophy P.O., Sulimova G., Zakharov I., Vizuete-Forster M., Levine M., Li S., MacHugh D.E., Hill E.W.","14622787600;8968563800;7403062043;7102932802;7005532469;7202049481;6504048641;7404034828;8558285700;6602729818;7202000866;","Evidence for biogeographic patterning of mitochondrial DNA sequences in Eastern horse populations",2006,"Animal Genetics","37","5",,"494","497",,48,"10.1111/j.1365-2052.2006.01495.x",2-s2.0-33748794498
"Mitteroecker P., Gunz P.","6507135382;6506472733;","Advances in Geometric morphometrics",2009,"Evolutionary Biology","36","2",,"235","247",,573,"10.1007/s11692-009-9055-x",2-s2.0-69449097227
"Mitteroecker P., Bookstein F.","6507135382;7004606384;","Linear Discrimination, Ordination, and the Visualization of Selection Gradients in Modern Morphometrics",2011,"Evolutionary Biology","38","1",,"100","114",,258,"10.1007/s11692-011-9109-8",2-s2.0-79952312407
"Monteiro L.R.","7103010498;","Multivariate regression models and geometric morphometrics: The search for causal factors in the analysis of shape",1999,"Systematic Biology","48","1",,"192","199",,257,"10.1080/106351599260526",2-s2.0-0033084978
"Müller H.","","Osteologische Untersuchung der Pferde von Grossörner-Molmeck vom Ende des 5. Jh.n.Chr",1955,"Wissenschaftliche Zeitschrift der Martin-Luther-Universität Halle. Ges.- Sprachwiss, Reihe 4","4",,,"661","696",,3,,2-s2.0-84871568458
"Nehring A.","","Fossile Pferde aus deutschen Diluvial-Ablagerungen und ihre Beziehungen zu den lebenden Pferden. Ein Beitrag zur Geschichte des Hauspferdes",1884,"Landwirthschaf. Jahr.","13",,,"81","160",,10,,2-s2.0-0006528526
"Olsen S.L.","7202565798;","Early horse domestication on the Eurasian steppe",2006,"Documenting Domestication: New Genetic and Archaeological Paradigms",,,,"245","269",,51,,2-s2.0-84887750834
"Ottoni C., Girdland Flink L., Evin A., Geörg C., De Cupere B., Van Neer W., Bartosiewicz L., Linderholm A., Barnett R., Peters J., Decorte R., Waelkens M., Vanderheyden N., Ricaut F.-X., Çakirlar C., Çevik Ö., Hoelzel A.R., Mashkour M., Mohaseb Karimlu A.F., Sheikhi Seno S., Daujat J., Brock F., Pinhasi R., Hongo H., Perez-Enciso M., Rasmussen M., Frantz L., Megens H.-J., Crooijmans R., Groenen M., Arbuckle B., Benecke N., Strand Vidarsdottir U., Burger J., Cucchi T., Dobney K., Larson G.","16836860100;55636124900;23977570900;57140428200;6506604649;55886485300;7003328048;24399317900;36776853100;7404190551;6701558321;6701539547;8625766700;6603261067;54977661200;57202509646;7004310137;23980277500;55915525100;55635986300;55635377900;7003530146;10041187600;7005444358;7004824708;56681765600;55470973700;6603423801;7003744396;55152322100;26033412600;6507420597;55349385000;12778968400;6506822509;6602595568;8280762100;","Pig domestication and human-mediated dispersal in western eurasia revealed through ancient DNA and geometric morphometrics",2013,"Molecular Biology and Evolution","30","4",,"824","832",,114,"10.1093/molbev/mss261",2-s2.0-84875580696
"Outram A.K., Stear N.A., Bendrey R., Olsen S., Kasparov A., Zaibert V., Thorpe N., Evershed R.P.","8954776500;24345454300;23096867700;7202565798;7005085553;57200796696;26323401100;7005538923;","The earliest horse harnessing and milking",2009,"Science","323","5919",,"1332","1335",,290,"10.1126/science.1168594",2-s2.0-62149112479
"Payne S., Bull G.","","Components of variation in measurements of pig bones and teeth, and the use of measurements to distinguish wild from domestic pig remains",1988,"Archaeozoologia","2","1-2",,"27","66",,106,,2-s2.0-0042000598
"Rivals F., Mihlbachler M.C., Solounias N.","22136269300;6508245460;6602481505;","Effect of ontogenetic-age distribution in fossil and modern samples on the interpretation of ungulate paleodietes using the mesowear method",2007,"Journal of Vertebrate Paleontology","27","3",,"763","767",,86,"10.1671/0272-4634(2007)27[763:EOODIF]2.0.CO;2",2-s2.0-34848902857
"Rohlf F.J.","","TpsRelw 1.41-Thin Plate Spline Relative Warp",2005,"Ecology and Evolution",,,,"","",,1,,2-s2.0-84888051219
"Rohlf F.J.","","TpsDig 2-Thin Plate Spline Digitizer",2010,"Ecology and Evolution",,,,"","",,1,,2-s2.0-84888067265
"James Rohlf F., Marcus L.F.","24518567800;7005305240;","A revolution morphometrics",1993,"Trends in Ecology and Evolution","8","4",,"129","132",,1263,"10.1016/0169-5347(93)90024-J",2-s2.0-0242462501
"Rohlf F.J., Slice D.","7003281107;6603334019;","Extensions of the procrustes method for the optimal superimposition of landmarks",1990,"Systematic Zoology","39","1",,"40","59",,2389,"10.2307/2992207",2-s2.0-84860428591
"Schulz E., Kaiser T.M.","21733538100;7102376278;","Historical distribution, habitat requirements and feeding ecology of the genus Equus (Perissodactyla)",2013,"Mammal Review","43","2",,"111","123",,22,"10.1111/j.1365-2907.2012.00210.x",2-s2.0-84874878768
"Sheets H.D., Covino K.M., Panasiewicz J.M., Morris S.R.","55663863700;14830225900;14830383200;7403325929;","Comparison of geometric morphometric outline methods in the discrimination of age-related differences in feather shape",2006,"Frontiers in Zoology","3",, 15,"","",,97,"10.1186/1742-9994-3-15",2-s2.0-33749530871
"Smil V.","7003606915;","Horse power: The millenium of the horse began with a whimper, but went out with a bang",2000,"Nature","405","6783",,"125","",,5,"10.1038/35012175",2-s2.0-0034636580
"Stirton R.A.","","Development of characters in horse teeth and the dental nomenclature",1941,"Journal of Mammalogy","22",,,"434","446",,13,,2-s2.0-1342283677
"Vilà C., Leonard J.A., Götherström A., Marklund S., Sandberg K., Lidén K., Wayne R.K., Ellegren H.","7005843645;7402283113;6602916497;57213377399;7005946002;7003643642;7103101948;7006386997;","Widespread origins of domestic horse lineages",2001,"Science","291","5503",,"474","477",,311,"10.1126/science.291.5503.474",2-s2.0-0035910491
"Warmuth V., Eriksson A., Bower M., Barker G., Barrett E., Hanks B., Li S., Lomitashvili D., Ochir-Goryaeva M., Sizonovg G.V., Soyonov V., Manica A.","37068299800;8624767400;8968563800;7202030377;57214045811;16642635700;8558285700;55227366600;55227365800;55227365700;55227366200;6603416293;","Reconstructing the origin and spread of horse domestication in the Eurasian steppe",2012,"Proceedings of the National Academy of Sciences of the United States of America","109","21",,"8202","8206",,91,"10.1073/pnas.1111122109",2-s2.0-84861428712
"Wolff J.","","The law of bone remodelling",1986,"The Law of Bone Remodelling",,,,"","",,903,,2-s2.0-0003474880
"Zeder M.A., Bradley D.G., Emshwiller E., Smith B.D.","7801563077;7403122733;6602655392;9638406800;","Documenting domestication: New genetic and archaeological paradigms",2006,"Documenting Domestication: New Genetic and Archaeological Paradigms",,,,"","",361,128,,2-s2.0-84887758894
