Authors,Author(s) ID,Title,Year,Source title,Volume,Issue,Art. No.,Page start,Page end,Page count,Cited by,DOI,Link,Affiliations,Authors with affiliations,Abstract,Author Keywords,Index Keywords,Document Type,Publication Stage,Access Type,Source,EID
"O'Higgins P., Jones N.","7004722122;57199321878;","Facial growth in Cercocebus torquatus: An application of three-dimensional geometric morphometric techniques to the study of morphological variation",1998,"Journal of Anatomy","193","2",,"251","272",,277,"10.1017/S0021878298003975","https://www.scopus.com/inward/record.uri?eid=2-s2.0-0031724058&doi=10.1017%2fS0021878298003975&partnerID=40&md5=06ba008cc284c3597335154d2f2920d8","Evolutionary Anatomy Unit, Dept. of Anat. and Devmtl. Biology, University College, London, United Kingdom; Dept. of Anat. and Devmtl. Biology, University College London, Rockefeller Building, University Street, London WC1E 6JJ, United Kingdom","O'Higgins, P., Evolutionary Anatomy Unit, Dept. of Anat. and Devmtl. Biology, University College, London, United Kingdom, Dept. of Anat. and Devmtl. Biology, University College London, Rockefeller Building, University Street, London WC1E 6JJ, United Kingdom; Jones, N., Evolutionary Anatomy Unit, Dept. of Anat. and Devmtl. Biology, University College, London, United Kingdom","This paper presents a study of 3-dimensional growth in the facial skeleton of the mangabey, Cercocebus torquatus. The pattern of facial cortical remodelling in this species is already well mapped from an earlier study. In this paper we consider the extent to which these remodelling maps relate to ontogenetic changes in size and shape of the face. This study is based on 31 facial landmarks taken from 49 adult and subadult faces. Our analysis draws on some of the tools of geometric morphometrics and we take this opportunity to describe our implementation of these tools for 3D data. The geometric analysis permits the known remodelling maps to be interpreted in the context of the general pattern of facial growth in this species. We are also able to examine sexual dimorphism in the face of this species and consider the extent to which males and females share similar ontogenetic allometries. Our findings indicate that the general pattern of size-related shape variation during facial growth is more or less identical for males and females up to eruption of the third permanent maxillary molar (M3). After this, ontogenetic allometries appear to diverge. The finding of a common growth allometry that is well approximated for younger specimens by a simple linear model is consistent with the earlier findings of a consistent pattern of facial remodelling up to M3 eruption. We consider the implications of these findings in terms of the potential for these approaches in the study of comparative growth in related species.","Facial remodelling; Geometric morphometrics; Thin plate spline analysis","age; allometry; article; cercocebus; controlled study; craniofacial morphology; face growth; female; geometry; male; molar tooth; nonhuman; ontogeny; priority journal; sex difference; statistical model; three dimensional imaging; Animals; Anthropometry; Bone Remodeling; Cercocebus; Facial Bones; Female; Male; Models, Anatomic; Sex Characteristics; Cercocebus; Cercocebus torquatus",Article,"Final",,Scopus,2-s2.0-0031724058
"Isaac G.L.","",[No title available],1977,"Olorgesailie: Archaeological Studies of a Middle Pleistocene Lake Basin in Kenya",,,,"","",,252,,,,"Isaac, G.L.",[No abstract available],,,,"Final",,Scopus,2-s2.0-0003874881
"O'Higgins P.","7004722122;","The study of morphological variation in the hominid fossil record: Biology, landmarks and geometry",2000,"Journal of Anatomy","197","1",,"103","120",,235,"10.1017/S0021878299006330","https://www.scopus.com/inward/record.uri?eid=2-s2.0-0033852603&doi=10.1017%2fS0021878299006330&partnerID=40&md5=03b8f6fba018e4b662962bc2b6808828","Evolutionary Anatomy Unit, Department of Anatomy and Developmental Biology, University College London, United Kingdom; Department of Anatomy and Developmental Biology, University College London, Rockefeller Building, University Street, London WC1E 6JJ, United Kingdom","O'Higgins, P., Evolutionary Anatomy Unit, Department of Anatomy and Developmental Biology, University College London, United Kingdom, Department of Anatomy and Developmental Biology, University College London, Rockefeller Building, University Street, London WC1E 6JJ, United Kingdom","This review considers some recent advances in shape analysis based on landmark data, and focuses on the application of these methods to the study of skeletal evolution in primates. These advances have provoked some controversy. The major aims of this review are to put these debates in context and to provide an overview for the nonmathematician. The purpose of morphometric studies is considered, together with issues relating to the nature, significance and identification of landmarks before turning to a review of available technologies for the analysis of morphological variation. These are considered in terms of underlying models and assumptions in order to clarify when each is appropriate. To illustrate the application of these methods, 3 example studies are presented. The first examines differences amongst ancient and modern adult human crania using 2-dimensional data. The second illustrates the extension of these methods into 3 dimensions in a study of facial growth in monkeys. The third presents an application to the analysis of the form of the hominoid talus. The review ends with an account of available software resources for shape analysis.","Facial variation; Geometric morphometrics; Sexual dimorphism; Shape analysis; Talus","bone development; bone scintiscanning; comparative anatomy; compartment model; computer assisted tomography; craniofacial morphology; evolution; fossil; geometry; human; image analysis; image reconstruction; monkey; morphometrics; nonhuman; priority journal; review; sex difference; species difference; talus; Adult; Animals; Evolution; Fossils; Haplorhini; Hominidae; Humans; Models, Anatomic; Paleontology; Sex Characteristics; Skull; Talus; Crania; Hominidae; Hominoidea; Primates",Review,"Final",,Scopus,2-s2.0-0033852603
"Clark G.","",[No title available],1969,"World Prehistory: A New Outline",,,,"","",,225,,,,"Clark, G.",[No abstract available],,,,"Final",,Scopus,2-s2.0-0003919352
"Rohlf F.J.","7003281107;","Statistical power comparisons among alternative morphometric methods",2000,"American Journal of Physical Anthropology","111","4",,"463","478",,188,"10.1002/(SICI)1096-8644(200004)111:4<463::AID-AJPA3>3.0.CO;2-B","https://www.scopus.com/inward/record.uri?eid=2-s2.0-0034079586&doi=10.1002%2f%28SICI%291096-8644%28200004%29111%3a4%3c463%3a%3aAID-AJPA3%3e3.0.CO%3b2-B&partnerID=40&md5=7db8ac7da9b97d1c4c987f65357f8aa9","Department of Ecology and Evolution, State University of New York, Stony Brook, NY 11794-5245, United States","Rohlf, F.J., Department of Ecology and Evolution, State University of New York, Stony Brook, NY 11794-5245, United States","This paper compares the statistical power of various tests that have been proposed to test for equality of shape in two populations. Power surfaces are computed with emphasis on the simplest case of three points in the plane (i.e., landmarks at the vertices of a triangle). Goodall's ([1991] J Roy Stat Soc Serb 53:285-339) F-test was found to have the highest power followed by T2-tests using Kendall tangent space coordinates. Power for T2- tests using Bookstein shape coordinates was good if the baseline was not the shortest side of the triangle. The Rao and Suryawanshi ([1996] Proc Natl Acad Sci 93:12132-12136 and [1998] Proc Natl Acad Sci 95:4121-4125) shape variables had much lower power when triangles were not close to being equilateral. Power surfaces for the EDMA-I T statistic revealed very low power for many shape comparisons including those between very different shapes. Power surface for the EDMA-II Z statistic were also complicated and depended strongly on the choice of baseline used for size scaling. The type I error rate was also often not correct for this method. Results for more than three landmarks are also presented. The implications of the results for practical applications of morphometrics are discussed. (C) 2000 Wiley-Liss, Inc.","EDMA; Inter-landmark distances; Kendall shape space; Morphometrics; Multivariate analysis; Power surfaces; Shape coordinates; Tangent space","article; intermethod comparison; morphometrics; simulation; statistical analysis; statistical model; system analysis; Anthropology, Physical; Anthropometry; Humans; Reproducibility of Results; Sensitivity and Specificity; Statistical Distributions",Article,"Final",,Scopus,2-s2.0-0034079586
"Collard M., Wood B.","7102608373;7401873883;","How reliable are human phylogenetic hypotheses?",2000,"Proceedings of the National Academy of Sciences of the United States of America","97","9",,"5003","5006",,167,"10.1073/pnas.97.9.5003","https://www.scopus.com/inward/record.uri?eid=2-s2.0-0034712946&doi=10.1073%2fpnas.97.9.5003&partnerID=40&md5=ae55628fb5870e4cd9c3e3ac8a4228c0","Department of Anthropology, University College London, London WC1E 6BT, United Kingdom; Department of Anthropology, George Washington University, Washington, DC 20052, United States","Collard, M., Department of Anthropology, University College London, London WC1E 6BT, United Kingdom; Wood, B., Department of Anthropology, George Washington University, Washington, DC 20052, United States","Cladistic analysis of cranial and dental evidence has been widely used to generate phylogenetic hypotheses about humans and their fossil relatives. However, the reliability of these hypotheses has never been subjected to external validation. To rectify this, we applied identical methods to equivalent evidence from two groups of extant higher primates for whom reliable molecular phylogenies are available, the hominoids and papionins. We found that the phylogenetic hypotheses based on the craniodental data were incompatible with the molecular phylogenies for the groups. Given the robustness of the molecular phylogenies, these results indicate that little confidence can be placed in phylogenies generated solely from higher primate craniodental evidence. The corollary of this is that existing phylogenetic hypotheses about human evolution are unlikely to be reliable. Accordingly, new approaches are required to address the problem of hominin phylogeny.",,"article; baboon; dentition; evolution; fossil; hominid; human; hypothesis; nonhuman; phylogeny; primate; priority journal; reliability; skull; validation process; Animals; Fossils; Gorilla gorilla; Hominidae; Humans; Hylobates; Paleodontology; Paleontology; Phylogeny; Pongo pygmaeus; Reproducibility of Results; Skull; Hominidae; Homo; Papio hamadryas; Primates",Article,"Final",Open Access,Scopus,2-s2.0-0034712946
"Slice D.E.","",[No title available],1998,"Software for Morphometric Research",,,,"","",,150,,,,"Slice, D.E.",[No abstract available],,,,"Final",,Scopus,2-s2.0-0004184561
"Thompson D.W.","",[No title available],1942,"On Growth and Form: A New Edition",,,,"","",,144,,,,"Thompson, D.W.",[No abstract available],,,,"Final",,Scopus,2-s2.0-0003834066
"Roe D.A.","8733223000;","British Lower and Middle Palaeolithic Handaxe Groups",1969,"Proceedings of the Prehistoric Society","34",,,"1","82",,128,"10.1017/S0079497X00013840","https://www.scopus.com/inward/record.uri?eid=2-s2.0-84971109187&doi=10.1017%2fS0079497X00013840&partnerID=40&md5=bdc6ca665d9e09ab8e3e73aa3dfe2814","Department of Ethnology and Prehistory, University of Oxford, United Kingdom","Roe, D.A., Department of Ethnology and Prehistory, University of Oxford, United Kingdom",[No abstract available],,,Article,"Final",,Scopus,2-s2.0-84971109187
"De Terra H., Paterson T.T.","",[No title available],1939,"Studies on the Ice Age in India and Associated Human Cultures",,,,"493","",,121,,,,"De Terra, H.; Paterson, T.T.",[No abstract available],,,,"Final",,Scopus,2-s2.0-0007675471
"McPherron S.P.","6506777264;","Handaxes as a measure of the mental capabilities of early hominids",2000,"Journal of Archaeological Science","27","8",,"655","663",,119,"10.1006/jasc.1999.0467","https://www.scopus.com/inward/record.uri?eid=2-s2.0-0033866974&doi=10.1006%2fjasc.1999.0467&partnerID=40&md5=0440cedd21354da455b135c87a4b4504","Department of Anthropology, 426 Graham Building, University of North Carolina Greensboro, P.O. Box 26170C, Greensboro, NC 27402-6170, United States","McPherron, S.P., Department of Anthropology, 426 Graham Building, University of North Carolina Greensboro, P.O. Box 26170C, Greensboro, NC 27402-6170, United States","Handaxes are often used to discuss the evolution of mental capabilities in early hominids. There are several reasons handaxes are used for this purpose, but principal among these is the notion that handaxe shape is an arbitrary imposition of form, on varied raw material, that reflects shared mental templates. If this is so, then changes in handaxe shape through time and space may speak directly to evolving mental capabilities. It is argued here, however, that far too little attention has been paid to much simpler levels of explanation that may say much less about mental capabilities. This point is illustrated by re-examining some data sets that have been used by others to show patterns in handaxe shape interpreted as reflecting differences in mental constructs or for elevated mental abilities. It will be argued here that some very basic factors, such as raw materials and reduction intensity, are better able to explain the observed patterns. As a result, the existence of mental templates for preferred handaxe shapes seems unlikely. (C) 2000 Academic Press.","Acheulian; Handaxes; Intelligence; Mental capabilities; Style; Symbolism; Technology","Acheulean; tool use; Hominidae",Article,"Final",,Scopus,2-s2.0-0033866974
"Ackermann R.R.","7202506415;","Ontogenetic integration of the hominoid face",2005,"Journal of Human Evolution","48","2",,"175","197",,96,"10.1016/j.jhevol.2004.11.001","https://www.scopus.com/inward/record.uri?eid=2-s2.0-13444302259&doi=10.1016%2fj.jhevol.2004.11.001&partnerID=40&md5=7a1b24fdd860959798c4bc1f6c9e5db9","Department of Archaeology, Faculty of Science, University of Cape Town, Private Bag, Rondebosch 7701, South Africa","Ackermann, R.R., Department of Archaeology, Faculty of Science, University of Cape Town, Private Bag, Rondebosch 7701, South Africa","By investigating similarity in cranial covariation patterns, it is possible to locate underlying functional and developmental causes for the patterning, and to make inferences about the evolutionary forces that have acted to produce the patterns. Furthermore, establishing where these covariation patterns may diverge in ontogeny can offer insight into when selection may have acted on development. Here, covariation patterns are compared among adult and non-adult members of the African ape/human clade, in order to address three questions. First, are integration patterns constant among adult African apes and humans? Second, are they are constant in non-adults - i.e. throughout ontogeny? Third, if they are not constant, when do they diverge? Measurements are obtained from 677 crania of adult and non-adult African apes and humans. In order to address the first two questions, correlation matrices and theoretical integration matrices are compared using matrix correlation methods. The third question is evaluated by comparing correlation and variance/covariance patterns, using matrix correlation and random skewers methods, respectively, between adjacent age categories within each species, and between equivalent age categories among the four species. Results show that the hominoids share a similar pattern of ontogenetic integration, suggesting that common developmental/functional integrative processes may play an important role in keeping covariance structure stable across this lineage. However, there are some important differences in the magnitude of integration and in phenotypic covariance structure among the species, which may provide some insight into how selection acted to differentiate humans from the great apes. © 2004 Elsevier Ltd. All rights reserved.","Cranial morphology; Hominidae; Modularity; Morphological integration; Phenotypic covariance structure; Variability","cranium; evolution; hominid; morphology; ontogeny; Alocasia macrorrhizos; Crania; Hominidae; Hominoidea; Homo",Article,"Final",,Scopus,2-s2.0-13444302259
"Falsetti A.B., Jungers W.L., Colle III T.M.","6603038152;7003589500;16446195600;","Morphometrics of the callitrichid forelimb: A case study in size and shape",1993,"International Journal of Primatology","14","4",,"551","572",,94,"10.1007/BF02215447","https://www.scopus.com/inward/record.uri?eid=2-s2.0-0001022934&doi=10.1007%2fBF02215447&partnerID=40&md5=5e32a6d465b0bc77013a2db0d5a5be06","Department of Ecology and Evolution, Division of Biological Sciences, State University of New York-Stony Brook, Stony Brook, 11794-5425, New York, United States; Department of Anatomical Sciences, The Health Sciences Center, State University of New York-Stony Brook, Stony Brook, 11794, New York, United States; Doctoral Program in Anthropological Sciences, State University of New York-Stony Brook, Stony Brook, 11794, New York, United States","Falsetti, A.B., Department of Ecology and Evolution, Division of Biological Sciences, State University of New York-Stony Brook, Stony Brook, 11794-5425, New York, United States; Jungers, W.L., Department of Anatomical Sciences, The Health Sciences Center, State University of New York-Stony Brook, Stony Brook, 11794, New York, United States; Colle III, T.M., Doctoral Program in Anthropological Sciences, State University of New York-Stony Brook, Stony Brook, 11794, New York, United States","Mosimann and colleagues formulated a technique that distinguishes between size and shape, based on the concept of geometric similarity and the distinction between ""log size-and-shape"" and ""log shape"" variables. We extend these formulations in an examination of the forelimb of three callitrichid species (adult Saguinus oedipus, Saguinus fuscicollis, and Callithrix jacchus). We employ principal components analysis to explore the relationship between variance explained by size-and-shape versus shape alone. Independence of shape vectors is examined via correlation analysis. Then we use log shape data to construct intersample (species means) and total sample (between all paris of individuals) matrices of average taxonomic distances. These distance matrices are subjected to cluster analysis and principal coordinate ordinations. Results of principal components analysis suggest that after isometric size is removed, there remains sufficient shape information to discriminate among the three taxa. Careful examination and quantification of the relationships between shape and size suggest that size information (e.g., geometric mean) is fundamental for understanding shape differences within and among callitrichid species; in other words, most aspects of forelimb shape are significantly correlated with size. Contrary to conventional wisdom, we also demonstrate that such correlations are not ""spurious"". Ordinations and clustering of log shape distance matrices (based on means and individuals) support the notion that, despite differences in size, the two tamarins are more similar in shape than either is to C. jacchus (despite size similarity between S. fuscicollis and C. jacchus). Although shape variation in the forelimb of calliirichids may have a functional component, the phylogenetic signal remains strong and serves to group individuals accordingly. © 1993 Plenum Publishing Corporation.","callitrichids; multivariate statistics; size and shape",,Article,"Final",,Scopus,2-s2.0-0001022934
"Kinnear P.R., Gray C.D.","6603835177;7402204353;","SPSS 12 made simple",2006,"SPSS 12 Made Simple",,,,"1","451",,91,"10.4324/9780203497388","https://www.scopus.com/inward/record.uri?eid=2-s2.0-84909286441&doi=10.4324%2f9780203497388&partnerID=40&md5=6884ea929ece78fb4e39a18fb1b017f6","Department of Psychology, University of Aberdeen, United Kingdom","Kinnear, P.R., Department of Psychology, University of Aberdeen, United Kingdom; Gray, C.D., Department of Psychology, University of Aberdeen, United Kingdom","SPSS 12 Made Simple provides a step-by-step coverage of every aspect of data analysis with SPSS from data entry to interpretation of the output. As well as advice on data entry and checking, there is guidance on the best ways of describing a data set and the choice of an appropriate statistical technique. Finally, the output is fully explained, with reference to fully annotated SPSS output. Extensive illustrations show exactly what is on the screen at every stage of the process, helping the reader to avoid common pitfalls and check their progress along the way. Most chapters end with practical exercises to illustrate the main points raised and allow the reader to test their understanding; but there is a final general revision section with further exercises on a range of topics. In view of the recommendations of the American Psychological Association, the book now contains advice on strength of effect, power and sample size. There is also guidance on how to report the results of statistical tests in journal articles. This new edition is written with the same clarity that has made the book such a success in the past. The initial chapters provide an introduction to the basics of SPSS, such as data entry, followed by more advanced techniques, such as sorting, case selection, aggregation and file merging. In these early chapters, the emphasis is upon checking the accuracy of data entry and exploring the data thoroughly before making any formal statistical tests. There is also extensive coverage of the powerful new graphics capabilities of SPSS 12. Each of the later chapters is devoted to a particular statistical technique. SPSS 12 Made Simple: Covers a wide range of statistical tests including t-tests, ANOVA, correlation, regression, multi-way frequency analysis, discriminant analysis, logistic regression and factor analysis. Shows you how to get as much out of your data as possible. Gives advice (with appropriate cautions and caveats) on choosing a statistical test. Makes extensive use of annotated screen snapshots of SPSS output, windows and dialog boxes. Includes both chapter-specific and general exercises. Has a comprehensive index. © 2004 Psychology Press. All rights reserved.",,,Book,"Final",,Scopus,2-s2.0-84909286441
"Aiello L.C.","7006805529;","Allometry and the analysis of size and shape in human evolution",1992,"Journal of Human Evolution","22","2",,"127","147",,88,"10.1016/0047-2484(92)90034-7","https://www.scopus.com/inward/record.uri?eid=2-s2.0-0026493627&doi=10.1016%2f0047-2484%2892%2990034-7&partnerID=40&md5=eec2c2db8e7953ba06980daaea6d4575","Department of Anthropology, University College London, Gower Street, London, WC1E 6BT England, United Kingdom","Aiello, L.C., Department of Anthropology, University College London, Gower Street, London, WC1E 6BT England, United Kingdom","This contribution has two main aims. The first is to assess the applicability of allometric techniques for purposes of predication and comparison, and the second is to test the possibility that the relationship between weight and stature was more significantly different in AL 288-1 (Australopithecus afarensis) and other Plio-Pleistocene hominids than it is in modern humans. It is argued that in the great majority of cases, the reduced major axis (RMA) is the preferred allometric technique. The reason for this is that the slope of the RMA is totally independent of the correlation coefficient. Both the least squares slope (LSR) and the major axis (MA) (which are both highly affected by the correlation coefficient) converge on it as the correlation coefficient approaches unity. It is also argued that the RMA provides the best estimate of the functional relation between the two variables in the analysis when the error variance is unknown, as is most frequently the case in allometric analyses. Furthermore, it is demonstrated that the MA produces a particularly spurious best-fit line when the correlation coefficient deviates from unity and the variance of the dependent variable (e.g., body weight) is particularly large in relation to the variance of the independent variable (e.g., stature). This has important implications not only for general allometric analysis but also particularly for the prediction of body weight from skeletal measurements. When RMA is used as the basis of inference and comparison, AL 288-1 (based on the best current estimates for stature and weight) has an inferred weight for its stature that would be highly unusual for modern humans, but similar to that observed for living African apes. OH 62 is similar to AL 288-1 in this respect. © 1992 Academic Press Limited.","allometry; australopithecines; human evolution; line-fitting; stature; weight","alometric technique; human evolution; reduced major axis; weight/stature ratio",Article,"Final",,Scopus,2-s2.0-0026493627
