Authors,Author(s) ID,Title,Year,Source title,Volume,Issue,Art. No.,Page start,Page end,Page count,Cited by,DOI,Link,Affiliations,Authors with affiliations,Abstract,Author Keywords,Index Keywords,Document Type,Publication Stage,Access Type,Source,EID
"Hair J.F., Anderson R.E., Tatham R.L., Black W.C.","",[No title available],1995,"Multivariate Data Analysis",,,,"","",,52056,,,,"Hair, J.F.; Anderson, R.E.; Tatham, R.L.; Black, W.C.",[No abstract available],,,,,,Scopus,2-s2.0-0003506109
"Quinn G.P., Keough M.J.","",[No title available],2002,"Experimental Design and Data Analysis for Biologists",,,,"","",,7965,,,,"Quinn, G.P.; Keough, M.J.",[No abstract available],,,,,,Scopus,2-s2.0-0003462293
"Bookstein F.L.","",[No title available],1991,"Morphometric Tools for Landmark Data: Geometry and Biology",,,,"","",,3980,,,,"Bookstein, F.L.",[No abstract available],,,,,,Scopus,2-s2.0-0003597817
"Rohlf F.J., Sokal R.R.","",[No title available],1995,"Biometry",,,,"","",,3842,,,,"Rohlf, F.J.; Sokal, R.R.",[No abstract available],,,,"Final",,Scopus,2-s2.0-0004244870
"Dryden I.L., Mardia K.V.","",[No title available],1998,"Statistical Shape Analysis",,,,"","",,2639,,,,"Dryden, I.L.; Mardia, K.V.",[No abstract available],,,,,,Scopus,2-s2.0-0003489720
"Rohlf F.J., Slice D.","7003281107;6603334019;","Extensions of the procrustes method for the optimal superimposition of landmarks",1990,"Systematic Zoology","39","1",,"40","59",,2394,"10.2307/2992207","https://www.scopus.com/inward/record.uri?eid=2-s2.0-84860428591&doi=10.2307%2f2992207&partnerID=40&md5=74ce7a85fe27c8da218b0b8e0fbb6d49","Department of Ecology and Evolution, State University of New York at Stony Brook, Stony Brook, NY, 11794-5245, United States","Rohlf, F.J., Department of Ecology and Evolution, State University of New York at Stony Brook, Stony Brook, NY, 11794-5245, United States; Slice, D., Department of Ecology and Evolution, State University of New York at Stony Brook, Stony Brook, NY, 11794-5245, United States","Superimposition methods for comparing configurations of landmarks in two or more specimens are reviewed. These methods show differences in shape among specimens as residuals after rotation, translation, and scaling them so that they align as well as possible. A new method is presented that generalizes Siegel and Benson's (1982) resistant-fit theta-rho analysis so that more than two objects can be compared at the same time. Both least-squares and resistant-fit approaches are generalized to allow for affine transformations (uniform shape change). The methods are compared, using artificial data and data on 18 landmarks on the wings of 127 species of North American mosquitoes. Graphical techniques are also presented to help summarize the patterns of differences in shape among the objects being compared. © 1990 Society of Systematic Zoology.",,,Article,"Final",,Scopus,2-s2.0-84860428591
"Gower J.C.","26643448300;","Generalized procrustes analysis",1975,"Psychometrika","40","1",,"33","51",,1620,"10.1007/BF02291478","https://www.scopus.com/inward/record.uri?eid=2-s2.0-0001886818&doi=10.1007%2fBF02291478&partnerID=40&md5=c7113fae6e77ffaebc62f66ce8c103be","Rothamsted Experimental Station, Harpenden, Herts, United Kingdom","Gower, J.C., Rothamsted Experimental Station, Harpenden, Herts, United Kingdom","Suppose Pi(i) (i = 1, 2, ..., m, j = 1, 2, ..., n) give the locations of mn points in p-dimensional space. Collectively these may be regarded as m configurations, or scalings, each of n points in p-dimensions. The problem is investigated of translating, rotating, reflecting and scaling the m configurations to minimize the goodness-of-fit criterion Σi=1m Σi=1n Δ2(Pj(i)Gi), where Gi is the centroid of the m points Pi(i) (i = 1, 2, ..., m). The rotated positions of each configuration may be regarded as individual analyses with the centroid configuration representing a consensus, and this relationship with individual scaling analysis is discussed. A computational technique is given, the results of which can be summarized in analysis of variance form. The special case m = 2 corresponds to Classical Procrustes analysis but the choice of criterion that fits each configuration to the common centroid configuration avoids difficulties that arise when one set is fitted to the other, regarded as fixed. © 1975 Psychometric Society.",,,Article,"Final",,Scopus,2-s2.0-0001886818
"Zelditch M., Swiderski D., Sheets H., Fink W.","6701615282;35493322600;55663863700;7005590403;","Geometric Morphometrics for Biologists",2004,"Geometric Morphometrics for Biologists",,,,"1","443",,1396,"10.1016/B978-0-12-778460-1.X5000-5","https://www.scopus.com/inward/record.uri?eid=2-s2.0-84902728366&doi=10.1016%2fB978-0-12-778460-1.X5000-5&partnerID=40&md5=bbfcd38d36d5bc6566def6d8fd5dec57","Museum of Paleontology, University of Michigan, MI, United States; Mammal Division, Museum of Zoology, University of Michigan, MI, United States; Department of Physics, Canisius College, Buffalo NY, United States","Zelditch, M., Museum of Paleontology, University of Michigan, MI, United States; Swiderski, D., Mammal Division, Museum of Zoology, University of Michigan, MI, United States; Sheets, H., Department of Physics, Canisius College, Buffalo NY, United States; Fink, W., Mammal Division, Museum of Zoology, University of Michigan, MI, United States","Geometric Morphometrics for Biologists is an introductory textbook for a course on geometric morphometrics, written for graduate students and upper division undergraduates, covering both theory of shape analysis and methods of multivariate analysis. It is designed for students with minimal math background; taking them from the process of data collection through basic and more advanced statistical analyses. Many examples are given, beginning with simple although realistic case-studies, through examples of complex analyses requiring several different kinds of methods. The book also includes URLâs for free software and step-by-step instructions for using the software. © 2004 Elsevier Inc. All rights reserved.",,,Book,"Final",,Scopus,2-s2.0-84902728366
"James Rohlf F., Marcus L.F.","24518567800;7005305240;","A revolution morphometrics",1993,"Trends in Ecology and Evolution","8","4",,"129","132",,1268,"10.1016/0169-5347(93)90024-J","https://www.scopus.com/inward/record.uri?eid=2-s2.0-0242462501&doi=10.1016%2f0169-5347%2893%2990024-J&partnerID=40&md5=14afd83efbc93ae5f62d49a4829a5597","Dept of Ecology and Evolution, State University of New York, Stony Brook, NY 11794-5245, United States; Dept of Biology, Queen's College, CUNY, Flushing, NY 11367, United States","James Rohlf, F., Dept of Ecology and Evolution, State University of New York, Stony Brook, NY 11794-5245, United States; Marcus, L.F., Dept of Biology, Queen's College, CUNY, Flushing, NY 11367, United States","We are now in the midst of a revolution in morphometric methodology. The new approaches are more effective in capturing information about the shape of an organism and result in more powerful statistical procedures for testing for differences in s shape. They are also more effective in enabling a researcher to visualize differences in shape and in suggesting simple traditional measurements that could be used in future studies. In this review we emphasize applications to exploratory studies in taxonomy and evolution. © 1993.",,,Review,"Final",,Scopus,2-s2.0-0242462501
"Adams D.C., Rohlf F.J., Slice D.E.","7404054540;7003281107;6603334019;","Geometric morphometrics: Ten years of progress following the ‘revolution’",2004,"Italian Journal of Zoology","71","1",,"5","16",,1201,"10.1080/11250000409356545","https://www.scopus.com/inward/record.uri?eid=2-s2.0-1242321708&doi=10.1080%2f11250000409356545&partnerID=40&md5=74fa0a4ec02d5ccc6f34b38d4e228cd8","Department of Ecology, Evolution, Organismal Biology, Department of Statistics, Iowa State University, Ames, IA, 50011–3223, United States; Department of Ecology and Evolution, State University of New York, Stony Brook, NY, 11794–5245, United States; Institute for Anthropology, University of Vienna, Winston-Salem, NC, 27157–1022, Austria; Department of Medical Engineering, Wake Forest University School of Medicine, Winston-Salem, NC, 27157–1022, United States","Adams, D.C., Department of Ecology, Evolution, Organismal Biology, Department of Statistics, Iowa State University, Ames, IA, 50011–3223, United States; Rohlf, F.J., Department of Ecology and Evolution, State University of New York, Stony Brook, NY, 11794–5245, United States; Slice, D.E., Institute for Anthropology, University of Vienna, Winston-Salem, NC, 27157–1022, Austria, Department of Medical Engineering, Wake Forest University School of Medicine, Winston-Salem, NC, 27157–1022, United States","The analysis of shape is a fundamental part of much biological research. As the field of statistics developed, so have the sophistication of the analysis of these types of data. This lead to multivariate morphometrics in which suites of measurements were analyzed together using canonical variates analysis, principal components analysis, and related methods. In the 1980s, a fundamental change began in the nature of the data gathered and analyzed. This change focused on the coordinates of landmarks and the geometric information about their relative positions. As a by-product of such an approach, results of multivariate analyses could be visualized as configurations of landmarks back in the original space of the organism rather than only as statistical scatter plots. This new approach, called “geometric morphometrics”;, had benefits that lead Rohlf and Marcus (1993) to proclaim a “revolution”; in morphometrics. In this paper, we briefly update the discussion in that paper and summarize the advances in the ten years since the paper by Rohlf and Marcus. We also speculate on future directions in morphometric analysis. © 2004 Taylor & Francis Group, LLC.","Generalized Procrustes analysis; Geometric morphometrics; Shape analysis","geometry; morphometry; zoology; Procrustes",Article,"Final",Open Access,Scopus,2-s2.0-1242321708
"Goodall C.","","Procrustes methods in the statistical analysis of shape",1991,"J. R. Statist. Soc. B","53","2",,"285","339",,1199,,,,"Goodall, C.",[No abstract available],,,,,,Scopus,2-s2.0-0000142472
"Bookstein F.L.","7004606384;","Landmark methods for forms without landmarks: Morphometrics of group differences in outline shape",1997,"Medical Image Analysis","1","3",,"225","243",,957,"10.1016/S1361-8415(97)85012-8","https://www.scopus.com/inward/record.uri?eid=2-s2.0-0031107378&doi=10.1016%2fS1361-8415%2897%2985012-8&partnerID=40&md5=13e7bb81c1f834c67647b53d0eefa883","Institute of Gerontology, University of Michigan, 300 North Ingalls Building, Ann Arbor, MI 48109-2007, United States","Bookstein, F.L., Institute of Gerontology, University of Michigan, 300 North Ingalls Building, Ann Arbor, MI 48109-2007, United States","Morphometrics, a new branch of statistics, combines tools from geometry, computer graphics and biometrics in techniques for the multivariate analysis of biological shape variation. Although medical image analysts typically prefer to represent scenes by way of curving outlines or surfaces, the most recent developments in this associated statistical methodology have emphasized the domain of landmark data: size and shape of configurations of discrete, named points in two or three dimensions. This paper introduces a combination of Procrustes analysis and thin-plate splines, the two most powerful tools of landmark-based morphometrics, for multivariate analysis of curving outlines in samples of biomedical images. The thin-plate spline is used to assign point-to-point correspondences, called semi-landmarks, between curves of similar but variable shape, while the standard algorithm for Procrustes shape averages and shape coordinates is altered to accord with the ways in which semi-landmarks formally differ from more traditional landmark loci. Subsequent multivariate statistics and visualization proceed mainly as in the landmark-based methods. The combination provides a range of complementary filters, from high pass to low pass, for effects on outline shape in grouped studies. The low-pass version is based on the spectrum of the spline, the high pass, on a familiar special case of Procrustes analysis. This hybrid method is demonstrated in a comparison of the shape of the corpus callosum from mid-sagittal sections of MRI of 25 human brains, 12 normal and 13 with schizophrenia.","Morphometrics; Multivariate analysis; Outlines; Procrustes analysis; Thin-plate spline","algorithm; article; corpus callosum; histology; human; image processing; methodology; multivariate analysis; nuclear magnetic resonance imaging; pathology; schizophrenia; statistics; Algorithms; Corpus Callosum; Humans; Image Processing, Computer-Assisted; Magnetic Resonance Imaging; Multivariate Analysis; Schizophrenia",Article,"Final",,Scopus,2-s2.0-0031107378
"Dytham C.","",[No title available],1999,"Choosing and Using Statistics: A Biologist's Guide",,,,"","",,879,,,,"Dytham, C.",[No abstract available],,,,,,Scopus,2-s2.0-0003681899
"Huberty C.J.","",[No title available],1994,"Applied Discriminant Analysis",,,,"","",,879,,,,"Huberty, C.J.",[No abstract available],,,,,,Scopus,2-s2.0-0003643695
"Kendall D.G.","23064672000;","Shape manifolds, procrustean metrics, and complex projective spaces",1984,"Bulletin of the London Mathematical Society","16","2",,"81","121",,822,"10.1112/blms/16.2.81","https://www.scopus.com/inward/record.uri?eid=2-s2.0-0002432238&doi=10.1112%2fblms%2f16.2.81&partnerID=40&md5=f07b714770ad9f540342a022ea72e9e1","Statistical Laboratory, 16 Mill Lane, Cambridge, CB2 1SB, United Kingdom","Kendall, D.G., Statistical Laboratory, 16 Mill Lane, Cambridge, CB2 1SB, United Kingdom","The shape-space ∑mk whose points σ represent the shapes of not totally degenerate k-ads in Rm is introduced as a quotient space carrying the quotient metric. When m = 1, we find that ∑1 k=SK−2 when m ≥ 3, the shape-space contains singularities. This paper deals mainly with the case m = 2, when the shape-space ∑2k can be identified with a version of CPk−2. Of special importance are the shape-measures induced on CPk−2 by any assigned diffuse law of distribution for the k vertices. We determine several such shape-measures, we resolve some of the technical problems associated with the graphic presentation and statistical analysis of empirical shape distributions, and among applications we discuss the relevance of these ideas to testing for the presence of non-accidental multiple alignments in collections of (i) neolithic stone monuments and (ii) quasars. Finally the recently introduced Ambartzumian density is examined from the present point of view, its norming constant is found, and its connexion with random Crofton polygons is established. © 1984 Oxford University Press.",,,Article,"Final",,Scopus,2-s2.0-0002432238
"White T.D., Folkens P.A.","",[No title available],1991,"Human Osteology",,,,"","",,780,,,,"White, T.D.; Folkens, P.A.",[No abstract available],,,,,,Scopus,2-s2.0-0003797978
"Leakey M.D.","",[No title available],1971,"Olduvai Gorge: Excavations in Beds I and II, 1960-1963","3",,,"","",,555,,,,"Leakey, M.D.",[No abstract available],,,,,,Scopus,2-s2.0-0003471652
"Rohlf F.J.","7003281107;","Shape statistics: Procrustes superimpositions and tangent spaces",1999,"Journal of Classification","16","2",,"197","223",,537,"10.1007/s003579900054","https://www.scopus.com/inward/record.uri?eid=2-s2.0-0033235691&doi=10.1007%2fs003579900054&partnerID=40&md5=afe1b218ad4917ce57cf2dee9936bc68","State University of New York, Stony Brook, NY, United States; Department of Ecology and Evolution, State University of New York, Stony Brook, NY 11794-5245, United States","Rohlf, F.J., State University of New York, Stony Brook, NY, United States, Department of Ecology and Evolution, State University of New York, Stony Brook, NY 11794-5245, United States","The shape of a set of labeled points corresponds to those attributes of the configuration that are invariant to the effects of translation, rotation, and scale. Procrustes distance may be used to compare different shapes and also serve as a metric that may be used to define multidimensional shape spaces. This paper demonstrates that the preshape space of planar triangles Procrustes aligned to a reference triangle corresponds to a unit hemisphere. An overview of methods used as linear approximations of D. G. Kendall's non-Euclidean shape space is given, and the equivalence of several methods based on orthogonal projections is shown. Some problems with approximations based on stereographic projections are also discussed. A simple example using artificial data is included.","Kendall shape space; Multivariate analysis; Partial warps; Preshape space; Tangent space",,Article,"Final",,Scopus,2-s2.0-0033235691
"Jungers W.L., Falsetti A.B., Wall C.E.","7003589500;6603038152;7102194935;","Shape, relative size, and size‐adjustments in morphometrics",1995,"American Journal of Physical Anthropology","38","21 S",,"137","161",,505,"10.1002/ajpa.1330380608","https://www.scopus.com/inward/record.uri?eid=2-s2.0-0028851596&doi=10.1002%2fajpa.1330380608&partnerID=40&md5=a3b4e177343e6028aa5d1f2f048568a7","Department of Anatomical Sciences, School of Medicine, S.U.N.Y. at Stony Brook, Stony Brook, New York, 11794, United States; National Museum of Health and Medicine, Armed Forces Institute of Pathology, Washington, District of Columbia, 20306, United States; Department of Biological Anthropology and Anatomy, Duke University Medical Center, Durham, North Carolina, 27710, United States","Jungers, W.L., Department of Anatomical Sciences, School of Medicine, S.U.N.Y. at Stony Brook, Stony Brook, New York, 11794, United States; Falsetti, A.B., National Museum of Health and Medicine, Armed Forces Institute of Pathology, Washington, District of Columbia, 20306, United States; Wall, C.E., Department of Biological Anthropology and Anatomy, Duke University Medical Center, Durham, North Carolina, 27710, United States","Many problems in comparative biology and biological anthropology require meaningful definitions of “relative size” and “shape.” Here we review the distinguishing features of ratios and residuals and their relationships to other methods of “size‐adjustment” for continuous data. Eleven statistical techniques are evaluated in reference to one broadly interspecific data set (craniometries of adult Old World monkeys) and one narrowly intraspecific data set (anthropometries of adult Native American males). Three different types of residuals are compared to three versions of shape ratios, and these are contrasted to “cscores,” Penrose shape, and multivariate adjustments based on the first principal component of the logged variance‐covariance matrix; all methods are also compared to raw and logged raw data. In order to help us identify appropriate; methods for size‐adjustment, geometrically similar or “isometric” versions of the male vervet and the Inuit male were created by scalar multiplication of all variables. The geometric mean of all variables is used as overall “size” throughout this investigation, but our conclusions would be the same for most other size variables. Residual adjustments failed to correctly identify individuals of the same shape in both sampkles. Like residuals, cscores are also sample‐specific and incorrectly attribute different shape values to individuals known to be identical in shape. Multivariate “residuals” (e.g., discarding the first principal component and Burnaby's method) are plagued by similar problems. If one of the goals of an analysis is to identify individuals (OTUs) of the same shape after accounting for overalll size differences, then none of these methods can be recommended. We also reject the assertion that size‐adjusted variables should be unciorrelated with size of “size‐free”; rather, whether or not shape covaries with size is an important empirical determination in any analysis. Without explicit similarity criteria, “lines of subtraction” can be very misleading. Only variables in the Mosimann family of shape rations allowed us to identify sized individuals of the same shape (“Iso‐OUTs”). Residuals from isometric lines in logarithmic space, projections of logged data to a plane orthogonal to an isometric vector, and Penrose shape distance based on logged data are also part of this shape family. Shape defined in this manner can be significantly correlated with size in allometric data sets (e.g., guenon craniometrics); ratio shape differences may be largely independent of size in narrowly intraspecific or intrasexual data sets (e.g., Native American anthropometrics). Log‐transformations of shape variables are not always necessary or desirable. We hope our findings enciourage other workers to question the assumptions and utility of residuals as size‐adjusted data and to explore shape and relative size within Mosimann's explicitly geometric framework. © 1995 Wiley‐Liss, Inc. Copyright © 1995 Wiley‐Liss, Inc., A Wiley Company","Morphometrics; Ratios; Residuals; Shape; Size","anthropometry; human; morphometrics; review",Article,"Final",,Scopus,2-s2.0-0028851596
"Bordes F.","",[No title available],1961,"Typologie du Paléolithique Ancien et Moyen",,,,"","",,485,,,,"Bordes, F.",[No abstract available],,,,,,Scopus,2-s2.0-0003911253
"Mosimann J.E.","7003513907;","Size allometry: Size and shape variables with characterizations of the lognormal and generalized gamma distributions",1970,"Journal of the American Statistical Association","65","330",,"930","945",,446,"10.1080/01621459.1970.10481136","https://www.scopus.com/inward/record.uri?eid=2-s2.0-84950615442&doi=10.1080%2f01621459.1970.10481136&partnerID=40&md5=328b103422d458575ba4966bd8222ed2","National Institutes of Health, United States","Mosimann, J.E., National Institutes of Health, United States","Size-related shape changes in animals are studied within a general framework of size variables and shape vectors. Isometry, or independence of shape and size, is defined as the independence of some (all) shape vector(s) from a particular size variable. With mild restrictions it is shown that isometry is possible with respect to at most one size variable, or in other words that shape will always be related to a variety of size variables. The choice of a size variable is a hitherto neglected, but important, part of an allometric study. The use of functional relationships in allometry is contrasted with the approach developed here. Also, size and shape variables are used in characterizations of the lognormal, gamma and generalized gamma distributions. The results, given in a biological context, are of interest in size and shape studies generally. © Taylor & Francis Group, LLC.",,,Article,"Final",,Scopus,2-s2.0-84950615442
"Howells W.W.","","Cranial Variation in Man. A Study by Multivariate Analysis of Patterns of Difference Among Recent Human Populations",1973,"Cranial Variation in Man",,,,"","",,424,,,,"Howells, W.W.",[No abstract available],,,,,,Scopus,2-s2.0-0003834718
"Shennan S.","",[No title available],1997,"Quantifying Archaeology",,,,"","",,384,,,,"Shennan, S.",[No abstract available],,,,"Final",,Scopus,2-s2.0-0004129790
"Schick K.D., Toth N.","",[No title available],1993,"Making Silent Stones Speak",,,,"","",,363,,,,"Schick, K.D.; Toth, N.",[No abstract available],,,,,,Scopus,2-s2.0-0004164515
