Authors,Author(s) ID,Title,Year,Source title,Volume,Issue,Art. No.,Page start,Page end,Page count,Cited by,DOI,Link,Affiliations,Authors with affiliations,Abstract,Author Keywords,Index Keywords,Document Type,Publication Stage,Access Type,Source,EID
"Wood B., Lieberman D.E.","7401873883;7202460412;","Craniodental variation in Paranthropus boisei: A developmental and functional perspective",2001,"American Journal of Physical Anthropology","116","1",,"13","25",,93,"10.1002/ajpa.1097","https://www.scopus.com/inward/record.uri?eid=2-s2.0-0034847413&doi=10.1002%2fajpa.1097&partnerID=40&md5=d23da2dfc981c0c5aa1ebb3b99e488b9","Department of Anthropology, George Washington University, Washington, DC 20052, United States; Human Origins Program, National Museum of Natural History, Smithsonian Institution, Washington, DC 20560, United States; Department of Anthropology, Harvard University, Peabody Museum, Cambridge, MA 02138, United States; Department of Anthropology, George Washington University, 2110 G St. NW, Washington, DC 20052, United States","Wood, B., Department of Anthropology, George Washington University, Washington, DC 20052, United States, Human Origins Program, National Museum of Natural History, Smithsonian Institution, Washington, DC 20560, United States, Department of Anthropology, George Washington University, 2110 G St. NW, Washington, DC 20052, United States; Lieberman, D.E., Department of Anthropology, Harvard University, Peabody Museum, Cambridge, MA 02138, United States","What levels and patterns of craniodental variation among a fossil hypodigm are necessary to reject the null hypothesis that only a single species is sampled? We suggest how developmental and functional criteria can be used to predict where in the skeleton of fossil hominins we should expect more, or less, within-species variation. We present and test three hypotheses about the factors contributing to craniodental variation in extant primate taxa, and then apply these results to the interpretation of the P. boisei hypodigm. Within the comparative samples of extant Homo, Pan, Gorilla, Pongo, and Colobus, variables from the cranial base, neurocranium, and face that are not subject to high magnitudes of strain have consistently lower levels of intraspecific variation than variables from regions of the face subject to high levels of strain. Dental size variables are intermediate in terms of their reliability. P. boisei is found to have a low degree of variability relative to extant primates for variables shown to be generally useful for testing taxonomic hypotheses. Contrary to the claims of Suwa et al. ([1997] Nature 389:489-492), the recently discovered material from Konso falls within the range of variation of the ""pre-Konso"" hypodigm of P. boisei for available conventional metrical variables. Those aspects of the Konso material that appear to extend the range of the P. boisei hypodigm involve regions of the skull predicted to be prone to high levels of within-species variation. The approach used in this study focuses on craniodental data, but it is applicable to other regions of the skeleton. © 2001 Wiley-Liss, Inc.","Coefficient of variation; Craniodental; Paranthropus boisei; Species; Taxonomy","anatomical variation; article; craniofacial morphology; fossil; mechanical stress; nonhuman; primate; skull; strain difference; taxonomy; Animals; Anthropology, Physical; Dentition; Female; Fossils; Male; Models, Theoretical; Primates; Skull",Article,"Final",,Scopus,2-s2.0-0034847413
"González-José R., Van Der Molen S.V., González-Pérez E., Hernández M.","6602423911;7003355277;6602570951;7401971749;","Patterns of Phenotypic Covariation and Correlation in Modern Humans as Viewed from Morphological Integration",2004,"American Journal of Physical Anthropology","123","1",,"69","77",,90,"10.1002/ajpa.10302","https://www.scopus.com/inward/record.uri?eid=2-s2.0-0347419489&doi=10.1002%2fajpa.10302&partnerID=40&md5=b21db76e82a837c6e2f2e9005597ccbc","Secció d'Antropologia, Facultat de Biologia, Universitat de Barcelona, 08028 Barcelona, Spain; Unitat de Zoologia, Facultat de Ciencies, Universitat Autonoma de Barcelona, 08193 Bellaterra, Barcelona, Spain; Secció d'Antropologia, Facultat de Biologia, Universitat de Barcelona, Av. Diagonal 645, 08028 Barcelona, Spain","González-José, R., Secció d'Antropologia, Facultat de Biologia, Universitat de Barcelona, 08028 Barcelona, Spain, Secció d'Antropologia, Facultat de Biologia, Universitat de Barcelona, Av. Diagonal 645, 08028 Barcelona, Spain; Van Der Molen, S.V., Unitat de Zoologia, Facultat de Ciencies, Universitat Autonoma de Barcelona, 08193 Bellaterra, Barcelona, Spain; González-Pérez, E., Secció d'Antropologia, Facultat de Biologia, Universitat de Barcelona, 08028 Barcelona, Spain; Hernández, M., Secció d'Antropologia, Facultat de Biologia, Universitat de Barcelona, 08028 Barcelona, Spain","Proportionality of phenotypic and genetic distance is of crucial importance to adequately focus on population history and structure, and it depends on the proportionality of genetic and phenotypic covariance. Constancy of phenotypic covariances is unlikely without constancy of genetic covariation if the latter is a substantial component of the former. If phenotypic patterns are found to be relatively stable, the most probable explanation is that genetic covariance matrices are also stable. Factors like morphological integration account for such stability. Morphological integration can be studied by analyzing the relationships among morphological traits. We present here a comparison of phenotypic correlation and covariance structure among worldwide human populations. Correlation and covariance matrices between 47 cranial traits were obtained for 28 populations, and compared with design matrices representing functional and developmental constraints. Among-population differences in patterns of correlation and covariation were tested for association with matrices of genetic distances (obtained after an examination of 10 Alu-insertions) and with Mahalanobis distances (computed after craniometrical traits). All matrix correlations were estimated by means of Mantel tests. Results indicate that correlation and covariance structure in our species is stable, and that among-group correlation/covariance similarity is not related to genetic or phenotypic distance. Conversely, genetic and morphological distance matrices were highly correlated. Correlation and covariation patterns were largely associated with functional and developmental factors, which probably account for the stability of covariance patterns. © 2004 Wiley-Liss, Inc.","Covariance matrices; Craniometrics; Molecular distances; Morphological distances","article; correlation analysis; craniometry; genetic distance; human; morphological adaptation; phenotypic variation; population differentiation; population research; skull; Alu Elements; Cephalometry; Evolution; Gene Frequency; Humans; Models, Genetic; Phenotype; Skull; Variation (Genetics)",Article,"Final",,Scopus,2-s2.0-0347419489
"Lieberman D.E.","7202460412;","Making Behavioral and Phylogenetic Inferences from Hominid Fossils: Considering the Developmental Influence of Mechanical Forces",1997,"Annual Review of Anthropology","26",,,"185","210",,77,"10.1146/annurev.anthro.26.1.185","https://www.scopus.com/inward/record.uri?eid=2-s2.0-0000152181&doi=10.1146%2fannurev.anthro.26.1.185&partnerID=40&md5=50b356bf4a5a62b2a218ce86079c5bf6","Department of Anthropology, Rutgers University, New Brunswick, NJ 08903-0270, United States","Lieberman, D.E., Department of Anthropology, Rutgers University, New Brunswick, NJ 08903-0270, United States","Fossils pose special problems for making phylogenetic and functional inferences about evolution. One reason is that bones have numerous functions and grow through a variety of processes, some of which are under strong genetic control, but many of which are highly influenced by external stimuli. Analyses of the angular kinetics, cross-sectional geometries, and microstructural properties of bones reveal information not only about the forces generated by habitual activities but also about osteogenic responses to such forces. Consequently, comparisons of osseous characters are at best an indirect and frequently misleading source of systematic information. By integrating functional and phylogenetic studies of the skeleton with analyses of how bones develop, we may find a useful solution to these problems.","Bone; Evolution; Functional morphology; Hominid; Phylogeny",,Article,"Final",,Scopus,2-s2.0-0000152181
"Lele S., Richtsmeier J.T.","35966285500;7004651665;","Euclidean distance matrix analysis: Confidence intervals for form and growth differences",1995,"American Journal of Physical Anthropology","98","1",,"73","86",,65,"10.1002/ajpa.1330980107","https://www.scopus.com/inward/record.uri?eid=2-s2.0-0029091295&doi=10.1002%2fajpa.1330980107&partnerID=40&md5=ebd62e89f49da9b467da3076a33b784d","Department of Biostatistics, School of Hygiene and Public Health, Johns Hokins University, Baltimore, Maryland, 21205, United States; Department of Cell Biology and Anatomy, School of Medicine, Johns Hokins University, Baltimore, Maryland, 21205, United States","Lele, S., Department of Biostatistics, School of Hygiene and Public Health, Johns Hokins University, Baltimore, Maryland, 21205, United States; Richtsmeier, J.T., Department of Cell Biology and Anatomy, School of Medicine, Johns Hokins University, Baltimore, Maryland, 21205, United States","Analysis of biological forms using landmark data has received substantial attention recently. Much of the statistical work in this area has concentrated on the estimation of average form, average form difference, and average growth difference. From the statistical, as well as the scientific point of view, it is important that any estimate of a scientifically relevant quantity be accompanied by a statement regarding its accuracy. Such a statement is contained in a confidence interval. The purpose of this paper is to provide a method to obtain confidence intervals for form difference and growth difference estimators. The estimators are based on Euclidean distance matrix analysis. The confidence intervals are calculated using the model independent bootstrap method. We illustrate the method by using three examples: morphological differences between samples of craniofacial patients and normal controls using two dimensional data from head X‐rays, sexual dimorphism of craniofacial morphology in Cebus apella, and sexual dimorphism of facial growth in Cebus apella using three‐dimensional data. © Wiley‐Liss, Inc. Copyright © 1995 Wiley‐Liss, Inc., A Wiley Company","Bootstrap; Craniofacial morphology; Estimation of form; Landmark data; Morphometrics; Sexual dimorphism","article; body growth; cebidae; mathematical analysis; nonhuman; sex difference; statistical analysis; Animal; Cebus; Comparative Study; Confidence Intervals; Craniofacial Dysostosis; Female; Growth; Male; Models, Biological; Sex Characteristics; Skull; Support, U.S. Gov't, Non-P.H.S.",Article,"Final",,Scopus,2-s2.0-0029091295
"Cerda-Flores R.M., Villalobos-Torres M.C., Barrera-Saldaña H.A., Cortés-Prieto L.M., Barajas L.O., Rivas F., Carracedo A., Zhong Y., Barton S.A., Chakraborty R.","7004128180;55407601800;57203078712;6503851192;35900630800;7006573640;7006062179;7401808976;53363215600;8747937800;","Genetic admixture in three Mexican Mestizo populations based on D1S80 and HLA-DQA1 loci",2002,"American Journal of Human Biology","14","2",,"257","263",,63,"10.1002/ajhb.10020","https://www.scopus.com/inward/record.uri?eid=2-s2.0-18344389032&doi=10.1002%2fajhb.10020&partnerID=40&md5=786369fabe6a415db0af451b2feb5812","Departamento de Genética de Poblaciones, Centro de Investigación Biomédica del Noreste (CIBIN), Instituto Mexicano del Seguro Social, Monterrey, Nuevo León, Mexico; Human Genetics Center, University of Texas, School of Public Health, Houston, TX, United States; Division de Postgrado, Facultad de Ciencias Biológicas, Universidad Autonoma de Nuevo León, Monterrey, Nuevo León, Mexico; Unidad de Laboratorios de Ingenieria y Expresion Genéticas, Departamento de Bioquímica, Universidad Autónoma de Nuevo León, Monterrey, Mexico; Immunology Division, Western Biomedical Research Center, Instituto Mexicano del Seguro Social, Guadalajara, Jalisco, Mexico; Unidad de Genética Forense, Departamento de Medicina Legal, Universidad de Santiago de Compostela, Galicia, Spain; Human Genetics Center, School of Public Health, P.O. Box 20186, Houston, TX 77225, United States","Cerda-Flores, R.M., Departamento de Genética de Poblaciones, Centro de Investigación Biomédica del Noreste (CIBIN), Instituto Mexicano del Seguro Social, Monterrey, Nuevo León, Mexico, Human Genetics Center, University of Texas, School of Public Health, Houston, TX, United States, Division de Postgrado, Facultad de Ciencias Biológicas, Universidad Autonoma de Nuevo León, Monterrey, Nuevo León, Mexico; Villalobos-Torres, M.C., Unidad de Laboratorios de Ingenieria y Expresion Genéticas, Departamento de Bioquímica, Universidad Autónoma de Nuevo León, Monterrey, Mexico; Barrera-Saldaña, H.A., Unidad de Laboratorios de Ingenieria y Expresion Genéticas, Departamento de Bioquímica, Universidad Autónoma de Nuevo León, Monterrey, Mexico; Cortés-Prieto, L.M., Immunology Division, Western Biomedical Research Center, Instituto Mexicano del Seguro Social, Guadalajara, Jalisco, Mexico; Barajas, L.O., Immunology Division, Western Biomedical Research Center, Instituto Mexicano del Seguro Social, Guadalajara, Jalisco, Mexico; Rivas, F., Immunology Division, Western Biomedical Research Center, Instituto Mexicano del Seguro Social, Guadalajara, Jalisco, Mexico; Carracedo, A., Unidad de Genética Forense, Departamento de Medicina Legal, Universidad de Santiago de Compostela, Galicia, Spain; Zhong, Y., Human Genetics Center, University of Texas, School of Public Health, Houston, TX, United States; Barton, S.A., Human Genetics Center, University of Texas, School of Public Health, Houston, TX, United States, Human Genetics Center, School of Public Health, P.O. Box 20186, Houston, TX 77225, United States; Chakraborty, R., Human Genetics Center, University of Texas, School of Public Health, Houston, TX, United States","This study compares genetic polymorphisms at the D1S80 and HLA-DQA1 loci in three Mexican Mestizo populations from three large states (Nuevo León, Jalisco, and the Federal District). Allele frequency distributions are relatively homogenous in the three samples; only the Federal District population shows minor differences of the HLA-DQA1 allele frequencies compared with the other two. In terms of genetic composition, these Mestizo populations show evidence of admixture with predominantly Spanish-European (50-60%) and Amerindian (37-49%) contributions; the African contribution (1-3%) is minor. Together with the observation that in Nuevo León, the admixture estimates based on D1S80 and HLA-DQA1, are virtually the same as those reported earlier from blood group loci, suggests that DNA markers, such as D1S80 and HLA-DQA1 are useful for examining genetic homogeneity/heterogeneity across Mestizo populations of Mexico. The inverse relationship of the proportion of gene diversity due to population differences (Gst) to within population gene diversity (Hs) is also consistent with theoretical predictions, supporting the use of these markers for population genetics studies. Am. J. Hum. Biol. 14:257-263, 2002. © 2002 Wiley-Liss, Inc.",,"DNA marker; HLA DQ antigen; Africa; allele; American Indian; article; blood group; controlled study; ethnic group; Europe; gene frequency; gene locus; genetic heterogeneity; genetic polymorphism; genetic variability; HLA system; human; population genetics; prediction; priority journal; Spain",Article,"Final",,Scopus,2-s2.0-18344389032
"Wijsman E.M., Cavalli-Sforza L.L.","","Migration and genetic population structure with special reference to humans",1984,"Annu. Rev. Ecol. Syst.","15",,,"279","301",,62,,,,"Wijsman, E.M.; Cavalli-Sforza, L.L.",[No abstract available],,,,"Final",,Scopus,2-s2.0-0001356970
"Lisker R., Ramírez E., Babinsky V.","55664209500;7101676241;6506118033;","Genetic Structure of Autochthonous Populations of Meso-America: Mexico",1996,"Human Biology","68","3",,"395","404",,57,,"https://www.scopus.com/inward/record.uri?eid=2-s2.0-0030157882&partnerID=40&md5=348232f71b11adb0408fa73f7c3577d0","Departamento de Genética, Inst. Nac. la Nutr. Salvador Zubiran, Vasco de Quiroga No 15, Tlalpan 14000, Mexico City, Mexico","Lisker, R., Departamento de Genética, Inst. Nac. la Nutr. Salvador Zubiran, Vasco de Quiroga No 15, Tlalpan 14000, Mexico City, Mexico; Ramírez, E., Departamento de Genética, Inst. Nac. la Nutr. Salvador Zubiran, Vasco de Quiroga No 15, Tlalpan 14000, Mexico City, Mexico; Babinsky, V., Departamento de Genética, Inst. Nac. la Nutr. Salvador Zubiran, Vasco de Quiroga No 15, Tlalpan 14000, Mexico City, Mexico","We analyze the possible effect of gene flow on the genetic structure of present-day Mexicans. For this purpose we reviewed previous admixture estimates for various Indian and Mestizo groups. Several facts seem clear: (1) There are no pure Indian groups in Mexico, because all Indian groups show variable degrees of admixture, mostly with whites (range, 0.088 in the Huichol to 0.373 in the Huasteco); (2) the main ancestral contribution to the noncoastal lower middle class Mestizo populations is Indian (above 50%) so that from a genetic standpoint Indians and lower middle class Mestizos are not much different; and (3) black ancestry is quite high on the coasts, ranging from 0.127 to 0.405 on the east coast, and is present in other Mestizos, ranging in large urban centers from 0.027 in Oaxaca to 0.107 in Puebla and in smaller cities from 0.08 in Tlaxcala to 0.181 in Cuanalán.","Admixture; Gene flow; Genetic structure; Meso-America; Mexico","American Indian; article; Caucasian; clinical trial; ethnic group; genetics; human; Mexico; migration; multicenter study; population; Emigration and Immigration; Ethnic Groups; European Continental Ancestry Group; Humans; Indians, North American; Mexico; Population",Article,"Final",,Scopus,2-s2.0-0030157882
"Gibson C.","",[No title available],1967,"Los aztecas bajo el dominio español (1519-1810)",,,,"","",,57,,,,"Gibson, C.",[No abstract available],,,,"Final",,Scopus,2-s2.0-33644511835
"Ross A.H., Slice D.E., Ubelaker D.H., Falsetti A.B.","7402568108;6603334019;7003416830;6603038152;","Population Affinities of 19th Century Cuban Crania: Implications for Identification Criteria in South Florida Cuban Americans",2004,"Journal of Forensic Sciences","49","1",,"11","16",,50,,"https://www.scopus.com/inward/record.uri?eid=2-s2.0-0347021124&partnerID=40&md5=73e4a8389c0bb13b33dbd729dc75cca1","Dept. of Sociology and Anthropology, Campus Box 8107, North Carolina State University, Raleigh, NC, United States; Institute for Anthropology, Univ. Vienna/Dept. of Biomed. Eng., Wake Forest Univ. School of Medicine, Winston-Salem, NC, United States; Department of Anthropology, National Museum of Natural History, Smithsonian Institution, Washington, D.C., United States; C.A. Pound Hum. Identification Lab., University of Florida, P.O. Box 112545, Gainesville, FL, United States; Dept. of Sociology and Anthropology, Campus Box 8107, North Carolina State University, Raleigh, NC 27695-8107, United States","Ross, A.H., Dept. of Sociology and Anthropology, Campus Box 8107, North Carolina State University, Raleigh, NC, United States, Dept. of Sociology and Anthropology, Campus Box 8107, North Carolina State University, Raleigh, NC 27695-8107, United States; Slice, D.E., Institute for Anthropology, Univ. Vienna/Dept. of Biomed. Eng., Wake Forest Univ. School of Medicine, Winston-Salem, NC, United States; Ubelaker, D.H., Department of Anthropology, National Museum of Natural History, Smithsonian Institution, Washington, D.C., United States; Falsetti, A.B., C.A. Pound Hum. Identification Lab., University of Florida, P.O. Box 112545, Gainesville, FL, United States","Identification criteria, specifically discriminant function formulae derived from traditional craniometrics, currently used in South Florida for Cuban Americans and other ""Hispanic"" groups, are unsuitable to provide adequate biological profiles due to complex biological histories as well as widely diverse geographic origins. Florida's total population is approximately 16 million (15,982,378) individuals. Of the total population 2,682,715, or 16.8%, are self-identified as ""Hispanic"". South Florida (herein defined as Miami-Dade, Broward and Collier Counties) is home to 60% of the total Hispanic population of Florida with 1,291,737 (48.15%) residing in Miami-Dade County. The Hispanic population of Miami-Dade County makes up 57.0% of the total population of 2,253,362. Each recognized sub-group of Hispanics (Mexican, Puerto Rican, and Cuban) includes its own geographic point-of-origin and population history. Cuban-Americans (arriving in the late 1950's and early 1960's) make up the largest sub-population of Florida's Hispanics in any county and in Miami-Dade number 650,601 or 51% of the total Latin population. Additionally, as in other agricultural states, Florida has a very large population of undocumented workers who primarily arrive from Texas and points south of the Straits of Florida. Thus the application of the available traditional craniometric and non-metric methods are not appropriate for South Florida's Latin population. To begin to address this issue in relation to South Florida's Cuban population, we present an analysis of cranio-facial shape variation in a 19th Century Cuban sample, 17th Century Spanish sample, a Precontact Cuban sample, and Terry Blacks using geometric morphometric methods. Significant biological shape differences and patterns of variation are observed among the groups. These results provide us with a context in which to begin to understand the biological variation of Cuban Americans, which will enable the development of identification criteria specific for this U.S. hybrid Hispanic community.","3-D coordinate data; Forensic science; Geometric morphometrics; Hispanic populations; Identification methods","biodiversity; conference paper; craniofacial morphology; craniometry; Cuba; Cuban American; data analysis; female; forensic identification; geographic origin; geometric morphometrics; geometry; Hispanic; history; human; male; morphometrics; normal human; population; priority journal; skull; three dimensional coordinate data; United States; Anthropology, Physical; Cephalometry; Cuba; Female; Florida; Forensic Anthropology; Hispanic Americans; Humans; Image Processing, Computer-Assisted; Male; Multivariate Analysis",Conference Paper,"Final",,Scopus,2-s2.0-0347021124
