Authors,Author(s) ID,Title,Year,Source title,Volume,Issue,Art. No.,Page start,Page end,Page count,Cited by,DOI,Link,Affiliations,Authors with affiliations,Abstract,Author Keywords,Index Keywords,Document Type,Publication Stage,Access Type,Source,EID
"Relethford J.H.","7005172819;","Apportionment of global human genetic diversity based on craniometrics and skin color",2002,"American Journal of Physical Anthropology","118","4",,"393","398",,194,"10.1002/ajpa.10079","https://www.scopus.com/inward/record.uri?eid=2-s2.0-0036329295&doi=10.1002%2fajpa.10079&partnerID=40&md5=520711786e204a07b86c7d54a25efded","Department of Anthropology, State University of New York College at Oneonta, Oneonta, NY 13820, United States","Relethford, J.H., Department of Anthropology, State University of New York College at Oneonta, Oneonta, NY 13820, United States","A number of analyses of classical genetic markers and DNA polymorphisms have shown that the majority of human genetic diversity exists within local populations (≈85%), with much less among local populations (≈5%) or between major geographic regions or ""races"" (≈10%). Previous analysis of craniometric variation (Relethford [1994] Am J Phys Anthropol 95:53-62) found that between 11-14% of global diversity exists among geographic regions, with the remaining diversity existing within regions. The methods used in this earlier paper are extended to a hierarchical partitioning of genetic diversity in quantitative traits, allowing for assessment of diversity among regions, among local populations within regions, and within local populations. These methods are applied to global data on craniometric variation (57 traits) and skin color. Multivariate analysis of craniometric variation shows results similar to those obtained from genetic markers and DNA polymorphisms: roughly 13% of the total diversity is among regions, 6% among local populations within regions, and 81% within local populations. This distribution is concordant with neutral genetic markers. Skin color shows the opposite pattern, with 88% of total variation among regions, 3% among local populations within regions, and 9% within local populations, a pattern shaped by natural selection. The apportionment of genetic diversity in skin color is atypical, and cannot be used for purposes of classification. If racial groups are based on skin color, it appears unlikely that other genetic and quantitative traits will show the same patterns of variation. © 2002 Wiley-Liss, Inc.","Craniometrics; Genetic diversity; Race; Skin color","article; craniometry; DNA polymorphism; genetic marker; genetic variability; geographic distribution; human; multivariate analysis; natural selection; skin color; Cephalometry; Continental Population Groups; Humans; Pigmentation; Polymorphism, Genetic; Variation (Genetics)",Article,"Final",,Scopus,2-s2.0-0036329295
"Liu J., Mercer J.M., Stam L.F., Gibson G.C., Zeng Z.-B., Laurie C.C.","57205667396;7202467703;6602491537;55558901400;7402647214;57195565212;","Genetic analysis of a morphological shape difference in the male genitalia of Drosophila simulans and D. mauritiana",1996,"Genetics","142","4",,"1129","1145",,170,,"https://www.scopus.com/inward/record.uri?eid=2-s2.0-0029864875&partnerID=40&md5=5d93c95509e1ab1987a52295d95e1ead","Department of Zoology, Duke University, Durham, NC 27708, United States; Department of Statistics, North Carolina State University, Raleigh, NC 27695, United States; DCMB/Zoology, Box 91000, Duke University, Durham, NC 27708, United States; Department of Biology, University of Michigan, Ann Arbor, MI 48109, United States","Liu, J., Department of Zoology, Duke University, Durham, NC 27708, United States; Mercer, J.M., Department of Zoology, Duke University, Durham, NC 27708, United States; Stam, L.F., Department of Zoology, Duke University, Durham, NC 27708, United States; Gibson, G.C., Department of Zoology, Duke University, Durham, NC 27708, United States, Department of Biology, University of Michigan, Ann Arbor, MI 48109, United States; Zeng, Z.-B., Department of Statistics, North Carolina State University, Raleigh, NC 27695, United States; Laurie, C.C., Department of Zoology, Duke University, Durham, NC 27708, United States, DCMB/Zoology, Box 91000, Duke University, Durham, NC 27708, United States","Two closely related species of Drosophila, D. simulans and D. mauritiana, differ markedly in morphology of the posterior lobe of the male genital arch. Both size and shape aspects of lobe variation can be quantified by a morphometric descriptor based on elliptical Fourier and principal components analyses. The genetic architecture of this quantitative trait (PC1) was investigated by hybridizing inbred lines to produce two backcrosss populations of ~200 individuals each, which were analyzed jointly by a composite interval mapping procedure with the aid of 18 marker loci. The parental lines show a large difference in PC1 (30.4 environmental standard deviations), and the markers account for >80% of the phenotypic variation in backcross populations. Eight of 15 intervals analyzed show convincing evidence of quantitative trial loci (QTL), and the range of estimated QTL effects is 5.7-15.9% of the parental difference (1.7-4.8 environmental standard deviations). These estimates may represent the joint effects of multiple QTL within a single interval (which averaged 23 cM in length). Although there is some evidence of partial dominance of mauritiana alleles and for epistasis, the pattern of inheritance is largely additive.",,"article; dna determination; drosophila; gene mapping; genetic analysis; male genital system; nonhuman; phenotype; priority journal; quantitative trait; species difference; Animals; Base Sequence; Crosses, Genetic; DNA Primers; Drosophila; Female; Genitalia, Male; Male; Molecular Sequence Data",Article,"Final",,Scopus,2-s2.0-0029864875
"Sans M.","56962583700;","Admixture studies in Latin America: From the 20th to the 21st century",2000,"Human Biology","72","1",,"155","177",,168,,"https://www.scopus.com/inward/record.uri?eid=2-s2.0-0034143970&partnerID=40&md5=b2a0d8902dd1f19d1858cdc7604c6669","Dept. of Biological Anthropology, University of the Republic, Magallanes 1577, 11200 Montevideo, Uruguay","Sans, M., Dept. of Biological Anthropology, University of the Republic, Magallanes 1577, 11200 Montevideo, Uruguay","The present study is a review of admixture studies in Latin America, an interesting subject because of the unique history of the area, in which populations from 3 different origins had contact and intercrossed. The most often used methods of analysis of admixture in Latin America and some problems related to them, such as the determination of the parental populations and selection of genetic markers, are briefly reviewed. Several sources of data for admixture studies (surnames, quantitative traits, proteins, and molecular information) are summarized. The results obtained using protein systems and blood groups, the most often used markers in Latin America, are considered. They are classified according to their application in 3 groups of populations: urban centers, native Americans, and African-descended subjects. The data show that almost every population is dihybrid or trihybrid, and when African influence is not detected, it is probably due more to the method than to an absence of that contribution. A special section is dedicated to the direction of gene flow, and results about directional mating based on mtDNA, Y-chromosome, and nuclear DNA or proteins are also given. From these studies it is possible to conclude that Amerindian admixture came mainly from female lineages, but it is difficult to establish what happened with the African contribution. A last subject considered is the relation between interethnic crosses and diseases; it is easy to analyze that relation when the pathological condition is related to a unique allele, but when complex diseases are considered, the results are not as clear because of the influence of nongenetic factors. Finally, the perspectives for admixture studies in the 21st century are considered, and some attempts to predict their future in Latin America are made.","Admixture studies; Hybrid populations; Latin America","Africa; American Indian; article; Caucasian; chromosome map; ethnology; Europe; female; genetic variability; genetics; history; human; male; methodology; migration; Negro; political system; social problem; South and Central America; Africa; African Continental Ancestry Group; Chromosome Mapping; Colonialism; Emigration and Immigration; Europe; European Continental Ancestry Group; Female; History, 19th Century; History, 20th Century; History, Ancient; Humans; Indians, Central American; Indians, South American; Latin America; Male; Social Problems; Variation (Genetics)",Article,"Final",,Scopus,2-s2.0-0034143970
"Salzano F.M., Bortolini M.C.","",[No title available],2002,"The Evolution and Genetics of Latin American Populations",,,,"","",,157,,,,"Salzano, F.M.; Bortolini, M.C.",[No abstract available],,,,"Final",,Scopus,2-s2.0-0003493733
"Lieberman D.E., Krovitz G.E., Yates F.W., Devlin M., St. Claire M.","7202460412;6506541494;36827319500;7102114891;8068292400;","Effects of food processing on masticatory strain and craniofacial growth in a retrognathic face",2004,"Journal of Human Evolution","46","6",,"655","677",,147,"10.1016/j.jhevol.2004.03.005","https://www.scopus.com/inward/record.uri?eid=2-s2.0-3042719559&doi=10.1016%2fj.jhevol.2004.03.005&partnerID=40&md5=bbefa817662a0984b232e819e3ba0d35","Department of Anthropology, Peabody Museum, Harvard University, 11 Divinity Avenue, Cambridge, MA 02138, United States; Department of Anthropology, Penn State University, College Park, PA 16802, United States; Bioqual Corporation, 9600 Medical Center Drive, Rockville, MD 20850-3336, United States","Lieberman, D.E., Department of Anthropology, Peabody Museum, Harvard University, 11 Divinity Avenue, Cambridge, MA 02138, United States; Krovitz, G.E., Department of Anthropology, Penn State University, College Park, PA 16802, United States; Yates, F.W., Department of Anthropology, Peabody Museum, Harvard University, 11 Divinity Avenue, Cambridge, MA 02138, United States; Devlin, M., Department of Anthropology, Peabody Museum, Harvard University, 11 Divinity Avenue, Cambridge, MA 02138, United States; St. Claire, M., Bioqual Corporation, 9600 Medical Center Drive, Rockville, MD 20850-3336, United States","Changes in the technology of food preparation over the last few thousand years (especially cooking, softening, and grinding) are hypothesized to have contributed to smaller facial size in humans because of less growth in response to strains generated by chewing softer, more processed food. While there is considerable comparative evidence to support this idea, most experimental tests of this hypothesis have been on non-human primates or other very prognathic mammals (rodents, swine) raised on hard versus very soft (nearly liquid) diets. Here, we examine facial growth and in vivo strains generated in response to raw/dried foods versus cooked foods in a retrognathic mammal, the rock hyrax (Procavia capensis). The results indicate that the hyrax cranium resembles the non-human primate cranium in having a steep gradient of strains from the occlusal to orbital regions, but differs from most non-anthropoids in being primarily twisted; the hyrax mandible is bent both vertically and laterally. In general, higher strains, as much as two-fold at some sites, are generated by masticating raw versus cooked food. Hyraxes raised on cooked food had significantly less growth (approximately 10%) in the ventral (inferior) and posterior portions of the face, where strains are highest, resembling many of the differences evident between humans raised on highly processed versus less processed diets. The results support the hypothesis that food processing techniques have led to decreased facial growth in the mandibular and maxillary arches in recent human populations. © 2004 Elsevier Ltd. All rights reserved.","Cooking; Hyrax; Mandible; Mastication; Maxilla; Skull growth; Strain","evolutionary biology; food processing; growth form; human activity; skull; Anthropoidea; Mammalia; Primates; Procavia capensis; Procaviidae; Rodentia; Sus scrofa",Article,"Final",,Scopus,2-s2.0-3042719559
"Aguirre Beltrán G.","","La población negra de México: Estudio etnohistórico, augmented and corrected edition",1946,"La Población Negra De México",,,,"","",,145,,,,"Aguirre Beltrán, G.",[No abstract available],,,,"Final",,Scopus,2-s2.0-0003815235
"Sparks C.S., Jantz R.L.","26639816700;7006005300;","A reassessment of human cranial plasticity: Boas revisited",2002,"Proceedings of the National Academy of Sciences of the United States of America","99","23",,"14636","14639",,139,"10.1073/pnas.222389599","https://www.scopus.com/inward/record.uri?eid=2-s2.0-0037069426&doi=10.1073%2fpnas.222389599&partnerID=40&md5=951a2526a473dae1cf401f8e54949d58","Department of Anthropology, Pennsylvania State University, 409 Carpenter Building, United States; Department of Anthropology, University of Tennessee, 250 South Stadium Hall, Knoxville, TN 37996, United States","Sparks, C.S., Department of Anthropology, Pennsylvania State University, 409 Carpenter Building, United States; Jantz, R.L., Department of Anthropology, University of Tennessee, 250 South Stadium Hall, Knoxville, TN 37996, United States","In 1912, Franz Boas published a study demonstrating the plastic nature of the human body in response to changes in the environment. The results of this study have been cited for the past 90 years as evidence of cranial plasticity. These findings, however, have never been critiqued thoroughly for their statistical and biological validity. This study presents a reassessment of Boas' data within a modern statistical and quantitative genetic framework. The data used here consist of head and face measurements on over 8,000 individuals of various European ethnic groups. By using pedigree information contained in Boas' data, narrow sense heritabilities are estimated by the method of maximum likelihood. In addition, a series of t tests and regression analyses are performed to determine the statistical validity of Boas' original findings on differentiation between American and European-born children and the prolonged effect of the environment on cranial form. Results indicate the relatively high genetic component of the head and face diameters despite the environmental differences during development. Results point to very small and insignificant differences between European- and American-born offspring, and no effect of exposure to the American environment on the cranial index in children. These results contradict Boas' original findings and demonstrate that they may no longer be used to support arguments of plasticity in cranial morphology.",,"article; cephalometry; craniofacial morphology; environmental factor; ethnic group; Europe; human; maximum likelihood method; pedigree; plasticity; priority journal; quantitative genetics; regression analysis; statistical analysis; Western Hemisphere; Aging; Anthropology, Physical; Ethnic Groups; Europe; European Continental Ancestry Group; Face; Female; Head; Humans; Male; Sex Characteristics; Skull; Boa (genus)",Article,"Final",Open Access,Scopus,2-s2.0-0037069426
"Crawford M.H.","",[No title available],1998,"The Origins of Native Americans: Evidence from Anthropological Genetics",,,,"","",,139,,,,"Crawford, M.H.",[No abstract available],,,,"Final",,Scopus,2-s2.0-0003826015
"Chakraborty R.","8747937800;","Gene admixture in human populations: Models and predictions",1986,"American Journal of Physical Anthropology","29","7 S",,"1","43",,131,"10.1002/ajpa.1330290502","https://www.scopus.com/inward/record.uri?eid=2-s2.0-84996059568&doi=10.1002%2fajpa.1330290502&partnerID=40&md5=b52d31b7f5ce3c9e7dfc811be7f64a64","Center for Demographic and Population Genetics, University of Texas Graduate School of Biomedical Sciences, Houston, Texas, 77225, United States","Chakraborty, R., Center for Demographic and Population Genetics, University of Texas Graduate School of Biomedical Sciences, Houston, Texas, 77225, United States","Brief accounts of methods for estimating proportions of admixture in populations and individuals of hybrid origin are presented with the objective of appraising their underlying assumptions. In view of the uncertainties introduced by assumptions under which admixture estimates are obtained, it is concluded that the reliability of estimates derived from different methods cannot be formally compared. With examples from several admixed populations, it is shown that all methods do not necessarily give discordant results when identical data are used to obtain admixture estimates. Even though past experiences using admixed populations to detect selection or to understand disease etiology have not been very successful, it is believed that admixed human populations can be regarded as a natural experiment. Hence, they are suitable for microevolutionary and epidemiological studies. The proper identification of ancestral populations and the degree of asymmetry in gene flow (sex‐biased admixture) are important issues in admixture studies. These aspects can be examined in the statistical properties of allele frequency distributions, but corroboration of particular models should be made from in‐depth investigations of historical demography and social structure of admixed populations. Future studies of admixture with DNA polymorphism data may resolve some of the uncertainties associated with current techniques of detecting genetic polymorphisms. Because of the abundance of genetic data, it is argued that morphological traits are of limited use in resolving current problems of human admixture studies. Copyright © 1986 Wiley‐Liss, Inc., A Wiley Company","Disease‐gene association; Gene identity; Genetic distance; Migration; Selection; Surname analysis",,Article,"Final",,Scopus,2-s2.0-84996059568
"Kiliaridis S.","7006176659;","Masticatory muscle influence on craniofacial growth",1995,"Acta Odontologica Scandinavica","53","3",,"196","202",,108,"10.3109/00016359509005972","https://www.scopus.com/inward/record.uri?eid=2-s2.0-0029315181&doi=10.3109%2f00016359509005972&partnerID=40&md5=931ec1ca905eef9b07c95e673a9e3483","Department of Orthodontics, Faculty of Odontology, Göteborg University, Göteborg, Sweden","Kiliaridis, S., Department of Orthodontics, Faculty of Odontology, Göteborg University, Göteborg, Sweden","The influence of the masticatory muscle function on craniofacial growth has been recorded in a series of animal experimental and clinical studies. The common characteristic of these investigations is that the elevator muscles of the mandible influence the transversal and the vertical dimensions of the face. The increased loading of the jaws due to masticatory muscle hyperfunction may lead to increased sutural growth and bone apposition, resulting in turn in an increased transversal growth of the maxilla and broader bone bases for the dental arches. Furthermore, an increase in the function of the masticatory muscles is associated with anterior growth rotation pattern of the mandible and with well-developed angular, coronoid, and condylar processes. © 1995 Informa UK Ltd All rights reserved: reproduction in whole or part not permitted.","Biomechanics; Bone remodeling; Cranial sutures; Masticatory muscles; Periosteum","animal; bone development; cranial suture; face; female; growth, development and aging; histology; human; jaw; male; mandible; masticatory muscle; maxilla; mechanical stress; physiology; review; tooth arch; tooth occlusion; Animal; Cranial Sutures; Dental Arch; Face; Female; Human; Jaw; Male; Mandible; Masticatory Muscles; Maxilla; Maxillofacial Development; Osteogenesis; Stress, Mechanical; Vertical Dimension",Article,"Final",,Scopus,2-s2.0-0029315181
"Relethford J.H.","7005172819;","Boas and beyond: Migration and craniometric variation",2004,"American Journal of Human Biology","16","4",,"379","386",,100,"10.1002/ajhb.20045","https://www.scopus.com/inward/record.uri?eid=2-s2.0-3442883983&doi=10.1002%2fajhb.20045&partnerID=40&md5=f8e534e71f9333d092243aed4600669f","Department of Anthropology, State Univ. of NY College at Oneonta, Oneonta, NY 13820, United States","Relethford, J.H., Department of Anthropology, State Univ. of NY College at Oneonta, Oneonta, NY 13820, United States","Migration is expected to affect craniometric variation in three ways: 1) movement into a different environment leading to developmental plasticity; 2) movement into a different environment followed by in situ adaptation through natural selection; and 3) changes in among-group differentiation and genetic distance through the action of gene flow. The relative influence of these three factors has been argued in the literature, most recently in a series of articles debating the statistical and biological significance of Boas's immigration studies as they relate to cranial plasticity. The Boas debate is discussed within the broader context of debate over genetic and environmental influences on craniometric variation. Additional examples are provided from an ongoing study of global craniometric variation. Although developmental plasticity and climatic adaptation have had an impact on craniometric variation, these factors tend not to erase, or even obscure greatly, underlying patterns of population structure and history that fit a neutral model of quantitative variation. Thus, craniometric data can be used to explore questions of gene flow and genetic affinity. © 2004 Wiley-Liss, Inc.",,"anatomical variation; anthropometry; article; climate change; craniometry; environmental change; evolutionary adaptation; gene flow; genetic association; genetic distance; human; immigration; morphological adaptation; natural selection; population differentiation; population genetics; population migration; population model; population movement pattern; population structure; priority journal; quantitative analysis; statistical analysis; Adult; Anthropology, Physical; Cephalometry; Child; Emigration and Immigration; Europe; Female; Genetics, Population; Geography; Humans; Male; Models, Genetic; Selection (Genetics); Temperature; United States; World Health; Boa (genus)",Article,"Final",,Scopus,2-s2.0-3442883983
"Lisker R., Perez‐Briceño R., Granados J., Babinsky V., de Rubens J., Armendares S., Buentello L.","55664209500;6603432039;55995937700;6506118033;6505879066;7006953497;6603935048;","Gene frequencies and admixture estimates in a Mexico City population",1986,"American Journal of Physical Anthropology","71","2",,"203","207",,96,"10.1002/ajpa.1330710207","https://www.scopus.com/inward/record.uri?eid=2-s2.0-0022490058&doi=10.1002%2fajpa.1330710207&partnerID=40&md5=50f595731533f8ece75366844546ea35","Instituto Nacional de la Nutrición ""Salvador Zubirán"", Tlalpan, Mexico City, 14000, Mexico; Instituto de Investigaciones Antropológicas, Universidad Nacional Autónoma de México, Mexico City, Mexico","Lisker, R., Instituto Nacional de la Nutrición ""Salvador Zubirán"", Tlalpan, Mexico City, 14000, Mexico; Perez‐Briceño, R., Instituto Nacional de la Nutrición ""Salvador Zubirán"", Tlalpan, Mexico City, 14000, Mexico; Granados, J., Instituto Nacional de la Nutrición ""Salvador Zubirán"", Tlalpan, Mexico City, 14000, Mexico; Babinsky, V., Instituto Nacional de la Nutrición ""Salvador Zubirán"", Tlalpan, Mexico City, 14000, Mexico; de Rubens, J., Instituto Nacional de la Nutrición ""Salvador Zubirán"", Tlalpan, Mexico City, 14000, Mexico; Armendares, S., Instituto de Investigaciones Antropológicas, Universidad Nacional Autónoma de México, Mexico City, Mexico; Buentello, L., Instituto de Investigaciones Antropológicas, Universidad Nacional Autónoma de México, Mexico City, Mexico","Five hundred and ten students of the Universidad Nacional Autónoma de México were tested to determine the distribution of ABO, MN, Rr‐Hr blood groups, and serum haptoglobin, albumin, and Factor Bf types. Based on the results we found that the proportion of Indian and White genes are of 56.16 and 43.84%, respectively in the dihybrid model and 2.93, 56.22, and 40.85% for Blacks, Indians, and Whites in the trihybrid one. The present study reveals a higher proportion of Indian genes in the Mexico City population than estimated in previous publications. Reasons why the present results apply to a much larger group of Mexico City mestizos than the previous ones are given. Copyright © 1986 Wiley‐Liss, Inc., A Wiley Company","Admixture estimates; Gene frequencies; Mexico City","plasma protein; blood and hemopoietic system; blood group; gene frequency; geographic distribution; heredity; human; human experiment; normal human; ABO Blood-Group System; Adolescent; Adult; African Continental Ancestry Group; European Continental Ancestry Group; Female; Gene Frequency; Haptoglobins; Humans; Indians, North American; Male; Mexico; Middle Aged; MNSs Blood-Group System; Models, Genetic; Phenotype; Rh-Hr Blood-Group System; Sampling Studies; Serum Albumin",Article,"Final",,Scopus,2-s2.0-0022490058
