Authors,Author(s) ID,Title,Year,Source title,Volume,Issue,Art. No.,Page start,Page end,Page count,Cited by,DOI,Link,Affiliations,Authors with affiliations,Abstract,Author Keywords,Index Keywords,Document Type,Publication Stage,Access Type,Source,EID
"Albers J., Estill C., MacDonald L.","23391787500;6603834135;7103387348;","Identification of ergonomics interventions used to reduce musculoskeletal loading for building installation tasks",2005,"Applied Ergonomics","36","4 SPEC. ISS.",,"427","439",,37,"10.1016/j.apergo.2004.07.005","https://www.scopus.com/inward/record.uri?eid=2-s2.0-18844426774&doi=10.1016%2fj.apergo.2004.07.005&partnerID=40&md5=c40e35639037a448be11edc7b749e4f2","Natl. Inst. Occup. Safety and Hlth., Centers for Dis. Contr. and Prev., MS C-24, 4676 Columbia Parkway, Cincinnati, OH 45226, United States","Albers, J., Natl. Inst. Occup. Safety and Hlth., Centers for Dis. Contr. and Prev., MS C-24, 4676 Columbia Parkway, Cincinnati, OH 45226, United States; Estill, C., Natl. Inst. Occup. Safety and Hlth., Centers for Dis. Contr. and Prev., MS C-24, 4676 Columbia Parkway, Cincinnati, OH 45226, United States; MacDonald, L., Natl. Inst. Occup. Safety and Hlth., Centers for Dis. Contr. and Prev., MS C-24, 4676 Columbia Parkway, Cincinnati, OH 45226, United States","Skilled workers in the mechanical and electrical installation (M/EI) building and construction trades experience high rates of disabling work-related musculoskeletal disorders (WMSDs). The M/EI trades involve installing piping; heating, ventilation and air conditioning (HVAC), and electrical systems in residential, commercial, and industrial buildings. In the absence of an ergonomics standard in the United States, some building and construction contractors, including M/EI sector contractors, have implemented various ergonomics interventions on their worksites on a voluntary basis. However, no data were available to determine the type of voluntary control measures being implemented, the task-specific hazards for which control measures needed to be developed or refined, and perceived barriers to improving hazard control. As part of a larger effort to obtain this data, the National Institute for Occupational Safety and Health (NIOSH) organized a stakeholder meeting to gather information regarding ergonomics interventions or 'best practices' by M/EI contractors and tradespeople. The attendees included 39 industry representatives, 17 construction ergonomics researchers from government and academia, and four ergonomics consultants with experience in the construction industry. Participants spent more than 50% of time meeting in small trade-specific breakout sessions. According to the participants, tasks common to the three trades included (1) drill holes and shoot fasteners; (2) place and install systems, and (3) lift and carry materials and equipment. Engineering interventions described in the stakeholder meeting included tools, equipment, and engineered building materials; administrative controls largely consisted of training and education programs and modifications of work and management practice. Most participants believed that there were significant limits to the impact individual contractors and tradespeople could have in leading ergonomics improvement in the building and construction industry.","Construction industry; Ergonomics intervention; Work-related musculoskeletal disorder","Air conditioning; Buildings; Construction industry; Electrical engineering; Heating; Installation; Piping systems; Social aspects; Ventilation; Electrical installation; Electrical systems; Voluntary controls; Work-related musculoskeletal disorders (WMSD); Ergonomics; air conditioning; article; building industry; construction work; electricity; equipment; ergonomics; hazard; human; job performance; musculoskeletal disease; occupational hazard; occupational safety; physical disability; United States; workload",Article,"Final",,Scopus,2-s2.0-18844426774
"Özener B.","9233391300;","Fluctuating and directional asymmetry in young human males: Effect of heavy working condition and socioeconomic status",2010,"American Journal of Physical Anthropology","143","1",,"112","120",,34,"10.1002/ajpa.21300","https://www.scopus.com/inward/record.uri?eid=2-s2.0-77956132896&doi=10.1002%2fajpa.21300&partnerID=40&md5=63232b13be2512979c84b1bfda936d1d","Department of Anthropology, Faculty of Science and Literature, Cumhuriyet University, Sivas, Turkey","Özener, B., Department of Anthropology, Faculty of Science and Literature, Cumhuriyet University, Sivas, Turkey","Many adverse environmental and genetic factors can affect stability of development during human growth. Although the level of fluctuating asymmetry (FA) may be influenced by environmental and genetic stress encountered during this period, directional asymmetry (DA) is largely attributable to differential mechanical loading during bone growth, for example, handedness. I assessed the effects of heavy working conditions and socioeconomic conditions on asymmetry levels in three groups of young human males: 1) individuals employed in the heavy industry sector (n = 104, mean age = 18.48 ± 0.61 years), 2) individuals who had the same socioeconomic status as the laborers (n = 102, mean age = 18.39 ± 0.58 years) but were not laborers, and 3) nonlaborers from the higher socioeconomic levels of society (n = 103, mean age = 18.43 ± 0.67). For all subjects, hand length, hand width, elbow width, wrist width, knee width, ankle width, foot length, foot width, ear length, and ear width were measured. All measurements of the upper extremities in the labor group appeared to exhibit DA; in the other two groups only hand measurements exhibited DA. According to analysis of FA, subjects living in poor conditions exhibited more FA than their nonlaborer peers living in better conditions. In addition, biomechanical pressures due to heavy working conditions of the labor group appeared to cause increased DA in the upper extremities: DA increased with an increase in the number of years working. © 2010 Wiley-Liss, Inc.","Biomechanical pressures; Directional asymmetry; Fluctuating asymmetry; Socioeconomic status; Young laborers","adolescent; adult; article; biomechanics; bone growth; environmental stress; fluctuating asymmetry; groups by age; handedness; human; male; socioeconomics; work environment; Adolescent; Analysis of Variance; Anthropometry; Biomechanics; Ear; Foot; Humans; Industry; Knee; Male; Occupations; Social Class; Upper Extremity; Workload; Young Adult",Article,"Final",,Scopus,2-s2.0-77956132896
"Ford J.M., Decker S.J.","55434571100;37561229800;","Computed tomography slice thickness and its effects on three-dimensional reconstruction of anatomical structures",2016,"Journal of Forensic Radiology and Imaging","4",,,"43","46",,31,"10.1016/j.jofri.2015.10.004","https://www.scopus.com/inward/record.uri?eid=2-s2.0-84961133317&doi=10.1016%2fj.jofri.2015.10.004&partnerID=40&md5=f881fed3a9c4023e72714a0eb6857a98","Department of Radiology, University of South Florida, Morsani College of Medicine, 2 Tampa General Circle, STC7033, Tampa, FL  33606, United States; Department of Pathology and Cell Biology, University of South Florida Morsani College of Medicine, 12901 Bruce B Downs Blvd, MDC11, Tampa, FL  33612, United States","Ford, J.M., Department of Radiology, University of South Florida, Morsani College of Medicine, 2 Tampa General Circle, STC7033, Tampa, FL  33606, United States; Decker, S.J., Department of Radiology, University of South Florida, Morsani College of Medicine, 2 Tampa General Circle, STC7033, Tampa, FL  33606, United States, Department of Pathology and Cell Biology, University of South Florida Morsani College of Medicine, 12901 Bruce B Downs Blvd, MDC11, Tampa, FL  33612, United States","Objectives: Computed Tomography (CT) scan parameters such as slice thickness have a direct impact on any 3D models derived from the volumetric data. Higher slice thickness spacing leads to loss of resolution quality in the visualizations. Materials and methods: Twenty CT head scans were acquired at a 0.625 mm slice thickness. These data sets were resliced a range of 1-5 mm slice thicknesses. The resultant 3D models of the skull were compared using the 0.625 mm model as a standard. Differences in surface area, volume and part-to-part comparison were analyzed. Results and conclusions: There were significant differences in surface area, volume and part-to-part comparison analyses from the 0.625 mm skulls as determined with One-way ANOVA by a p-value less than 0.05. Part-to-part comparison proved to have the greatest sensitivity for detecting geometric differences between slice thickness treatments. This study proposes using a 1.25 mm maximum slice thickness when forensic practitioners require 3D reconstruction in their casework. © 2015 Elsevier Ltd.","3D reconstruction; Computed tomography; Crania; Forensic; Post mortem; Slice thickness; Visualization","adult; anatomy; anthropometric parameters; Article; biological model; computed tomography scanner; computer assisted tomography; controlled study; female; forensic medicine; geometry; human; image processing; image quality; image reconstruction; priority journal; radiological parameters; skull; slice thickness; surface property; three dimensional imaging",Article,"Final",,Scopus,2-s2.0-84961133317
"Weiss E.","35499329800;","Sex differences in humeral bilateral asymmetry in two hunter-gatherer populations: California Amerinds and British Columbian Amerinds",2009,"American Journal of Physical Anthropology","140","1",,"19","24",,29,"10.1002/ajpa.21025","https://www.scopus.com/inward/record.uri?eid=2-s2.0-68949092103&doi=10.1002%2fajpa.21025&partnerID=40&md5=18941dde9c2b0d9c5aaa439628cbda1e","Anthropology Department, San Jose State University, One Washington Square, San Jose, CA 95192-0113, United States","Weiss, E., Anthropology Department, San Jose State University, One Washington Square, San Jose, CA 95192-0113, United States","This study uses two prehistoric Amerindian populations of hunter-gatherer subsistence patterns to determine whether levels of sexual dimorphism in humeral bilateral cross-sectional asymmetry are related to sex-specific differences in activities among these populations. Results confirmed that males of the California Amerind population who engaged in the more unimanual activities of spear hunting and warfare were more asymmetrical than were their female counterparts who engaged in the more bimanual activities of grinding acorns. California Amerind males were also more asymmetrical than British Columbian Amerind males who rowed (using both arms) extensively. Sex differences within British Columbian Amerinds were not statistically significant, nor were female differences between populations. In general, levels of humeral asymmetry appear to be more dependent on sex and population-specific behaviors rather than broad subsistence patterns. © 2009 Wiley-Liss, Inc.","Cross-sections; Humeral asymmetry; Sex differences","adult; aged; American Indian; animal hunting; article; bone structure; Canada; controlled study; cultural anthropology; daily life activity; ethnic difference; female; grinding; human; human tissue; humerus; male; prehistoric period; sex difference; social structure; United States; war; Adaptation, Physiological; Adolescent; Adult; Anthropology, Physical; Body Size; British Columbia; California; Cross-Sectional Studies; Female; History, Ancient; Human Activities; Humans; Humerus; Indians, North American; Male; Middle Aged; Sex Factors; Stress, Mechanical",Article,"Final",,Scopus,2-s2.0-68949092103
"Sakaue K.","7004439803;","Bilateral asymmetry of the humerus in Jomon people and modern Japanese",1997,"Anthropological Science","105","4",,"231","246",,28,"10.1537/ase.105.231","https://www.scopus.com/inward/record.uri?eid=2-s2.0-0031240168&doi=10.1537%2fase.105.231&partnerID=40&md5=dd40390c3be884f580e60d024f1212e1","Department of Biological Sciences, Graduate School of Science, University of Tokyo, Hongo, Bunkyo-ku, Tokyo 113, Japan","Sakaue, K., Department of Biological Sciences, Graduate School of Science, University of Tokyo, Hongo, Bunkyo-ku, Tokyo 113, Japan","In the present study, I examined the bilateral asymmetries of several morphological characters of the humerus of 63 modern Japanese (male 46, female 17) and 40 Jomon people (male 20, female 20) with the aim of distinguishing between metric features that are strongly affected by mechanical loading and those that are not, and to discuss the loading conditions of the upper arms of Jomon people. The results were that the bilateral asymmetries of humeral length and all other measurements except for proximal epiphyseal breadth did not correlate significantly with asymmetries of diaphyseal geometric properties. Since the longitudinal growth of a long bone stops when its epiphyses are fused with the metaphyses while corticla remodelling goes on for life, the present results can be interpreted as follows: 1) Bilateral asymmetries in the longitudinal direction is likely to reflect the cumulative loading conditions to around an age of 20 years, and 2) bilateral asymmetries in the tranverse direction reflects loading conditions relatively close to the time of death. Regarding the loading conditions inferred for the upper arms of Jomon people, it is suggested that they were stronger than in modern Japanese and some hunter-gatherers (Amerindians). The loading conditions of the upper arms of Jomon people were also likely to be less asymmetric than in other populations, while differing considerably between sexes.","Bilateral asymmetry; Cross-sectional geometric properties; Humerus; Linear measurements",,Article,"Final",Open Access,Scopus,2-s2.0-0031240168
"Abdel Fatah E.E., Shirley N.R., Mahfouz M.R., Auerbach B.M.","16174093600;16239027200;7005145380;7003971947;","A three-dimensional analysis of bilateral directional asymmetry in the human clavicle",2012,"American Journal of Physical Anthropology","149","4",,"547","559",,27,"10.1002/ajpa.22156","https://www.scopus.com/inward/record.uri?eid=2-s2.0-84869508629&doi=10.1002%2fajpa.22156&partnerID=40&md5=737a69f350c3124f3a85da4143ae8512","University of Tennessee, Mechanical, Aerospace, Biomedical Engineering Department, 301 Perkins Hall, Knoxville, TN 37996, United States; Department of Anatomy, DeBusk College of Osteopathic Medicine, Lincoln Memorial University, Harrogate, TN 37752, United States; Department of Anthropology, University of Tennessee, Knoxville, TN 37996, United States","Abdel Fatah, E.E., University of Tennessee, Mechanical, Aerospace, Biomedical Engineering Department, 301 Perkins Hall, Knoxville, TN 37996, United States; Shirley, N.R., Department of Anatomy, DeBusk College of Osteopathic Medicine, Lincoln Memorial University, Harrogate, TN 37752, United States; Mahfouz, M.R., University of Tennessee, Mechanical, Aerospace, Biomedical Engineering Department, 301 Perkins Hall, Knoxville, TN 37996, United States; Auerbach, B.M., Department of Anthropology, University of Tennessee, Knoxville, TN 37996, United States","This study presents a novel three-dimensional analysis using statistical atlases and automated measurements to assess diaphyseal morphology of the clavicle and its relationship to muscle asymmetry. A sample of 505 individuals (285 males, 220 females) from the William McCormick Clavicle Collection was CT scanned, segmented, and added to a statistical bone atlas that captures correspondence between homologous points on the bone surfaces. Muscle attachment sites were localized on the atlas and then propagated across the entire population. Cross-sectional contours were extracted at 5% increments along the entire bone, as well as at muscle attachment sites and the clavicle waist; maximum and minimum dimensions of each cross-sectional contour were calculated. In addition, the entire three-dimensional surface was examined for asymmetry by analyzing the magnitude and directional differences between homologous points across all bone surfaces in the dataset. The results confirm the existing studies on clavicle asymmetry, namely that the left clavicle is longer than the right, but the right is more robust than the left. However, the patterns of asymmetry are sexually dimorphic. Males are significantly asymmetric in all dimensions and at muscle and ligament attachment sites (P < 0.05), whereas female asymmetry is more variable. We hypothesize that this is related to absolute and relative differences in male muscle strength compared to females. However, an area with no muscle attachments on the posterior midshaft was significantly asymmetric in both sexes. We suggest that this is a curvature difference caused by opposing muscle actions at the medial and lateral ends of the bone. Am J Phys Anthropol 2012. © 2012 Wiley Periodicals, Inc. Copyright © 2012 Wiley Periodicals, Inc.","computed tomography scans; computer-automated bone measurements; morphological variation; muscle attachment; statistical bone atlas","article; atlas; clavicle; computer assisted tomography; diaphysis; female; human; human tissue; ligament; male; muscle; muscle contraction; muscle strength; skeletal muscle; Adult; Algorithms; Clavicle; Female; Humans; Imaging, Three-Dimensional; Male; Models, Statistical; Muscle, Skeletal; Tomography, X-Ray Computed",Article,"Final",,Scopus,2-s2.0-84869508629
"Mays S.A.","7004073550;","Asymmetry in metacarpal cortical bone in a collection of British post-mediaeval human skeletons",2002,"Journal of Archaeological Science","29","4",,"435","441",,27,"10.1006/jasc.2002.0729","https://www.scopus.com/inward/record.uri?eid=2-s2.0-0036081876&doi=10.1006%2fjasc.2002.0729&partnerID=40&md5=492c930d1f7aa96e92523253df59015b","Ancient Monuments Laboratory, English Heritage Centre for Archaeology, Fort Cumberland, Fort Cumberland Road, Eastney, Portsmouth, PO4 9LD, United Kingdom","Mays, S.A., Ancient Monuments Laboratory, English Heritage Centre for Archaeology, Fort Cumberland, Fort Cumberland Road, Eastney, Portsmouth, PO4 9LD, United Kingdom","Bilateral asymmetry in measures of metacarpal cortical bone, particularly second moments of area, in a group of 18th-19th century AD skeletons was investigated. The aim was to study variation in bilateral asymmetry with respect to sex and occupation. The skeletal material came from the crypt at Christ Church Spitalfields, London. The study sample comprised individuals with personal identifications from coffin plates. For a subset of the males, occupation was known from documentary sources. Results showed that bilateral asymmetry in second moment of area varied, to a limited extent, with occupation. Sex differences in bilateral asymmetry were also found. © 2002 Elsevier Science Ltd. All rights reserved.","Biomechanics; Occupation; Spitalfields","archaeological evidence; asymmetry; biomechanics; bone; occupation; skeleton; England (London); United Kingdom",Article,"Final",,Scopus,2-s2.0-0036081876
"Harcourt-Smith W.E.H., Tallman M., Frost S.R., Wiley D.F., Rohlf F.J., Delson E.","16041929000;54900276000;7102366517;8083068200;7003281107;57201830259;","Analysis of selected hominoid joint surfaces using laser scanning and geometric morphometrics: A preliminary report",2008,"Vertebrate Paleobiology and Paleoanthropology",,"9781402069963",,"373","383",,23,"10.1007/978-1-4020-6997-0_17","https://www.scopus.com/inward/record.uri?eid=2-s2.0-85045110793&doi=10.1007%2f978-1-4020-6997-0_17&partnerID=40&md5=7240543fd106dc5d5036fc885d7e3de5","Department of Vertebrate Paleontology, American Museum of Natural History, Central Park West & 79th Street, New York, NY  10024, United States; CUNY Graduate School, New York, NY  10016, United States; NYCEP, United States; Department of Anthropology, University of Oregon, Eugene, OR  97403, United States; Institute for Data Analysis and Visualization, University of California, Davis, CA  95616, United States; Department of Ecology and Evolution, Stony Brook University, Stony Brook, NY  11794, United States; Department of Anthropology, Lehman College/CUNY, United States","Harcourt-Smith, W.E.H., Department of Vertebrate Paleontology, American Museum of Natural History, Central Park West & 79th Street, New York, NY  10024, United States; Tallman, M., CUNY Graduate School, New York, NY  10016, United States, NYCEP, United States; Frost, S.R., Department of Anthropology, University of Oregon, Eugene, OR  97403, United States; Wiley, D.F., Institute for Data Analysis and Visualization, University of California, Davis, CA  95616, United States; Rohlf, F.J., Department of Ecology and Evolution, Stony Brook University, Stony Brook, NY  11794, United States; Delson, E., Department of Vertebrate Paleontology, American Museum of Natural History, Central Park West & 79th Street, New York, NY  10024, United States, NYCEP, United States, Department of Anthropology, Lehman College/CUNY, United States","Fred Szalay is a polymath of evolutionary morphology. From the mid-1960s (Szalay, 1968) to at least the mid-1980s (Szalay et al., 1987), he was acknowledged as the leading researcher on non-anthropoid fossil primates, complementing the anthropoid expertise of Elwyn Simons who had just laid the foundations for paleoprimatology as a distinct field through his revisions and field success in the Fayum of Egypt. Fred edited two volumes in this area in 1975, in both of which Delson (as a very junior colleague) was most pleased to be included (Szalay, 1975; Luckett and Szalay, 1975), which in turn led to their collaborative review of the whole order (Szalay and Delson, 1979). Fred was also an early critic of the cladistic approach to phylogenetic reconstruction, passionately opposed to the narrowness of evolutionary thinking that he felt stemmed from cladistic thinking, so he developed (often with Walter Bock) a refinement of the “evolutionary” taxonomic approach (e.g., Szalay, 1977b, 1993; Szalay and Bock, 1991). Although his earliest work focused on crania and dentitions, Fred was equally interested in postcranial morphology from both functional and phylogenetic viewpoints (Decker and Szalay, 1974; Szalay and Decker, 1974; Szalay et al., 1975); he almost single-handedly made morphology of the postcranium relevant to mammalian phytogeny reconstruction, and he argued that the distinction between functionalism and non-functional thinking was entirely artificial. His long 1977(a) paper on mammalian phytogeny was almost entirely based on the evidence from foot bones, and this focus continued in his work on primates (Szalay and Dagosto, 1980, 1988; Szalay and Langdon, 1986) as well as eutherian and especially metatherian mammals (Szalay and Drawhorn, 1980; Szalay, 1984, 1994; Szalay and Lucas, 1993, 1996; Szalay and Sargis, 2001). Fred argued that taxa could just as readily be distinguished by their postcrania as by their teeth, ear regions or facial structure. Many of his colleagues rejected this idea or thought that (at best), postcranial morphology might delineate families or subfamilies, but not genera or species. Fred’s most recent contribution (Szalay, 2007; in a book whose co-editor is the same as this volume’s) reviewed the locomotor adaptations of the earliest primates and their predecessors, comparing several entrenched hypotheses unfavorably to his own prior interpretations. © Springer Science + Business Media B.V. 2008.","Centroid size; Joint congruence; Joint surface; Procrustes distance; Trochlear groove",,Book Chapter,"Final",,Scopus,2-s2.0-85045110793
