Authors,Author(s) ID,Title,Year,Source title,Volume,Issue,Art. No.,Page start,Page end,Page count,Cited by,DOI,Link,Affiliations,Authors with affiliations,Abstract,Author Keywords,Index Keywords,Document Type,Publication Stage,Access Type,Source,EID
"Maté-González M.Á., Yravedra J., Martín-Perea D.M., Palomeque-González J., San-Juan-Blazquez M., Estaca-Gómez V., Uribelarrea D., Álvarez-Alonso D., Cuartero F., González-Aguilera D., Domínguez-Rodrigo M.","56780291300;56962776200;57192089446;56780262200;57192960468;57188553158;6507093504;55320183200;36476024800;24477009700;6603679662;","Flint and Quartzite: Distinguishing Raw Material Through Bone Cut Marks",2018,"Archaeometry","60","3",,"437","452",,18,"10.1111/arcm.12327","https://www.scopus.com/inward/record.uri?eid=2-s2.0-85028314535&doi=10.1111%2farcm.12327&partnerID=40&md5=7935fac98e936d7ec89bc21b83e7d8a2","Department of Cartography and Terrain Engineering, Polytechnic School of Avila, University of Salamanca, Hornos Caleros 50, Avila, 05003, Spain; C.A.I. Arqueometry and Archaeological Analysis, Complutense University, Profesor Aranguren s/n, Madrid, 28040, Spain; Department of Prehistory, Complutense University, Profesor Aranguren s/n, Madrid, 28040, Spain; IDEA (Institute of Evolution in Africa), Origins Museum, Plaza de San Andrés 2, Madrid, 28005, Spain; Geodynamics Department, Complutense University of Madrid, José Antonio Novais 12, Madrid, 28040, Spain; Department of Prehistory, UNED, Madrid, Spain; Department of Archaeology, Autonomous University, Madrid, Spain","Maté-González, M.Á., Department of Cartography and Terrain Engineering, Polytechnic School of Avila, University of Salamanca, Hornos Caleros 50, Avila, 05003, Spain, C.A.I. Arqueometry and Archaeological Analysis, Complutense University, Profesor Aranguren s/n, Madrid, 28040, Spain; Yravedra, J., Department of Prehistory, Complutense University, Profesor Aranguren s/n, Madrid, 28040, Spain, IDEA (Institute of Evolution in Africa), Origins Museum, Plaza de San Andrés 2, Madrid, 28005, Spain; Martín-Perea, D.M., Geodynamics Department, Complutense University of Madrid, José Antonio Novais 12, Madrid, 28040, Spain; Palomeque-González, J., Department of Prehistory, Complutense University, Profesor Aranguren s/n, Madrid, 28040, Spain; San-Juan-Blazquez, M., Department of Prehistory, Complutense University, Profesor Aranguren s/n, Madrid, 28040, Spain; Estaca-Gómez, V., Department of Prehistory, Complutense University, Profesor Aranguren s/n, Madrid, 28040, Spain; Uribelarrea, D., Geodynamics Department, Complutense University of Madrid, José Antonio Novais 12, Madrid, 28040, Spain; Álvarez-Alonso, D., Department of Prehistory, UNED, Madrid, Spain; Cuartero, F., Department of Archaeology, Autonomous University, Madrid, Spain; González-Aguilera, D., C.A.I. Arqueometry and Archaeological Analysis, Complutense University, Profesor Aranguren s/n, Madrid, 28040, Spain; Domínguez-Rodrigo, M., Department of Prehistory, Complutense University, Profesor Aranguren s/n, Madrid, 28040, Spain, IDEA (Institute of Evolution in Africa), Origins Museum, Plaza de San Andrés 2, Madrid, 28005, Spain","Since the 1980s, several experimental analyses have been able to differentiate some lithic tool types and some of their raw materials according to the morphology of cut marks imprinted by such tools when used for butchering activities. Thus, metal tool use has been differentiated in contexts with an abundance of lithic tools, or even the use of hand axes has been documented in carcass processing, in contrast with simple unretouched or retouched flakes. As important as this information is, there are still other important aspects to be analysed. Can cut marks produced with different lithic raw material types be differentiated? Can cut marks made with different types of the same raw material type be characterized and differentiated? The objective of this study is to evaluate if cut marks resulting from the use of different flints and different quartzites are distinguishable from each other. In the present work, an experimental analysis of hundreds of cut marks produced by five types of flint and five varieties of quartzite was carried out. Microphotogrammetry and geometric–morphometric techniques were applied to analyse these cut marks. The results show that flint cut marks and quartzite cut marks can be characterized at the assemblage level. Different types of flint produced cut marks that were not significantly different from each other. Cut marks made with Olduvai Gorge quartzite were significantly different from those produced with a set comprising several other types of quartzites. Crystal size, which is larger in Olduvai Gorge quartzites (0.5 mm) than Spanish quartzites (177–250 μm), is discussed as being the main reason for these statistically significant differences. This documented intra-sample and inter-sample variance does not hinder the resolution of the approach to differentiate between these two generic raw material types and opens the door for the application of this method in archaeological contexts. © 2017 University of Oxford","cut marks; flint; micro-morphometry; micro-photogrammetry; quartzite; raw materials","archaeology; flint; lithic fragment; morphometry; photogrammetry; quartzite; tool use",Article,"Final",,Scopus,2-s2.0-85028314535
"Nicoud E.","","Le Paradoxe Acheuléen",2013,"Le paradoxe Acheuléen. Documents préhistoriques 32",,,,"","",,18,,,,"Nicoud, E.",[No abstract available],,,,"Final",,Scopus,2-s2.0-84905470162
"Merritt S.R.","56600134900;","Cut Mark Cluster Geometry and Equifinality in Replicated Early Stone Age Butchery",2016,"International Journal of Osteoarchaeology","26","4",,"585","598",,17,"10.1002/oa.2448","https://www.scopus.com/inward/record.uri?eid=2-s2.0-84928157289&doi=10.1002%2foa.2448&partnerID=40&md5=6be3e5ed596c6a053d6719beee674627","Anthropology Department, University of Alabama at Birmingham, Birmingham, AL, United States","Merritt, S.R., Anthropology Department, University of Alabama at Birmingham, Birmingham, AL, United States","Early Stone Age cut marks created during tool-assisted carnivory potentially offer inferences into hominin butchery behaviour and access to complete or defleshed carcasses. Actualistic butchery trials of 16 goat and cow half-carcasses were completed by an experienced butcher with replicated Oldowan tools to investigate how the geometric organisation of cut mark clusters reflects flake versus core tool use and bulk muscle versus scrap defleshing. A cluster of cut marks is defined as a series of adjacent cut mark striations that occur at an anatomical location and are bounded by unmarked cortical surface. Tool type and butchery action were predicted to differentially mark certain long bone portions and influence cluster attributes. Moulds of 613 cut mark clusters were photographed and measured using ImageJ software (National Institutes of Health, Bethesda, Maryland, USA) for cluster area, cut mark count, median cut mark length and standard deviation of cut mark length and angle. Analysis suggests the following results: (i) cluster attributes are correlated;(ii) changes in cluster geometry are related to increasing cut mark count and length but not tool type or defleshed muscle amount; (iii) large clusters occur on large animals; and (iv) long bone midshaft portions are cut-marked during both bulk and scrap muscle defleshing. Analysis of 179 cut mark clusters on long bone shafts of sizes 1–4 mammals from three Okote member assemblages at Koobi Fora, Kenya, shows that archaeological clusters have a similar number of marks when compared with experimental clusters but are significantly smaller, have shorter median marks and include less deviation in mark length and angle. Archaeological clusters corroborate that increasing area is positively correlated with cut mark count, median mark length and standard deviation of mark length and angle. A quantitative inferential model that links cut mark cluster geometry to tool type or the amount of muscle defleshed is not supported by these data. Copyright © 2015 John Wiley & Sons, Ltd. Copyright © 2015 John Wiley & Sons, Ltd.","actualism; bone surface modification; butchery; configurational analysis; cut marks; experimental taphonomy; Oldowan",,Article,"Final",,Scopus,2-s2.0-84928157289
"Braun D.R., Pante M., Archer W.","23972180300;21733442900;35085743300;","Cut marks on bone surfaces: Influences on variation in the form of traces of ancient behaviour",2016,"Interface Focus","6","3",,"","",7,17,"10.1098/rsfs.2016.0006","https://www.scopus.com/inward/record.uri?eid=2-s2.0-84964287523&doi=10.1098%2frsfs.2016.0006&partnerID=40&md5=7d1dd2af8bcfa2ea0364dda95998eda1","Center for the Advanced Study of Human Paleobiology, George Washington University, Washington, DC, United States; Department of Anthropology, Colorado State University, Fort Collins, CO, United States; Department of Human Evolution, Max Planck Institute for Evolutionary Anthropology, Leipzig, Germany","Braun, D.R., Center for the Advanced Study of Human Paleobiology, George Washington University, Washington, DC, United States, Department of Human Evolution, Max Planck Institute for Evolutionary Anthropology, Leipzig, Germany; Pante, M., Department of Anthropology, Colorado State University, Fort Collins, CO, United States; Archer, W., Department of Human Evolution, Max Planck Institute for Evolutionary Anthropology, Leipzig, Germany","Although we know that our lineage has been producing sharp-edged tools for over 2.6 Myr, our knowledge of what they were doing with these tools is far less complete. Studies of these sharp-edged stone tools show that they were most probably used as cutting implements. However, the only substantial evidence of this is the presence of cut marks on the bones of animals found in association with stone tools in ancient deposits. Numerous studies have aimed to quantify the frequency and placement of these marks. At present there is little consensus on the meaning of these marks and how the frequency relates to specific behaviours in the past. Here we investigate the possibility that mechanical properties associated with edges of stone tools as well as the properties of bones themselves may contribute to the overall morphology of these marks and ultimately their placement in the archaeological record. Standardized tests of rock mechanics (Young’s modulus and Vickers hardness) indicate that the hardness of tool edges significantly affects cut-mark morphology. In addition, we show that indentation hardness of bones also impacts the overall morphology of cut marks. Our results show that rock type and bone portions influence the shape and prevalence of cut marks on animal bones. © 2016 The Author(s) Published by the Royal Society. All rights reserved.","Cut marks; Diet; Mechanical properties; Palaeolithic",,Article,"Final",Open Access,Scopus,2-s2.0-84964287523
"Nicoud E.","","What does the Acheulean consist of? The example of Western Europe (MIS 16-9)",2013,"Mitteilungen der Gesellschaft für Urgeschichte","22",,,"41","60",,17,,,,"Nicoud, E.",[No abstract available],,,,"Final",,Scopus,2-s2.0-84992582422
"O'Higgins P., Johnson J.","","The quantitative description and comparison of biological forms",1988,"Crit. Rev. Anat. Sci.","1",,,"149","170",,17,,,,"O'Higgins, P.; Johnson, J.",[No abstract available],,,,,,Scopus,2-s2.0-0042532625
"Walker M.J., Anesin D., Angelucci D.E., Avilés-Fernández A., Berna F., Buitrago-López A.T., Fernández-Jalvo Y., Haber-Uriarte M., López-Jiménez A., López-Martínez M., Martín-Lerma I., Ortega-Rodrigáñez J., Polo-Camacho J.-L., Rhodes S.E., Richter D., Rodríguez-Estrella T., Schwenninger J.-L., Skinner A.R.","55461477600;55634978700;17343332900;37096838900;7801410989;37065747100;6603680696;37096887800;37097635000;37097634100;55144024900;37097779100;37097849100;57190813192;55550383000;6506760619;14043969600;57189813493;","Combustion at the late Early Pleistocene site of Cueva Negra del Estrecho del Río Quípar (Murcia, Spain)",2016,"Antiquity","90","351",,"571","589",,16,"10.15184/aqy.2016.91","https://www.scopus.com/inward/record.uri?eid=2-s2.0-84983316492&doi=10.15184%2faqy.2016.91&partnerID=40&md5=e0ece70b6b642e80551a414bbab04e69","Murcia University, Experimental Sciences Research Group E005-11 'Quaternary Palaeoecology, Palaeoanthropology', Biology Faculty, Campus Universitario de Espinardo, Murcia, 30100, Spain; Murcian Association for the Study of Palaeoanthropology and the Quaternary (MUPANTQUAT), Museo Arqueologico de Murcia, PO Box 4123, Murcia, 30080, Spain; 'B. Bagolini' Laboratory for Prehistoric and Medieval Archaeology and Historical Geography, Department of Humanities, Trento University, via T. Gar 14, Trento, I-38122, Italy; Department of Archaeology, Simon Fraser University, 888 University Drive, Burnaby, BC  V5A 1S6, Canada; Department of Palaeobiology, National Museum of Natural Sciences, Spanish National Research Council, Calle José Gutiérrez Abascal 2, Madrid, 28006, Spain; Institut für Naturwissenschaftliche Archäologie - Archäozoologie, Universität Tübingen, Rümelinstrasse 23, Tübingen, D-72070, Germany; Department of Human Evolution, Max Planck Institute for Evolutionary Anthropology, Deutscher Platz 6, Leipzig, D-04103, Germany; Lehrstuhl Geomorphologie, Universität Bayreuth, Universitätsstrasse 30, Bayreuth, D-95447, Germany; Institut für Ökologie, Leuphana Universität Lüneburg, Scharnhorststrasse 1, Lüneburg, 21335, Germany; Department of Mining Engineering, Geology and Cartography, Cartagena Polytechnic University, Edificio 'La Milagrosa', Plaza Cronista Isidoro Valverde, Cartagena, 30202, Spain; Research Laboratory for Archaeology and the History of Art, Oxford University, Dyson Perrins Building, South Parks Road, Oxford, OX1 3QY, United Kingdom; Department of Chemistry, Williams College, 880 Main Street, Williamstown, MA  01267, United States","Walker, M.J., Murcia University, Experimental Sciences Research Group E005-11 'Quaternary Palaeoecology, Palaeoanthropology', Biology Faculty, Campus Universitario de Espinardo, Murcia, 30100, Spain, Murcian Association for the Study of Palaeoanthropology and the Quaternary (MUPANTQUAT), Museo Arqueologico de Murcia, PO Box 4123, Murcia, 30080, Spain; Anesin, D., 'B. Bagolini' Laboratory for Prehistoric and Medieval Archaeology and Historical Geography, Department of Humanities, Trento University, via T. Gar 14, Trento, I-38122, Italy; Angelucci, D.E., 'B. Bagolini' Laboratory for Prehistoric and Medieval Archaeology and Historical Geography, Department of Humanities, Trento University, via T. Gar 14, Trento, I-38122, Italy; Avilés-Fernández, A., Murcia University, Experimental Sciences Research Group E005-11 'Quaternary Palaeoecology, Palaeoanthropology', Biology Faculty, Campus Universitario de Espinardo, Murcia, 30100, Spain, Murcian Association for the Study of Palaeoanthropology and the Quaternary (MUPANTQUAT), Museo Arqueologico de Murcia, PO Box 4123, Murcia, 30080, Spain; Berna, F., Department of Archaeology, Simon Fraser University, 888 University Drive, Burnaby, BC  V5A 1S6, Canada; Buitrago-López, A.T., Murcia University, Experimental Sciences Research Group E005-11 'Quaternary Palaeoecology, Palaeoanthropology', Biology Faculty, Campus Universitario de Espinardo, Murcia, 30100, Spain, Murcian Association for the Study of Palaeoanthropology and the Quaternary (MUPANTQUAT), Museo Arqueologico de Murcia, PO Box 4123, Murcia, 30080, Spain; Fernández-Jalvo, Y., Department of Palaeobiology, National Museum of Natural Sciences, Spanish National Research Council, Calle José Gutiérrez Abascal 2, Madrid, 28006, Spain; Haber-Uriarte, M., Murcia University, Experimental Sciences Research Group E005-11 'Quaternary Palaeoecology, Palaeoanthropology', Biology Faculty, Campus Universitario de Espinardo, Murcia, 30100, Spain, Murcian Association for the Study of Palaeoanthropology and the Quaternary (MUPANTQUAT), Museo Arqueologico de Murcia, PO Box 4123, Murcia, 30080, Spain; López-Jiménez, A., Murcia University, Experimental Sciences Research Group E005-11 'Quaternary Palaeoecology, Palaeoanthropology', Biology Faculty, Campus Universitario de Espinardo, Murcia, 30100, Spain, Murcian Association for the Study of Palaeoanthropology and the Quaternary (MUPANTQUAT), Museo Arqueologico de Murcia, PO Box 4123, Murcia, 30080, Spain; López-Martínez, M., Murcia University, Experimental Sciences Research Group E005-11 'Quaternary Palaeoecology, Palaeoanthropology', Biology Faculty, Campus Universitario de Espinardo, Murcia, 30100, Spain, Murcian Association for the Study of Palaeoanthropology and the Quaternary (MUPANTQUAT), Museo Arqueologico de Murcia, PO Box 4123, Murcia, 30080, Spain; Martín-Lerma, I., Murcia University, Experimental Sciences Research Group E005-11 'Quaternary Palaeoecology, Palaeoanthropology', Biology Faculty, Campus Universitario de Espinardo, Murcia, 30100, Spain, Murcian Association for the Study of Palaeoanthropology and the Quaternary (MUPANTQUAT), Museo Arqueologico de Murcia, PO Box 4123, Murcia, 30080, Spain; Ortega-Rodrigáñez, J., Murcia University, Experimental Sciences Research Group E005-11 'Quaternary Palaeoecology, Palaeoanthropology', Biology Faculty, Campus Universitario de Espinardo, Murcia, 30100, Spain, Murcian Association for the Study of Palaeoanthropology and the Quaternary (MUPANTQUAT), Museo Arqueologico de Murcia, PO Box 4123, Murcia, 30080, Spain; Polo-Camacho, J.-L., Murcia University, Experimental Sciences Research Group E005-11 'Quaternary Palaeoecology, Palaeoanthropology', Biology Faculty, Campus Universitario de Espinardo, Murcia, 30100, Spain, Murcian Association for the Study of Palaeoanthropology and the Quaternary (MUPANTQUAT), Museo Arqueologico de Murcia, PO Box 4123, Murcia, 30080, Spain; Rhodes, S.E., Institut für Naturwissenschaftliche Archäologie - Archäozoologie, Universität Tübingen, Rümelinstrasse 23, Tübingen, D-72070, Germany; Richter, D., Department of Human Evolution, Max Planck Institute for Evolutionary Anthropology, Deutscher Platz 6, Leipzig, D-04103, Germany, Lehrstuhl Geomorphologie, Universität Bayreuth, Universitätsstrasse 30, Bayreuth, D-95447, Germany, Institut für Ökologie, Leuphana Universität Lüneburg, Scharnhorststrasse 1, Lüneburg, 21335, Germany; Rodríguez-Estrella, T., Murcia University, Experimental Sciences Research Group E005-11 'Quaternary Palaeoecology, Palaeoanthropology', Biology Faculty, Campus Universitario de Espinardo, Murcia, 30100, Spain, Murcian Association for the Study of Palaeoanthropology and the Quaternary (MUPANTQUAT), Museo Arqueologico de Murcia, PO Box 4123, Murcia, 30080, Spain, Department of Mining Engineering, Geology and Cartography, Cartagena Polytechnic University, Edificio 'La Milagrosa', Plaza Cronista Isidoro Valverde, Cartagena, 30202, Spain; Schwenninger, J.-L., Research Laboratory for Archaeology and the History of Art, Oxford University, Dyson Perrins Building, South Parks Road, Oxford, OX1 3QY, United Kingdom; Skinner, A.R., Department of Chemistry, Williams College, 880 Main Street, Williamstown, MA  01267, United States","Control of fire was a hallmark of developing human cognition and an essential technology for the colonisation of cooler latitudes. In Europe, the earliest evidence comes from recent work at the site of Cueva Negra del Estrecho del Río Quípar in south-eastern Spain. Charred and calcined bone and thermally altered chert were recovered from a deep, 0.8-million-year-old sedimentary deposit. A combination of analyses indicated that these had been heated to 400-600°C, compatible with burning. Inspection of the sediment and hydroxyapatite also suggests combustion and degradation of the bone. The results provide new insight into Early Palaeolithic use of fire and its significance for human evolution. Copyright © 2016 Antiquity Publications Ltd.","Acheulean; cognitive evolution; combustion; Early Pleistocene; Palaeolithic",,Article,"Final",Open Access,Scopus,2-s2.0-84983316492
"Domínguez-Rodrigo M., Fernández-López S., Alcalá L.","","How can taphonomy be defined in the XXI Century?",2011,"Journal of Taphonomy","9","1",,"1","13",,15,,,,"Domínguez-Rodrigo, M.; Fernández-López, S.; Alcalá, L.",[No abstract available],,,,"Final",,Scopus,2-s2.0-84867651922
"Domínguez-Rodrigo M.","6603679662;","Successful classification of experimental bone surface modifications (BSM) through machine learning algorithms: a solution to the controversial use of BSM in paleoanthropology?",2019,"Archaeological and Anthropological Sciences","11","6",,"2711","2725",,13,"10.1007/s12520-018-0684-9","https://www.scopus.com/inward/record.uri?eid=2-s2.0-85053340004&doi=10.1007%2fs12520-018-0684-9&partnerID=40&md5=6f26ec096877fe107e7b2d654ab1c897","Institute of Evolution in Africa (IDEA), University of Alcalá de Henares, Covarrubias 36, Madrid, 28010, Spain; Department of Prehistory, Complutense University, Madrid, 28040, Spain","Domínguez-Rodrigo, M., Institute of Evolution in Africa (IDEA), University of Alcalá de Henares, Covarrubias 36, Madrid, 28010, Spain, Department of Prehistory, Complutense University, Madrid, 28040, Spain","Here, I show that powerful machine learning (ML) algorithms can efficiently classify most BSM of any given controlled experimental assemblage. In some cases, classification may reach an accuracy of 100%. No other statistical tool commonly used in taphonomy had been this successful at classification before. However, the heuristics of ML algorithms depend tightly on the objectivity in raw data collection. The use of multivariate approaches in which variables are independently scored by the analyst introduces a subjective bias. In this work, I show that different analysts producing raw data on the same testing data set can lead to widely divergent BSM classifications and interpretations using the same powerful ML algorithms. It is emphasized that until an objective non-biasing method of raw data collection is implemented, BSM classification carried out via statistical tests will remain heuristically limited. As a consequence, the application of these referents to archeological BSM does not guarantee a correct interpretation beyond the analyst expertise. © 2018, Springer-Verlag GmbH Germany, part of Springer Nature.","Algorithm; Bone surface modification; Cut marks; Machine learning; Taphonomy; Trampling marks",,Article,"Final",,Scopus,2-s2.0-85053340004
"Hervé M.","","RVAideMemoire: Testing and Plotting Procedures for Biostatistics. R Package Version 0.9-71",2019,"RVAideMemoire: Testing and Plotting Procedures for Biostatistics",,,,"","",,11,,,,"Hervé, M.",[No abstract available],,,,"Final",,Scopus,2-s2.0-85065549303
