Authors,Author(s) ID,Title,Year,Source title,Volume,Issue,Art. No.,Page start,Page end,Page count,Cited by,DOI,Link,Affiliations,Authors with affiliations,Abstract,Author Keywords,Index Keywords,Document Type,Publication Stage,Access Type,Source,EID
"Albrecht G.H.","7102097193;","Assessing the affinities of fossils using canonical variates and generalized distances",1992,"Human Evolution","7","4",,"49","69",,50,"10.1007/BF02436412","https://www.scopus.com/inward/record.uri?eid=2-s2.0-51649138090&doi=10.1007%2fBF02436412&partnerID=40&md5=0a7e202bb5aec7898789279fa6188f12","Department of Anatomy and Cell Biology, University of Southern California, 1333 San Pablo Street, CA, 90033, United States","Albrecht, G.H., Department of Anatomy and Cell Biology, University of Southern California, 1333 San Pablo Street, CA, 90033, United States","Canonical variate analysis and generalized distances are commonly used multivariate statistical techniques for assessing the comparative morphology of living and fossil primates. Some common pitfalls of these methods when used to analyze fossil specimens are: (1) ignoring the possibility that a fossil belongs to a group other than one of the predefined reference samples (i.e., restricted versus unrestricted approaches to classification), (2) misinterpreting probabilities of group membership (i.e., posterior versus typicality probabilities), and (3) failing to understand how sample sizes influence multivariate ordinations in trying to effectively illustrate the morphometric affinities of a fossil (i.e., weighted versus unweighted analyses with fossils entered indirectly or directly into the analysis). To better understand canonincal variate analysis and generalized distances, the workings of these methods are portrayed graphically as a series of rotations and rescaling of data plotted in a multivariate data space. The influence of sample sizes and the importance of higher-numberer canonical variates are emphasized. Simple examples taken from the literature illustrate how the different approaches to including a fosil in canonical variate analysis may affect the multivariate results upon which physical anthropologists base their interpretations of the fossil's morphology. © 1992 International Institute for the Study of Man.","Fossils; Morphometrics; Multivariate Analysis",,Article,"Final",,Scopus,2-s2.0-51649138090
"Solodenko N., Zupancich A., Cesaro S.N., Marder O., Lemorini C., Barkai R.","55224663200;55357114300;7006795090;6603475709;6505457608;6603406279;","Fat residue use-wear found on Acheulian biface scraper associated with butchered elephant remains at the site of Revadim, Israel",2015,"PLoS ONE","10","3", e0118572,"","",,48,"10.1371/journal.pone.0118572","https://www.scopus.com/inward/record.uri?eid=2-s2.0-84925438700&doi=10.1371%2fjournal.pone.0118572&partnerID=40&md5=5eb3c9dc937e36e6a299223a5412d8cc","Jacob M. Alkow Department of Archaeology and Ancient Near Eastern Cultures, Tel Aviv University, Ramat Aviv, Tel Aviv, Israel; Scientific Methodologies Applied to Cultural Heritage (SMATCH), ISMN-CNR c/o Dept. of Chemistry, Sapienza Università di Roma, Rome, Italy; Department of Bible, Archaeology and Ancient Near Eastern Studies, Ben-Gurion University of the Negev, Beer-Sheva, Israel; Department of Classics, La Sapienza University of Rome, Rome, Italy","Solodenko, N., Jacob M. Alkow Department of Archaeology and Ancient Near Eastern Cultures, Tel Aviv University, Ramat Aviv, Tel Aviv, Israel; Zupancich, A., Jacob M. Alkow Department of Archaeology and Ancient Near Eastern Cultures, Tel Aviv University, Ramat Aviv, Tel Aviv, Israel; Cesaro, S.N., Scientific Methodologies Applied to Cultural Heritage (SMATCH), ISMN-CNR c/o Dept. of Chemistry, Sapienza Università di Roma, Rome, Italy; Marder, O., Department of Bible, Archaeology and Ancient Near Eastern Studies, Ben-Gurion University of the Negev, Beer-Sheva, Israel; Lemorini, C., Department of Classics, La Sapienza University of Rome, Rome, Italy; Barkai, R., Jacob M. Alkow Department of Archaeology and Ancient Near Eastern Cultures, Tel Aviv University, Ramat Aviv, Tel Aviv, Israel","The archaeological record indicates that elephants must have played a significant role in early human diet and culture during Palaeolithic times in the Old World. However, the nature of interactions between early humans and elephants is still under discussion. Elephant remains are found in Palaeolithic sites, both open-air and cave sites, in Europe, Asia, the Levant, and Africa. In some cases elephant and mammoth remains indicate evidence for butchering and marrow extraction performed by humans. Revadim Quarry (Israel) is a Late Acheulian site where elephant remains were found in association with characteristic Lower Palaeolithic flint tools. In this paper we present results regarding the use of Palaeolithic tools in processing animal carcasses and rare identification of fat residue preserved on Lower Palaeolithic tools. Our results shed new light on the use of Palaeolithic stone tools and provide, for the first time, direct evidence (residue) of animal exploitation through the use of an Acheulian biface and a scraper. The association of an elephant rib bearing cut marks with these tools may reinforce the view suggesting the use of Palaeolithic stone tools in the consumption of large game. © 2015 Solodenko et al.",,"calcium phosphate; fat; analytic method; animal tissue; Article; bone mineral; carcass; elephant; hydrolysis; infrared spectroscopy; Israel; nonhuman; Paleolithic; residue analysis; rib; shoulder; use wear analysis; animal; archeology; carnivory; diet; human; paleontology; Animalia; Elephantidae; Animals; Archaeology; Carnivory; Diet; Elephants; Fats; Humans; Israel; Paleontology",Article,"Final",Open Access,Scopus,2-s2.0-84925438700
"Binford L.R.","","Were there elephant hunters at Torralba?",1987,"The Evolution of Human Hunting",,,,"47","105",,48,,,,"Binford, L.R.",[No abstract available],,,,,,Scopus,2-s2.0-0041452723
"Yravedra J., Maté-González M.Á., Palomeque-González J.F., Aramendi J., Estaca-Gómez V., San Juan Blazquez M., García Vargas E., Organista E., González-Aguilera D., Arriaza M.C., Cobo-Sánchez L., Gidna A., Uribelarrea Del Val D., Baquedano E., Mabulla A., Domínguez-Rodrigo M.","56962776200;56780291300;56780262200;55827562600;57188553158;57192960468;57192955709;55839096100;24477009700;56786056800;55826172800;55123224100;6507093504;36237883200;18133831000;6603679662;","A new approach to raw material use in the exploitation of animal carcasses at BK (Upper Bed II, Olduvai Gorge, Tanzania): a micro-photogrammetric and geometric morphometric analysis of fossil cut marks",2017,"Boreas","46","4",,"860","873",,37,"10.1111/bor.12224","https://www.scopus.com/inward/record.uri?eid=2-s2.0-85009477629&doi=10.1111%2fbor.12224&partnerID=40&md5=4397bdf09c627b4a8fea02d8f62d6e9b","Department of Prehistory, Complutense University, Prof. Aranguren s/n, Madrid, 28040, Spain; IDEA (Institute of Evolution in Africa), Covarrubias 36, Madrid, 28010, Spain; Department of Cartography and Terrain Engineering, Polytechnic School of Avila, University of Salamanca, Hornos Caleros 50, Avila, 05003, Spain; C.A.I. Arqueometría y Análisis Arqueológico, Complutense University, Prof. Aranguren s/n, Madrid, 28040, Spain; Archaeology Museum, Dar es Salaam, Tanzania; Department of Geodynamic, Complutense University, Avda. Complutense, Madrid, Spain; Museo Arqueológico Regional, Plaza de las Bernardas s/n, Alcalá de Henares, Madrid, 28801, Spain; Archaeology Unit, University of Dar es Salaam, P.O. Box 35050, Dar es Salaam, Tanzania","Yravedra, J., Department of Prehistory, Complutense University, Prof. Aranguren s/n, Madrid, 28040, Spain, IDEA (Institute of Evolution in Africa), Covarrubias 36, Madrid, 28010, Spain; Maté-González, M.Á., Department of Cartography and Terrain Engineering, Polytechnic School of Avila, University of Salamanca, Hornos Caleros 50, Avila, 05003, Spain, C.A.I. Arqueometría y Análisis Arqueológico, Complutense University, Prof. Aranguren s/n, Madrid, 28040, Spain; Palomeque-González, J.F., Department of Prehistory, Complutense University, Prof. Aranguren s/n, Madrid, 28040, Spain; Aramendi, J., Department of Prehistory, Complutense University, Prof. Aranguren s/n, Madrid, 28040, Spain, IDEA (Institute of Evolution in Africa), Covarrubias 36, Madrid, 28010, Spain; Estaca-Gómez, V., Department of Prehistory, Complutense University, Prof. Aranguren s/n, Madrid, 28040, Spain; San Juan Blazquez, M., Department of Prehistory, Complutense University, Prof. Aranguren s/n, Madrid, 28040, Spain; García Vargas, E., Department of Prehistory, Complutense University, Prof. Aranguren s/n, Madrid, 28040, Spain; Organista, E., Department of Prehistory, Complutense University, Prof. Aranguren s/n, Madrid, 28040, Spain, IDEA (Institute of Evolution in Africa), Covarrubias 36, Madrid, 28010, Spain; González-Aguilera, D., Department of Cartography and Terrain Engineering, Polytechnic School of Avila, University of Salamanca, Hornos Caleros 50, Avila, 05003, Spain; Arriaza, M.C., IDEA (Institute of Evolution in Africa), Covarrubias 36, Madrid, 28010, Spain; Cobo-Sánchez, L., Department of Prehistory, Complutense University, Prof. Aranguren s/n, Madrid, 28040, Spain, IDEA (Institute of Evolution in Africa), Covarrubias 36, Madrid, 28010, Spain; Gidna, A., Archaeology Museum, Dar es Salaam, Tanzania; Uribelarrea Del Val, D., Department of Geodynamic, Complutense University, Avda. Complutense, Madrid, Spain; Baquedano, E., IDEA (Institute of Evolution in Africa), Covarrubias 36, Madrid, 28010, Spain, Museo Arqueológico Regional, Plaza de las Bernardas s/n, Alcalá de Henares, Madrid, 28801, Spain; Mabulla, A., Archaeology Unit, University of Dar es Salaam, P.O. Box 35050, Dar es Salaam, Tanzania; Domínguez-Rodrigo, M., Department of Prehistory, Complutense University, Prof. Aranguren s/n, Madrid, 28040, Spain, IDEA (Institute of Evolution in Africa), Covarrubias 36, Madrid, 28010, Spain","The use of innovative techniques such as micro-photogrammetry and geometric morphometrics may have a major impact on the differentiation of cut marks made with different raw materials and, thus, link butchering processes with stone tool reduction sequences. This work focuses on a sample of cut-marked bones from the Bell's Korongo (BK) site (Upper Bed II, Olduvai Gorge, Tanzania), which is an emblematic early Pleistocene site where a large faunal assemblage, including a diverse megafauna, occurs in association with quartzite and basalt industries. We present a detailed study of a sample of 58 cut marks identified on a set of recently excavated BK fossils, using a micro-photogrammetric and geometric morphometric approach, with the aim of identifying the raw materials used in the butchery of carcasses. In order to carry out this study, we previously carried out an experimental analysis to characterize cut marks and their morphology according to the types of raw material found at BK, namely quartzite and basalt. The results from the experimental study show that there is a good fit between raw material type and cut mark morphology, enabling us to confidently apply this method to the analysis of the cut marks of the BK fossil assemblage. The present study shows that most of the BK cut marks were created by the use of quartzite tools. The efficiency of this type of raw material is emphasized, which explains its curation over the landscape by hominins. © 2017 Collegium Boreas. Published by John Wiley & Sons Ltd",,"fauna; fossil record; hominid; morphology; morphometry; photogrammetry; Pleistocene; Arusha [Tanzania]; Olduvai Gorge; Tanzania; Animalia",Article,"Final",,Scopus,2-s2.0-85009477629
"Pante M.C., Muttart M.V., Keevil T.L., Blumenschine R.J., Njau J.K., Merritt S.R.","21733442900;57192594999;57192595276;6602434690;6504092583;56600134900;","A new high-resolution 3-D quantitative method for identifying bone surface modifications with implications for the Early Stone Age archaeological record",2017,"Journal of Human Evolution","102",,,"1","11",,37,"10.1016/j.jhevol.2016.10.002","https://www.scopus.com/inward/record.uri?eid=2-s2.0-85006943933&doi=10.1016%2fj.jhevol.2016.10.002&partnerID=40&md5=8ef96890d73a76a753180b9227081913","Department of Anthropology, Colorado State University, 1787 Campus Delivery, Fort Collins, CO  80523, United States; Palaeontological Scientific Trust, P.O. Box 203, Parklands, Johannesburg, 2121, South Africa; Department of Geological Sciences, Indiana University, 1001 E Tenth Street, Bloomington, IN  47405, United States; Department of Anthropology, University of Alabama at Birmingham, 1401 University Blvd., HHB 312, Birmingham, AL  35294, United States","Pante, M.C., Department of Anthropology, Colorado State University, 1787 Campus Delivery, Fort Collins, CO  80523, United States; Muttart, M.V., Department of Anthropology, Colorado State University, 1787 Campus Delivery, Fort Collins, CO  80523, United States; Keevil, T.L., Department of Anthropology, Colorado State University, 1787 Campus Delivery, Fort Collins, CO  80523, United States; Blumenschine, R.J., Palaeontological Scientific Trust, P.O. Box 203, Parklands, Johannesburg, 2121, South Africa; Njau, J.K., Department of Geological Sciences, Indiana University, 1001 E Tenth Street, Bloomington, IN  47405, United States; Merritt, S.R., Department of Anthropology, University of Alabama at Birmingham, 1401 University Blvd., HHB 312, Birmingham, AL  35294, United States","Bone surface modifications have become important indicators of hominin behavior and ecology at prehistoric archaeological sites. However, the method by which we identify and interpret these marks remains largely unchanged despite decades of research, relying on qualitative criteria and lacking standardization between analysts. Recently, zooarchaeologists have begun using new technologies capable of capturing 3-D data from bone surface modifications to advance our knowledge of these informative traces. However, an important step in this research has been overlooked and after years of work, we lack both a universal and replicable protocol and an understanding of the precision of these techniques. Here we propose a new standard for identifying bone surface modifications using high-resolution 3-D data and offer a systematic and replicable approach for researchers to follow. Data were collected with a white-light non-contact confocal profilometer and analyzed with Digital Surf's Mountains® software. Our data show that when methods are standardized, results between researchers are statistically indistinguishable. Multivariate analyses using the measured parameters allow discrimination between stone tool cut marks and mammalian carnivore tooth marks with 97.5% accuracy. Application of this method to fossil specimens resulted in 100% correspondence with identifications made by an experienced analyst using macroscopic observations of qualitative features of bone surface modifications. High-resolution 3-D analyses of bone surface modifications have great potential to improve the reliability and accuracy of taphonomic research, but only if our methods are replicable and precise. © 2016 Elsevier Ltd","Confocal profilometry; Cut mark; Feeding trace; Tooth mark","archaeological evidence; bone; carnivore; fossil record; hominid; multivariate analysis; quantitative analysis; Stone Age; Mammalia; anatomy and histology; animal; archeology; bone; fossil; hominid; multivariate analysis; procedures; three dimensional imaging; tool use; Animals; Archaeology; Bone and Bones; Fossils; Hominidae; Imaging, Three-Dimensional; Multivariate Analysis; Tool Use Behavior",Article,"Final",,Scopus,2-s2.0-85006943933
"Santonja M., Pérez-González A., Panera J., Rubio-Jara S., Méndez-Quintas E.","6507934601;55148343400;36438531500;36438705600;30567535600;","The coexistence of Acheulean and Ancient Middle Palaeolithic techno-complexes in the Middle Pleistocene of the Iberian Peninsula",2016,"Quaternary International","411",,,"367","377",,36,"10.1016/j.quaint.2015.04.056","https://www.scopus.com/inward/record.uri?eid=2-s2.0-84930603809&doi=10.1016%2fj.quaint.2015.04.056&partnerID=40&md5=07a2532f18ff551ba2c431af21611151","CENIEH (Centro Nacional de Investigación sobre la Evolución Humana), Paseo Sierra de Atapuerca, s/n, Burgos, 09002, Spain; IDEA (Institute of Evolution in Africa), Museo de los Orígenes, Plaza de San Andrés 2, Madrid, 28005, Spain; Escuela Interuniversitaria de Posgrado en Evolución Humana, Universidad de Burgos, C/ Juan de Austria 1, Burgos, 09001, Spain","Santonja, M., CENIEH (Centro Nacional de Investigación sobre la Evolución Humana), Paseo Sierra de Atapuerca, s/n, Burgos, 09002, Spain; Pérez-González, A., CENIEH (Centro Nacional de Investigación sobre la Evolución Humana), Paseo Sierra de Atapuerca, s/n, Burgos, 09002, Spain; Panera, J., IDEA (Institute of Evolution in Africa), Museo de los Orígenes, Plaza de San Andrés 2, Madrid, 28005, Spain; Rubio-Jara, S., IDEA (Institute of Evolution in Africa), Museo de los Orígenes, Plaza de San Andrés 2, Madrid, 28005, Spain; Méndez-Quintas, E., Escuela Interuniversitaria de Posgrado en Evolución Humana, Universidad de Burgos, C/ Juan de Austria 1, Burgos, 09001, Spain","Two clearly differentiated techno-complexes can be recognised in the Iberian Peninsula during the second half of the Middle Pleistocene: the Acheulean and the Middle Palaeolithic. In this paper we present the current state of research on both technological entities, and propose that they represent two different industrial traditions. The Acheulean, a techno-complex that originated and developed in Africa, is considered to have reached Western Europe via Gibraltar, and developed only to a limited extent. In contrast, relict populations with a different technological tradition would have been present on the European continent since the late Early Pleistocene and developed a technological tradition was based on the development of chaînes operatoire of débitage. From MIS 10 on these industries had reached a high degree of complexity and diversity. © 2015 Elsevier Ltd and INQUA","Acheulean; Iberian Peninsula; Middle Palaeolithic; Middle Pleistocene","archaeology; marine isotope stage; Paleolithic; Pleistocene; Iberian Peninsula; Nes",Article,"Final",,Scopus,2-s2.0-84930603809
"Soressi M., Hays M.A.","","Manufacture, transport and use of Mousterian bifaces. A case study from the Perigord (France)",2003,"Multiple Approaches to the Study of Bifacial Technologies",,,,"125","147",,36,,,,"Soressi, M.; Hays, M.A.",[No abstract available],,,,"Final",,Scopus,2-s2.0-0042094808
"Van Gijn A.L.","6506738495;","Science and interpretation in microwear studies",2014,"Journal of Archaeological Science","48","1",,"166","169",,35,"10.1016/j.jas.2013.10.024","https://www.scopus.com/inward/record.uri?eid=2-s2.0-84902538055&doi=10.1016%2fj.jas.2013.10.024&partnerID=40&md5=10b1de29490c45e07323e8be48a404ef","Material Culture and Artefact Studies, Faculty of Archaeology, Leiden University, PB 9515, 2300 RA Leiden, Netherlands","Van Gijn, A.L., Material Culture and Artefact Studies, Faculty of Archaeology, Leiden University, PB 9515, 2300 RA Leiden, Netherlands","Microwear analysis is regarded by some as problematical because of the subjective nature of the functional inferences. Aware of this problem, microwear analysts have proposed various methods of quantification that use several new analytical techniques. Although useful, these methods, employ overly simple experimentation that does no justice to the unlimited variability of human-object relationships. Instead, it is argued that we have to rely more on interpretation, incorporating ethnographic and ethno-historic information. At the same time we have to improve our daily microwear practice by producing better photographs and studying larger samples. This paper is intended as a general reflection on microwear methodology. © 2013 Elsevier Ltd.","Interpretation; Methodology; Microwear","analytical method; archaeology; methodology; photograph",Article,"Final",,Scopus,2-s2.0-84902538055
"Monteiro L.R., Bordin B., Furtado dos Reis S.","7103010498;6505819110;7004642148;","Shape distances, shape spaces and the comparison of morphometric methods",2000,"Trends in Ecology and Evolution","15","6",,"217","220",,33,"10.1016/S0169-5347(99)01775-9","https://www.scopus.com/inward/record.uri?eid=2-s2.0-0034115377&doi=10.1016%2fS0169-5347%2899%2901775-9&partnerID=40&md5=d8fac2531302a3fb82b09826cc8a8d83","Laboratório de Ciências Ambientais-CBB, Universidade Estadual do Norte Fluminense, Fluminense, Av. Alberto Lamego 2000 Horto, Campos dos Goytacazes Rio de Janeiro, 28015-620, Brazil; Departamento de Matemática, Universidade Estadual de Campinas, Caixa Postal 6065, 13083-970 Campinas São Paulo, Brazil; Departamento de Parasitologia, Universidade Estadual de Campinas, Caixa Postal 6109, 13083-970 Campinas São Paulo, Brazil","Monteiro, L.R., Laboratório de Ciências Ambientais-CBB, Universidade Estadual do Norte Fluminense, Fluminense, Av. Alberto Lamego 2000 Horto, Campos dos Goytacazes Rio de Janeiro, 28015-620, Brazil; Bordin, B., Laboratório de Ciências Ambientais-CBB, Universidade Estadual do Norte Fluminense, Fluminense, Av. Alberto Lamego 2000 Horto, Campos dos Goytacazes Rio de Janeiro, 28015-620, Brazil, Departamento de Matemática, Universidade Estadual de Campinas, Caixa Postal 6065, 13083-970 Campinas São Paulo, Brazil; Furtado dos Reis, S., Departamento de Parasitologia, Universidade Estadual de Campinas, Caixa Postal 6109, 13083-970 Campinas São Paulo, Brazil",[No abstract available],,"geometry; mathematical analysis; measurement; morphogenesis; morphometrics; note; simulation",Short Survey,"Final",,Scopus,2-s2.0-0034115377
