Authors,Author(s) ID,Title,Year,Source title,Volume,Issue,Art. No.,Page start,Page end,Page count,Cited by,DOI,Link,Affiliations,Authors with affiliations,Abstract,Author Keywords,Index Keywords,Document Type,Publication Stage,Access Type,Source,EID
[No author name available],[No author id available],[No title available],2012,"R: A Language and Environment for Statistical Computing",,,,"","",,79302,,,,"",[No abstract available],,,,"Final",,Scopus,2-s2.0-84863304598
"Venables W.N., Ripley B.D.","",[No title available],1994,"Modern Applied Statistics with S-Plus",,,,"","",,14942,,,,"Venables, W.N.; Ripley, B.D.",[No abstract available],,,,,,Scopus,2-s2.0-0003895851
"Fisher R.A.","","The use of multiple measurements in taxonomic problems",1936,"Ann. Eugenics","7","2",,"179","188",,8026,,,,"Fisher, R.A.",[No abstract available],,,,,,Scopus,2-s2.0-0000764772
"Pearson K.","","On lines and planes of closest fit to systems of points in space",1901,"Philosophical Magazine","2","2",,"559","572",,5004,,,,"Pearson, K.",[No abstract available],,,,,,Scopus,2-s2.0-0000325341
"Bookstein F.L.","",[No title available],1991,"Morphometric Tools for Landmark Data: Geometry and Biology",,,,"","",,3980,,,,"Bookstein, F.L.",[No abstract available],,,,,,Scopus,2-s2.0-0003597817
"Mahalanobis P.C.","","On the generalized distance in statistics",1936,"Proc. Nat. Inst. Sci. India",,,,"49","55",,3710,,,,"Mahalanobis, P.C.",[No abstract available],,,,,,Scopus,2-s2.0-0002975203
"Dryden I.L., Mardia K.V.","",[No title available],1998,"Statistical Shape Analysis",,,,"","",,2639,,,,"Dryden, I.L.; Mardia, K.V.",[No abstract available],,,,,,Scopus,2-s2.0-0003489720
"McLachlan G.J.","",[No title available],1992,"Discriminant Analysis and Statistical Pattern Recognition",,,,"","",,2393,,,,"McLachlan, G.J.",[No abstract available],,,,"Final",,Scopus,2-s2.0-0004027527
"Klingenberg C.P.","7004588456;","MorphoJ: An integrated software package for geometric morphometrics",2011,"Molecular Ecology Resources","11","2",,"353","357",,1769,"10.1111/j.1755-0998.2010.02924.x","https://www.scopus.com/inward/record.uri?eid=2-s2.0-78650839801&doi=10.1111%2fj.1755-0998.2010.02924.x&partnerID=40&md5=d30b5ebcfc053aa3854553146529e97f","Faculty of Life Sciences, University of Manchester, Michael Smith Building, Manchester M13 9PT, United Kingdom","Klingenberg, C.P., Faculty of Life Sciences, University of Manchester, Michael Smith Building, Manchester M13 9PT, United Kingdom","Increasingly, data on shape are analysed in combination with molecular genetic or ecological information, so that tools for geometric morphometric analysis are required. Morphometric studies most often use the arrangements of morphological landmarks as the data source and extract shape information from them by Procrustes superimposition. The MorphoJ software combines this approach with a wide range of methods for shape analysis in different biological contexts. The program offers an integrated and user-friendly environment for standard multivariate analyses such as principal components, discriminant analysis and multivariate regression as well as specialized applications including phylogenetics, quantitative genetics and analyses of modularity in shape data. MorphoJ is written in Java and versions for the Windows, Macintosh and Unix/Linux platforms are freely available from © 2010 Blackwell Publishing Ltd.","Geometric morphometrics; Multivariate statistics; Phylogeny; Procrustes superimposition; Quantitative genetics; Shape","article; computer interface; computer program; genetic procedures; instrumentation; multivariate analysis; phylogeny; Genetic Techniques; Multivariate Analysis; Phylogeny; Software; User-Computer Interface",Article,"Final",,Scopus,2-s2.0-78650839801
"Binford L.R.","",[No title available],1981,"Bones: Ancient Men and Modern Myths",,,,"","",,1763,,,,"Binford, L.R.",[No abstract available],,,,,,Scopus,2-s2.0-0003747768
"Gower J.C.","26643448300;","Generalized procrustes analysis",1975,"Psychometrika","40","1",,"33","51",,1620,"10.1007/BF02291478","https://www.scopus.com/inward/record.uri?eid=2-s2.0-0001886818&doi=10.1007%2fBF02291478&partnerID=40&md5=c7113fae6e77ffaebc62f66ce8c103be","Rothamsted Experimental Station, Harpenden, Herts, United Kingdom","Gower, J.C., Rothamsted Experimental Station, Harpenden, Herts, United Kingdom","Suppose Pi(i) (i = 1, 2, ..., m, j = 1, 2, ..., n) give the locations of mn points in p-dimensional space. Collectively these may be regarded as m configurations, or scalings, each of n points in p-dimensions. The problem is investigated of translating, rotating, reflecting and scaling the m configurations to minimize the goodness-of-fit criterion Σi=1m Σi=1n Δ2(Pj(i)Gi), where Gi is the centroid of the m points Pi(i) (i = 1, 2, ..., m). The rotated positions of each configuration may be regarded as individual analyses with the centroid configuration representing a consensus, and this relationship with individual scaling analysis is discussed. A computational technique is given, the results of which can be summarized in analysis of variance form. The special case m = 2 corresponds to Classical Procrustes analysis but the choice of criterion that fits each configuration to the common centroid configuration avoids difficulties that arise when one set is fitted to the other, regarded as fixed. © 1975 Psychometric Society.",,,Article,"Final",,Scopus,2-s2.0-0001886818
"Brain C.K.","",[No title available],1981,"The Hunters or the Hunted? An Introduction to African Cave Taphonomy",,,,"","",,1270,,,,"Brain, C.K.",[No abstract available],,,,,,Scopus,2-s2.0-0003560905
"James Rohlf F., Marcus L.F.","24518567800;7005305240;","A revolution morphometrics",1993,"Trends in Ecology and Evolution","8","4",,"129","132",,1268,"10.1016/0169-5347(93)90024-J","https://www.scopus.com/inward/record.uri?eid=2-s2.0-0242462501&doi=10.1016%2f0169-5347%2893%2990024-J&partnerID=40&md5=14afd83efbc93ae5f62d49a4829a5597","Dept of Ecology and Evolution, State University of New York, Stony Brook, NY 11794-5245, United States; Dept of Biology, Queen's College, CUNY, Flushing, NY 11367, United States","James Rohlf, F., Dept of Ecology and Evolution, State University of New York, Stony Brook, NY 11794-5245, United States; Marcus, L.F., Dept of Biology, Queen's College, CUNY, Flushing, NY 11367, United States","We are now in the midst of a revolution in morphometric methodology. The new approaches are more effective in capturing information about the shape of an organism and result in more powerful statistical procedures for testing for differences in s shape. They are also more effective in enabling a researcher to visualize differences in shape and in suggesting simple traditional measurements that could be used in future studies. In this review we emphasize applications to exploratory studies in taxonomy and evolution. © 1993.",,,Review,"Final",,Scopus,2-s2.0-0242462501
"Bookstein F.L.","7004606384;","Principal Warps: Thin-Plate Splines and the Decomposition of Deformations",1989,"IEEE Transactions on Pattern Analysis and Machine Intelligence","11","6",,"567","585",,1257,"10.1109/34.24792","https://www.scopus.com/inward/record.uri?eid=2-s2.0-79957563017&doi=10.1109%2f34.24792&partnerID=40&md5=cff712aaae68443780d2a30c89a6fd7d","Center for Human Growth and Development, University of Michigan, Ann Arbor, MI 48109, United States","Bookstein, F.L., Center for Human Growth and Development, University of Michigan, Ann Arbor, MI 48109, United States","One conventional tool for interpolating surfaces over scattered data, the thin-plate spline, has an elegant algebra expressing the dependence of the physical bending energy of a thin metal plate on point constraints. For interpolation of a surface over a fixed set of nodes in the plane, the bending energy is a quadratic form in the heights assigned to the surface. The spline is the superposition of eigenvectors of the bending energy matrix, of successively larger physical scales, over a tilted flat plane having no bending energy at all. When these splines are paired, one representing the x-coordinate of another form and the other the y-coordinate, they aid greatly in the modeling of biological shape change as deformation. In this context, the pair becomes an interpolation map from R2 to R2 relating two sets of landmark points. The spline maps decompose, in the same way as the spline surfaces, into a linear part (an affine transformation) together with the superposition of principal warps, which are geometrically independent, affine-free deformations of progressively smaller geometrical scales. The warps decompose an empirical deformation into orthogonal features more or less as a conventional orthogonal functional analysis decomposes the single scene. This paper demonstrates the decomposition of deformations by principal warps, extends the method to deal with curving edges between landmarks, relates this formalism to other applications of splines current in computer vision, and indicates how they might aid in the extraction of features for analysis, comparison, and diagnosis of biological and medical images. © 1989 IEEE","Affine transformations; biharmonic equation; biomedical image analysis; deformation; principal warps; quadratic variation; shape; thin-plate splines; warping",,Article,"Final",,Scopus,2-s2.0-79957563017
"Goodall C.","","Procrustes methods in the statistical analysis of shape",1991,"J. R. Statist. Soc. B","53","2",,"285","339",,1199,,,,"Goodall, C.",[No abstract available],,,,,,Scopus,2-s2.0-0000142472
"Adams D.C., Otárola-Castillo E.","7404054540;25629989200;","Geomorph: An r package for the collection and analysis of geometric morphometric shape data",2013,"Methods in Ecology and Evolution","4","4",,"393","399",,799,"10.1111/2041-210X.12035","https://www.scopus.com/inward/record.uri?eid=2-s2.0-84875761771&doi=10.1111%2f2041-210X.12035&partnerID=40&md5=2d3144c1d1d4ec733b4b43b8717c4368","Department of Ecology, Evolution, and Organismal Biology, Iowa State University, Ames, IA, 50011, United States; Department of Statistics, Iowa State University, Ames, IA, 50011, United States; Department of Human Evolutionary Biology, Department of Statistics, Harvard University, Cambridge, MA, 02138, United States","Adams, D.C., Department of Ecology, Evolution, and Organismal Biology, Iowa State University, Ames, IA, 50011, United States, Department of Statistics, Iowa State University, Ames, IA, 50011, United States; Otárola-Castillo, E., Department of Ecology, Evolution, and Organismal Biology, Iowa State University, Ames, IA, 50011, United States, Department of Human Evolutionary Biology, Department of Statistics, Harvard University, Cambridge, MA, 02138, United States","Many ecological and evolutionary studies seek to explain patterns of shape variation and its covariation with other variables. Geometric morphometrics is often used for this purpose, where a set of shape variables are obtained from landmark coordinates following a Procrustes superimposition. We introduce geomorph: a software package for performing geometric morphometric shape analysis in the r statistical computing environment. Geomorph provides routines for all stages of landmark-based geometric morphometric analyses in two and three-dimensions. It is an open source package to read, manipulate, and digitize landmark data, generate shape variables via Procrustes analysis for points, curves and surfaces, perform statistical analyses of shape variation and covariation, and to provide graphical depictions of shapes and patterns of shape variation. An important contribution of geomorph is the ability to perform Procrustes superimposition on landmark points, as well as semilandmarks from curves and surfaces. A wide range of statistical methods germane to testing ecological and evolutionary hypotheses of shape variation are provided. These include standard multivariate methods such as principal components analysis, and approaches for multivariate regression and group comparison. Methods for more specialized analyses, such as for assessing shape allometry, comparing shape trajectories, examining morphological integration, and for assessing phylogenetic signal, are also included. Several functions are provided to graphically visualize results, including routines for examining variation in shape space, visualizing allometric trajectories, comparing specific shapes to one another and for plotting phylogenetic changes in morphospace. Finally, geomorph participates to make available advanced geometric morphometric analyses through the r statistical computing platform. © 2013 The Authors. Methods in Ecology and Evolution © 2013 British Ecological Society.","Evolutionary biology; Macroevolution; Statistics",,Article,"Final",,Scopus,2-s2.0-84875761771
"Hotelling H.","24359722000;","Analysis of a complex of statistical variables into principal components",1933,"Journal of Educational Psychology","24","7",,"498","520",,791,"10.1037/h0070888","https://www.scopus.com/inward/record.uri?eid=2-s2.0-0001710505&doi=10.1037%2fh0070888&partnerID=40&md5=d37768f0f12feb8a06d51d7913b964b6",,"Hotelling, H.","(Continued from September issue.) The following general topics are considered in this section of the paper: determination of principal components for individuals; iterative solution of normal equations--convergence; tests as samples of a larger aggregate of tests; principal components with perfect weighting; and the ""sand"" and ""cobblestone"" theories of the mind. (PsycINFO Database Record (c) 2006 APA, all rights reserved). © 1933 American Psychological Association.","BIOMETRY AND STATISTICS; FACTOR ANALYSIS",,Article,"Final",,Scopus,2-s2.0-0001710505
"Keeley L.H.","",[No title available],1980,"Experimental Determination of Stone Tool Uses: A Microwear Analysis",,,,"","",,695,,,,"Keeley, L.H.",[No abstract available],,,,,,Scopus,2-s2.0-0003436999
"Rohlf F.J.","7003281107;","Shape statistics: Procrustes superimpositions and tangent spaces",1999,"Journal of Classification","16","2",,"197","223",,537,"10.1007/s003579900054","https://www.scopus.com/inward/record.uri?eid=2-s2.0-0033235691&doi=10.1007%2fs003579900054&partnerID=40&md5=afe1b218ad4917ce57cf2dee9936bc68","State University of New York, Stony Brook, NY, United States; Department of Ecology and Evolution, State University of New York, Stony Brook, NY 11794-5245, United States","Rohlf, F.J., State University of New York, Stony Brook, NY, United States, Department of Ecology and Evolution, State University of New York, Stony Brook, NY 11794-5245, United States","The shape of a set of labeled points corresponds to those attributes of the configuration that are invariant to the effects of translation, rotation, and scale. Procrustes distance may be used to compare different shapes and also serve as a metric that may be used to define multidimensional shape spaces. This paper demonstrates that the preshape space of planar triangles Procrustes aligned to a reference triangle corresponds to a unit hemisphere. An overview of methods used as linear approximations of D. G. Kendall's non-Euclidean shape space is given, and the equivalence of several methods based on orthogonal projections is shown. Some problems with approximations based on stereographic projections are also discussed. A simple example using artificial data is included.","Kendall shape space; Multivariate analysis; Partial warps; Preshape space; Tangent space",,Article,"Final",,Scopus,2-s2.0-0033235691
"Semenov S.A.","",[No title available],1964,"Prehistoric Technology",,,,"","",,469,,,,"Semenov, S.A.",[No abstract available],,,,"Final",,Scopus,2-s2.0-0004168479
"Rohlf F.J., Corti M.","7003281107;56232198800;","Use of two-block partial least-squares to study covariation in shape",2000,"Systematic Biology","49","4",,"740","753",,459,"10.1080/106351500750049806","https://www.scopus.com/inward/record.uri?eid=2-s2.0-0034351393&doi=10.1080%2f106351500750049806&partnerID=40&md5=f5aaf8597bd3c13104f1b4468125b0ee","Department of Ecology and Evolution, State University of New York, Stony Brook, NY 11794-5245, United States; Dipto. di Biol. Animale e dell'Uomo, Universita' di Roma La Sapienza, via Borelli 50, 00161 Roma, Italy","Rohlf, F.J., Department of Ecology and Evolution, State University of New York, Stony Brook, NY 11794-5245, United States; Corti, M., Dipto. di Biol. Animale e dell'Uomo, Universita' di Roma La Sapienza, via Borelli 50, 00161 Roma, Italy","The relatively new two-block partial least-squares method for analyzing the covariance between two sets of variables is described and contrasted with the well-known method of canonical correlation analysis. Their statistical properties, types of answers, and visualization techniques are discussed. Examples are given to show its usefulness in comparing two sets of variables - especially when one or both of the sets of variables are shape variables from a geometric morphometric study.","Canonical correlation; Covariance; Morphometrics; Mus musculus domesticus; Partial least squares; Plethodon; Visualization","analysis of variance; animal; article; bone; classification; fibula; genetics; histology; humerus; mouse; regression analysis; skull; tibia; ulna; Analysis of Variance; Animals; Bone and Bones; Fibula; Humerus; Least-Squares Analysis; Mice; Skull; Tibia; Ulna",Article,"Final",Open Access,Scopus,2-s2.0-0034351393
"Schick K.D., Toth N.","",[No title available],1993,"Making Silent Stones Speak",,,,"","",,363,,,,"Schick, K.D.; Toth, N.",[No abstract available],,,,,,Scopus,2-s2.0-0004164515
"Shipman P., Rose J.","7004475336;7404390659;","Early hominid hunting, butchering, and carcass-processing behaviors: Approaches to the fossil record",1983,"Journal of Anthropological Archaeology","2","1",,"57","98",,322,"10.1016/0278-4165(83)90008-9","https://www.scopus.com/inward/record.uri?eid=2-s2.0-0002170703&doi=10.1016%2f0278-4165%2883%2990008-9&partnerID=40&md5=f1f2d7ae90180cf9580c9a630030c6b0","Department of Cell Biology and Anatomy, The Johns Hopkins University School of Medicine, 725 North Wolfe Street, Baltimore, MD 21205, United States","Shipman, P., Department of Cell Biology and Anatomy, The Johns Hopkins University School of Medicine, 725 North Wolfe Street, Baltimore, MD 21205, United States; Rose, J., Department of Cell Biology and Anatomy, The Johns Hopkins University School of Medicine, 725 North Wolfe Street, Baltimore, MD 21205, United States","A major aim of paleoanthropology is to learn what ancient behaviors were related to the acquisition, processing, and consumption of meat and when these behaviors arose. For this reason, studies focusing on purported early hominid hunting and butchery sites are important if rigorous criteria for recognizing such sites are used. Different criteria currently used as evidence of hominid involvement with ancient bones are reviewed and it is concluded that the presence of cutmarks, verified by scanning electron microscope (SEM) inspection, is the most reliable. Successful application of this criterion depends upon a thorough knowledge of the normal variations in microscopic morphology of different types of marks that are found on bones. Therefore, variations in microscopic and gross morphology within and among a large sample of known stone tool cutmarks, carnivore tooth scratches, and rodent gnawing marks are documented. The effects of sedimentary abrasion, as caused by fluvial transport of bones, are also presented. Guidelines are presented for using microscopic criteria to identify unknown marks on fossils and possible applications of this approach are discussed. Further, it is suggested that evidence of hominid carcass-processing activities can be placed into one of three ranked categories of certainty according to the type of data used. Explicitly stating the category and type of evidence used to deduce hominid activities, and by extension to define site types (i.e., butchery, kill, base camp), may improve the clarity of hypotheses about and interpretations of early hominid behaviors. © 1983.",,,Article,"Final",,Scopus,2-s2.0-0002170703
"Kendall D.G.","23064672000;","A survey of the statistical theory of shape",1989,"Statistical Science","4","2",,"87","99",,313,"10.1214/ss/1177012582","https://www.scopus.com/inward/record.uri?eid=2-s2.0-84972538798&doi=10.1214%2fss%2f1177012582&partnerID=40&md5=0b9fc9f1245e9bdf6540916542f6448c","Churchill College, Department of Pure Mathematics and Mathematical Statistics, University of Cambridge, United Kingdom","Kendall, D.G., Churchill College, Department of Pure Mathematics and Mathematical Statistics, University of Cambridge, United Kingdom","This is a review of the current state of the ""theory of shape"" introduced by the author in 1977. It starts with a definition of ""shape"" for a set of k points in m dimensions. The first task is to identify the shape spaces in which such objects naturally live, and then to examine the probability structures induced on such a shape space by corresponding structures in Rm. Against this theoretical background one formulates and solves statistical problems concerned with shape characteristics of empirical sets of points. Some applications (briefly sketched here) are to archeology, astronomy, geography and physical chemistry. We also outline more recent work on ""size-and-shape,"" on shapes of sets of points in riemannian spaces, and on shape-theoretic aspects of random Delaunay tessellations. © 1989, Institute of Mathematical Statistics. All Rights Reserved.","Central place theory; Convex polygon; Delaunay tessellation; Galaxy; Quasar; Riemannian submersion; Singular tessellation; Spherical triangle; Stochastic physical chemistry; Void",,Article,"Final",Open Access,Scopus,2-s2.0-84972538798
"Roberts M.B., Parfitt S.A.","","Boxgrove. A Middle Pleistocene hominid site at Eartham Quarry, Boxgrove, West Sussex",1999,"Boxgrove: A Middle Pleistocene Hominid Site at Eartham Quarry, Boxgrove, West Sussex",,,,"","",,283,,,,"Roberts, M.B.; Parfitt, S.A.",[No abstract available],,,,"Final",,Scopus,2-s2.0-0003518368
"Piaget J.","",[No title available],1971,"Psychology and Epistemology",,,,"","",,265,,,,"Piaget, J.",[No abstract available],,,,"Final",,Scopus,2-s2.0-0004322907
"Domínguez-Rodrigo M., de Juana S., Galán A.B., Rodríguez M.","6603679662;11839691900;25723149700;57197402162;","A new protocol to differentiate trampling marks from butchery cut marks",2009,"Journal of Archaeological Science","36","12",,"2643","2654",,256,"10.1016/j.jas.2009.07.017","https://www.scopus.com/inward/record.uri?eid=2-s2.0-70349783751&doi=10.1016%2fj.jas.2009.07.017&partnerID=40&md5=a373b089296c5023568181278b5f2d5a","Department of Prehistory, Complutense University, c/Prof. Aranguren s/n, 28040 Madrid, Spain","Domínguez-Rodrigo, M., Department of Prehistory, Complutense University, c/Prof. Aranguren s/n, 28040 Madrid, Spain; de Juana, S., Department of Prehistory, Complutense University, c/Prof. Aranguren s/n, 28040 Madrid, Spain; Galán, A.B., Department of Prehistory, Complutense University, c/Prof. Aranguren s/n, 28040 Madrid, Spain; Rodríguez, M., Department of Prehistory, Complutense University, c/Prof. Aranguren s/n, 28040 Madrid, Spain","Microscopic signatures have previously been used to emphasize the similarities of butchery and trampling marks. The experimental background applied to differentiate both types of marks has been rather limited and authors have sometimes reached conflicting conclusions. This is partly due to methodological reasons: some authors have used very high magnification to examine microscopic features, whereas others have relied on more reduced magnification. Likewise, some experiments have exposed bones to trampling for reduced periods (minutes) whereas others have used longer time periods (hours). The present study stresses that the use of a scanning electronic microscope is not practical for identifying the impact of butchery and trampling marks in complete bone assemblages. It also emphasizes that previous studies have not addressed all the possible variables that could potentially be used to discriminate these marks, nor have they quantified the morphological patterns of each type of mark. Here we present a multivariate analysis of more than a dozen variables and show that butchery and trampling marks have very distinctive microscopic morphology. We advocate the use of a low magnification approach (≤40×), which can enable the analysis of complete assemblages using either hand lenses or binocular lenses. We also show the morphological criteria that differentiate butchery cut marks made with simple and retouched tools. We show that whereas complete discrimination of marks is impossible due to some degree of overlap, the list of criteria derived through multivariate analyses can be confidently used to correctly differentiate butchery and trampling marks in more than 90% of cases. © 2009 Elsevier Ltd. All rights reserved.","Butchery; Cut marks; Equifinality; Multivariate analysis; Retouched flakes; Simple flakes; Trampling marks","archaeological evidence; multivariate analysis; scanning electron microscopy; trampling",Article,"Final",,Scopus,2-s2.0-70349783751
"Isaac G.L.","",[No title available],1977,"Olorgesailie: Archaeological Studies of a Middle Pleistocene Lake Basin in Kenya",,,,"","",,252,,,,"Isaac, G.L.",[No abstract available],,,,"Final",,Scopus,2-s2.0-0003874881
