Authors,Author(s) ID,Title,Year,Source title,Volume,Issue,Art. No.,Page start,Page end,Page count,Cited by,DOI,Link,Affiliations,Authors with affiliations,Abstract,Author Keywords,Index Keywords,Document Type,Publication Stage,Access Type,Source,EID
"Boucher B.J.","35126734600;","Sex differences in the foetal pelvis",1957,"American Journal of Physical Anthropology","15","4",,"581","600",,55,"10.1002/ajpa.1330150409","https://www.scopus.com/inward/record.uri?eid=2-s2.0-0000874472&doi=10.1002%2fajpa.1330150409&partnerID=40&md5=70b331d79e822fa5c60f7acca949a1e5","Department of Anatomy, Washington University, School of Medicine, St Louis, United States; London Hospital Medical College, London, United Kingdom","Boucher, B.J., Department of Anatomy, Washington University, School of Medicine, St Louis, United States, London Hospital Medical College, London, United Kingdom",[No abstract available],,"article; fetus; histology; pelvis; PELVIS/anatomy and histology; sexual development; FETUS; PELVIS/anatomy and histology; SEX CHARACTERISTICS; Fetus; Pelvis; Sex Characteristics",Article,"Final",,Scopus,2-s2.0-0000874472
"Gonzalez P.N., Bernal V., Perez S.I.","55799217100;55930645900;13808174600;","Analysis of sexual dimorphism of craniofacial traits using geometric morphometric techniques",2011,"International Journal of Osteoarchaeology","21","1",,"82","91",,43,"10.1002/oa.1109","https://www.scopus.com/inward/record.uri?eid=2-s2.0-79251470148&doi=10.1002%2foa.1109&partnerID=40&md5=3e443ace3ee749c7f86df2d073e3e256","División Antropología, Facultad de Ciencias Naturales y Museo, Universidad Nacional de La Plata, Paseo del Bosque s/n, La Plata 1900, Argentina","Gonzalez, P.N., División Antropología, Facultad de Ciencias Naturales y Museo, Universidad Nacional de La Plata, Paseo del Bosque s/n, La Plata 1900, Argentina; Bernal, V., División Antropología, Facultad de Ciencias Naturales y Museo, Universidad Nacional de La Plata, Paseo del Bosque s/n, La Plata 1900, Argentina; Perez, S.I., División Antropología, Facultad de Ciencias Naturales y Museo, Universidad Nacional de La Plata, Paseo del Bosque s/n, La Plata 1900, Argentina","This work deals with the assessment of cranial sexual dimorphism in human skeletal samples applying geometric morphometric techniques. The purpose of this research is to apply such techniques to quantitatively describe in craniofacial traits the degree and pattern of shape and size sexual dimorphism. Likewise, we evaluate the precision and accuracy of semilandmark-based techniques for sex estimation. We employ a sample of 125 adult skulls of known sex from the Coimbra collection. A set of coordinate points was selected to describe glabella, mastoid, frontal and zygomatic processes. The results of intra-class correlation coefficient (ICC) show excellent intra- and inter-observer agreement (ICC>0.96) in the location of the coordinates of points employed. The principal component analysis (PCA) performed on shape variables shows a large superposition of both sexes, suggesting a relatively low degree of dimorphism in shape. As a consequence, the average percentages of correct sex estimations based on these variables were of 60.12 and 68.90%, obtained by discriminant analysis with leave-one-out cross validation and k-means clustering respectively. Conversely, when centroid size is included in PCA, females and males exhibit large separation along the first component. The highest values of correct assignment (77.86 and 72.15%) were found using shape-size variables with discriminant and k-means clustering analysis, indicating that the traits analysed display marked sex differences related to the larger size and more robust features of males. Finally, the advantages of geometric morphometric techniques are discussed. © 2009 John Wiley & Sons, Ltd.","Cranial sex; Discriminant analysis; K-means clustering; Semilandmarks",,Article,"Final",,Scopus,2-s2.0-79251470148
"Vlak D., Roksandic M., Schillaci M.A.","35321452400;23470776200;6603933072;","Greater sciatic notch as a sex indicator in juveniles",2008,"American Journal of Physical Anthropology","137","3",,"309","315",,43,"10.1002/ajpa.20875","https://www.scopus.com/inward/record.uri?eid=2-s2.0-55849125780&doi=10.1002%2fajpa.20875&partnerID=40&md5=7b768de9b46cc028b9c046a354d3ce77","Department of Anthropology, University of Toronto, Toronto, ON, Canada; Institute for Anthropological Research, Zagreb, Croatia; Department of Anthropology, University of Winnipeg, Winnipeg, MB, Canada; Department of Social Sciences, University of Toronto Scarborough, Toronto, ON, Canada; Institute for Anthropological Research, Gajeva 32, P.O. Box 290, Zagreb 10 000, Croatia","Vlak, D., Department of Anthropology, University of Toronto, Toronto, ON, Canada, Institute for Anthropological Research, Zagreb, Croatia, Institute for Anthropological Research, Gajeva 32, P.O. Box 290, Zagreb 10 000, Croatia; Roksandic, M., Department of Anthropology, University of Winnipeg, Winnipeg, MB, Canada; Schillaci, M.A., Department of Social Sciences, University of Toronto Scarborough, Toronto, ON, Canada","Using Schutkowski's method for juvenile sex determination (Schutkowski H. 1993. Am J Phys Anthropol 90:199-205), we evaluated the morphology of the greater sciatic notch of 56 ilia (23 females and 33 males) from a documented skeletal collection housed at the Bocage Museum in Lisbon (Portugal). After applying Schutkowski's original methodology and comparing the results with previous studies, we used age-adjusted metrical variables to describe greater sciatic notch depth, breadth, and angle. Although results of both morphological and metrical analyses did not reveal a statistically significant level of sexual analyses dimorphism, we found a strong correlation between pelvic morphology and age at death. On the basis of the obtained results, we argue that Schutkowski's morphological method does not predict sex accurately in all populations and that recorded correlation of iliac features with age needs to be further explored in the context of the ontogeny of sexual dimorphism. ©2008 Wiley-Liss, Inc.","Morphology; Ontogeny; Osteology; Sex determination; Sexual dimorphism; Skeletal remains","Notch receptor; article; bone structure; correlation analysis; greater sciatic notch; human; ischium; juvenile; morphometrics; sex determination; sex difference; Adolescent; Age Factors; Anthropology, Physical; Child; Child, Preschool; Female; Humans; Ilium; Infant; Infant, Newborn; Male; Sex Characteristics; Sex Determination by Skeleton",Article,"Final",,Scopus,2-s2.0-55849125780
"Wilson L.A., MacLeod N., Humphrey L.T.","7403521601;57200347364;12544863500;","Morphometric criteria for sexing juvenile human skeletons using the ilium",2008,"Journal of Forensic Sciences","53","2",,"269","278",,40,"10.1111/j.1556-4029.2008.00656.x","https://www.scopus.com/inward/record.uri?eid=2-s2.0-41149113037&doi=10.1111%2fj.1556-4029.2008.00656.x&partnerID=40&md5=51d7e1d6f5ed727a5989345bf6821ca8","Department of Biology, Imperial College London, London SW7 2AZ, United Kingdom; Department of Palaeontology, Natural History Museum, Cromwell Road, London SW7 5BD, United Kingdom; Universität Zürich, Palaontologisches Institut und Museum, Karl Schmid-Strasse 4, CH-8006 Zürich, Switzerland","Wilson, L.A., Department of Biology, Imperial College London, London SW7 2AZ, United Kingdom, Universität Zürich, Palaontologisches Institut und Museum, Karl Schmid-Strasse 4, CH-8006 Zürich, Switzerland; MacLeod, N., Department of Palaeontology, Natural History Museum, Cromwell Road, London SW7 5BD, United Kingdom; Humphrey, L.T., Department of Palaeontology, Natural History Museum, Cromwell Road, London SW7 5BD, United Kingdom","Previous attempts to sex juvenile skeletons have focused on the application of qualitative or semi-quantitative techniques. This study applies a variety of geometric morphometric methods, including eigenshape analysis, to this problem. Six metric criteria for the ilia were tested with the aim of investigating previous ideas concerning sexually diagnostic characters. This study uses 25 ilia from juveniles of known age and sex from Christ Church, Spitalfields, London. Ninety-six percent of juvenile ilia were correctly identified as male or female using the shape of the greater sciatic notch. Identification accuracy is shown to improve with age for several criteria. Males were identified to a higher accuracy than females. Application of geometric techniques improves the understanding of the relationship between age, sex, and shape and the clarity with which these relationships can be quantified. Archaeological and forensic relevance of the results are discussed with recommendations for future application. © 2008 American Academy of Forensic Sciences.","Forensic anthropology; Forensic science; Geometric morphometrics; Ilium; Juvenile osteology; Sex determination","article; forensic identification; groups by age; human; iliac bone; morphometrics; priority journal; sex determination; sex difference; skeleton; Child; Child, Preschool; Female; Forensic Anthropology; Humans; Ilium; Image Processing, Computer-Assisted; Infant; Infant, Newborn; Male; Reproducibility of Results; Sex Determination by Skeleton",Article,"Final",,Scopus,2-s2.0-41149113037
"Cardoso H.F.V.","23394620800;","Sample-specific (universal) metric approaches for determining the sex of immature human skeletal remains using permanent tooth dimensions",2008,"Journal of Archaeological Science","35","1",,"158","168",,40,"10.1016/j.jas.2007.02.013","https://www.scopus.com/inward/record.uri?eid=2-s2.0-35748972623&doi=10.1016%2fj.jas.2007.02.013&partnerID=40&md5=5ed37773fbd7836884bfaf9ba277a0a6","Departamento de Zoologia e Antropologia (Museu Bocage), Museu Nacional de História Natural, Rua da Escola Politécnica 58, 1269-102 Lisboa, Portugal","Cardoso, H.F.V., Departamento de Zoologia e Antropologia (Museu Bocage), Museu Nacional de História Natural, Rua da Escola Politécnica 58, 1269-102 Lisboa, Portugal","In this paper, three approaches for developing sample-specific sex determination methods of immature skeletal remains based on permanent tooth dimensions are proposed and tested using a sample of identified skeletons. The sample comprises adult and subadult individuals selected from the Lisbon documented skeletal collection, housed at the National Museum of Natural History in Lisbon, Portugal. Faciolingual and mesiodistal diameters were the tooth dimensions utilized. In the first approach, sex-specific logistic regression formulae based on adult tooth dimensions are developed and then used to determine the sex of the subadult sample. The second and third approaches are based on the sectioning point procedure, which uses the overall mean of a measurement (tooth diameter) collected from the sample as the discriminant criteria for determining the sex of the individuals in that sample. While in the second approach the adult overall mean of each dimension is used as the discriminant criteria for determining the sex of the subadults, in the third approach it is the subadult overall mean of each dimension that comprises the discriminant criteria that is applied back to the subadults for determining sex. Results show that the canines are the teeth with the highest sexual dimorphism and methods of sex determination based on canine dimensions provide correct allocation accuracies between 58.8% and 100% depending on the diameter and the approach that is being used. Canine faciolingual dimensions provide the best overall results. Combinations of measurements from the same and different teeth do not increase significantly the accuracy of the methods and approaches. Some of the problems of subadult sex determination methods based on adult tooth dimensions result from differing levels of sexual dimorphism between the adult and subadult segment of the sample. Mortality or cultural bias may increase or decrease the sexual dimorphism of the subadults compared to the adults. Small subadult samples utilized in this study may also raise questions regarding the accuracy of the three different sample-specific approaches. However, high consistency of results using the canine and different approaches, suggests that adult and subadult canine dimensions can be reliable sex discriminators of immature skeletal remains in archaeological samples. The major advantage of the approaches presented here is that they can be used to derive sample-specific methods and, therefore, eliminate the problem of applying morphological or metric methods to individuals originating from a population that differs from the one that contributed to the development of the method. © 2007 Elsevier Ltd. All rights reserved.","Archaeological samples; Lisbon collection; Permanent dentition; Sex determination; Subadults; Tooth size","accuracy assessment; archaeology; discriminant analysis; regression analysis; sex determination; skeleton; Eurasia; Europe; Lisboa [Portugal]; Lisbon; Portugal; Southern Europe",Article,"Final",,Scopus,2-s2.0-35748972623
"Cardoso H.F.V., Saunders S.R.","23394620800;7202876055;","Two arch criteria of the ilium for sex determination of immature skeletal remains: A test of their accuracy and an assessment of intra- and inter-observer error",2008,"Forensic Science International","178","1",,"24","29",,38,"10.1016/j.forsciint.2008.01.012","https://www.scopus.com/inward/record.uri?eid=2-s2.0-43049092959&doi=10.1016%2fj.forsciint.2008.01.012&partnerID=40&md5=5a5c8e093a883e396e32799e9f9bbf13","Departamento de Antropologia, Universidade de Coimbra, Rua do Arco da Traição, 3000-056 Coimbra, Portugal; Faculdade de Medicina, Universidade do Porto, Al. Prof. Hernâni Monteiro, 4200-319 Porto, Portugal; Department of Anthropology, McMaster University, Chester New Hall 524, 1280 Main St. West, Hamilton, Ont. L8S 4L9, Canada","Cardoso, H.F.V., Departamento de Antropologia, Universidade de Coimbra, Rua do Arco da Traição, 3000-056 Coimbra, Portugal, Faculdade de Medicina, Universidade do Porto, Al. Prof. Hernâni Monteiro, 4200-319 Porto, Portugal, Department of Anthropology, McMaster University, Chester New Hall 524, 1280 Main St. West, Hamilton, Ont. L8S 4L9, Canada; Saunders, S.R., Department of Anthropology, McMaster University, Chester New Hall 524, 1280 Main St. West, Hamilton, Ont. L8S 4L9, Canada","Although the assignment of sex to immature skeletal remains is considered problematic, some traits have been considered useful for both forensic and bioarchaeological applications. One such trait is the arch criterion found in subadult ilia, which is defined relative to the greater sciatic notch-auricular surface area. In adults, the composite arch has also been described in relation to this area and has proven relatively successful in sex determination. This study offers an examination of the accuracy of the arch criterion and the composite arch in determining the sex of subadult skeletal remains, and an assessment of intra- and inter-observer scoring error. A sample of 97 skeletons of known sex and age (<15 years) from the Lisbon collection (Portugal) were selected and the traits were scored by three observers on orthogonal photos of each ilium. In general the agreement within (67.7-88.5%) and between (50.5-76.3%) examiners was poor and overall accuracy (26.7-52.6%) did not meet the expectations of that reported in previous studies. The authors suggest that this derives from great variation in morphology, difficulties in interpreting criteria and possibly a lack of association between the expression of the traits and sex. Careful examination of sex-related morphology in the immature skeleton and additional blind tests of so-called useful traits should continue to be carried out. © 2008 Elsevier Ireland Ltd. All rights reserved.","Arch criterion; Composite arch; Forensic science; Ilium; Sex determination; Subadults","accuracy; archeology; article; error; forensic science; human; human tissue; iliac bone; morphology; priority journal; sex determination; skeleton; Adolescent; Child; Child, Preschool; Female; Forensic Anthropology; Humans; Ilium; Infant; Infant, Newborn; Male; Observer Variation; Sex Determination by Skeleton",Article,"Final",,Scopus,2-s2.0-43049092959
"Klingenberg C.P.","",[No title available],2008,"MorphoJ. Faculty of Life Sciences",,,,"","",,37,,,,"Klingenberg, C.P.",[No abstract available],,,,"Final",,Scopus,2-s2.0-67650410406
"Wilson L.A.B., Cardoso H.F.V., Humphrey L.T.","7403521601;23394620800;12544863500;","On the reliability of a geometric morphometric approach to sex determination: A blind test of six criteria of the juvenile ilium",2011,"Forensic Science International","206","1-3",,"35","42",,30,"10.1016/j.forsciint.2010.06.014","https://www.scopus.com/inward/record.uri?eid=2-s2.0-79952452028&doi=10.1016%2fj.forsciint.2010.06.014&partnerID=40&md5=c56b88be090b356978584c6b38cb0a1d","Paläontologisches Institut und Museum, Universität Zürich, Karl Schmid-Strasse 4, CH-8006 Zürich, Switzerland; Universidade de Lisboa, Museu Nacional de História Natural, Centro de Biologia Ambiental, Rua da Escola Politécnica 56/58, 1250-102 Lisboa, Portugal; Universidade do Porto, Faculdade de Medicina, Jardim Carrilho Videira, 4050-167 Porto, Portugal; Department of Palaeontology, The Natural History Museum, Cromwell Road, London SW7 5BD, United Kingdom","Wilson, L.A.B., Paläontologisches Institut und Museum, Universität Zürich, Karl Schmid-Strasse 4, CH-8006 Zürich, Switzerland; Cardoso, H.F.V., Universidade de Lisboa, Museu Nacional de História Natural, Centro de Biologia Ambiental, Rua da Escola Politécnica 56/58, 1250-102 Lisboa, Portugal, Universidade do Porto, Faculdade de Medicina, Jardim Carrilho Videira, 4050-167 Porto, Portugal; Humphrey, L.T., Department of Palaeontology, The Natural History Museum, Cromwell Road, London SW7 5BD, United Kingdom","Despite the attention of many studies, researchers still struggle to identify criteria with which to sex juvenile remains at levels of accuracy and reproducibility comparable with those documented for adults. This study uses a sample of 82 juvenile ilia from an identified Portuguese population (Lisbon collection) to test the cross-applicability of a new approach by Wilson et al. [23] that uses geometric morphometric methods to sex the subadult ilium. Further, we evaluate the wider applicability of these methods for forensic casework, extending the age range of the original study by examining an additional 19 juvenile ilia from the St. Brides and Spitalfields collections, housed in London. Levels of accuracy for the Portuguese sample (62.2-89.0%) indicate that the methods can be used to document dimorphism in another sample. Discriminant functions are sample-specific, indicated by not better than average classification using cross-validation. We propose a methodological update, whereby we recommend disuse of the auricular surface morphology criterion, based upon reduced success rates and inadequate accuracy of female identification. We show, in addition to population differences, differences in the ontogeny of dimorphism may lead to differing degrees of success for female identification using some criteria. The success rates are highest between the ages of 11.00 and 14.99 years (93.3% males, 80.0% females). © 2010 Elsevier Ireland Ltd.","Forensic science; Geometric morphometrics; Ilium; Ontogeny; Sex determination","accuracy; adolescent; age; article; child; controlled study; female; forensic identification; human; human tissue; iliac bone; infant; joint; male; morphometrics; observer variation; ontogeny; Portugal; preschool child; priority journal; reliability; school child; sex determination; sex difference; United Kingdom; validation process; Adolescent; Analysis of Variance; Child; Child, Preschool; Discriminant Analysis; Female; Forensic Anthropology; Humans; Ilium; Infant; Male; Reproducibility of Results; Sex Determination by Skeleton",Article,"Final",,Scopus,2-s2.0-79952452028
"Alemán I., Irurita J., Valencia A.R., Martínez A., Lõpez-Lázaro S., Viciano J., Botella M.C.","23134325000;46861089100;55445095700;57188667346;46861416800;37089591100;23134271400;","Brief communication: The Granada osteological collection of identified infants and young children",2012,"American Journal of Physical Anthropology","149","4",,"606","610",,28,"10.1002/ajpa.22165","https://www.scopus.com/inward/record.uri?eid=2-s2.0-84869500757&doi=10.1002%2fajpa.22165&partnerID=40&md5=4e8a07c20391e17a832863d2009bce66","Department of Legal Medicine, Toxicology and Physical Anthropology, Medicine Faculty, University of Granada, Granada 18012, Spain","Alemán, I., Department of Legal Medicine, Toxicology and Physical Anthropology, Medicine Faculty, University of Granada, Granada 18012, Spain; Irurita, J., Department of Legal Medicine, Toxicology and Physical Anthropology, Medicine Faculty, University of Granada, Granada 18012, Spain; Valencia, A.R., Department of Legal Medicine, Toxicology and Physical Anthropology, Medicine Faculty, University of Granada, Granada 18012, Spain; Martínez, A., Department of Legal Medicine, Toxicology and Physical Anthropology, Medicine Faculty, University of Granada, Granada 18012, Spain; Lõpez-Lázaro, S., Department of Legal Medicine, Toxicology and Physical Anthropology, Medicine Faculty, University of Granada, Granada 18012, Spain; Viciano, J., Department of Legal Medicine, Toxicology and Physical Anthropology, Medicine Faculty, University of Granada, Granada 18012, Spain; Botella, M.C., Department of Legal Medicine, Toxicology and Physical Anthropology, Medicine Faculty, University of Granada, Granada 18012, Spain","The objective of this study is to present the characteristics of a collection of identified infants and young children housed in the Laboratory of Anthropology of the University of Granada, Spain. The sample, which is still being enlarged, is currently composed of 230 complete skeletons aged from 5 months of gestation to 8 years, with a majority below 1 year. It mainly dates from the mid-20th century. The state of preservation is very good, and antemortem information is available from burial and death certificates, among other documents. Our sample makes an important contribution to the relatively few collections available in the world for investigating the osteological development of the skeletons of infants and young children from a physical anthropological perspective. Am J Phys Anthropol, 2012. © 2012 Wiley Periodicals, Inc. Copyright © 2012 Wiley Periodicals, Inc.","age estimation; antemortem data; forensic anthropology; skeletal sample","article; bone development; cause of death; child; data collection method; death certificate; female; fetus; gestational age; groups by age; human; human tissue; infant; male; newborn; osteology; physical anthropology; posthumous care; preschool child; preservation; school child; skeleton; social status; Spain",Article,"Final",,Scopus,2-s2.0-84869500757
