Authors,Author(s) ID,Title,Year,Source title,Volume,Issue,Art. No.,Page start,Page end,Page count,Cited by,DOI,Link,Affiliations,Authors with affiliations,Abstract,Author Keywords,Index Keywords,Document Type,Publication Stage,Access Type,Source,EID
"Fleiss J.L.","",[No title available],1981,"Statistical Methods for Rates and Proportions",,,,"","",,18349,,,,"Fleiss, J.L.",[No abstract available],,,,"Final",,Scopus,2-s2.0-0003877646
"Fleiss J.L.","",[No title available],1986,"The Design and Analysis of Clinical Experiments",,,,"","",,4422,,,,"Fleiss, J.L.",[No abstract available],,,,,,Scopus,2-s2.0-0003532215
"Bookstein F.L.","",[No title available],1991,"Morphometric Tools for Landmark Data: Geometry and Biology",,,,"","",,3980,,,,"Bookstein, F.L.",[No abstract available],,,,,,Scopus,2-s2.0-0003597817
"Buikstra J.E., Ubelaker D.H.","","Standards for data collection from human skeletal remains",1994,"Standards for Data Collection from Human Skeletal Remains",,,,"","",,2465,,,,"Buikstra, J.E.; Ubelaker, D.H.",[No abstract available],,,,,,Scopus,2-s2.0-0003655056
"Scheuer L., Black S.","",[No title available],2000,"Developmental Juvenile Osteology",,,,"","",,1288,,,,"Scheuer, L.; Black, S.",[No abstract available],,,,,,Scopus,2-s2.0-0004177176
"Adams D.C., Rohlf F.J., Slice D.E.","7404054540;7003281107;6603334019;","Geometric morphometrics: Ten years of progress following the ‘revolution’",2004,"Italian Journal of Zoology","71","1",,"5","16",,1201,"10.1080/11250000409356545","https://www.scopus.com/inward/record.uri?eid=2-s2.0-1242321708&doi=10.1080%2f11250000409356545&partnerID=40&md5=74fa0a4ec02d5ccc6f34b38d4e228cd8","Department of Ecology, Evolution, Organismal Biology, Department of Statistics, Iowa State University, Ames, IA, 50011–3223, United States; Department of Ecology and Evolution, State University of New York, Stony Brook, NY, 11794–5245, United States; Institute for Anthropology, University of Vienna, Winston-Salem, NC, 27157–1022, Austria; Department of Medical Engineering, Wake Forest University School of Medicine, Winston-Salem, NC, 27157–1022, United States","Adams, D.C., Department of Ecology, Evolution, Organismal Biology, Department of Statistics, Iowa State University, Ames, IA, 50011–3223, United States; Rohlf, F.J., Department of Ecology and Evolution, State University of New York, Stony Brook, NY, 11794–5245, United States; Slice, D.E., Institute for Anthropology, University of Vienna, Winston-Salem, NC, 27157–1022, Austria, Department of Medical Engineering, Wake Forest University School of Medicine, Winston-Salem, NC, 27157–1022, United States","The analysis of shape is a fundamental part of much biological research. As the field of statistics developed, so have the sophistication of the analysis of these types of data. This lead to multivariate morphometrics in which suites of measurements were analyzed together using canonical variates analysis, principal components analysis, and related methods. In the 1980s, a fundamental change began in the nature of the data gathered and analyzed. This change focused on the coordinates of landmarks and the geometric information about their relative positions. As a by-product of such an approach, results of multivariate analyses could be visualized as configurations of landmarks back in the original space of the organism rather than only as statistical scatter plots. This new approach, called “geometric morphometrics”;, had benefits that lead Rohlf and Marcus (1993) to proclaim a “revolution”; in morphometrics. In this paper, we briefly update the discussion in that paper and summarize the advances in the ten years since the paper by Rohlf and Marcus. We also speculate on future directions in morphometric analysis. © 2004 Taylor & Francis Group, LLC.","Generalized Procrustes analysis; Geometric morphometrics; Shape analysis","geometry; morphometry; zoology; Procrustes",Article,"Final",Open Access,Scopus,2-s2.0-1242321708
"Ferembach D., Schwidetzky I., Stloukal M.","","Recommendations for age and sex diagnoses of skeletons",1980,"J Hum Evol","9",,,"517","549",,612,,,,"Ferembach, D.; Schwidetzky, I.; Stloukal, M.",[No abstract available],,,,,,Scopus,2-s2.0-0000884253
"Rohlf F.J.","",[No title available],2005,"TpsDig, Digitize Landmarks and Outlines",,,,"","",,606,,,,"Rohlf, F.J.",[No abstract available],,,,"Final",,Scopus,2-s2.0-18844422334
"Rohlf F.J.","",[No title available],2006,"TpsDig, Version 2.10",,,,"","",,561,,,,"Rohlf, F.J.",[No abstract available],,,,"Final",,Scopus,2-s2.0-46749110881
"Bruzek J.","6602595244;","A method for visual determination of sex, using the human hip bone",2002,"American Journal of Physical Anthropology","117","2",,"157","168",,530,"10.1002/ajpa.10012","https://www.scopus.com/inward/record.uri?eid=2-s2.0-0036159009&doi=10.1002%2fajpa.10012&partnerID=40&md5=5950a75aee2e3507d3ea6cf08fffca6f","U.M.R. 5809 du C.N.R.S., Laboratoire d'Anthropologie des Populations du Passé, Université Bordeaux I, 33405 Talence, France; Laboratoire d'Anthropologie des Populations du Passé, UMR 5809 du CNRS, Université Bordeaux I, Avenue des Facultés, 33405 Talence, France","Bruzek, J., U.M.R. 5809 du C.N.R.S., Laboratoire d'Anthropologie des Populations du Passé, Université Bordeaux I, 33405 Talence, France, Laboratoire d'Anthropologie des Populations du Passé, UMR 5809 du CNRS, Université Bordeaux I, Avenue des Facultés, 33405 Talence, France","A new visual method for the determination of sex using the human hip bone (os coxae) is proposed, based on a revision of several previous approaches which scored isolated characters of this bone. The efficacy of the methodology is tested on a sample of 402 adults of known sex and age of French and Portuguese origins. With the simultaneous use of five characters of the hip bone, it is possible to provide a correct sexual diagnosis in 95% of all cases, with an error of 2% and an inability to identify sex in only 3%. The advantage of this new method is a reduction in observer subjectivity, since the evaluation procedure cannot involve any anticipation of the result. In addition, this method of sex determination increases the probability of a correct diagnosis with isolated fragments of the hip bone, provided that a combination of elements of one character is found to be typically male or female. © 2002 Wiley-Liss, Inc.","Human pelvis; Method; Morphological traits; Sex determination","article; controlled study; error; female; hip; human; male; methodology; sex determination; visual system",Article,"Final",,Scopus,2-s2.0-0036159009
"Lewis M.E.","","The Bioarchaeology of Children: Perspectives from Biological and Forensic Anthropology",2007,"The Bioarchaeology of Children: Perspectives from Biological and Forensic Anthropology",,,,"","",,347,,,,"Lewis, M.E.",[No abstract available],,,,"Final",,Scopus,2-s2.0-35348829135
"Zelditch M., Swiderski D., Sheets H.","6701615282;35493322600;55663863700;","Geometric Morphometrics for Biologists",2012,"Geometric Morphometrics for Biologists",,,,"","",478,327,"10.1016/C2010-0-66209-2","https://www.scopus.com/inward/record.uri?eid=2-s2.0-85013710796&doi=10.1016%2fC2010-0-66209-2&partnerID=40&md5=9fa6c4eb0f9b1322a93839d9f872d4f5","Museum of Paleontology, University of Michigan, Ann Arbor, MI, United States; University of Michigan Medical Center, Ann Arbor, MI, United States; Department of Physics, Canisius College, Buffalo, NY, United States","Zelditch, M., Museum of Paleontology, University of Michigan, Ann Arbor, MI, United States; Swiderski, D., University of Michigan Medical Center, Ann Arbor, MI, United States; Sheets, H., Department of Physics, Canisius College, Buffalo, NY, United States","The first edition of Geometric Morphometrics for Biologists has been the primary resource for teaching modern geometric methods of shape analysis to biologists who have a stronger background in biology than in multivariate statistics and matrix algebra. These geometric methods are appealing to biologists who approach the study of shape from a variety of perspectives, from clinical to evolutionary, because they incorporate the geometry of organisms throughout the data analysis. The second edition of this book retains the emphasis on accessible explanations, and the copious illustrations and examples of the first, updating the treatment of both theory and practice. The second edition represents the current state-of-the-art and adds new examples and summarizes recent literature, as well as provides an overview of new software and step-by-step guidance through details of carrying out the analyses. Contains updated coverage of methods, especially for sampling complex curves and 3D forms and a new chapter on applications of geometric morphometrics to forensics Offers a reorganization of chapters to streamline learning basic concepts Presents detailed instructions for conducting analyses with freely available, easy to use software Provides numerous illustrations, including graphical presentations of important theoretical concepts and demonstrations of alternative approaches to presenting results. © 2012 Elsevier Inc. All rights reserved.",,,Book,"Final",,Scopus,2-s2.0-85013710796
"Sheets H.D.","",[No title available],2003,"IMP-Integrated Morphometrics Package",,,,"","",,256,,,,"Sheets, H.D.",[No abstract available],,,,"Final",,Scopus,2-s2.0-0041428764
"Schutkowski H.","6701906311;","Sex determination of infant and juvenile skeletons: I. Morphognostic features",1993,"American Journal of Physical Anthropology","90","2",,"199","205",,189,"10.1002/ajpa.1330900206","https://www.scopus.com/inward/record.uri?eid=2-s2.0-0027392736&doi=10.1002%2fajpa.1330900206&partnerID=40&md5=daccdbe915370868d46f9b6e9ee50b9a","Institut Für Anthropologie, Universität Göttingen, Göttingen, D-3400, Germany","Schutkowski, H., Institut Für Anthropologie, Universität Göttingen, Göttingen, D-3400, Germany","Ancient cemeteries are often characterized by a considerable number of infants and young children. Sex differences in childhood mortality, however, could rarely be studied up to now, mainly because there were only few proven traits for sexual determination of immature skeletons. Based on a historic sample of sixty‐one children of known sex and age from Spitalfields, London (37 boys, 24 girls), sexually distinctive traits in the mandible and ilium are presented for morphognostic diagnosis. Besides other features, boys typically show a more prominent chin, an anteriorly wider dental arcade, and a narrower and deeper sciatic notch than girls. Most of the traits presented in this study allow individuals between birth and five years of age to be successfully allocated to either sex in 70–90% of the cases. © 1993 Wiley‐Liss, Inc. Copyright © 1993 Wiley‐Liss, Inc., A Wiley Company","Children's skeletons; Mandible; Pelvis; Sex determination; Spitalfields","age determination; article; child; childhood mortality; female; human; human tissue; iliac bone; infant; juvenile; male; mandible; morphogenesis; sex determination; sex difference; skeleton; tooth arch; Age Factors; Child; Child, Preschool; Female; History of Medicine, Ancient; Human; Ilium; Infant; Infant, Newborn; Male; Mandible; Paleopathology; Sex Determination (Analysis)",Article,"Final",,Scopus,2-s2.0-0027392736
"Slice D.E.","",[No title available],2005,"Modern Morphometrics in Physical Anthropology",,,,"","",,188,,,,"Slice, D.E.",[No abstract available],,,,"Final",,Scopus,2-s2.0-8644228122
"Corp I.","","IBM SPSS Statistics for Windows",2011,"IBM SPSS Statistics for Windows",,,,"","",,179,,,,"Corp, I.",[No abstract available],,,,"Final",,Scopus,2-s2.0-84969325869
"Webster M., Sheets H.D.","","A practical introduction to landmark-based geometric morphometrics",2010,"The Paleontological Society Papers","16",,,"163","188",,164,,,,"Webster, M.; Sheets, H.D.",[No abstract available],,,,"Final",,Scopus,2-s2.0-79952389558
"Baker B.J., Dupras T.L., Tocheri M.W., Wheeler S.M.","7401449331;6602400982;9433025300;55181458900;","osteology of infants and children",2005,"Osteology of Infants and Children",,,,"1","178",,117,,"https://www.scopus.com/inward/record.uri?eid=2-s2.0-84896571308&partnerID=40&md5=83506db794d4e9bcf21a9a6c2ae65d3c",,"Baker, B.J.; Dupras, T.L.; Tocheri, M.W.; Wheeler, S.M.","Most archaeologists and bioarchaeologists receive little or no training in the recognition of skeletal remains of fetuses, infants, and children. Yet many research sites may contain such materials. Without a framework for identifying the bones or the excavation techniques suited to their recovery, archaeologists may often overlook subadult skeletal remains or even confuse them with animal bones. The Osteology of Infants and Children fills the need for a field and lab manual on this important topic and provides a supplemental textbook for human osteology courses. Focusing on juvenile skeletons, their recovery and identification, and siding in both field and lab settings, the volume provides basic descriptions and careful illustrations of each skeletal element at varying stages of development, along with sections on differentiation from other bones and siding tips. The book offers detailed treatment of the skull and teeth, including the cranial vault and facial bones, and examines the infracranial skeleton: vertebrae, pelvis, chest, shoulders, arms, hands, legs, and feet. A quick reference guide explains age estimation and identification templates. The illustrations are enhanced by photographs from two recent archaeology projects in Egypt, at Abydos and Dakhleh Oasis. The extensive collection of fetal and child remains from these sites provides new reference material unavailable in previous publications, making this manual an unparalleled resource in the field of physical anthropology. Copyright © 2005 by Brenda J. Baker, Tosha L. Dupras, Matthew W. Tocheri, and Sandra M. Wheeler Manufactured in the United States of America. All rights reserved.",,,Book,"Final",,Scopus,2-s2.0-84896571308
"Albanese J.","7005396001;","A metric method for sex determination using the hipbone and the femur",2003,"Journal of Forensic Sciences","48","2",,"263","273",,97,,"https://www.scopus.com/inward/record.uri?eid=2-s2.0-0037346533&partnerID=40&md5=70ebd62602696e97b82d92562338e0b5","Department of Anthropology, McMaster University, Hamilton, Ont. L8S 4L9, Canada","Albanese, J., Department of Anthropology, McMaster University, Hamilton, Ont. L8S 4L9, Canada","Since the earliest descriptions of the pubis length measurement, it has been recognized that the location of the key landmark in the acetabulum has to be estimated. Using samples from the Terry Collection (n = 324) and the Coimbra Collection (n = 232), the purpose of this research is to, first, test the reproducibility of a new alternative to the traditional measurement of the pubis, and second, to use the best measurement of the pubis along with other measurements of the hipbone and femur to develop a metric method that can be used with confidence to determine the sex of individuals of various geographic origins and time periods. In this study, it was found that, first, the alternative pubis measurement, known as the superior pubis ramus length (SPRL), can be collected more reliably with less mean intra-observer error (0.57%) than the more commonly used manner of measuring the pubis (2.7%). Second, a logistic regression sex determination method using the SPRL, along with other measurements of the hipbone and femur, has an allocation accuracy of 90% to 98.5% (depending on the model used and the manner of testing) across independent samples. Third, traditional racial categorization was irrelevant to the accuracy of the method. Fourth, measurement error greater than 2% in the measurement of the pubis can be the difference between a correct and an incorrect allocation of sex, particularly in borderline cases.","Forensic anthropology; Forensic science; Human identification; Pelvis; Sex determination; Skeletal","adult; articular cartilage; conference paper; female; forensic identification; forensic science; geographic distribution; hip; human; logistic regression analysis; major clinical study; male; measurement; physical anthropology; priority journal; reproducibility; sampling; sex determination; Anthropometry; Female; Femur; Forensic Anthropology; Humans; Logistic Models; Male; Metric System; Observer Variation; Pelvic Bones; Reproducibility of Results; Sex Characteristics",Conference Paper,"Final",,Scopus,2-s2.0-0037346533
"Weaver D.S.","57214630964;","Sex differences in the Ilia of a known sex and age sample of fetal and infant Skeletons",1980,"American Journal of Physical Anthropology","52","2",,"191","195",,94,"10.1002/ajpa.1330520205","https://www.scopus.com/inward/record.uri?eid=2-s2.0-0019190920&doi=10.1002%2fajpa.1330520205&partnerID=40&md5=63cc254e81dee968360f4a563cb36f24","Department of Anthropology, Wake Forest University, Winston-Salem, North Carolina, 27109, United States","Weaver, D.S., Department of Anthropology, Wake Forest University, Winston-Salem, North Carolina, 27109, United States","Ilia from a known sex, race, and age sample of fetal and infant skeletons from the collections of the Smithsonian Institution were evaluated for six metric and one nonmetric characters. Three indices calculated from the measurements were analyzed. The nonmetric trait was examined for fit with known sex. The three indices failed to show significant sex differences. The nonmetric trait, Auricular Surface Elevation, proved dependable (91% accurate) for the male Fetal and Six Month age groups. Copyright © 1980 Wiley‐Liss, Inc., A Wiley Company","Auricular surface elevation; Infant Ilia; Sexing","age; bone; iliac bone; methodology; normal human; normal value; sex; sex difference; Age Factors; Female; Fetus; Human; Ilium; Infant; Infant, Newborn; Male; Sex Factors; Skeleton",Article,"Final",,Scopus,2-s2.0-0019190920
"Saunders S.R.","","Subadult skeletons and growth-related studies",2000,"Biological Anthropology of the Human Skeleton",,,,"135","162",,91,,,,"Saunders, S.R.",[No abstract available],,,,"Final",,Scopus,2-s2.0-0000246466
"Gonzalez P.N., Bernal V., Perez S.I.","55799217100;55930645900;13808174600;","Geometric morphometric approach to sex estimation of human pelvis",2009,"Forensic Science International","189","1-3",,"68","74",,71,"10.1016/j.forsciint.2009.04.012","https://www.scopus.com/inward/record.uri?eid=2-s2.0-67349205835&doi=10.1016%2fj.forsciint.2009.04.012&partnerID=40&md5=25358556545ea4273b514cff0c256826","División Antropología, Facultad de Ciencias Naturales y Museo, Universidad Nacional de La Plata, Paseo del Bosque s/n, La Plata, 1900, Argentina","Gonzalez, P.N., División Antropología, Facultad de Ciencias Naturales y Museo, Universidad Nacional de La Plata, Paseo del Bosque s/n, La Plata, 1900, Argentina; Bernal, V., División Antropología, Facultad de Ciencias Naturales y Museo, Universidad Nacional de La Plata, Paseo del Bosque s/n, La Plata, 1900, Argentina; Perez, S.I., División Antropología, Facultad de Ciencias Naturales y Museo, Universidad Nacional de La Plata, Paseo del Bosque s/n, La Plata, 1900, Argentina","Sex estimation of skeletal remains is an important issue in both forensics and bioarchaeology. The chance of attaining a high level of accuracy regarding sex allocations is related to the skeletal component analyzed and the ability of the techniques employed to describe shape and size differences among the sexes. Current opinion regards the hip bone as the most reliable sex indicator because it is the most dimorphic bone, particularly in adult individuals. The aim of this study was therefore to analyze the greater sciatic notch and the ischiopubic complex morphology by employing geometric morphometric techniques, based on semilandmark and multivariate statistical methods, in order to develop a reliable and accurate technique for adult sex estimation. The sample analyzed consisted of 121 adult left hip bones randomly selected from the collection of documented skeletons housed at the Museu Antropologico de Coimbra. Morphometric analysis was based on coordinates of landmarks and semilandmarks of the ilium and ischiopubic regions that were digitized on 2D photographic images. Discriminant analysis with leave-one-out cross-validation and k-means clustering of shape and shape-size variables were used in order to classify individuals by sex. For the greater sciatic notch, average accuracy of 90.9% was achieved with both multivariate analyses based on shape variables. For the ischiopubic complex, the values obtained with shape variables were 93.4% and 90.1% for discriminant and k-means, respectively. Females were misclassified more frequently than males, especially for the ischiopubic complex. When multivariate statistical analyses were performed using shape-size variables, the percentages of correct classifications were lower than those obtained with shape variables. We conclude that the use of geometric morphometrics and multivariate statistics is a reliable method to quantify pelvic shape differences between the sexes and could be applied to discriminate between females and males. © 2009 Elsevier Ireland Ltd. All rights reserved.","Discriminant analysis; Ischiopubic complex; k-Means clustering; Sciatic notch; Semilandmarks; Sexual dimorphism","accuracy; adolescent; adult; article; controlled study; female; forensic identification; geometry; human; human tissue; iliac bone; male; morphometrics; pelvis; priority journal; quantitative analysis; reliability; sex determination; sex difference; Adolescent; Adult; Discriminant Analysis; Female; Forensic Anthropology; Humans; Image Processing, Computer-Assisted; Male; Middle Aged; Multivariate Analysis; Pelvic Bones; Photography; Principal Component Analysis; Sex Determination by Skeleton; Young Adult",Article,"Final",,Scopus,2-s2.0-67349205835
"Sutter R.C.","14044073100;","Nonmetric subadult skeletal sexing traits: I. A blind test of the accuracy of eight previously proposed methods using prehistoric known-sex mummies from Northern Chile",2003,"Journal of Forensic Sciences","48","5",,"927","935",,57,,"https://www.scopus.com/inward/record.uri?eid=2-s2.0-0042320315&partnerID=40&md5=45f856b72f8dd7857dda61622a5fc7bc","Department of Anthropology, IN Univ. - Purdue Univ. Ft. Wayne, 2101 E. Coliseum Blvd., Fort Wayne, IN, United States; Museo San Miguel de Azapa, Depto. de Arqueologia y Museologia, Universidad de Tarapacá, Arica, Chile","Sutter, R.C., Department of Anthropology, IN Univ. - Purdue Univ. Ft. Wayne, 2101 E. Coliseum Blvd., Fort Wayne, IN, United States, Museo San Miguel de Azapa, Depto. de Arqueologia y Museologia, Universidad de Tarapacá, Arica, Chile","While a number of nonmetric sex-related traits have been proposed, the accurate assignment of sex to subadult skeletal materials is generally considered problematic. Eight previously proposed nonmetric traits of the ilia and mandible have been demonstrated by other researchers to be related to the known-sex of subadults, yet there has been relatively little research attempting to evaluate the utility of these traits using independent collections of known-sex subadult skeletal remains. These eight traits include: elevation of the auricular surface, angle of the greater sciatic notch, depth of the greater sciatic notch, the ""arch criteria,"" curvature of the iliac crest, gonial eversion, mandibular protrusion, and mandibular arcade shape. The present study blindly tested these eight nonmetric traits using 85 autopsied prehistoric known-sex mummified subadult remains from northern Chile that range in age between newborn and 15 skeletal years of age. The two primary questions examined for each trait are: (1) are the different character states for each of the eight traits related to known-sex, and (2) which of the eight traits are accurate enough for use in forensic cases? These questions are examined for each trait by both sex and age class so as to uncover potential sex- and age-related strengths and weaknesses for each of the characteristics. The results indicate that all eight of the previously proposed subadult sex-related traits are indeed related to known-sex, but that there is a great deal of variation by both sex and age in terms of the strength of congruent sex-related associations. With the exception of gonial eversion, all of the traits produced statistically significant X2 values for their associations with known-sex when all subadult remains were considered. However, when all subadults are considered, only four traits demonstrated acceptable levels of accuracy for forensic applications. These traits include the arch criteria (82.3%), angle of the sciatic notch (80.7%), depth of the sciatic notch (79.0%), and mandibular arcade shape (77.6%). For subadults ranging in age from newborn to five skeletal years of age, only depth of the sciatic notch (81.5%) and the arch criteria (81.5%) approach acceptable levels of accuracy for use in forensic cases. The implications of these results are discussed and recommendations for bioarchaeological and forensic applications are made.","Bioarchaeology; Forensic anthropology; Forensic science; Human identification; Juvenile","accuracy; adolescent; age distribution; archeology; child; Chile; conference paper; female; forensic science; human; iliac bone; iliac crest; infant; major clinical study; male; mandible; newborn; paleopathology; physical anthropology; priority journal; sex determination; skeleton; Adolescent; Age Factors; Anthropometry; Child; Child, Preschool; Chile; Female; Forensic Anthropology; Humans; Infant; Infant, Newborn; Male; Mummies; Reference Values; Reproducibility of Results; Sex Characteristics",Conference Paper,"Final",,Scopus,2-s2.0-0042320315
