Authors,Author(s) ID,Title,Year,Source title,Volume,Issue,Art. No.,Page start,Page end,Page count,Cited by,DOI,Link,Affiliations,Authors with affiliations,Abstract,Author Keywords,Index Keywords,Document Type,Publication Stage,Access Type,Source,EID
"Wilson L.A.B., Ives R., Cardoso H.F.V., Humphrey L.T.","7403521601;10145089700;23394620800;12544863500;","Shape, size, and maturity trajectories of the human ilium",2015,"American Journal of Physical Anthropology","156","1",,"19","34",,26,"10.1002/ajpa.22625","https://www.scopus.com/inward/record.uri?eid=2-s2.0-84919444135&doi=10.1002%2fajpa.22625&partnerID=40&md5=01b5774b90a27d07bcdc25685eccbf26","School of Biological, Earth and Environmental Sciences, University of New South Wales, Kensington, NSW  2052, Australia; AOC Archaeology Group, St Margaret's Business Centre, Twickenham, TW1 1JS, United Kingdom; Department of Archaeology, Centre for Forensic Research, Simon Fraser University, Burnaby, BC  V5A 1S6, Canada; Department of Earth Sciences, Natural History Museum, London, SW7 5BD, United Kingdom","Wilson, L.A.B., School of Biological, Earth and Environmental Sciences, University of New South Wales, Kensington, NSW  2052, Australia; Ives, R., AOC Archaeology Group, St Margaret's Business Centre, Twickenham, TW1 1JS, United Kingdom; Cardoso, H.F.V., Department of Archaeology, Centre for Forensic Research, Simon Fraser University, Burnaby, BC  V5A 1S6, Canada; Humphrey, L.T., Department of Earth Sciences, Natural History Museum, London, SW7 5BD, United Kingdom","Morphological traits of the ilium have consistently been more successful for juvenile sex determination than have techniques applied to other skeletal elements, however relatively little is known about the ontogeny and maturation of size and shape dimorphism in the ilium. We use a geometric morphometric approach to quantitatively separate the ontogeny of size and shape of the ilium, and analyze interpopulation differences in the onset, rate and patterning of sexual dimorphism. We captured the shape of three traits for a total of 191 ilia from Lisbon (Portugal) and London (UK) samples of known age and sex (0-17 years). Our results indicate that a) there is a clear dissociation between the ontogeny of size and shape in males and females, b) the ontogeny of size and shape are each defined by nonlinear trajectories that differ between the sexes, c) there are interpopulation differences in ontogenetic shape trajectories, which point to population-specific patterning in the attainment of sexual dimorphism, and d) the rate of shape maturation and size maturation is typically higher for females than males. Male and female shape differences in the ilium are brought about by trajectory divergence. Differences in size and shape maturation between the sexes suggest that maturity may confound our ability to discriminate between the sexes by introducing variation not accounted for in age-based groupings. The accuracy of sex determination methods using the ilium may be improved by the use of different traits for particular age groups, to capture the ontogenetic development of shape in both sexes. © 2014 Wiley Periodicals, Inc.","Development; Geometric morphometrics; Growth; Juvenile sex determination; Postcranial skeleton","adolescent; Article; bone maturation; bone shape; bone size; child; controlled study; female; geometry; groups by age; human; human tissue; iliac bone; iliac crest; infant; male; morphometrics; musculoskeletal system parameters; ontogeny; Portugal; preschool child; school child; sex determination; sex difference; surface property; United Kingdom; analysis of variance; anatomy and histology; growth, development and aging; iliac bone; newborn; physical anthropology; Adolescent; Analysis of Variance; Anthropology, Physical; Child; Child, Preschool; Female; Humans; Ilium; Infant; Infant, Newborn; Male; Sex Determination by Skeleton",Article,"Final",,Scopus,2-s2.0-84919444135
"Rohlf F.J.","",[No title available],2009,"TPSUTIL: Version 1.44",,,,"","",,14,,,,"Rohlf, F.J.",[No abstract available],,,,"Final",,Scopus,2-s2.0-79955389993
"Irurita Olivares J., Alemán Aguilera I.","46861089100;57202798507;","Validation of the sex estimation method elaborated by Schutkowski in the Granada Osteological Collection of identified infant and young children: Analysis of the controversy between the different ways of analyzing and interpreting the results",2016,"International Journal of Legal Medicine","130","6",,"1623","1632",,10,"10.1007/s00414-016-1354-z","https://www.scopus.com/inward/record.uri?eid=2-s2.0-84961782295&doi=10.1007%2fs00414-016-1354-z&partnerID=40&md5=75e41b8537d105736091f21d51dbae15","Centro de Investigación. Pontificia Universidad Católica del Ecuador Sede en Esmeraldas (PUCESE), Esmeraldas, Ecuador; Laboratory of Anthropology, Department of Legal Medicine, Toxicology and Physical Anthropology, University of Granada, Granada, 18012, Spain","Irurita Olivares, J., Centro de Investigación. Pontificia Universidad Católica del Ecuador Sede en Esmeraldas (PUCESE), Esmeraldas, Ecuador; Alemán Aguilera, I., Laboratory of Anthropology, Department of Legal Medicine, Toxicology and Physical Anthropology, University of Granada, Granada, 18012, Spain","Sex estimation of juveniles in the Physical and Forensic Anthropology context is currently a task with serious difficulties because the discriminatory bone characteristics are minimal until puberty. Also, the small number of osteological collections of children available for research has made it difficult to develop effective methodologies in this regard. This study tested the characteristics of the ilium and jaw proposed by Schutkowski in 1993 for estimation of sex in subadults. The study sample consisted of 109 boys and 76 girls, ranging in age from 5 months of gestation to 6 years, from the identified osteological collection of Granada (Spain). For the analysis and interpretation of the results, we have proposed changes from previous studies because we believe they raised methodological errors relating to the calculation of probabilities of success and sex distribution in the sample. The results showed correct assignment probabilities much lower than those obtained by Schutkowski as well as by other authors. The best results were obtained with the angle and depth of the sciatic notch, with 0.73 and 0.80 probability of correct assignment respectively if the male trait was observed. The results obtained with the other criteria were too small to be valid in the context of Physical or Forensic Anthropology. From our results, we concluded that Schutkowski method should not be used in forensic context, and that the sciatic notch is the most dimorphic trait in subadults and, therefore, the most appropriate to develop more effective methods for estimating sex. © 2016, Springer-Verlag Berlin Heidelberg.","Forensic anthropology; Ilium; Infant; Jaw; Sex estimation","anatomy and histology; chi square distribution; child; female; human; iliac bone; infant; male; mandible; newborn; preschool child; procedures; sex determination; validation study; Chi-Square Distribution; Child; Child, Preschool; Female; Humans; Ilium; Infant; Infant, Newborn; Male; Mandible; Sex Determination by Skeleton",Article,"Final",,Scopus,2-s2.0-84961782295
"GarcÃ­a-Mancuso R., GonzÃ¡lez P.N.","","Reconocimeitno de rasgos dimÃ³rficos en ilion infantil mediante el uso de morfometrÃ­a geomÃ©trica",2013,"Cs Morfol","15","1",,"1","11",,3,,,,"GarcÃ­a-Mancuso, R.; GonzÃ¡lez, P.N.",[No abstract available],,,,"Final",,Scopus,2-s2.0-84991865916
"González P., Bernal V., Barrientos G.","","Estimación del dimorfismo sexual en el esqueleto pélvico y mandibular de individuos subadultos: comparación de técnicas visuales y de morfometría geométrica",2005,"Werken","6",,,"49","61",,3,,,,"González, P.; Bernal, V.; Barrientos, G.",[No abstract available],,,,"Final",,Scopus,2-s2.0-85031280105
