Authors,Author(s) ID,Title,Year,Source title,Volume,Issue,Art. No.,Page start,Page end,Page count,Cited by,DOI,EID
"Pitulko V.V., Kasparov A.K.","6507858054;7005085553;","Archaeological dogs from the Early Holocene Zhokhov site in the Eastern Siberian Arctic",2017,"Journal of Archaeological Science: Reports","13",,,"491","515",,19,"10.1016/j.jasrep.2017.04.003",2-s2.0-85018300983
"Lee E.J., Merriwether D.A., Kasparov A.K., Nikolskiy P.A., Sotnikova M.V., Yu Pavlova E., Pitulko V.V.","34971377400;6602101253;7005085553;6507572068;6602669017;57213946093;6507858054;","Ancient DNA analysis of the oldest Canid species from the Siberian Arctic and genetic contribution to the domestic dog",2015,"PLoS ONE","10","5", e0125759,"","",,10,"10.1371/journal.pone.0125759",2-s2.0-84957310703
"Goebel T., Slobodin S.B., Waters M.R.","7004650092;7801642475;57209811922;","New dates from Ushki-1, Kamchatka, confirm 13,000calBP age for earliest Paleolithic occupation",2010,"Journal of Archaeological Science","37","10",,"2640","2649",,33,"10.1016/j.jas.2010.05.024",2-s2.0-77955266209
"Leathlobhair M.N., Perri A.R., Irving-Pease E.K., Witt K.E., Linderholm A., Haile J., Lebrasseur O., Ameen C., Blick J., Boyko A.R., Brace S., Cortes Y.N., Crockford S.J., Devault A., Dimopoulos E.A., Eldridge M., Enk J., Gopalakrishnan S., Gori K., Grimes V., Guiry E., Hansen A.J., Hulme-Beaman A., Johnson J., Kitchen A., Kasparov A.K., Kwon Y.-M., Nikolskiy P.A., Lope C.P., Manin A., Martin T., Meyer M., Myers K.N., Omura M., Rouillard J.-M., Pavlova E.Y., Sciulli P., Sinding M.-H.S., Strakova A., Ivanova V.V., Widga C., Willerslev E., Pitulko V.V., Barnes I., Gilbert M.T.P., Dobney K.M., Malhi R.S., Murchison E.P., Larson G., Frantz L.A.F.","57189518908;56646131200;57200616726;56454933700;24399317900;56875784900;52563899200;57190193977;21833273400;22133571100;55068108200;57202921322;6602760445;27367812500;57189694623;57202925617;26024983200;12239105800;55777490100;23027470800;41861383400;7401928605;36627224600;55494673500;23489084200;7005085553;57201465458;6507572068;8751729000;57189524535;55541591800;57189524799;56347878700;57202924778;6603817023;7006072696;6701423231;55336658000;56346027600;55354153600;24765664800;56273625000;6507858054;35503036400;57203214424;6602595568;6603513746;7801402739;8280762100;55470973700;","The evolutionary history of dogs in the Americas",2018,"Science","361","6397",,"81","85",,18,"10.1126/science.aao4776",2-s2.0-85049611678
"Duggan A.T., Harris A.J.T., Marciniak S., Marshall I., Kuch M., Kitchen A., Renaud G., Southon J., Fuller B., Young J., Fiedel S., Golding G.B., Grimes V., Poinar H.","55589373800;57196040406;56480318200;16064515000;6701456307;23489084200;14023287300;7005895771;7102974742;57196042787;55891955900;7004093160;23027470800;7004151707;","Genetic Discontinuity between the Maritime Archaic and Beothuk Populations in Newfoundland, Canada",2017,"Current Biology","27","20",,"3149","3156.e11",,6,"10.1016/j.cub.2017.08.053",2-s2.0-85031307133
"Raghavan M., DeGiorgio M., Albrechtsen A., Moltke I., Skoglund P., Korneliussen T.S., Grønnow B., Appelt M., Gulløv H.C., Friesen T.M., Fitzhugh W., Malmström H., Rasmussen S., Olsen J., Melchior L., Fuller B.T., Fahrni S.M., Stafford T., Jr., Grimes V., Renouf M.A.P., Cybulski J., Lynnerup N., Lahr M.M., Britton K., Knecht R., Arneborg J., Metspalu M., Cornejo O.E., Malaspinas A.-S., Wang Y., Rasmussen M., Raghavan V., Hansen T.V.O., Khusnutdinova E., Pierre T., Dneprovsky K., Andreasen C., Lange H., Hayes M.G., Coltrain J., Spitsyn V.A., Götherström A., Orlando L., Kivisild T., Villems R., Crawford M.H., Nielsen F.C., Dissing J., Heinemeier J., Meldgaard M., Bustamante C., O'Rourke D.H., Jakobsson M., Gilbert M.T.P., Nielsen R., Willerslev E.","35488646800;26028770000;23032972200;24437405900;36465559000;26639439000;24450187900;56366372300;36720965800;7004560990;6602549490;8946822300;8977364800;57207820931;16316631400;7102974742;35787065000;7004919386;23027470800;6602417335;15519001800;7003342155;6603894491;36027962100;7005085911;6506677433;57205450001;6506138861;36772368200;56433179700;56681765600;56366281500;57213467043;35381528600;35810900800;56366289100;8977548000;23975905900;8776548900;8762903700;55406355000;6602916497;7006472586;55804366500;7004629464;57131499100;7201827789;6701363139;7003985450;36834995200;35228607000;7102240247;55122106300;7202762494;56008936500;56273625000;","The genetic prehistory of the New World Arctic",2014,"Science","345","6200", 1255832,"","",,155,"10.1126/science.1255832",2-s2.0-84907279761
"Rasmussen M., Li Y., Lindgreen S., Pedersen J.S., Albrechtsen A., Moltke I., Metspalu M., Metspalu E., Kivisild T., Gupta R., Bertalan M., Nielsen K., Gilbert M.T.P., Wang Y., Raghavan M., Campos P.F., Kamp H.M., Wilson A.S., Gledhill A., Tridico S., Bunce M., Lorenzen E.D., Binladen J., Guo X., Zhao J., Zhang X., Zhang H., Li Z., Chen M., Orlando L., Kristiansen K., Bak M., Tommerup N., Bendixen C., Pierre T.L., Gronnow B., Meldgaard M., Andreasen C., Fedorova S.A., Osipova L.P., Higham T.F.G., Ramsey C.B., Hansen T.V.O., Nielsen F.C., Crawford M.H., Brunak S., Sicheritz-Pont́n T., Villems R., Nielsen R., Krogh A., Wang J., Willerslev E.","56681765600;23766780600;15128650200;57195308608;23032972200;24437405900;57205450001;6603276067;55804366500;7501322334;25640766500;35285846100;7202762494;56433179700;35488646800;16244107300;35810364600;57207872343;35810151600;34267883800;55160482300;6602567974;6507545455;35810537100;57191637561;35249930300;57207482509;57199753788;56134525100;7006472586;7102589497;7103144458;7006770483;7003904148;35810900800;24450187900;36834995200;8977548000;35306925400;57203881313;7003799879;56333730200;57213467043;7201827789;57131499100;7005477388;35489239400;7004629464;56008936500;57205707402;55552724800;56273625000;","Ancient human genome sequence of an extinct Palaeo-Eskimo",2010,"Nature","463","7282",,"757","762",,450,"10.1038/nature08835",2-s2.0-76749141381
"Scheib C.L., Li H., Desai T., Link V., Kendall C., Dewar G., Griffith P.W., Mörseburg A., Johnson J.R., Potter A., Kerr S.L., Endicott P., Lindo J., Haber M., Xue Y., Tyler-Smith C., Sandhu M.S., Lorenz J.G., Randall T.D., Faltyskova Z., Pagani L., Danecek P., O’Connell T.C., Martz P., Boraas A.S., Byrd B.F., Leventhal A., Cambra R., Williamson R., Lesage L., Holguin B., Soto E.Y.-D., Rosas J., Metspalu M., Stock J.T., Manica A., Scally A., Wegmann D., Malhi R.S., Kivisild T.","57191579329;36059388200;57191750349;57189903460;57199179050;14061736300;57202391110;56688653300;55494673500;56146394600;53564096200;6506976481;55256629600;7102207183;7402270896;57204334101;7004012378;7201873662;57202390075;56505573500;49862154800;16642071000;57191074704;14045717800;55820468300;7005243326;55595554100;6603234945;7401944059;7004179905;57202395941;57202395139;57202392267;57205450001;7202121868;6603416293;25637652100;15752040200;6603513746;55804366500;","Ancient human parallel lineages within North America contributed to a coastal expansion",2018,"Science","360","6392",,"1024","1027",,24,"10.1126/science.aar6851",2-s2.0-85048178453
"Sikora M., Pitulko V.V., Sousa V.C., Allentoft M.E., Vinner L., Rasmussen S., Margaryan A., de Barros Damgaard P., de la Fuente C., Renaud G., Yang M.A., Fu Q., Dupanloup I., Giampoudakis K., Nogués-Bravo D., Rahbek C., Kroonen G., Peyrot M., McColl H., Vasilyev S.V., Veselovskaya E., Gerasimova M., Pavlova E.Y., Chasnyk V.G., Nikolskiy P.A., Gromov A.V., Khartanovich V.I., Moiseyev V., Grebenyuk P.S., Fedorchenko A.Y., Lebedintsev A.I., Slobodin S.B., Malyarchuk B.A., Martiniano R., Meldgaard M., Arppe L., Palo J.U., Sundell T., Mannermaa K., Putkonen M., Alexandersen V., Primeau C., Baimukhanov N., Malhi R.S., Sjögren K.-G., Kristiansen K., Wessman A., Sajantila A., Lahr M.M., Durbin R., Nielsen R., Meltzer D.J., Excoffier L., Willerslev E.","23670766800;6507858054;23989723700;57205536379;7801526263;8977364800;56437418300;56798502900;55324887000;14023287300;55371759100;55082636100;6602711154;56135534600;55894649400;6602128406;37005947000;36470843600;57202868790;57006456500;6505947947;57201195245;7006072696;36142717800;6507572068;7102053934;36473395600;6701863618;57191985497;57189367702;6507305098;7801642475;7004086135;56012830100;36834995200;12241162500;7004664626;55596566200;15046688600;57209037605;57213349941;55361841600;57200800942;6603513746;36829763900;8930819100;36136109500;56267974300;57208458475;7102868950;56008936500;7004705181;7004470075;56273625000;","The population history of northeastern Siberia since the Pleistocene",2019,"Nature","570","7760",,"182","188",,11,"10.1038/s41586-019-1279-z",2-s2.0-85066934053
"Flegontov P., Altınışık N.E., Changmai P., Rohland N., Mallick S., Adamski N., Bolnick D.A., Broomandkhoshbacht N., Candilio F., Culleton B.J., Flegontova O., Friesen T.M., Jeong C., Harper T.K., Keating D., Kennett D.J., Kim A.M., Lamnidis T.C., Lawson A.M., Olalde I., Oppenheimer J., Potter B.A., Raff J., Sattler R.A., Skoglund P., Stewardson K., Vajda E.J., Vasilyev S., Veselovskaya E., Hayes M.G., O’Rourke D.H., Krause J., Pinhasi R., Reich D., Schiffels S.","12770450200;57197855702;36170351400;6506138463;24339060900;57204660225;35447569100;57197745947;55468274800;56213358900;35147970000;7004560990;56326014400;57194505292;57201078176;35571732400;57209256324;57204653466;57204650917;55340878500;57197747202;13411507700;15830328300;57209426054;36465559000;35103595700;25030686600;57006456500;6505947947;8776548900;57201981611;57203088508;10041187600;7102313000;54685190500;","Palaeo-Eskimo genetic ancestry and the peopling of Chukotka and North America",2019,"Nature","570","7760",,"236","240",,6,"10.1038/s41586-019-1251-y",2-s2.0-85067075462
"Perri A., Widga C., Lawler D., Martin T., Loebel T.","",[No title available],2018,"New Evidence of the Earliest Domestic Dogs in the Americas",,,,"","",,1,,2-s2.0-85077875565
"Morey D.F., Aaris-Sørensen K.","6602985141;6507185122;","Paleoeskimo dogs of the Eastern Arctic",2002,"Arctic","55","1",,"44","56",,30,"10.14430/arctic689",2-s2.0-0036093230
"Howse L.","6504589356;","Hunting Technologies and Archaeofaunas: Societal Differences Between Hunter-Gatherers of the Eastern Arctic",2019,"Journal of Archaeological Method and Theory","26","1",,"88","111",,1,"10.1007/s10816-018-9366-2",2-s2.0-85041924104
"McGhee R.","","When and why did the Inuit move to the eastern Arctic?",2009,"The Northern World AD 900-1400",,,,"155","163",,28,,2-s2.0-79959996090
"Friesen T.M., Arnold C.D.","7004560990;7203014075;","The timing of the thule migration: New dates from the Western Canadian Arctic",2008,"American Antiquity","73","3",,"527","538",,69,"10.1017/S0002731600046850",2-s2.0-50049125060
"Mathiassen T.","","Archaeology of the Central Eskimos",1927,"Report of the Fifth Thule Expedition","4","2",,"1921","1924",,62,,2-s2.0-0344903039
"McGhee R.","","Ancient People of the Arctic",1996,"Ancient People of the Arctic",,,,"","",,179,,2-s2.0-0003598997
"Gulløv H.C.","","From Middle Ages to colonial times: Archaeological and ethnohistorical studies of the Thule culture in south west Greenland 1300-1800 AD. Meddelelser om Grønland",1997,"From Middle Ages to Colonial Times: Archaeological and Ethnohistorical Studies of the Thule Culture in South West Greenland 1300-1800 AD",,,,"","",,32,,2-s2.0-4243373316
"Pitul'ko V.V., Kasparov A.K.","6507858054;7005085553;","Ancient arctic hunters: Material culture and survival strategy",1996,"Arctic Anthropology","33","1",,"1","36",,29,,2-s2.0-0030456136
"Lévesque F.","","Threatening the fantasy of an Arctic welfare state",2018,"Dogs in the North",,,,"172","190",,1,,2-s2.0-85077868413
"Sonne C., Langebæk R., Dietz R., Andersen-Ranberg E., Houser G., Hansen A.J., Sinding M.-H.S., Olsen M.T., Egevang C., Gilbert M.T.P., Meldgaard M.","8759440300;6507448302;7203003549;57190392203;57209453087;7401928605;55336658000;55351754300;6507212061;57203214424;36834995200;","Greenland sled dogs at risk of extinction",2018,"Science","360","6393",,"1080","",,2,"10.1126/science.aat9578",2-s2.0-85048574612
"Brown S.K., Darwent C.M., Wictum E.J., Sacks B.N.","7501416848;6503886981;6506312266;7004432277;","Using multiple markers to elucidate the ancient, historical and modern relationships among North American Arctic dog breeds",2015,"Heredity","115","6",,"488","495",,11,"10.1038/hdy.2015.49",2-s2.0-84947045788
"Brown S.K., Darwent C.M., Sacks B.N.","7501416848;6503886981;7004432277;","Ancient DNA evidence for genetic continuity in arctic dogs",2013,"Journal of Archaeological Science","40","2",,"1279","1288",,39,"10.1016/j.jas.2012.09.010",2-s2.0-84873839807
"MacRury I.K.","",[No title available],1991,"The Inuit Dog: Its Provenance, Environment and History",,,,"","",,5,,2-s2.0-84903290830
"Webster M., Sheets H.D.","","A practical introduction to landmark-based geometric morphometrics",2010,"The Paleontological Society Papers","16",,,"163","188",,163,,2-s2.0-79952389558
"Thalmann O., Shapiro B., Cui P., Schuenemann V.J., Sawyer S.K., Greenfield D.L., Germonpré M.B., Sablin M.V., López-Giráldez F., Domingo-Roura X., Napierala H., Uerpmann H.-P., Loponte D.M., Acosta A.A., Giemsch L., Schmitz R.W., Worthington B., Buikstra J.E., Druzhkova A., Graphodatsky A.S., Ovodov N.D., Wahlberg N., Freedman A.H., Schweizer R.M., Koepfli K.-P., Leonard J.A., Meyer M., Krause J., Pääbo S., Green R.E., Wayne R.K.","55931417300;7402300615;55929925500;20735667400;54881795300;55930193600;6602438625;6507924182;8730232400;6602592837;37056104000;14326382600;36782598600;42260905400;55486652300;35238708800;55930904800;6701752370;49561130900;7003878913;14623183200;6602565669;57202414139;26024496400;6506265169;7402283113;35311551900;8765526800;7006151134;36023707900;7103101948;","Complete mitochondrial genomes of ancient canids suggest a European origin of domestic dogs",2013,"Science","342","6160",,"871","874",,265,"10.1126/science.1243650",2-s2.0-84887783184
"Zelditch M.L., Swiderski D.L., Sheets H.D., Fink W.L.","","Morphometrics and systematics",2004,"Geometric Morphometrics for Biologists",,,,"363","381",,6,,2-s2.0-77956690482
"Evin A., Cucchi T., Cardini A., Strand Vidarsdottir U., Larson G., Dobney K.","23977570900;6506822509;21933368100;55349385000;8280762100;6602595568;","The long and winding road: Identifying pig domestication through molar size and shape",2013,"Journal of Archaeological Science","40","1",,"735","743",,87,"10.1016/j.jas.2012.08.005",2-s2.0-84867907430
"Pang J.-F., Kluetsch C., Zou X.-J., Zhang A.-B., Luo L.-Y., Angleby H., Ardalan A., Ekström C., Sköllermo A., Lundeberg J., Matsumura S., Leitner T., Zhang Y.-P., Savolainen P.","7201734669;55665807400;9036324600;14070950700;55452564500;8960139400;16244116500;20634064200;10143797700;7004756744;35741011900;7004559956;55881841300;35263300600;","MtDNA data indicate a single origin for dogs south of yangtze river, less than 16,300 years ago, from numerous wolves",2009,"Molecular Biology and Evolution","26","12",,"2849","2864",,242,"10.1093/molbev/msp195",2-s2.0-70450227389
"Tackney J., Jensen A.M., Kisielinski C., O'Rourke D.H.","36835587800;7403021171;57205361963;7102240247;","Molecular analysis of an ancient Thule population at Nuvuk, Point Barrow, Alaska",2019,"American Journal of Physical Anthropology","168","2",,"303","317",,4,"10.1002/ajpa.23746",2-s2.0-85059746323
"Raghavan M., Steinrücken M., Harris K., Schiffels S., Rasmussen S., DeGiorgio M., Albrechtsen A., Valdiosera C., Ávila-Arcos M.C., Malaspinas A.-S., Eriksson A., Moltke I., Metspalu M., Homburger J.R., Wall J., Cornejo O.E., Moreno-Mayar J.V., Korneliussen T.S., Pierre T., Rasmussen M., Campos P.F., De Barros Damgaard P., Allentoft M.E., Lindo J., Metspalu E., Rodríguez-Varela R., Mansilla J., Henrickson C., Seguin-Orlando A., Malmstöm H., Stafford T., Jr., Shringarpure S.S., Moreno-Estrada A., Karmin M., Tambets K., Bergström A., Xue Y., Warmuth V., Friend A.D., Singarayer J., Valdes P., Balloux F., Leboreiro I., Vera J.L., Rangel-Villalobos H., Pettener D., Luiselli D., Davis L.G., Heyer E., Zollikofer C.P.E., Ponce De León M.S., Smith C.I., Grimes V., Pike K.-A., Deal M., Fuller B.T., Arriaza B., Standen V., Luz M.F., Ricaut F., Guidon N., Osipova L., Voevoda M.I., Posukh O.L., Balanovsky O., Lavryashina M., Bogunov Y., Khusnutdinova E., Gubina M., Balanovska E., Fedorova S., Litvinov S., Malyarchuk B., Derenko M., Mosher M.J., Archer D., Cybulski J., Petzelt B., Mitchell J., Worl R., Norman P.J., Parham P., Kemp B.M., Kivisild T., Tyler-Smith C., Sandhu M.S., Crawford M., Villems R., Smith D.G., Waters M.R., Goebel T., Johnson J.R., Malhi R.S., Jakobsson M., Meltzer D.J., Manica A., Durbin R., Bustamante C.D., Song Y.S., Nielsen R., Willerslev E.","35488646800;37108633100;26326850200;54685190500;8977364800;26028770000;23032972200;15623754200;49460994600;36772368200;8624767400;24437405900;57205450001;56584406900;7201352010;6506138861;55195757500;26639439000;35810900800;56681765600;16244107300;56798502900;57205536379;55256629600;6603276067;56798542300;6603363962;54782626600;55266529300;56798597600;7004919386;24448310600;23480508500;8937652000;8790150900;55498277900;7402270896;37068299800;57203048291;7801490077;56033135100;6701693410;11141346500;56797626500;8100115300;6701660397;6602928572;7403144732;56250782500;7006560849;7004048915;7501659689;23027470800;57206456110;7003838608;7102974742;6602846124;6602356440;56797896400;6603261067;6603124639;57203881313;57195959148;6603671828;57215688518;8655112700;12784538100;35381528600;23970506900;57205450032;35306925400;26654389500;7004086135;7003956145;9436695700;57065813300;15519001800;55782876300;56797163300;16064820000;7201826831;35392381800;7202003305;55804366500;57204334101;7004012378;57131499100;7004629464;57202909938;57209811922;7004650092;55494673500;6603513746;55122106300;7004705181;6603416293;7102868950;35228607000;35231093900;56008936500;56273625000;","Genomic evidence for the Pleistocene and recent population history of Native Americans",2015,"Science","349","6250", aab3884,"","",,179,"10.1126/science.aab3884",2-s2.0-84939864401
"Hjortlund S.","","Om de smitsomme Hundesygdomme i Nordgrønland og deres Bekæmpelse",1907,"Meddelelser Fra Direktoratet for Den Kongelige Grønlandske.","1907",,,"57","81",,1,,2-s2.0-85077908742
"Andersen D.B.","","The Use of Dog Teams and the Use of Subsistence-Caught Fish for Feeding Sled Dogs in the Yukon River Drainage, Alaska",1992,"The Use of Dog Teams and the Use of Subsistence-Caught Fish for Feeding Sled Dogs in the Yukon River Drainage",,,,"","",,9,,2-s2.0-84910119541
"Park R.W.","","Dog remains from Devon Island, N.W.T.: Archaeological and osteological evidence for domestic dog use in the Thule culture",1987,"Arctic","40","3",,"184","190",,17,,2-s2.0-0006066262
"Lykke L.P.","",[No title available],2017,"Arctic Nomads",,,,"","",,1,,2-s2.0-85077891501
"Masson-Maclean E., McManus-Fry E., Britton K.","","The archaeology of dogs at the precontact Yup'ik site of Nunalleq, Western Alaska",2019,"Beyond Domestication: Archaeological Investigations into the Human-canine Connection",,,,"","",,1,,2-s2.0-85077864342
"Issenman B.K.","","Sinews of Survival: The Living Legacy of Inuit Clothing",1997,"Sinews of Survival: The Living Legacy of Inuit Clothing",,,,"","",,41,,2-s2.0-0007102921
"McManus-Fry E.","","Pre-contact Ecology, Subsistence, and Diet on the Yukon Kuskokwim Delta: An Integrated Ecosystem Approach to Pre-contact Arctic Lifeways Using Zooarchaeological Analysis and Stable Isotope Techniques",2015,"Pre-contact Ecology, Subsistence and Diet on the Yukon-Kuskokwim Delta: An Integrated Ecosystem Approach",,,,"","",,5,,2-s2.0-85042825922
"Ledger P.M., Forbes V., Masson-Maclean E., Hillerdal C., Hamilton W.D., McManus-Fry E., Jorge A., Britton K., Knecht R.A.","55536785300;55841505500;57192264654;55711193700;25626279800;57188993640;36872803400;36027962100;7005085911;","THREE GENERATIONS under ONE ROOF? Bayesian MODELING of RADIOCARBON DATA from NUNALLEQ, YUKON-KUSKOKWIM DELTA, Alaska",2018,"American Antiquity","83","3",,"505","524",,6,"10.1017/aaq.2018.14",2-s2.0-85048989921
"McManus-Fry E., Knecht R., Dobney K., Richards M.P., Britton K.","57188993640;7005085911;6602595568;55953686600;36027962100;","Dog-human dietary relationships in Yup'ik western Alaska: The stable isotope and zooarchaeological evidence from pre-contact Nunalleq",2018,"Journal of Archaeological Science: Reports","17",,,"964","972",,15,"10.1016/j.jasrep.2016.04.007",2-s2.0-84964596859
"Frobisher S.M.","","The second voyage of Master Martin Frobisher",0000,"VOYAGES: VOL V (EVERYMAN'S LIBRARY NO 338)",,,,"","",,1,,2-s2.0-85077842805
"Whitbourne R.","",[No title available],1620,"A Discourse and Discovery of Newfoundland with Many Reasons to Proove How Worthy and Beneficiall a Plantation May There After a Far Better Manner Than Now It Is",,,,"","",,6,,2-s2.0-77950084780
"Allen G.M.","","Dogs of the American aborigines",1920,"Bulletin of the Museum of Comparative Zoology","63","9",,"431","517",,49,,2-s2.0-0006017203
"Degerbøl M., Freuchen P.","",[No title available],1935,"Mammals. Report of the Fifth Thule Expedition 1921-24. The Danish Expedition to Arctic North America in Charge of Knud Rasmussen","2",,,"","",,4,,2-s2.0-84914468569
"Hindrikson M., Männil P., Ozolins J., Krzywinski A., Saarma U.","36699711700;15760153200;57215130833;57188752832;6508125252;","Bucking the Trend in Wolf-Dog Hybridization: First Evidence from Europe of Hybridization between Female Dogs and Male Wolves",2012,"PLoS ONE","7","10", e46465,"","",,55,"10.1371/journal.pone.0046465",2-s2.0-84867034288
"Coppinger R., Coppinger L.","",[No title available],2001,"Dogs: A New Understanding of Canine Origin, Behavior and Evolution",,,,"","",,349,,2-s2.0-0003771688
"Vilà C., Wayne R.K.","7005843645;7103101948;","Hybridization between wolves and dogs",1999,"Conservation Biology","13","1",,"195","198",,97,"10.1046/j.1523-1739.1999.97425.x",2-s2.0-0033008695
"Wang G.-D., Xie H.-B., Peng M.-S., Irwin D., Zhang Y.-P.","56331494000;36861734000;36167089800;35237354400;55881841300;","Domestication genomics: Evidence from animals",2014,"Annual Review of Animal Biosciences","2",,,"65","84",,47,"10.1146/annurev-animal-022513-114129",2-s2.0-84903278682
"Frantz L.A.F., Larson G.","","A genetic perspective on the domestication continuum",2018,"Hybrid Communities",,,,"41","56",,1,,2-s2.0-85077886625
"Gilbert M.T.P., Bandelt H.-J., Hofreiter M., Barnes I.","7202762494;7003956536;6701450663;35503036400;","Assessing ancient DNA studies",2005,"Trends in Ecology and Evolution","20","10",,"541","544",,394,"10.1016/j.tree.2005.07.005",2-s2.0-24944589560
"Ersmark E.","",[No title available],2015,"Population Demography and Genetic Diversity in the Pleistocene Cave Lion",,,,"","",,1,,2-s2.0-85077874771
"Dabney J., Knapp M., Glocke I., Gansauge M.-T., Weihmann A., Nickel B., Valdiosera C., García N., Pääbo S., Arsuaga J.-L., Meyer M.","55008605700;57213928159;55752006600;55345961100;23471001600;7005709519;15623754200;35333939400;7006151134;6506247114;35311551900;","Complete mitochondrial genome sequence of a Middle Pleistocene cave bear reconstructed from ultrashort DNA fragments",2013,"Proceedings of the National Academy of Sciences of the United States of America","110","39",,"15758","15763",,393,"10.1073/pnas.1314445110",2-s2.0-84884624229
"Li H.","","Aligning sequence reads, clone sequences and assembly contigs with BWA-MEM",2013,"Aligning Sequence Reads, Clone Sequences and Assembly Contigs with BWA-MEM",,,,"","",,1992,,2-s2.0-84890081976
"Lindblad-Toh K., Wade C.M., Mikkelsen T.S., Karlsson E.K., Jaffe D.B., Kamal M., Clamp M., Chang J.L., Kulbokas III E.J., Zody M.C., Mauceli E., Xie X., Breen M., Wayne R.K., Ostrander E.A., Ponting C.P., Galibert F., Smith D.R., DeJong P.J., Kirkness E., Alvarez P., Biagi T., Brockman W., Butler J., Chin C.-W., Cook A., Cuff J., Daly M.J., DeCaprio D., Gnerre S., Grabherr M., Kellis M., Kleber M., Bardeleben C., Goodstadt L., Heger A., Hitte C., Kim L., Koepfli K.-P., Parker H.G., Pollinger J.P., Searle S.M.J., Sutter N.B., Thomas R., Webber C., Lander E.S.","6603065092;7102531600;9271577100;9839207000;35336888100;23102933700;57204972891;7601548816;6506292758;6506919380;6602549898;8311948600;7103338353;7103101948;35377190600;7004959561;57201818917;8328796200;6701728835;7005488078;57214478643;9743060700;56696012000;7403925252;7202170783;9744355300;6701462408;7201456226;8773007600;6506778444;9744255400;6602385400;57203196174;6602755357;6603071864;7005675729;6603672763;7202158985;6506265169;9741915500;34571657100;57203609197;6507734790;9841779300;9842790000;16151582900;","Genome sequence, comparative analysis and haplotype structure of the domestic dog",2005,"Nature","438","7069",,"803","819",,1546,"10.1038/nature04338",2-s2.0-28644447707
"Stamatakis A.","6602125055;","RAxML-VI-HPC: Maximum likelihood-based phylogenetic analyses with thousands of taxa and mixed models",2006,"Bioinformatics","22","21",,"2688","2690",,11052,"10.1093/bioinformatics/btl446",2-s2.0-33750403801
"Stamatakis A.","6602125055;","RAxML version 8: A tool for phylogenetic analysis and post-analysis of large phylogenies",2014,"Bioinformatics","30","9",,"1312","1313",,9587,"10.1093/bioinformatics/btu033",2-s2.0-84899553363
"Bouckaert R., Heled J., Kühnert D., Vaughan T., Wu C.-H., Xie D., Suchard M.A., Rambaut A., Drummond A.J.","6603109318;25724258200;54789048000;16640811300;57208448415;57201928238;6603887291;7004230842;26643297100;","BEAST 2: A Software Platform for Bayesian Evolutionary Analysis",2014,"PLoS Computational Biology","10","4", e1003537,"","",,2281,"10.1371/journal.pcbi.1003537",2-s2.0-84901305512
"Rohlf F.J.","7003281107;","The tps series of software",2015,"Hystrix","26","1",,"1","4",,216,"10.4404/hystrix-26.1-11264",2-s2.0-84936938125
