Authors,Author(s) ID,Title,Year,Source title,Volume,Issue,Art. No.,Page start,Page end,Page count,Cited by,DOI,EID
"Evin A., Souter T., Hulme-Beaman A., Ameen C., Allen R., Viacava P., Larson G., Cucchi T., Dobney K.","23977570900;36549247200;36627224600;57190193977;55356426100;57190186640;8280762100;6506822509;6602595568;","The use of close-range photogrammetry in zooarchaeology: Creating accurate 3D models of wolf crania to study dog domestication",2016,"Journal of Archaeological Science: Reports","9",,,"87","93",,29,"10.1016/j.jasrep.2016.06.028",2-s2.0-84978225025
"Lebrun R.","",[No title available],2018,"Morphodig, an Open-Source 3D Freeware Dedicated to Biology",,,,"","",,3,,2-s2.0-85058657272
"Rohlf F.J., Slice D.","7003281107;6603334019;","Extensions of the procrustes method for the optimal superimposition of landmarks",1990,"Systematic Zoology","39","1",,"40","59",,2389,"10.2307/2992207",2-s2.0-84860428591
"Adams D.C., Rohlf F.J., Slice D.E.","","A field comes of age: Geometric morphometrics in the 21st century",2013,"It J Mamm.","24",,,"","",,2,,2-s2.0-85019891982
[No author name available],[No author id available],"R: A language and environment for statistical computing",2015,"R: A Language and Environment for Statistical Computing",,,,"","",,25329,,2-s2.0-84964927929
"Schlager S.","48662907600;","Morpho and Rvcg - Shape Analysis in R: R-Packages for Geometric Morphometrics, Shape Analysis and Surface Manipulations",2017,"Statistical Shape and Deformation Analysis: Methods, Implementation and Applications",,,,"217","256",,112,"10.1016/B978-0-12-810493-4.00011-0",2-s2.0-85032284776
