Authors,Author(s) ID,Title,Year,Source title,Volume,Issue,Art. No.,Page start,Page end,Page count,Cited by,DOI,Link,Affiliations,Authors with affiliations,Abstract,Author Keywords,Index Keywords,Document Type,Publication Stage,Access Type,Source,EID
"Chapman T., Lefevre P., Semal P., Moiseev F., Sholukha V., Louryan S., Rooze M., Van Sint Jan S.","36606040200;35566279500;24598131700;8407791500;7801674261;26643063100;7005226745;6602848511;","Sex determination using the probabilistic sex diagnosis (DSP: Diagnose sexuelle probabiliste) tool in a virtual environment",2014,"Forensic Science International","234",,,"189.e1","189.e8",,19,"10.1016/j.forsciint.2013.10.037","https://www.scopus.com/inward/record.uri?eid=2-s2.0-84891346784&doi=10.1016%2fj.forsciint.2013.10.037&partnerID=40&md5=8412fb25185eeb882c1f6aadee1f9a8c","Laboratory of Anatomy, Biomechanics and Organogenesis (LABO), Faculty of Medicine, Université Libre de Bruxelles (ULB), Erasme Campus, Building G2.4.101, 808 Lennik Street, 1070 Brussels, Belgium; Laboratory of Anthropology and Prehistory, Royal Belgian Institute of Natural Sciences, 29 Rue Vautier, 1000 Brussels, Belgium; Department of Radiology, ULB Erasme Hospital, Belgium","Chapman, T., Laboratory of Anatomy, Biomechanics and Organogenesis (LABO), Faculty of Medicine, Université Libre de Bruxelles (ULB), Erasme Campus, Building G2.4.101, 808 Lennik Street, 1070 Brussels, Belgium, Laboratory of Anthropology and Prehistory, Royal Belgian Institute of Natural Sciences, 29 Rue Vautier, 1000 Brussels, Belgium; Lefevre, P., Laboratory of Anatomy, Biomechanics and Organogenesis (LABO), Faculty of Medicine, Université Libre de Bruxelles (ULB), Erasme Campus, Building G2.4.101, 808 Lennik Street, 1070 Brussels, Belgium; Semal, P., Laboratory of Anthropology and Prehistory, Royal Belgian Institute of Natural Sciences, 29 Rue Vautier, 1000 Brussels, Belgium; Moiseev, F., Laboratory of Anatomy, Biomechanics and Organogenesis (LABO), Faculty of Medicine, Université Libre de Bruxelles (ULB), Erasme Campus, Building G2.4.101, 808 Lennik Street, 1070 Brussels, Belgium; Sholukha, V., Laboratory of Anatomy, Biomechanics and Organogenesis (LABO), Faculty of Medicine, Université Libre de Bruxelles (ULB), Erasme Campus, Building G2.4.101, 808 Lennik Street, 1070 Brussels, Belgium; Louryan, S., Laboratory of Anatomy, Biomechanics and Organogenesis (LABO), Faculty of Medicine, Université Libre de Bruxelles (ULB), Erasme Campus, Building G2.4.101, 808 Lennik Street, 1070 Brussels, Belgium, Department of Radiology, ULB Erasme Hospital, Belgium; Rooze, M., Laboratory of Anatomy, Biomechanics and Organogenesis (LABO), Faculty of Medicine, Université Libre de Bruxelles (ULB), Erasme Campus, Building G2.4.101, 808 Lennik Street, 1070 Brussels, Belgium; Van Sint Jan, S., Laboratory of Anatomy, Biomechanics and Organogenesis (LABO), Faculty of Medicine, Université Libre de Bruxelles (ULB), Erasme Campus, Building G2.4.101, 808 Lennik Street, 1070 Brussels, Belgium","The hip bone is one of the most reliable indicators of sex in the human body due to the fact it is the most dimorphic bone. Probabilistic Sex Diagnosis (DSP: Diagnose Sexuelle Probabiliste) developed by Murail et al., in 2005, is a sex determination method based on a worldwide hip bone metrical database. Sex is determined by comparing specific measurements taken from each specimen using sliding callipers and computing the probability of specimens being female or male. In forensic science it is sometimes not possible to sex a body due to corpse decay or injury. Skeletalization and dissection of a body is a laborious process and desecrates the body. There were two aims to this study. The first aim was to examine the accuracy of the DSP method in comparison with a current visual sexing method on sex determination. A further aim was to see if it was possible to virtually utilise the DSP method on both the hip bone and the pelvic girdle in order to utilise this method for forensic sciences.For the first part of the study, forty-nine dry hip bones of unknown sex were obtained from the Body Donation Programme of the Université Libre de Bruxelles (ULB). A comparison was made between DSP analysis and visual sexing on dry bone by two researchers. CT scans of bones were then analysed to obtain three-dimensional (3D) virtual models and the method of DSP was analysed virtually by importing the models into a customised software programme called lhpFusionBox which was developed at ULB. The software enables DSP distances to be measured via virtually-palpated bony landmarks. There was found to be 100% agreement of sex between the manual and virtual DSP method. The second part of the study aimed to further validate the method by analysing thirty-nine supplementary pelvic girdles of known sex blind. There was found to be a 100% accuracy rate further demonstrating that the virtual DSP method is robust. Statistically significant differences were found in the identification of sex between researchers in the visual sexing method although both researchers identified the same sex in all cases in the manual and virtual DSP methods for both the hip bones and pelvic girdles. © 2013 Elsevier Ireland Ltd.","Forensic; LhpFusionBox; Pelvis; Sex determination; Sexing","article; computer assisted tomography; controlled study; female; forensic science; gender identity; human; image analysis; intermethod comparison; linear system; male; measurement accuracy; pelvic girdle; pelvis; priority journal; sex determination; three dimensional imaging; validation study; virtual reality; Forensic; LhpFusionBox; Pelvis; Sex determination; Sexing; Adult; Female; Forensic Anthropology; Humans; Image Processing, Computer-Assisted; Imaging, Three-Dimensional; Male; Pelvic Bones; Sex Determination by Skeleton; Software; Tomography, X-Ray Computed",Article,"Final",,Scopus,2-s2.0-84891346784
"Velemínská J., Krajíček V., Dupej J., Goméz-Valdés J.A., Velemínský P., Šefčáková A., Pelikán J., Sánchez-Mejorada G., Brůžek J.","6505794954;37665286000;24079751800;16063951800;8577075400;6506943676;36730016100;55989730100;6602595244;","Technical Note: Geometric morphometrics and sexual dimorphism of the greater sciatic notch in adults from two skeletal collections: The accuracy and reliability of sex classification",2013,"American Journal of Physical Anthropology","152","4",,"558","565",,19,"10.1002/ajpa.22373","https://www.scopus.com/inward/record.uri?eid=2-s2.0-84887477254&doi=10.1002%2fajpa.22373&partnerID=40&md5=d0848662be6057d8168d7f2158c213b7","Department of Anthropology and Human Genetics, Faculty of Science, Charles University in Prague, Viničná 7, 12844 Prague 2, Czech Republic; Department of Software and Computer Science Education, Faculty of Mathematics and Physics, Charles University in Prague, Prague 11800, Czech Republic; Departamento de Anatomía, Facultad de Medicina, Ciudad Universitaria, Coyoacán, Distrito Federal 04510, Mexico; Department of Anthropology, National Museum, Prague 11579, Czech Republic; Department of Anthropology, Slovak National Museum, Bratislava 81006, Slovakia; A3P-PACEA, UMR 5199 CNRS, University Bordeaux i, Talence 33405, France","Velemínská, J., Department of Anthropology and Human Genetics, Faculty of Science, Charles University in Prague, Viničná 7, 12844 Prague 2, Czech Republic; Krajíček, V., Department of Anthropology and Human Genetics, Faculty of Science, Charles University in Prague, Viničná 7, 12844 Prague 2, Czech Republic, Department of Software and Computer Science Education, Faculty of Mathematics and Physics, Charles University in Prague, Prague 11800, Czech Republic; Dupej, J., Department of Software and Computer Science Education, Faculty of Mathematics and Physics, Charles University in Prague, Prague 11800, Czech Republic; Goméz-Valdés, J.A., Departamento de Anatomía, Facultad de Medicina, Ciudad Universitaria, Coyoacán, Distrito Federal 04510, Mexico; Velemínský, P., Department of Anthropology, National Museum, Prague 11579, Czech Republic; Šefčáková, A., Department of Anthropology, Slovak National Museum, Bratislava 81006, Slovakia; Pelikán, J., Department of Software and Computer Science Education, Faculty of Mathematics and Physics, Charles University in Prague, Prague 11800, Czech Republic; Sánchez-Mejorada, G., Departamento de Anatomía, Facultad de Medicina, Ciudad Universitaria, Coyoacán, Distrito Federal 04510, Mexico; Brůžek, J., Department of Anthropology and Human Genetics, Faculty of Science, Charles University in Prague, Viničná 7, 12844 Prague 2, Czech Republic, A3P-PACEA, UMR 5199 CNRS, University Bordeaux i, Talence 33405, France","The greater sciatic notch (GSN) is one of the most important and frequently used characteristics for determining the sex of skeletons, but objective assessment of this characteristic is not without its difficulties. We tested the robustness of GSN sex classification on the basis of geometric morphometrics (GM) and support vector machines (SVM), using two different population samples. Using photographs, the shape of the GSN in 229 samples from two assemblages (documented collections of a Euroamerican population from the Maxwell Museum, University of New Mexico, and a Hispanic population from Universidad Nacional Autõnoma de México, Mexico City) was segmented automatically and evaluated using six curve representations. The optimal dimensionality for each representation was determined by finding the best sex classification. The classification accuracy of the six curve representations in our study was similar but the highest and concurrently homologous cross-validated accuracy of 92% was achieved for a pooled sample using Fourier coefficient and Legendre polynomial methods. The success rate of our classification was influenced by the number of semilandmarks or coefficients and was only slightly affected by GSN marginal point positions. The intrapopulation variability of the female GSN shape was significantly lower compared with the male variability, possibly as a consequence of the intense selection pressure associated with reproduction. Males were misclassified more often than females. Our results show that by using a suitable GSN curve representation, a GM approach, and SVM analysis, it is possible to obtain a robust separation between the sexes that is stable for a multipopulation sample. Am J Phys Anthropol 152:558-565, 2013. © 2013 Wiley Periodicals, Inc. Copyright © 2013 Wiley Periodicals, Inc.","curve segmentation; hip bone; sex assessment; shape analysis; SVM learning model","accuracy; adult; article; automation; female; geometry; greater sciatic notch; Hispanic; human; male; morphometrics; pelvic girdle; photography; reliability; reproduction; sex determination; sex difference; support vector machine; United States; curve segmentation; hip bone; sex assessment; shape analysis; SVM learning model; Anthropology, Physical; Female; Humans; Male; Pelvic Bones; Principal Component Analysis; Reproducibility of Results; Sex Characteristics; Sex Determination by Skeleton; Support Vector Machines",Article,"Final",,Scopus,2-s2.0-84887477254
"González P.N., Bernal V., Ivan Perez S., Barrientos G.","55799217100;55930645900;21740866600;16634555400;","Analysis of dimorphic structures of the human pelvis: its implications for sex estimation in samples without reference collections",2007,"Journal of Archaeological Science","34","10",,"1720","1730",,19,"10.1016/j.jas.2006.12.013","https://www.scopus.com/inward/record.uri?eid=2-s2.0-34548676380&doi=10.1016%2fj.jas.2006.12.013&partnerID=40&md5=38ee77900e9998b93ccf0d2a495a7477","CONICET, División Antropología, Facultad de Ciencias Naturales y Museo, Universidad Nacional de La Plata, Paseo del Bosque s/n, 1900 La Plata, Argentina; CONICET, Instituto Nacional de Antropología y Pensamiento Latinoamericano, Universidad Nacional de La Plata, Argentina","González, P.N., CONICET, División Antropología, Facultad de Ciencias Naturales y Museo, Universidad Nacional de La Plata, Paseo del Bosque s/n, 1900 La Plata, Argentina; Bernal, V., CONICET, División Antropología, Facultad de Ciencias Naturales y Museo, Universidad Nacional de La Plata, Paseo del Bosque s/n, 1900 La Plata, Argentina; Ivan Perez, S., CONICET, División Antropología, Facultad de Ciencias Naturales y Museo, Universidad Nacional de La Plata, Paseo del Bosque s/n, 1900 La Plata, Argentina; Barrientos, G., CONICET, Instituto Nacional de Antropología y Pensamiento Latinoamericano, Universidad Nacional de La Plata, Argentina","This work deals with the analysis of pelvic sexual dimorphism in skeletal samples of human prehistoric populations for which adequate reference collections of known sex are not available. We use geometric morphometric techniques based on semilandmarks in order to quantify shape variation of the greater sciatic notch and ischiopubic region. Firstly, intra- and interobserver error associated with the placement of point coordinates in geometric morphometric analyses were evaluated through intraclass correlation coefficient and Kappa index. Our results indicate that such techniques, in contrast to morphoscopic analysis, allow quantification and objective description of sexual dimorphism in pelvic traits, as well as, performing repeated analyses of numerous individuals with no previous observer experience required. Secondly, relative warp analyses calculated based on semilandmarks were used to describe sexual dimorphism pattern of the ischiopubic region and the greater sciatic notch of two unknown sex Amerindian samples from Argentina, and k-means clustering analysis was applied to detect two groups within each sample. One sample corresponds to hunter-gatherers from South Argentina (n = 29), whereas the other comprises farmers from Northwest Argentina (n = 30). The results obtained suggest that: (a) the first relative warps axis obtained for both structures summarizes shape changes due to sexual dimorphism; (b) the individuals grouped into clusters can be assigned as female or male based on their shape; and (c) sexual dimorphism is not equally expressed in both archaeological samples. These findings support the hypothesis that patterns of pelvic sexual dimorphism vary among human populations and thus, criteria for sexing are population-specific. © 2006 Elsevier Ltd. All rights reserved.","Geometric morphometrics; Ischiopubic region; Sciatic notch; Unknown sex samples","anatomy; archaeological evidence; cluster analysis; correlation; hunter-gatherer; morphometry; prehistoric; sexual dimorphism; skeletal remains; Argentina; South America",Article,"Final",,Scopus,2-s2.0-34548676380
"Betti L.","26429046600;","Sexual dimorphism in the size and shape of the os coxae and the effects of microevolutionary processes",2014,"American Journal of Physical Anthropology","153","2",,"167","177",,18,"10.1002/ajpa.22410","https://www.scopus.com/inward/record.uri?eid=2-s2.0-84892577557&doi=10.1002%2fajpa.22410&partnerID=40&md5=7c1ea948becbe2de178c61a5d7a6dc48","Division of Biological Anthropology, Department of Archaeology and Anthropology, University of Cambridge, Pembroke Street, Cambridge CB2 3QG, United Kingdom","Betti, L., Division of Biological Anthropology, Department of Archaeology and Anthropology, University of Cambridge, Pembroke Street, Cambridge CB2 3QG, United Kingdom","Sexual dimorphism in the human pelvis has been studied widely for forensic purposes, but it is still unclear to what extent it varies among human populations. There is evidence that microevolutionary processes, both neutral (i.e., population history) and selective (e.g., thermoregulatory adaptation and size-related obstetrical constraints) contribute to explain pelvic variation among populations, but the extent to which these factors affect pelvic sexual dimorphism is unknown. In this study, I analyze sexual dimorphism of the os coxae in 20 globally distributed human populations, using 3D morphometric data to separate the size and shape components of sexual differences. After evaluating population differences in the degree and pattern of sexual dimorphism, I test for the effect of population history, climate, and body size in shaping global diversity. The results show that size and shape dimorphism follow different patterns. Coxal size dimorphism is generally quite consistent through populations, with males bigger than females, but it appears to be reduced in small-bodied populations, possibly in relation to obstetrically-related selective pressures for a spacious birth canal. Beyond a general species-wide pattern of shape dimorphism, commonly used for forensic sex determination, other aspects of sexual differences in coxal shape vary among human populations, reflecting the effects of neutral demographic processes and climatic adaptation. © 2013 Wiley Periodicals, Inc.","climate; obstetrical constraints; pelvis; population history","anatomical variation; article; body mass; body size; climate; demography; evolution; female; hip; hip shape; hip size; human; male; morphometrics; musculoskeletal system parameters; pelvis; pubic bone; sex determination; sex difference; climate; obstetrical constraints; pelvis; population history; Analysis of Variance; Anthropology, Physical; Biological Evolution; Body Size; Female; Humans; Least-Squares Analysis; Male; Pelvic Bones; Sex Characteristics; Somatotypes",Article,"Final",,Scopus,2-s2.0-84892577557
"Gómez-Valdés J.A., Quinto-Sánchez M., Menéndez Garmendia A., Veleminska J., Sánchez-Mejorada G., Bruzek J.","16063951800;55214951500;55214951600;6505794954;55989730100;6602595244;","Comparison of methods to determine sex by evaluating the greater sciatic notch: Visual, angular and geometric morphometrics",2012,"Forensic Science International","221","1-3",,"156.e1","156.e7",,18,"10.1016/j.forsciint.2012.04.027","https://www.scopus.com/inward/record.uri?eid=2-s2.0-84864326754&doi=10.1016%2fj.forsciint.2012.04.027&partnerID=40&md5=4df7d36c6eb19ca20019a0443301b4b3","Departamento de Anatomía, Facultad de Medicina, Universidad Nacional Autónoma de México, Circuito Interior, Ciudad Universitaria, Coyoacan, Distrito Federal 04510, Mexico; Posgrado en Antropología, Universidad Nacional Autónoma de México, Circuito Exterior, Ciudad Universitaria, Coyoacan, Distrito Federal 04510, Mexico; Laboratorio de Osteología, Licenciatura en Antropología Física, Escuela Nacional de Antropología e Historia, Periférico Sur y Zapote S/N, Colonia Isidro Fabela, Tlalpan, Distrito Federal 14030, Mexico; Department of Anthropology and Human Genetics, Faculty of Sciences, Charles University, 12844, Vinicna 7, Prague, Czech Republic; PACEA-LAPP, UMR5199, Centre National de la Recherche Scientifique, Université Bordeaux 1, Avenue des Facultés, 33405 Talence, France","Gómez-Valdés, J.A., Departamento de Anatomía, Facultad de Medicina, Universidad Nacional Autónoma de México, Circuito Interior, Ciudad Universitaria, Coyoacan, Distrito Federal 04510, Mexico, Posgrado en Antropología, Universidad Nacional Autónoma de México, Circuito Exterior, Ciudad Universitaria, Coyoacan, Distrito Federal 04510, Mexico; Quinto-Sánchez, M., Laboratorio de Osteología, Licenciatura en Antropología Física, Escuela Nacional de Antropología e Historia, Periférico Sur y Zapote S/N, Colonia Isidro Fabela, Tlalpan, Distrito Federal 14030, Mexico; Menéndez Garmendia, A., Departamento de Anatomía, Facultad de Medicina, Universidad Nacional Autónoma de México, Circuito Interior, Ciudad Universitaria, Coyoacan, Distrito Federal 04510, Mexico; Veleminska, J., Department of Anthropology and Human Genetics, Faculty of Sciences, Charles University, 12844, Vinicna 7, Prague, Czech Republic; Sánchez-Mejorada, G., Departamento de Anatomía, Facultad de Medicina, Universidad Nacional Autónoma de México, Circuito Interior, Ciudad Universitaria, Coyoacan, Distrito Federal 04510, Mexico; Bruzek, J., Department of Anthropology and Human Genetics, Faculty of Sciences, Charles University, 12844, Vinicna 7, Prague, Czech Republic, PACEA-LAPP, UMR5199, Centre National de la Recherche Scientifique, Université Bordeaux 1, Avenue des Facultés, 33405 Talence, France","Sex estimation is the first step for biological profile reconstruction of an unknown skeleton (archaeological or contemporary) and consequently for positive identification of skeletal remains recovered from forensic settings. Several tools have been developed using different osseous structures. With the intention to provide an objective method comparison, we reported the analysis of three different methods (visual, metric and geometric morphometrics) for sex assessment of the greater sciatic notch. One hundred and thirty pelvic bones (45.4% females and 54.6% males) from the National Autonomous University of Mexico Skeletal Collection pertaining to the contemporary Mexican population were analyzed.We used the ROC-analysis to test between desired false positive thresholds (1-specificity) and expected true positive rates (sensitivity) in order to predict the best approach to sex assessment. The comparison of the area under the ROC-curves shows significant differences among visual and metric methods. At the same time, the analysis suggested that higher morphological variation among the sexes is independent of the methodological approach.The results indicate that the metric (angle), with a high percent of indeterminate cases (34.6%), and visual, with 26.2% of the cases allocated as intermediate cases, were poorly accurate; we cannot recommend these techniques for sexing an unknown specimen. On the other hand, the geometric morphometrics approach improves sex estimation in 82.3% of correctly classified individuals with more than 95% of posterior probability.In addition to the method comparison, the major sexual variation of the greater sciatic notch was determined to be located on its posterior border. © 2012 Elsevier Ireland Ltd.","Forensic anthropology population data; Forensic osteology; Geometric morphometrics; Greater sciatic notch; Sex diagnosis","accuracy; adult; aged; angular morphometrics; area under the curve; article; false positive result; female; forensic identification; geometric morphometrics; Hispanic; human; human tissue; intermethod comparison; male; methodology; morphometrics; pelvic girdle; physical anthropology; prediction; priority journal; probability; receiver operating characteristic; sciatic notch; sensitivity and specificity; sex determination; sex difference; visual morphometrics",Article,"Final",,Scopus,2-s2.0-84864326754
"Mestekova S., Bruzek J., Veleminska J., Chaumoitre K.","56789998400;6602595244;6505794954;6604096608;","A Test of the DSP Sexing Method on CT Images from a Modern French Sample",2015,"Journal of Forensic Sciences","60","5",,"1295","1299",,17,"10.1111/1556-4029.12817","https://www.scopus.com/inward/record.uri?eid=2-s2.0-84941173126&doi=10.1111%2f1556-4029.12817&partnerID=40&md5=b41c6c314121c7f67d99245ae1756d1d","Department of Anthropology and Human Genetics, Faculty of Sciences, Charles University, Vinicna 7, Prague, 12844, Czech Republic; PACEA-A3P, UMR5199, Centre National de la Recherche Scientifique, Université Bordeaux 1, Avenue des Facultés, Talence, 33405, France; Department of Medical Imaging, AP-HM, University North Hospital, Chemin des Bourrely, Marseille Cedex 20, 13915, France","Mestekova, S., Department of Anthropology and Human Genetics, Faculty of Sciences, Charles University, Vinicna 7, Prague, 12844, Czech Republic; Bruzek, J., Department of Anthropology and Human Genetics, Faculty of Sciences, Charles University, Vinicna 7, Prague, 12844, Czech Republic, PACEA-A3P, UMR5199, Centre National de la Recherche Scientifique, Université Bordeaux 1, Avenue des Facultés, Talence, 33405, France; Veleminska, J., Department of Anthropology and Human Genetics, Faculty of Sciences, Charles University, Vinicna 7, Prague, 12844, Czech Republic; Chaumoitre, K., Department of Medical Imaging, AP-HM, University North Hospital, Chemin des Bourrely, Marseille Cedex 20, 13915, France","The hip bone is considered to be one of the most reliable indicators in sex determination. The aim of this study was to test the reliability of the DSP method for the hip bone proposed by Murail et al. (Bull Mem Soc Anthropol Paris, 17, 2005, 167) on a sample from a present-day population in France (52 males and 54 females). Ten linear measurements were collected from three-dimensional models derived from computed tomography images (CTI). To quantify the proportions of correct sex determinations, a more rigorous posterior probability threshold of 0.95 was applied. Using all 10 measurements, 92.3% of males and 97.2% of females were sexed correctly. The percentage of undetermined specimens varied depending on the used combination of measurements; however, all sexes were assigned with a 100% accuracy. This study proves that DSP is an appropriate and reliable tool for sex determination, based on dimensions obtained from CTI. © 2015 American Academy of Forensic Sciences.","Computed tomography; Forensic anthropology; Forensic science; Os coxae; Reliability; Sex determination; Virtual morphometric","adult; aged; anatomy and histology; computer assisted tomography; discriminant analysis; female; France; human; male; middle aged; pelvic girdle; physical anthropology; procedures; radiography; sex determination; three dimensional imaging; very elderly; young adult; Adult; Aged; Aged, 80 and over; Discriminant Analysis; Female; Forensic Anthropology; France; Humans; Imaging, Three-Dimensional; Male; Middle Aged; Pelvic Bones; Sex Determination by Skeleton; Tomography, X-Ray Computed; Young Adult",Article,"Final",,Scopus,2-s2.0-84941173126
