Authors,Author(s) ID,Title,Year,Source title,Volume,Issue,Art. No.,Page start,Page end,Page count,Cited by,DOI,Link,Affiliations,Authors with affiliations,Abstract,Author Keywords,Index Keywords,Document Type,Publication Stage,Access Type,Source,EID
"Bookstein F.L.","",[No title available],1991,"Morphometric Tools for Landmark Data: Geometry and Biology",,,,"","",,3980,,,,"Bookstein, F.L.",[No abstract available],,,,,,Scopus,2-s2.0-0003597817
"Klingenberg C.P.","7004588456;","MorphoJ: An integrated software package for geometric morphometrics",2011,"Molecular Ecology Resources","11","2",,"353","357",,1769,"10.1111/j.1755-0998.2010.02924.x","https://www.scopus.com/inward/record.uri?eid=2-s2.0-78650839801&doi=10.1111%2fj.1755-0998.2010.02924.x&partnerID=40&md5=d30b5ebcfc053aa3854553146529e97f","Faculty of Life Sciences, University of Manchester, Michael Smith Building, Manchester M13 9PT, United Kingdom","Klingenberg, C.P., Faculty of Life Sciences, University of Manchester, Michael Smith Building, Manchester M13 9PT, United Kingdom","Increasingly, data on shape are analysed in combination with molecular genetic or ecological information, so that tools for geometric morphometric analysis are required. Morphometric studies most often use the arrangements of morphological landmarks as the data source and extract shape information from them by Procrustes superimposition. The MorphoJ software combines this approach with a wide range of methods for shape analysis in different biological contexts. The program offers an integrated and user-friendly environment for standard multivariate analyses such as principal components, discriminant analysis and multivariate regression as well as specialized applications including phylogenetics, quantitative genetics and analyses of modularity in shape data. MorphoJ is written in Java and versions for the Windows, Macintosh and Unix/Linux platforms are freely available from © 2010 Blackwell Publishing Ltd.","Geometric morphometrics; Multivariate statistics; Phylogeny; Procrustes superimposition; Quantitative genetics; Shape","article; computer interface; computer program; genetic procedures; instrumentation; multivariate analysis; phylogeny; Genetic Techniques; Multivariate Analysis; Phylogeny; Software; User-Computer Interface",Article,"Final",,Scopus,2-s2.0-78650839801
"Zelditch M., Swiderski D., Sheets H., Fink W.","6701615282;35493322600;55663863700;7005590403;","Geometric Morphometrics for Biologists",2004,"Geometric Morphometrics for Biologists",,,,"1","443",,1396,"10.1016/B978-0-12-778460-1.X5000-5","https://www.scopus.com/inward/record.uri?eid=2-s2.0-84902728366&doi=10.1016%2fB978-0-12-778460-1.X5000-5&partnerID=40&md5=bbfcd38d36d5bc6566def6d8fd5dec57","Museum of Paleontology, University of Michigan, MI, United States; Mammal Division, Museum of Zoology, University of Michigan, MI, United States; Department of Physics, Canisius College, Buffalo NY, United States","Zelditch, M., Museum of Paleontology, University of Michigan, MI, United States; Swiderski, D., Mammal Division, Museum of Zoology, University of Michigan, MI, United States; Sheets, H., Department of Physics, Canisius College, Buffalo NY, United States; Fink, W., Mammal Division, Museum of Zoology, University of Michigan, MI, United States","Geometric Morphometrics for Biologists is an introductory textbook for a course on geometric morphometrics, written for graduate students and upper division undergraduates, covering both theory of shape analysis and methods of multivariate analysis. It is designed for students with minimal math background; taking them from the process of data collection through basic and more advanced statistical analyses. Many examples are given, beginning with simple although realistic case-studies, through examples of complex analyses requiring several different kinds of methods. The book also includes URLâs for free software and step-by-step instructions for using the software. © 2004 Elsevier Inc. All rights reserved.",,,Book,"Final",,Scopus,2-s2.0-84902728366
"James Rohlf F., Marcus L.F.","24518567800;7005305240;","A revolution morphometrics",1993,"Trends in Ecology and Evolution","8","4",,"129","132",,1268,"10.1016/0169-5347(93)90024-J","https://www.scopus.com/inward/record.uri?eid=2-s2.0-0242462501&doi=10.1016%2f0169-5347%2893%2990024-J&partnerID=40&md5=14afd83efbc93ae5f62d49a4829a5597","Dept of Ecology and Evolution, State University of New York, Stony Brook, NY 11794-5245, United States; Dept of Biology, Queen's College, CUNY, Flushing, NY 11367, United States","James Rohlf, F., Dept of Ecology and Evolution, State University of New York, Stony Brook, NY 11794-5245, United States; Marcus, L.F., Dept of Biology, Queen's College, CUNY, Flushing, NY 11367, United States","We are now in the midst of a revolution in morphometric methodology. The new approaches are more effective in capturing information about the shape of an organism and result in more powerful statistical procedures for testing for differences in s shape. They are also more effective in enabling a researcher to visualize differences in shape and in suggesting simple traditional measurements that could be used in future studies. In this review we emphasize applications to exploratory studies in taxonomy and evolution. © 1993.",,,Review,"Final",,Scopus,2-s2.0-0242462501
"Phenice T.W.","6507474253;","A newly developed visual method of sexing the os pubis",1969,"American Journal of Physical Anthropology","30","2",,"297","301",,764,"10.1002/ajpa.1330300214","https://www.scopus.com/inward/record.uri?eid=2-s2.0-0014487643&doi=10.1002%2fajpa.1330300214&partnerID=40&md5=6af4e65eea1f9ffd0c3209b1a1aff75f","Department of Anthropology, University of Kansas, United States","Phenice, T.W., Department of Anthropology, University of Kansas, United States","Preliminary investigation has indicated that the use of the ventral arc, subpubic concavity, and medial aspect of the ischio‐pubic ramus as sexing criteria allows one to sex the os pubis with an accuracy in excess of 95%. The method described here is simple and objective enough to allow the beginning researcher to sex hip bones accurately while requiring the presence of only a small fragment of the bone. Copyright © 1969 Wiley‐Liss, Inc., A Wiley Company",,"article; female; hip; histology; human; male; pelvimetry; pelvis; pubic bone; sex determination; technique; Female; Hip; Human; Male; Methods; Pelvimetry; Pelvis; Pubic Bone; Sex Determination (Analysis)",Article,"Final",,Scopus,2-s2.0-0014487643
"Ferembach D., Schwidetzky I., Stloukal M.","","Recommendations for age and sex diagnoses of skeletons",1980,"J Hum Evol","9",,,"517","549",,612,,,,"Ferembach, D.; Schwidetzky, I.; Stloukal, M.",[No abstract available],,,,,,Scopus,2-s2.0-0000884253
"Bruzek J.","6602595244;","A method for visual determination of sex, using the human hip bone",2002,"American Journal of Physical Anthropology","117","2",,"157","168",,530,"10.1002/ajpa.10012","https://www.scopus.com/inward/record.uri?eid=2-s2.0-0036159009&doi=10.1002%2fajpa.10012&partnerID=40&md5=5950a75aee2e3507d3ea6cf08fffca6f","U.M.R. 5809 du C.N.R.S., Laboratoire d'Anthropologie des Populations du Passé, Université Bordeaux I, 33405 Talence, France; Laboratoire d'Anthropologie des Populations du Passé, UMR 5809 du CNRS, Université Bordeaux I, Avenue des Facultés, 33405 Talence, France","Bruzek, J., U.M.R. 5809 du C.N.R.S., Laboratoire d'Anthropologie des Populations du Passé, Université Bordeaux I, 33405 Talence, France, Laboratoire d'Anthropologie des Populations du Passé, UMR 5809 du CNRS, Université Bordeaux I, Avenue des Facultés, 33405 Talence, France","A new visual method for the determination of sex using the human hip bone (os coxae) is proposed, based on a revision of several previous approaches which scored isolated characters of this bone. The efficacy of the methodology is tested on a sample of 402 adults of known sex and age of French and Portuguese origins. With the simultaneous use of five characters of the hip bone, it is possible to provide a correct sexual diagnosis in 95% of all cases, with an error of 2% and an inability to identify sex in only 3%. The advantage of this new method is a reduction in observer subjectivity, since the evaluation procedure cannot involve any anticipation of the result. In addition, this method of sex determination increases the probability of a correct diagnosis with isolated fragments of the hip bone, provided that a combination of elements of one character is found to be typically male or female. © 2002 Wiley-Liss, Inc.","Human pelvis; Method; Morphological traits; Sex determination","article; controlled study; error; female; hip; human; male; methodology; sex determination; visual system",Article,"Final",,Scopus,2-s2.0-0036159009
"Slice D.E.","6603334019;","Geometric morphometrics",2007,"Annual Review of Anthropology","36",,,"261","281",,330,"10.1146/annurev.anthro.34.081804.120613","https://www.scopus.com/inward/record.uri?eid=2-s2.0-36048942133&doi=10.1146%2fannurev.anthro.34.081804.120613&partnerID=40&md5=5f0b0e37354cef031f810f2f68366c4a","Department of Anthropology, University of Vienna, A-1091 Vienna, Austria","Slice, D.E., Department of Anthropology, University of Vienna, A-1091 Vienna, Austria","Morphometrics, the field of biological shape analysis, has undergone major change in recent years. Most of this change has been due to the development and adoption of methods to analyze the Cartesian coordinates of anatomical landmarks. These geometric morphometric (GM) methods focus on the retention of geometric information throughout a study and provide efficient, statistically powerful analyses that can readily relate abstract, multivariate results to the physical structure of the original specimens. Physical anthropology has played a central role in both the development and the early adoption of these methods, just as it has done in the realm of general statistics, where it has served as a major motivating and contributing force behind much innovation. This review surveys the current state of GM, the role of authropologists in its development, recent applications of GM in physical anthropology, and GM-based methods newly introduced to, or by, anthropology, which are likely to impact future research. Copyright © 2007 by Annual Reviews. All rights reserved.","Allometry; Asymmetry; HTU; Landmarks; Procrustes analysis; Shape","allometry; anthropology; geometry; morphometry; multivariate analysis",Review,"Final",,Scopus,2-s2.0-36048942133
"Murail P., Bruzek J., Houët F., Cunha E.","","DSP: a tool for probabilistic sex diagnosis using worldwide variability in hip-bone measurements",2005,"Bulletins et Mémoires de la Société d'Anthropologie de Paris","17","3-4",,"167","176",,234,,,,"Murail, P.; Bruzek, J.; Houët, F.; Cunha, E.",[No abstract available],,,,"Final",,Scopus,2-s2.0-60749126664
"WASHBURN S.L.","7006299763;","Tools and human evolution.",1960,"Scientific American","203",,,"63","75",,213,,"https://www.scopus.com/inward/record.uri?eid=2-s2.0-34548531623&partnerID=40&md5=f3c4f0bb6a1c4318e4e3842d6320a51e",,"WASHBURN, S.L.",[No abstract available],,"article; evolution; EVOLUTION; Evolution",Article,"Final",,Scopus,2-s2.0-34548531623
"Slice D.E.","",[No title available],2005,"Modern Morphometrics in Physical Anthropology",,,,"","",,188,,,,"Slice, D.E.",[No abstract available],,,,"Final",,Scopus,2-s2.0-8644228122
"Meindl R.S., Lovejoy C.O., Mensforth R.P., Carlos L.D.","6701838245;7006644104;6602807931;57192034010;","Accuracy and direction of error in the sexing of the skeleton: Implications for paleodemography",1985,"American Journal of Physical Anthropology","68","1",,"79","85",,151,"10.1002/ajpa.1330680108","https://www.scopus.com/inward/record.uri?eid=2-s2.0-0021826796&doi=10.1002%2fajpa.1330680108&partnerID=40&md5=97199024d8216e647442fa2eed421b63","Departments of Anthropology and Biology, Kent State University, Kent, Ohio, 44242, United States; Department of Orthopaedic Surgery, Case Western Reserve University, Cuyahoga County Coroner's Office, Cleveland Museum of Natural History, Cleveland, Ohio, 44106, United States; Department of Human Anatomy, Northeast Ohio Universities College of Medicine, Rootstown, Ohio, 44272, United States","Meindl, R.S., Departments of Anthropology and Biology, Kent State University, Kent, Ohio, 44242, United States; Lovejoy, C.O., Departments of Anthropology and Biology, Kent State University, Kent, Ohio, 44242, United States, Department of Orthopaedic Surgery, Case Western Reserve University, Cuyahoga County Coroner's Office, Cleveland Museum of Natural History, Cleveland, Ohio, 44106, United States, Department of Human Anatomy, Northeast Ohio Universities College of Medicine, Rootstown, Ohio, 44272, United States; Mensforth, R.P., Departments of Anthropology and Biology, Kent State University, Kent, Ohio, 44242, United States; Carlos, L.D., Department of Human Anatomy, Northeast Ohio Universities College of Medicine, Rootstown, Ohio, 44272, United States","Determinations of sex by subjective assessment of the skulls from a skeletal series of known sex were compared to fully independent assessments based on pelves of the same specimens. Within‐sex correlations of cranial and pelvic morphologies measured on an android‐gynecoid scale were smaller than expected. Subjective assessment by means of the skull compared favorably to that of the linear discriminant functions of Giles and Elliot; however, the direction of error was similar for both procedures. Of course, estimations based on the pelves were generally superior to both in terms of frequency and overall bias of error. The bias of sex estimation for paleodemographic purposes is contingent upon completeness of skeletal remains. Copyright © 1985 Wiley‐Liss, Inc., A Wiley Company","Demography; Forensic; Paleodemography; Sexing; Sex‐determination","age; autopsy; bone; clinical article; controlled study; demography; diagnosis; etiology; forensic medicine; human; identification; legal aspect; normal human; paleoanthropology; preliminary communication; sex determination; sex difference; Adult; Caucasoid Race; Comparative Study; Demography; Female; Human; Male; Negroid Race; Paleontology; Pelvic Bones; Sex Determination (Analysis); Skeleton; Skull; Support, U.S. Gov't, Non-P.H.S.; United States",Article,"Final",,Scopus,2-s2.0-0021826796
"Rosenberg K.R.","57215449131;","The evolution of modern human childbirth",1992,"American Journal of Physical Anthropology","35","15 S",,"89","124",,129,"10.1002/ajpa.1330350605","https://www.scopus.com/inward/record.uri?eid=2-s2.0-0026592043&doi=10.1002%2fajpa.1330350605&partnerID=40&md5=6674df7943d950bbb4bb0ba8429b5c7d","Department of Anthropology, University of Delaware, Newark, Delaware, 19716, United States","Rosenberg, K.R., Department of Anthropology, University of Delaware, Newark, Delaware, 19716, United States","Human birth follows a pattern which is unique among mammals. Distinctions include the orientation of the fetus as it passes through the birth canal, the way the fetus emerges from the birth canal, difficulty during labor, and behavior by the mother and/or other individuals around the time of birth. Birth has important implications for the morphology of the pelvis, for sex differences in the pelvis, for such aspects of human biology as size (and maturity) at birth, and for behavior (including cooperative behavior). This paper reviews the fossil and comparative evidence for when and how the modern pattern of birth evolved. The modern human pattern of birth evolved in a mosaic manner with some unique features appearing early in human evolution and others quite late. A human‐like entry of the fetal head into the birth canal was already present among australopithecines as a result of their wide pelvic apertures. Other aspects of modern human birth such as the rotation of the head and body within the birth canal and the emergence of the fetal head in an occiput anterior position probably evolved later, when encephalization had placed increasing selection on both the form of the pelvis and the timing of birth. Cooperative behavior during and after birth accompanied the origin of the fully modern human mechanism of birth. The unique phenomenon of modern human birth did not evolve in response to a single “obstetrical dilemma” but as part of a complex interplay between changes in a number of aspects of human biology. © 1992 Wiley‐Liss, Inc. Copyright © 1992 Wiley‐Liss, Inc., A Wiley Company","Childbirth; Human evolution; Obstetrics; Pelvis","childbirth; evolution; fetus; human; labor; morphology; nonhuman; pelvis; review; sex difference",Article,"Final",,Scopus,2-s2.0-0026592043
"Rogers T., Saunders S.","7202089198;7202876055;","Accuracy of sex determination using morphological traits of the human pelvis",1994,"Journal of Forensic Sciences","39","4",,"1047","1056",,101,,"https://www.scopus.com/inward/record.uri?eid=2-s2.0-0028673586&partnerID=40&md5=4e2655689700966caa2401f5998fa769","Dept. of Archaelogy, Simon Fraser University, Burnaby, BC V5A 1S6, Canada","Rogers, T., Dept. of Archaelogy, Simon Fraser University, Burnaby, BC V5A 1S6, Canada; Saunders, S., Dept. of Archaelogy, Simon Fraser University, Burnaby, BC V5A 1S6, Canada","This study assesses the accuracy and reliability of 17 individual morphological traits of the pelvis frequently used to determine the sex of human skeletal remains. A sample of 49 fight and left adult hip bones and sacra of documented individuals were available from an historic church cemetery dating from the 19th century. A hypothetical ranking of the accuracy of traits was drawn from the literature. Next, individual traits were evaluated for precision and accuracy of observations, and combinations of two and three traits were evaluated for their collective effectiveness as sex indicators. The effect of age on the accuracy of traits for sex determination was also examined. Precision of traits was generally good. Several combinations of three criteria produced higher levels of accuracy than the trait list as a whole. A total of six traits was judged to be most effective as sex discriminators because of low intraobserver error levels and better than 83% accuracy rates. There was no indication of an age effect on the precision or accuracy of these traits although sample sizes are small.","human identification; pelvis; physical anthropology","adult; age; analytical error; article; female; hip; human; human tissue; male; pelvis; physical anthropology; priority journal; probability; reliability; sacrum; sex determination; skeleton; Adult; Age Determination by Skeleton; Aging; Anthropology, Physical; Female; History of Medicine, 19th Cent.; Human; Male; Middle Age; Observer Variation; Pelvis; Postmortem Changes; Probability; Reproducibility of Results; Sex Determination (Analysis); Support, Non-U.S. Gov't",Article,"Final",,Scopus,2-s2.0-0028673586
"O'Higgins P., Jones N.","","Tools for statistical shape analysis",2006,"Tools for Statistical Shape Analysis",,,,"","",,95,,,,"O'Higgins, P.; Jones, N.",[No abstract available],,,,"Final",,Scopus,2-s2.0-33846536610
"Wells J.C.K., DeSilva J.M., Stock J.T.","55603815000;57206141657;7202121868;","The obstetric dilemma: An ancient game of russian roulette, or a variable dilemma sensitive to ecology?",2012,"Yearbook of Physical Anthropology","149","SUPPL.55",,"40","71",,89,"10.1002/ajpa.22160","https://www.scopus.com/inward/record.uri?eid=2-s2.0-84872273232&doi=10.1002%2fajpa.22160&partnerID=40&md5=e30bc221a79fa9ccd0472d7f5d5771c8","Childhood Nutrition Research Centre, UCL Institute of Child Health, London WC1N 1EH, United Kingdom; Department of Anthropology, Boston University, Boston, MA 02215, United States; Department of Archaeology and Anthropology, Cambridge CB2 3DZ, United Kingdom","Wells, J.C.K., Childhood Nutrition Research Centre, UCL Institute of Child Health, London WC1N 1EH, United Kingdom; DeSilva, J.M., Department of Anthropology, Boston University, Boston, MA 02215, United States; Stock, J.T., Department of Archaeology and Anthropology, Cambridge CB2 3DZ, United Kingdom","The difficult birth process of humans, often described as the ""obstetric dilemma,""is commonly assumed to reflect antagonistic selective pressures favoring neonatal encephalization and maternal bipedal locomotion. However, cephalo-pelvic disproportion is not exclusive to humans, and is present in some primate species of smaller body size. The fossil record indicates mosaic evolution of the obstetric dilemma, involving a number of different evolutionary processes, and it appears to have shifted in magnitude between Australopithecus, Pleistocene Homo, and recent human populations. Most attention to date has focused on its generic nature, rather than on its variability between populations. We reevaluate the nature of the human obstetric dilemma using updated hominin and primate literature, and then consider the contribution of phenotypic plasticity to variability in its magnitude. Both maternal pelvic dimensions and fetal growth patterns are sensitive to ecological factors such as diet and the thermal environment. Neonatal head girth has low plasticity, whereas neonatal mass and maternal stature have higher plasticity. Secular trends in body size may therefore exacerbate or decrease the obstetric dilemma. The emergence of agriculture may have exacerbated the dilemma, by decreasing maternal stature and increasing neonatal growth and adiposity due to dietary shifts. Paleodemographic comparisons between foragers and agriculturalists suggest that foragers have considerably lower rates of perinatal mortality. In contemporary populations, maternal stature remains strongly associated with perinatal mortality in many populations. Long-term improvements in nutrition across future generations may relieve the dilemma, but in the meantime, variability in its magnitude is likely to persist. © 2012 Wiley Periodicals, Inc.","Birth; Cephalopelvic disproportion; Encephalization; Growth; Nutrition; Obstetric dilemma; Pelvis; Phenotypic plasticity","animal; article; body size; brain; cephalopelvic disproportion; evolution; female; histology; human; pelvis; physical anthropology; physiology; pregnancy; primate; Animals; Anthropology, Physical; Biological Evolution; Body Size; Brain; Cephalopelvic Disproportion; Female; Humans; Pelvis; Pregnancy; Primates; Australopithecus; Primates",Article,"Final",,Scopus,2-s2.0-84872273232
"Bruzek J., Murail P.","6602595244;6603224146;","Methodology and reliability of sex determination from the skeleton",2006,"Forensic Anthropology and Medicine: Complementary Sciences From Recovery to Cause of Death",,,,"225","242",,88,"10.1007/978-1-59745-099-7_9","https://www.scopus.com/inward/record.uri?eid=2-s2.0-84891405667&doi=10.1007%2f978-1-59745-099-7_9&partnerID=40&md5=a9e57a9b64a73dffda75f383f1cccc1d","UMR 5199, PACEA, Laboratoire d'Anthropologie des Populations du Passé, Université Bordeaux 1, Talence, France","Bruzek, J., UMR 5199, PACEA, Laboratoire d'Anthropologie des Populations du Passé, Université Bordeaux 1, Talence, France; Murail, P., UMR 5199, PACEA, Laboratoire d'Anthropologie des Populations du Passé, Université Bordeaux 1, Talence, France","Once a body is completely decomposed, it is necessary to determine sex from the skeleton. The hip bone is the most reliable indicator for sex determination because the pattern of sexual dimorphism is common to the whole human race. Two reliable visual methods are suggested to assess sex from the hip bone. However, the authors recommend the use of a method based on discriminant function analysis including a probabilistic approach that the authors recently developed with a large sample of known-sex individuals. The population specificity of sexual dimorphism of the other parts of the skeleton is also discussed. The authors particularly insist on the inherent limits of discriminant functions on extrapelvic measurements. © 2006 Humana Press Inc.","adult; discriminant function; hip bones; pelvic measurements; probability; Sex determination",,Book Chapter,"Final",,Scopus,2-s2.0-84891405667
