Authors,Author(s) ID,Title,Year,Source title,Volume,Issue,Art. No.,Page start,Page end,Page count,Cited by,DOI,Link,Affiliations,Authors with affiliations,Abstract,Author Keywords,Index Keywords,Document Type,Publication Stage,Access Type,Source,EID
"Tague R.G.","6603550525;","Sexual dimorphism in the human bony pelvis, with a consideration of the Neandertal pelvis from Kebara cave, Israel",1992,"American Journal of Physical Anthropology","88","1",,"1","21",,88,"10.1002/ajpa.1330880102","https://www.scopus.com/inward/record.uri?eid=2-s2.0-0026524311&doi=10.1002%2fajpa.1330880102&partnerID=40&md5=92860a80279569f35844aab1379b0444","Department of Geography and Anthropology, Louisiana State University, Baton Rouge, Louisiana, 70803-4105, United States","Tague, R.G., Department of Geography and Anthropology, Louisiana State University, Baton Rouge, Louisiana, 70803-4105, United States","Sexual dimorphism of the human pelvis is inferentially related to obstetrics. However, researchers disagree in the identification and obstetric significance of pelvic dimorphisms. This study addresses three issues. First, common patterns in dimorphism are identified by analysis of pelvimetrics from six independent samples (Whites and Blacks of known sex and four Amerindian samples of unknown sex). Second, an hypothesis is tested that the index of pelvic dimorphism (female mean × 100/male mean) is inversely related to pelvic variability. Third, the pelvic dimensions of the Neandertal male from Kebara cave, Israel are compared with those of the males in this study. The results show that the pelvic inlet is the plane of least dimorphism in humans. The reason that reports often differ in the identification of dimorphisms for this pelvic plane is that both the length of the pubis and the shape of the inlet are related to nutrition. The dimensions of the pelvis that are most dimorphic (that is, female larger than male) are the measures of posterior space, angulation of sacrum, biischial breadth, and subpubic angle. Interestingly, these dimensions are also the most variable. The hypothesis that variability and dimorphism are inversely related fails to be supported. The factors that influence pelvic variability are discussed. The Kebara 2 pelvis has a spacious inlet and a confined outlet relative to modern males, though the circumferences of both planes in the Neandertal are within the range of variation of modern males. The inference is that outlet circumference in Neandertal females is also small in size, but within the range of variation of modern females. Arguments that Neandertal newborns were larger in size than those of modern humans necessarily imply that birth was more difficult in Neandertals. © 1992 Wiley‐Liss, Inc. Copyright © 1992 Wiley‐Liss, Inc., A Wiley Company","Neandertal; Obstetrics; Pelvis; Sexual dimorphism","adult; article; evolution; female; human; human tissue; israel; male; obstetrics; paleoanthropology; pelvic girdle; pelvimetry; sex difference; variance; Animal; Caucasoid Race; Female; Fossils; Hominidae; Human; Indians, North American; Israel; Male; Negroid Race; Pelvic Bones; Sex Characteristics; Support, Non-U.S. Gov't",Article,"Final",,Scopus,2-s2.0-0026524311
"Lockwood C.A., Lynch J.M., Kimbel W.H.","7102516713;25934906700;6603930109;","Quantifying temporal bone morphology of great apes and humans: An approach using geometric morphometrics",2002,"Journal of Anatomy","201","6",,"447","464",,87,"10.1046/j.1469-7580.2002.00122.x","https://www.scopus.com/inward/record.uri?eid=2-s2.0-18744389738&doi=10.1046%2fj.1469-7580.2002.00122.x&partnerID=40&md5=7adca44c6aae11a24a0570152de7bf94","Department of Anthropology, Institute of Human Origins, Arizona State University, Tempe, AZ 85287, United States; Barrett Honors College, Institute of Human Origins, Arizona State University, Tempe, AZ 85287, United States","Lockwood, C.A., Department of Anthropology, Institute of Human Origins, Arizona State University, Tempe, AZ 85287, United States; Lynch, J.M., Barrett Honors College, Institute of Human Origins, Arizona State University, Tempe, AZ 85287, United States; Kimbel, W.H., Department of Anthropology, Institute of Human Origins, Arizona State University, Tempe, AZ 85287, United States","The hominid temporal bone offers a complex array of morphology that is linked to several different functional systems. Its frequent preservation in the fossil record gives the temporal bone added significance in the study of human evolution, but its morphology has proven difficult to quantify. In this study we use techniques of 3D geometric morphometrics to quantify differences among humans and great apes and discuss the results in a phylogenetic context. Twenty-three landmarks on the ectocranial surface of the temporal bone provide a high level of anatomical detail. Generalized Procrustes analysis (GPA) is used to register (adjust for position, orientation and scale) landmark data from 405 adults representing Homo, Pan, Gorilla and Pongo. Principal components analysis of residuals from the GPA shows that the major source of variation is between humans and apes. Human characteristics such as a coronally orientated petrous axis, a deep mandibular fossa, a projecting mastoid process, and reduced lateral extension of the tympanic element strongly impact the analysis. In phenetic cluster analyses, gorillas and orangutans group together with respect to chimpanzees, and all apes group together with respect to humans. Thus, the analysis contradicts depictions of African apes as a single morphotype. Gorillas and orangutans lack the extensive preglenoid surface of chimpanzees, and their mastoid processes are less medially inflected. These and other characters shared by gorillas and orangutans are probably primitive for the African hominid clade.","Geometric morphometrics; Hominids; Hominoids; Relative warp analysis; Thin-plate spline analysis","Africa; analytic method; Anthropoidea; ape; article; bone structure; chimpanzee; cladistics; cluster analysis; comparative anatomy; controlled study; craniofacial morphology; evolution; fossil; geographical variation (species); geometry; gorilla; hominid; human; human versus animal comparison; mandible; mastoid; middle ear; morphometrics; morphotype; nonhuman; orang utan; Pan paniscus; petrous bone; phylogeny; priority journal; register; structure analysis; temporal bone; Adult; Animals; Gorilla gorilla; Hominidae; Humans; Pan troglodytes; Phylogeny; Pongo pygmaeus; Temporal Bone; Alocasia macrorrhizos; Animalia; Anthropoidea; Hominidae; Homo; Pan (ape); Pan paniscus; Pan troglodytes; Paniscus; Pongo; Pongo pygmaeus; Procrustes",Article,"Final",,Scopus,2-s2.0-18744389738
"Pretorius E., Steyn M., Scholtz Y.","8252586100;7006176987;10145152400;","Investigation into the usability of geometric morphometric analysis in assessment of sexual dimorphism",2006,"American Journal of Physical Anthropology","129","1",,"64","70",,79,"10.1002/ajpa.20251","https://www.scopus.com/inward/record.uri?eid=2-s2.0-29244439935&doi=10.1002%2fajpa.20251&partnerID=40&md5=79eab43fdb836920c5d2b449e50be688","Department of Anatomy, University of Pretoria, Pretoria 0001, South Africa; PO Box 2034, Pretoria 0001, South Africa","Pretorius, E., Department of Anatomy, University of Pretoria, Pretoria 0001, South Africa, PO Box 2034, Pretoria 0001, South Africa; Steyn, M., Department of Anatomy, University of Pretoria, Pretoria 0001, South Africa; Scholtz, Y., Department of Anatomy, University of Pretoria, Pretoria 0001, South Africa","Understanding sexual dimorphism is very important in studies of human evolution and skeletal biology. Sexual dimorphic characteristics can be studied morphologically and metrically, although morphologic studies pose several problems such as difficulties with quantification and interobserver error. Geometric morphometrics is a relatively new method that allows better assessment of morphologic characteristics. This paper aims to investigate the usability of this method by assessing three different morphologic characteristics in a sample of South African blacks: shape of the greater sciatic notch, mandibular ramus flexure, and shape of the orbits. Relative warps, thin-plate splines, and canonical variates analysis (CVA) analyses were performed. As expected, the shape of the greater sciatic notch provided the best separation between the sexes. Surprisingly, however, the shape of the orbits performed better that ramus flexure. Several possible explanations for this result are possible, which include the possibility that orbit shape is more sexually dimorphic than previously expected, or that biological reality is not reflected by this technique. More research is, however, needed. © 2005 Wiley-Liss, Inc.","Geometric morphometrics; Greater sciatic notch; Orbit shape; Ramus flexure","analytic method; anatomy; article; canonical analysis; canonical variates analysis; evolution; female; geometric morphometry; geometry; human; human tissue; male; mandibular nerve; morphometrics; Negro; orbit; pelvis; quantitative analysis; sex difference; skeleton; South Africa; African Continental Ancestry Group; Body Size; Bone and Bones; Female; Humans; Male; Sex Characteristics; South Africa",Article,"Final",,Scopus,2-s2.0-29244439935
"Gonzalez P.N., Bernal V., Perez S.I.","55799217100;55930645900;13808174600;","Geometric morphometric approach to sex estimation of human pelvis",2009,"Forensic Science International","189","1-3",,"68","74",,71,"10.1016/j.forsciint.2009.04.012","https://www.scopus.com/inward/record.uri?eid=2-s2.0-67349205835&doi=10.1016%2fj.forsciint.2009.04.012&partnerID=40&md5=25358556545ea4273b514cff0c256826","División Antropología, Facultad de Ciencias Naturales y Museo, Universidad Nacional de La Plata, Paseo del Bosque s/n, La Plata, 1900, Argentina","Gonzalez, P.N., División Antropología, Facultad de Ciencias Naturales y Museo, Universidad Nacional de La Plata, Paseo del Bosque s/n, La Plata, 1900, Argentina; Bernal, V., División Antropología, Facultad de Ciencias Naturales y Museo, Universidad Nacional de La Plata, Paseo del Bosque s/n, La Plata, 1900, Argentina; Perez, S.I., División Antropología, Facultad de Ciencias Naturales y Museo, Universidad Nacional de La Plata, Paseo del Bosque s/n, La Plata, 1900, Argentina","Sex estimation of skeletal remains is an important issue in both forensics and bioarchaeology. The chance of attaining a high level of accuracy regarding sex allocations is related to the skeletal component analyzed and the ability of the techniques employed to describe shape and size differences among the sexes. Current opinion regards the hip bone as the most reliable sex indicator because it is the most dimorphic bone, particularly in adult individuals. The aim of this study was therefore to analyze the greater sciatic notch and the ischiopubic complex morphology by employing geometric morphometric techniques, based on semilandmark and multivariate statistical methods, in order to develop a reliable and accurate technique for adult sex estimation. The sample analyzed consisted of 121 adult left hip bones randomly selected from the collection of documented skeletons housed at the Museu Antropologico de Coimbra. Morphometric analysis was based on coordinates of landmarks and semilandmarks of the ilium and ischiopubic regions that were digitized on 2D photographic images. Discriminant analysis with leave-one-out cross-validation and k-means clustering of shape and shape-size variables were used in order to classify individuals by sex. For the greater sciatic notch, average accuracy of 90.9% was achieved with both multivariate analyses based on shape variables. For the ischiopubic complex, the values obtained with shape variables were 93.4% and 90.1% for discriminant and k-means, respectively. Females were misclassified more frequently than males, especially for the ischiopubic complex. When multivariate statistical analyses were performed using shape-size variables, the percentages of correct classifications were lower than those obtained with shape variables. We conclude that the use of geometric morphometrics and multivariate statistics is a reliable method to quantify pelvic shape differences between the sexes and could be applied to discriminate between females and males. © 2009 Elsevier Ireland Ltd. All rights reserved.","Discriminant analysis; Ischiopubic complex; k-Means clustering; Sciatic notch; Semilandmarks; Sexual dimorphism","accuracy; adolescent; adult; article; controlled study; female; forensic identification; geometry; human; human tissue; iliac bone; male; morphometrics; pelvis; priority journal; quantitative analysis; reliability; sex determination; sex difference; Adolescent; Adult; Discriminant Analysis; Female; Forensic Anthropology; Humans; Image Processing, Computer-Assisted; Male; Middle Aged; Multivariate Analysis; Pelvic Bones; Photography; Principal Component Analysis; Sex Determination by Skeleton; Young Adult",Article,"Final",,Scopus,2-s2.0-67349205835
"Krishan K., Chatterjee P.M., Kanchan T., Kaur S., Baryah N., Singh R.K.","57202279708;57214608407;35237157900;57210943770;56568337200;57215037898;","A review of sex estimation techniques during examination of skeletal remains in forensic anthropology casework",2016,"Forensic Science International","261",,,"165.e1","165.e8",,65,"10.1016/j.forsciint.2016.02.007","https://www.scopus.com/inward/record.uri?eid=2-s2.0-84960799609&doi=10.1016%2fj.forsciint.2016.02.007&partnerID=40&md5=e35e61160a7643c6cf6e1cb9a9535f41","Department of Anthropology, Panjab University, Chandigarh, India; Department of Forensic Medicine and Toxicology, Kasturba Medical College (Affiliated to Manipal University), Mangalore, India; Department of Forensic Medicine, Pt. J.N.M. Medical College, Government of Chhattisgarh, Raipur, India","Krishan, K., Department of Anthropology, Panjab University, Chandigarh, India; Chatterjee, P.M., Department of Anthropology, Panjab University, Chandigarh, India; Kanchan, T., Department of Forensic Medicine and Toxicology, Kasturba Medical College (Affiliated to Manipal University), Mangalore, India; Kaur, S., Department of Anthropology, Panjab University, Chandigarh, India; Baryah, N., Department of Anthropology, Panjab University, Chandigarh, India; Singh, R.K., Department of Forensic Medicine, Pt. J.N.M. Medical College, Government of Chhattisgarh, Raipur, India","Sex estimation is considered as one of the essential parameters in forensic anthropology casework, and requires foremost consideration in the examination of skeletal remains. Forensic anthropologists frequently employ morphologic and metric methods for sex estimation of human remains. These methods are still very imperative in identification process in spite of the advent and accomplishment of molecular techniques. A constant boost in the use of imaging techniques in forensic anthropology research has facilitated to derive as well as revise the available population data. These methods however, are less reliable owing to high variance and indistinct landmark details. The present review discusses the reliability and reproducibility of various analytical approaches; morphological, metric, molecular and radiographic methods in sex estimation of skeletal remains. Numerous studies have shown a higher reliability and reproducibility of measurements taken directly on the bones and hence, such direct methods of sex estimation are considered to be more reliable than the other methods. Geometric morphometric (GM) method and Diagnose Sexuelle Probabiliste (DSP) method are emerging as valid methods and widely used techniques in forensic anthropology in terms of accuracy and reliability. Besides, the newer 3D methods are shown to exhibit specific sexual dimorphism patterns not readily revealed by traditional methods. Development of newer and better methodologies for sex estimation as well as re-evaluation of the existing ones will continue in the endeavour of forensic researchers for more accurate results. © 2016 Elsevier Ireland Ltd.","Direct methods versus indirect methods; Forensic anthropology; Forensic Anthropology Population Data; Forensic sciences; Sex estimation methods; Skeletal remains","accuracy; analytic method; Article; artificial neural network; bone examination; diagnose sexuelle probabiliste; digital radiography; discriminant analysis; DNA determination; DNA fingerprinting; geometry; human; intermethod comparison; morphometrics; physical anthropology; polymerase chain reaction; priority journal; quantitative analysis; reproducibility; sex determination; short tandem repeat; validation process; diagnostic imaging; factual database; forensic anthropology; procedures; sex determination; sexual development; Databases, Factual; Diagnostic Imaging; Discriminant Analysis; Forensic Anthropology; Humans; Neural Networks (Computer); Sex Characteristics; Sex Determination Analysis; Sex Determination by Skeleton",Article,"Final",,Scopus,2-s2.0-84960799609
"Tague R.G.","6603550525;","Do big females have big pelves?",2000,"American Journal of Physical Anthropology","112","3",,"377","393",,57,"10.1002/1096-8644(200007)112:3<377::AID-AJPA8>3.0.CO;2-O","https://www.scopus.com/inward/record.uri?eid=2-s2.0-0033938955&doi=10.1002%2f1096-8644%28200007%29112%3a3%3c377%3a%3aAID-AJPA8%3e3.0.CO%3b2-O&partnerID=40&md5=58acadae74dc0dfdf3597f27ce5ff0cd","Dept. of Geography and Anthropology, Louisiana State University, Baton Rouge, LA 70803-4105, United States","Tague, R.G., Dept. of Geography and Anthropology, Louisiana State University, Baton Rouge, LA 70803-4105, United States","Previous studies have shown that maternal stature is a correlate of both pelvic size and reproductive efficiency. This study addresses the issue of body size and obstetric advantage. The relationship between pelvic size and three nonpelvic measures of body size is determined for females and males. The skeletal sample consists of blacks, whites, and Native Americans. The variables include 28 measures of the pelvis, length and head diameter of the femur, and clavicular length. The coefficient of multiple determination (CMD) is computed for each pelvic measure using multiple regression, with the three nonpelvic measures serving as the independent variables. Partial correlation coefficients are also calculated between each pelvic and nonpelvic variable, while controlling for the other two nonpelvic variables. The results show that all CMDs in females and all but one CMD in their CMDs for 22 of the 28 pelvic variables; of the six variables that are significantly different, five are of the midplane. The sexes are also broadly comparable in their partial correlations. The results are explained as follows. First, the concordance between the sexes in the relationship between pelvic size and nonpelvic measures of body size is due to their genetic similarity for homologous structures. Second, as pelvic size is at the minimum at the midplane, the sexual differences in CMDs are the result of selection with respect to obstetrics. Third, four explanations for the low CMDs are discussed: 1) lack of populationally or racially specific analysis; 2) nonlinear relationship between pelvic size and nonpelvic measures of body size; 3) combination of negative allometric selection between newborn body weight and maternal stature and weight with positive selection for maternal pelvic size; and 4) hormonally induced increase in pelvic capacity during parturition. (C) 2000 Wiley-Liss, Inc.","Clavicle; Femur; Obstetrics; Pelvis; Sexual difference","article; body build; body size; childbirth; clavicle; controlled study; female; femur; human; labor complication; male; maternal welfare; pelvic girdle; sex difference; Animals; Evolution; Female; Humans; Indians, North American; Male; Pelvis; Regression Analysis",Article,"Final",,Scopus,2-s2.0-0033938955
"Steyn M., Pretorius E., Hutten L.","7006176987;8252586100;6506491565;","Geometric morphometric analysis of the greater sciatic notch in South Africans",2004,"HOMO- Journal of Comparative Human Biology","54","3",,"197","206",,54,"10.1078/0018-442X-00076","https://www.scopus.com/inward/record.uri?eid=2-s2.0-3042660885&doi=10.1078%2f0018-442X-00076&partnerID=40&md5=2d3c6b0919be561921808922fa3ff7db","Dept. of Anatomy, University of Pretoria, South Africa; Department of Anatomy, University of Pretoria, POBox 2034, Pretoria 0001, South Africa","Steyn, M., Dept. of Anatomy, University of Pretoria, South Africa, Department of Anatomy, University of Pretoria, POBox 2034, Pretoria 0001, South Africa; Pretorius, E., Dept. of Anatomy, University of Pretoria, South Africa; Hutten, L., Dept. of Anatomy, University of Pretoria, South Africa","The width of the greater sciatic notch of the pelvis is a characteristic commonly used to determine sex in unknown individuals. Recent research on South African skeletal material indicated that this feature may not be so reliable, especially in South African white males. In this study the greater sciatic notches of 115 known skeletons of South African origin were analysed using geometric morphometrics. Geometric morphometrics is a relatively new method that helps to quantify shape. Using this method, it was observed that South African black males have the typical narrow shape, while both the black and white females have typical wide notches. The white males, however, showed a very wide variation and their shapes scattered across the range. The shape of the greater sciatic notch is therefore not reliable to use in sex determination in this population group. Geometric morphometric analysis proved to be a valuable and reliable method to verify morphological characteristics observed with more traditional methods.",,"article; controlled study; female; geometry; human; human tissue; male; morphometrics; race difference; sciatic nerve; sex determination; sex difference; skeleton; South America",Article,"Final",,Scopus,2-s2.0-3042660885
"Kurki H.K.","24070932100;","Protection of obstetric dimensions in a small-bodied human sample",2007,"American Journal of Physical Anthropology","133","4",,"1152","1165",,52,"10.1002/ajpa.20636","https://www.scopus.com/inward/record.uri?eid=2-s2.0-34547471114&doi=10.1002%2fajpa.20636&partnerID=40&md5=60ad3c58bed301d44bb6b495d91509a2","Department of Anthropology, University Victoria, STN CSC, P.O. Box 3050, Victoria, BC V8W 3P5, Canada","Kurki, H.K., Department of Anthropology, University Victoria, STN CSC, P.O. Box 3050, Victoria, BC V8W 3P5, Canada","In human females, the bony pelvis must find a balance between being small (narrow) for efficient bipedal locomotion, and being large to accommodate a relatively large newborn. It has been shown that within a given population, taller/larger-bodied women have larger pelvic canals. This study investigates whether in a population where small body size is the norm, pelvic geometry (size and shape), on average, shows accommodation to protect the obstetric canal. Osteometric data were collected from the pelves, femora, and clavicles (body size indicators) of adult skeletons representing a range of adult body size. Samples include Holocene Later Stone Age (LSA) foragers from southern Africa (n = 28 females, 31 males), Portuguese from the Coimbra-identified skeletal collection (CISC) (n = 40 females, 40 males) and European-Americans from the Hamann-Todd osteological collection (H-T) (n = 40 females, 40 males). Patterns of sexual dimorphism are similar in the samples. Univariate and multivariate analyses of raw and Mosimann shape-variables indicate that compared to the CISC and H-T females, the LSA females have relatively large midplane and outlet canal planes (particularly posterior and A-P lengths). The LSA males also follow this pattern, although with absolutely smaller pelves in multivariate space. The CISC females, who have equally small stature, but larger body mass, do not show the same type of pelvic canal size and shape accommodation. The results suggest that adaptive allometric modeling in at least some small-bodied populations protects the obstetric canal. These findings support the use of population-specific attributes in the clinical evaluation of obstetric risk. ©2007 Wiley-Liss, Inc.","Body size; Later Stone Age; Morphometric analysis; Pelvis","allometry; article; body height; body mass; body size; clavicle; female; femur; forager; geological time; geometry; human; inguinal canal; Late Holocene; locomotion; male; measurement; morphometrics; multivariate analysis; pelvis; sex difference; South Africa; univariate analysis; Adaptation, Biological; Analysis of Variance; Anthropometry; Body Size; Clavicle; Female; Femur; Humans; Male; Multivariate Analysis; Pelvis; Sex Characteristics",Article,"Final",,Scopus,2-s2.0-34547471114
"Kelley M.A.","7403230404;","Sex determination with fragmented skeletal remains",1979,"Journal of Forensic Sciences","24","1",,"154","158",,49,,"https://www.scopus.com/inward/record.uri?eid=2-s2.0-0018370753&partnerID=40&md5=8f965cc0ef8c9ae8ec0e4940bc2e399a","Dept. Anthropol., Case West. Reserve Univ., Cleveland, Ohio, United States","Kelley, M.A., Dept. Anthropol., Case West. Reserve Univ., Cleveland, Ohio, United States","In fragmentaary adult skeletal remains, sex determination is frequently more difficult and reliability is lowered. The grater sciatic notch/acetabular index uses more durable portions of the pelvis and offers 90% or better reliability. When used in conjunction with other skeletal features and available artifacts, its reliability will be reinforced.",,"bone; diagnosis; forensic medicine; legal aspect; pelvis; sex determination; sex difference; skeleton; Acetabulum; Anthropometry; Female; Forensic Medicine; Human; Ischium; Male; Pelvic Bones; Sex Determination (Analysis)",Article,"Final",,Scopus,2-s2.0-0018370753
