Authors,Author(s) ID,Title,Year,Source title,Volume,Issue,Art. No.,Page start,Page end,Page count,Cited by,DOI,Link,Affiliations,Authors with affiliations,Abstract,Author Keywords,Index Keywords,Document Type,Publication Stage,Access Type,Source,EID
"Işcan M.Y., Derrick K.","","Determination of sex from the sacroiliac joint: A visual assessment technique",1984,"Florida Sci","47","2",,"94","98",,45,,,,"Işcan, M.Y.; Derrick, K.",[No abstract available],,,,"Final",,Scopus,2-s2.0-0002540193
"Camilleri A.P.","7003374295;","The obstetric significance of short stature",1981,"European Journal of Obstetrics and Gynecology and Reproductive Biology","12","6",,"347","356",,45,"10.1016/0028-2243(81)90080-0","https://www.scopus.com/inward/record.uri?eid=2-s2.0-0019773319&doi=10.1016%2f0028-2243%2881%2990080-0&partnerID=40&md5=2b2e95697fafb34a8b7290980fcf1801","Southampton General Hospital, Southampton, United Kingdom","Camilleri, A.P., Southampton General Hospital, Southampton, United Kingdom","A study is made of the obstetric performance of 2791 Maltese women in relation to their stature, the height of almost two-thirds of these mothers was 5 ft. or less. It is confirmed that today the shorter woman continues to carry a higher risk of low birth-weight, cesarean section, low Apgar score, and a bad obstetric history. It should be remembered that whereas maternal height is an index of the woman's general health and nutritional status from her childhood, yet a major role is also played by genetic factors. The obstetric significance of a particular height should be related to the patient's own genetic background. Obstetric management in relation to maternal height entails different cut-off points for different populations. © 1981.","birth-weight; nutrition; pelvis","apgar score; cesarean section; etiology; low birth weight; major clinical study; newborn; pregnancy; short stature; therapy; Adult; Apgar Score; Birth Weight; Body Height; Cesarean Section; Female; Fetal Death; Human; Infant, Low Birth Weight; Infant, Newborn; Labor Complications; Male; Malta; Obstetrical Forceps; Parity; Pregnancy; Pregnancy Complications",Article,"Final",,Scopus,2-s2.0-0019773319
"Betti L., von Cramon-Taubadel N., Manica A., Lycett S.J.","26429046600;23471109300;6603416293;9434693200;","Global Geometric Morphometric Analyses of the Human Pelvis Reveal Substantial Neutral Population History Effects, Even across Sexes",2013,"PLoS ONE","8","2", e55909,"","",,43,"10.1371/journal.pone.0055909","https://www.scopus.com/inward/record.uri?eid=2-s2.0-84873585922&doi=10.1371%2fjournal.pone.0055909&partnerID=40&md5=c22f79b67733286ddaf992f91a6d122a","Department of Anthropology, School of Anthropology and Conservation, University of Kent, Canterbury, United Kingdom; Department of Archaeology and Anthropology, University of Cambridge, Cambridge, United Kingdom; Department of Zoology, University of Cambridge, Cambridge, United Kingdom","Betti, L., Department of Anthropology, School of Anthropology and Conservation, University of Kent, Canterbury, United Kingdom, Department of Archaeology and Anthropology, University of Cambridge, Cambridge, United Kingdom; von Cramon-Taubadel, N., Department of Anthropology, School of Anthropology and Conservation, University of Kent, Canterbury, United Kingdom; Manica, A., Department of Zoology, University of Cambridge, Cambridge, United Kingdom; Lycett, S.J., Department of Anthropology, School of Anthropology and Conservation, University of Kent, Canterbury, United Kingdom","Recent applications of population genetic models to human craniodental traits have revealed a strong neutral component to patterns of global variation. However, little work has been undertaken to determine whether neutral processes might also be influencing the postcranium, perhaps due to substantial evidence for selection and plastic environmental responses in these regions. Recent work has provided evidence for neutral effects in the pelvis, but has been limited in regard to shape data (small numbers of linear measurements) and restricted only to males. Here, we use geometric morphometric methods to examine population variation in the human os coxae (pelvic bone) in both males and females. Neutrality is examined via apportionment of variance patterns and fit to an Out-of-Africa serial founder effect model, which is known to structure neutral genetic patterns. Moreover, we compare males and females directly, and the true versus false pelvis, in order to examine potential obstetrical effects. Our results indicate evidence for substantial neutral population history effects on pelvic shape variation. They also reveal evidence for the effect of obstetrical constraints, but these affect males and females to equivalent extents. Our results do not deny an important role for selection in regard to specific aspects of human pelvic variation, especially in terms of features associated with body size and proportions. However, our analyses demonstrate that at a global level, the shape of the os coxae reveals substantial evidence for neutral variation. Our analyses thus indicate that population variation in the human pelvis might be used to address important questions concerning population history, just as the human cranium has done. © 2013 Betti et al.",,"analog digital converter; anatomic landmark; anatomic model; anatomical variation; article; body size; comparative anatomy; controlled study; female; geographic distribution; geographic origin; hip; human; human experiment; human tissue; male; mathematical computing; morphometrics; pelvic girdle; pelvis; phenotypic variation; population research; sex determination; sex difference; Biological Evolution; Female; Founder Effect; Genetics, Population; Humans; Male; Models, Theoretical; Pelvis; Phenotype; Selection, Genetic; Sex Characteristics",Article,"Final",Open Access,Scopus,2-s2.0-84873585922
"Bytheway J.A., Ross A.H.","26031935600;7402568108;","A geometric morphometric approach to sex determination of the human adult os coxa",2010,"Journal of Forensic Sciences","55","4",,"859","864",,39,"10.1111/j.1556-4029.2010.01374.x","https://www.scopus.com/inward/record.uri?eid=2-s2.0-77954344705&doi=10.1111%2fj.1556-4029.2010.01374.x&partnerID=40&md5=8d7534596cd5d438d6f365778d872810","College of Criminal Justice, Forensic Science, Sam Houston State University, Huntsville, TX 77341-2525, United States; Department of Sociology and Anthropology, North Carolina State University, Raleigh, NC 27695-8107, United States","Bytheway, J.A., College of Criminal Justice, Forensic Science, Sam Houston State University, Huntsville, TX 77341-2525, United States; Ross, A.H., Department of Sociology and Anthropology, North Carolina State University, Raleigh, NC 27695-8107, United States","Sex determination of the human skeleton is best assessed from the os coxa. The present study explored the possibility of using three-dimensional landmark coordinate data collected from various landmarks located over the entire bone to determine whether there were significant sex differences local to the landmarks. Thirty-six landmarks were digitized on 200 African American and European American male and female adult human os coxae. MANCOVA results show that sex and size have a significant effect on shape for both European Americans (Sex, F = 17.50, d.f. = 36, 63, p > F = 0.0001; Size, F = 2.56, d.f. = 36, 63, p > F = 0.0022) and African Americans (Sex, F = 21.18, d.f. = 36, 63, p > F = 0.0001; Size, F = 2.59, d.f. = 36, 63, p > F = 0.0005). The discriminant analysis shows that sexing accuracy for European Americans is 98% for both males and females, 98% for African American females, and 100% for African American males. © 2010 American Academy of Forensic Sciences.","discriminant function analysis; forensic anthropology; forensic science; geometric morphometrics; os coxa; sex determination","adult; article; Caucasian; computer program; discriminant analysis; female; histology; human; image processing; male; methodology; Negro; pelvic girdle; physical anthropology; principal component analysis; sex determination; Adult; African Continental Ancestry Group; Discriminant Analysis; European Continental Ancestry Group; Female; Forensic Anthropology; Humans; Image Processing, Computer-Assisted; Male; Pelvic Bones; Principal Component Analysis; Sex Determination by Skeleton; Software",Article,"Final",,Scopus,2-s2.0-77954344705
"Tague R.G.","6603550525;","Big-bodied males help us recognize that females have big pelves",2005,"American Journal of Physical Anthropology","127","4",,"392","405",,39,"10.1002/ajpa.20226","https://www.scopus.com/inward/record.uri?eid=2-s2.0-22544478437&doi=10.1002%2fajpa.20226&partnerID=40&md5=346a0d9958db74cea995f9cf0f15643e","Department of Geography and Anthropology, Louisiana State University, Baton Rouge, LA 70803-4105, United States","Tague, R.G., Department of Geography and Anthropology, Louisiana State University, Baton Rouge, LA 70803-4105, United States","Schultz ([1949] Am. J. Phys. Anthropol. 7:401-424) presented a conundrum: among primates, sexual dimorphism of the pelvis is a developmental adjunct to dimorphism in other aspects of the body, albeit in the converse direction. Among species in which males are larger than females in body size, females are larger than males in some pelvic dimensions; species with little sexual dimorphism in nonpelvic size show little pelvic dimorphism. Obstetrical difficulty does not explain this relationship. The present study addresses this issue, evaluating the relationship between pelvic and femoral sexual dimorphism in 12 anthropoid species. The hypothesis is that species in which males are significantly larger than females in femoral size will have a higher incidence, magnitude, and variability of pelvic sexual dimorphism, with females having relatively larger pelves than males, compared with species monomorphic in femoral size. The results are consistent with the hypothesis. The proposed explanation is that the default pelvic anatomy in adulthood is that of the female; testosterone redirects growth from the default type to that of the male by differentially enhancing and repressing growth among the pelvic dimensions. Testosterone also influences sexual dimorphism of the femur. The magnitude of the pelvic response to testosterone is greater in species that are sexually dimorphic in the femur than in those that are monomorphic. © 2004 Wiley-Liss, Inc.","Obstetrics; Pelvis; Primate; Sexual dimorphism; Testosterone; Variability","testosterone; article; body mass; female; femur head; male; measurement; nonhuman; pelvis; primate; sex difference; species differentiation; Animals; Anthropometry; Body Size; Female; Femur; Male; Pelvic Bones; Primates; Sex Characteristics",Article,"Final",,Scopus,2-s2.0-22544478437
"Kurki H.K.","24070932100;","Bony pelvic canal size and shape in relation to body proportionality in humans",2013,"American Journal of Physical Anthropology","151","1",,"88","101",,34,"10.1002/ajpa.22243","https://www.scopus.com/inward/record.uri?eid=2-s2.0-84876464940&doi=10.1002%2fajpa.22243&partnerID=40&md5=5899bdff4bc92f940b741c714e8a1171","Department of Anthropology, University of Victoria, P.O. Box 1700, STN CSC, Victoria, BC, V8W 2Y2, Canada","Kurki, H.K., Department of Anthropology, University of Victoria, P.O. Box 1700, STN CSC, Victoria, BC, V8W 2Y2, Canada","Obstetric selection acts on the female pelvic canal to accommodate the human neonate and contributes to pelvic sexual dimorphism. There is a complex relationship between selection for obstetric sufficiency and for overall body size in humans. The relationship between selective pressures may differ among populations of different body sizes and proportions, as pelvic canal dimensions vary among populations. Size and shape of the pelvic canal in relation to body size and shape were examined using nine skeletal samples (total female n = 57; male n = 84) from diverse geographical regions. Pelvic, vertebral, and lower limb bone measurements were collected. Principal component analyses demonstrate pelvic canal size and shape differences among the samples. Male multivariate variance in pelvic shape is greater than female variance for North and South Africans. High-latitude samples have larger and broader bodies, and pelvic canals of larger size and, among females, relatively broader medio-lateral dimensions relative to low-latitude samples, which tend to display relatively expanded inlet antero-posterior (A-P) and posterior canal dimensions. Differences in canal shape exist among samples that are not associated with latitude or body size, suggesting independence of some canal shape characteristics from body size and shape. The South Africans are distinctive with very narrow bodies and small pelvic inlets relative to an elongated lower canal in A-P and posterior lengths. Variation in pelvic canal geometry among populations is consistent with a high degree of evolvability in the human pelvis. © 2013 Wiley Periodicals, Inc.","body proportions; ecogeographic variation; morphometric analysis; obstetric selection; pelvis","article; body build; body size; female; human; latitude; leg; male; morphology; morphometrics; pelvis; principal component analysis; Analysis of Variance; Anthropology, Physical; Anthropometry; Body Size; Continental Population Groups; Female; Femur; Humans; Male; Pelvic Bones; Principal Component Analysis; Sex Factors",Article,"Final",,Scopus,2-s2.0-84876464940
"Rissech C., Sañudo J.R., Malgosa A.","7801369763;7003741747;6602449452;","The acetabular point: A morphological and ontogenetic study",2001,"Journal of Anatomy","198","6",,"743","748",,32,"10.1017/S0021878201007932","https://www.scopus.com/inward/record.uri?eid=2-s2.0-0034935688&doi=10.1017%2fS0021878201007932&partnerID=40&md5=59e012c63c528049b38968ac301581db","Departament de Biologia Animal, Vegetal i Ecologia, Unitat d'Antropologia, Spain; Departament de Ciencies Morfològiques i Embriologia, Universitat Autònoma de Barcelona, Spain; Departament de Biologia Animal, Vegetal i Ecologia, Unitat d'Antropologia, Universitat Autònoma de Barcelona, Edifici C, 08193 Bellaterra, Spain","Rissech, C., Departament de Biologia Animal, Vegetal i Ecologia, Unitat d'Antropologia, Spain; Sañudo, J.R., Departament de Ciencies Morfològiques i Embriologia, Universitat Autònoma de Barcelona, Spain; Malgosa, A., Departament de Biologia Animal, Vegetal i Ecologia, Unitat d'Antropologia, Spain, Departament de Biologia Animal, Vegetal i Ecologia, Unitat d'Antropologia, Universitat Autònoma de Barcelona, Edifici C, 08193 Bellaterra, Spain","The acetabular point was analysed by studying human pelvic bones from 326 individuals ranging from newborns to age 97 y. The bones were categorised into 3 groups according to the degree of fusion for the 3 elements of the pelvis: nonfused (59), semifused (5) and fused (262). The acetabular point in immature pelvic bones is clearly represented by the point of the fusion lines for each bony element at the level of the acetabular fossa. In adult pelvic bones the acetabular fossa has an irregular clover-leaf shape, the superior lobe being smaller than the anterior and posterior lobes. Cross-sectional analysis of acetabular morphology suggested that the acetabular point in adult pelvic bones is always represented by the indentation between the superior and the anterior lobes of the acetabular fossa.","Acetabulum; Bone; Pelvis","acetabulum; adolescent; adult; age; aged; analysis; article; bone; child; controlled study; human; human tissue; infant; morphology; newborn; ontogeny; pelvic girdle; pelvis; priority journal; Acetabulum; Adolescent; Adult; Aged; Aged, 80 and over; Child; Child, Preschool; Female; Humans; Infant; Infant, Newborn; Male; Middle Aged; Pelvic Bones",Article,"Final",,Scopus,2-s2.0-0034935688
"Betti L., von Cramon-Taubadel N., Manica A., Lycett S.J.","26429046600;23471109300;6603416293;9434693200;","The interaction of neutral evolutionary processes with climatically-driven adaptive changes in the 3D shape of the human os coxae",2014,"Journal of Human Evolution","73",,,"64","74",,26,"10.1016/j.jhevol.2014.02.021","https://www.scopus.com/inward/record.uri?eid=2-s2.0-84905754659&doi=10.1016%2fj.jhevol.2014.02.021&partnerID=40&md5=193cb4004510a7cc1ca8b122ac67f2c5","Division of Biological Anthropology, Department of Archaeology and Anthropology, University of Cambridge, Cambridge CB2 3QG, United Kingdom; Department of Anthropology, University at Buffalo, SUNY, Buffalo, NY 14261-0005, United States; Department of Zoology, University of Cambridge, Cambridge CB2 3EJ, United Kingdom","Betti, L., Division of Biological Anthropology, Department of Archaeology and Anthropology, University of Cambridge, Cambridge CB2 3QG, United Kingdom; von Cramon-Taubadel, N., Department of Anthropology, University at Buffalo, SUNY, Buffalo, NY 14261-0005, United States; Manica, A., Department of Zoology, University of Cambridge, Cambridge CB2 3EJ, United Kingdom; Lycett, S.J., Department of Anthropology, University at Buffalo, SUNY, Buffalo, NY 14261-0005, United States","Differences in the breadth of the pelvis among modern human populations and among extinct hominin species have often been interpreted in the light of thermoregulatory adaptation, whereby a larger pelvic girdle would help preserve body temperature in cold environments while a narrower pelvis would help dissipate heat in tropical climates. There is, however, a theoretical problem in interpreting a pattern of variation as evidence of selection without first accounting for the effects of neutral evolutionary processes (i.e., mutation, genetic drift and migration). Here, we analyse 3D configurations of 27 landmarks on the os coxae of 1494 modern human individuals representing 30 male and 23 female populations from five continents and a range of climatic conditions. We test for the effects of climate on the size and shape of the pelvic bone, while explicitly accounting for population history (i.e., geographically-mediated gene flow and genetic drift). We find that neutral processes account for a substantial proportion of shape variance in the human os coxae in both sexes. Beyond the neutral pattern due to population history, temperature is a significant predictor of shape and size variation in the os coxae, at least in males. The effect of climate on the shape of the pelvic bone, however, is comparatively limited, explaining only a small percentage of shape variation in males and females. In accordance with previous hypotheses, the size of the os coxae tends to increase with decreasing temperature, although the significance of the association is reduced when population history is taken into account. In conclusion, the shape and size of the human os coxae reflect both neutral evolutionary processes and climatically-driven adaptive changes. Neutral processes have a substantial effect on pelvic variation, suggesting such factors will need to be taken into account in future studies of human and fossil hominin coxal variation. © 2014 Elsevier Ltd.","Climate; Neutral variation; Pelvis; Selection","bone; climate conditions; climate effect; fossil; hominid; human evolution; selection; shape; size; adaptation; anatomy and histology; climate; evolution; female; genetic drift; human; male; migration; pelvic girdle; Adaptation, Biological; Biological Evolution; Climate; Female; Genetic Drift; Human Migration; Humans; Male; Pelvic Bones",Article,"Final",,Scopus,2-s2.0-84905754659
"Wood B.A., Chamberlain A.T.","7401873883;7101825522;","The primate pelvis: Allometry or sexual dimorphism?",1986,"Journal of Human Evolution","15","4",,"257","263",,26,"10.1016/S0047-2484(86)80053-7","https://www.scopus.com/inward/record.uri?eid=2-s2.0-0022912613&doi=10.1016%2fS0047-2484%2886%2980053-7&partnerID=40&md5=ba3164ef798f49701b57a1bf4eb4872f","Department of Human Anatomy and Cell Biology, The University of Liverpool, P.O. Box 147, Liverpool, L69 3BX England, United Kingdom","Wood, B.A., Department of Human Anatomy and Cell Biology, The University of Liverpool, P.O. Box 147, Liverpool, L69 3BX England, United Kingdom; Chamberlain, A.T., Department of Human Anatomy and Cell Biology, The University of Liverpool, P.O. Box 147, Liverpool, L69 3BX England, United Kingdom","In several primate species the pelvic skeleton exhibits marked sexual dimorphism. Some workers have proposed that the structure of the female primate pelvis is influenced by the presence of the birth canal, but others have sought to explain pelvic dimorphism as the allometric consequence of differences in body size between the sexes. Measurements of five pelvic dimensions together with the length of the femur (an indicator of overall body size) were obtained for several species of primates including modern man. In some species the females exhibit differential pelvic growth, resulting in a difference between the size dimorphism of the pelvis and that of the femur. Differential female pelvic growth is confined to pelvic dimensions that are related to the size of the birth canal, confirming previous suggestions that relative neonatal size is a determinant of pelvic dimorphism in primates. © 1986 Academic Press Inc. (London) Limited.","allometry; Cercopithecus; Colobus; Gorilla; Homo; Pan; Papio; pelvis; Presbytis; sexual dimorphism","allometry; ape; bone; human; monkey; pelvis; sex difference",Article,"Final",,Scopus,2-s2.0-0022912613
"Kurki H.K.","24070932100;","Skeletal variability in the pelvis and limb skeleton of humans: Does stabilizing selection limit female pelvic variation?",2013,"American Journal of Human Biology","25","6",,"795","802",,24,"10.1002/ajhb.22455","https://www.scopus.com/inward/record.uri?eid=2-s2.0-84886286477&doi=10.1002%2fajhb.22455&partnerID=40&md5=f18a0aad9442227b791b372e548de8d9","Department of Anthropology, University of Victoria, Victoria, BC, V8W 2Y2, Canada","Kurki, H.K., Department of Anthropology, University of Victoria, Victoria, BC, V8W 2Y2, Canada","Objectives: This study tests the hypothesis, a correlate of the obstetric dilemma, that skeletal variability in the human female pelvic canal is limited owing to the action of stabilizing selection. Levels of variation in three skeletal regions (pelvic canal, noncanal pelvis, and limbs) of females and males are compared to each other and between sexes. Methods: Nine human skeletal samples (total female n=101; male n=117) representing diverse populations were included. Osteometric data were collected from the articulated pelvis, os coxa, sacrum, femur, tibia, humerus, radius, and clavicle. Coefficients of variation, adjusted for small sample size (V*), were calculated for variables in separate samples by sex, and mean V*s were taken for the skeletal regions. Size variances were measured as V* of the geometric mean (GM) of the skeletal region variables. Using nonparametric methods, coefficients were compared between sexes and skeletal regions and correlations among V*s were calculated. Results: Females and males do not differ in levels of variation for any skeletal region. The pelvic canal is the most variable region in both sexes, while size variability (GM) is similar among the three skeletal regions. Across the samples, canal and noncanal pelvic regions share patterns of variability in females but not males, while variability of the limb skeleton is independent in both sexes. Conclusions: The results suggest that stabilizing selection does not limit variability in the female pelvic canal. Biological plasticity may be greater in the canal than that in other skeletal regions. © 2013 Wiley Periodicals, Inc.",,"anthropometry; article; bones of the arm and hand; female; genetic selection; histology; human; leg; male; pelvic girdle; sexual development; Anthropometry; Arm Bones; Female; Humans; Leg Bones; Male; Pelvic Bones; Selection, Genetic; Sex Characteristics",Article,"Final",,Scopus,2-s2.0-84886286477
