Authors,Author(s) ID,Title,Year,Source title,Volume,Issue,Art. No.,Page start,Page end,Page count,Cited by,DOI,Link,Affiliations,Authors with affiliations,Abstract,Author Keywords,Index Keywords,Document Type,Publication Stage,Access Type,Source,EID
"Benazzi S., Nguyen H.N., Schulz D., Grosse I.R., Gruppioni G., Hublin J.-J., Kullmer O.","24068504800;55660078900;35171298600;7005946636;6603411020;6602606027;6508188094;","The Evolutionary Paradox of Tooth Wear: Simply Destruction or Inevitable Adaptation?",2013,"PLoS ONE","8","4", e62263,"","",,19,"10.1371/journal.pone.0062263","https://www.scopus.com/inward/record.uri?eid=2-s2.0-84876584680&doi=10.1371%2fjournal.pone.0062263&partnerID=40&md5=1fcb82f614846dd4d869d672d66d9d7a","Department of Human Evolution, Max Planck Institute for Evolutionary Anthropology, Leipzig, Germany; Dental Workshop Bensheim, Private Laboratory for Training, Research and Methods, Heppenheim, Germany; Department of Mechanical and Industrial Engineering, University of Massachusetts, Amherst, MA, United States; Department of Cultural Heritage, University of Bologna, Ravenna, Italy; Department of Palaeoanthropology and Messel Research, Senckenberg Research Institute, Frankfurt am Main, Germany","Benazzi, S., Department of Human Evolution, Max Planck Institute for Evolutionary Anthropology, Leipzig, Germany; Nguyen, H.N., Department of Human Evolution, Max Planck Institute for Evolutionary Anthropology, Leipzig, Germany; Schulz, D., Dental Workshop Bensheim, Private Laboratory for Training, Research and Methods, Heppenheim, Germany; Grosse, I.R., Department of Mechanical and Industrial Engineering, University of Massachusetts, Amherst, MA, United States; Gruppioni, G., Department of Cultural Heritage, University of Bologna, Ravenna, Italy; Hublin, J.-J., Department of Human Evolution, Max Planck Institute for Evolutionary Anthropology, Leipzig, Germany; Kullmer, O., Department of Palaeoanthropology and Messel Research, Senckenberg Research Institute, Frankfurt am Main, Germany","Over the last century, humans from industrialized societies have witnessed a radical increase in some dental diseases. A severe problem concerns the loss of dental materials (enamel and dentine) at the buccal cervical region of the tooth. This ""modern-day"" pathology, called non-carious cervical lesions (NCCLs), is ubiquitous and worldwide spread, but is very sporadic in modern humans from pre-industrialized societies. Scholars believe that several factors are involved, but the real dynamics behind this pathology are far from being understood. Here we use an engineering approach, finite element analysis (FEA), to suggest that the lack of dental wear, characteristic of industrialized societies, might be a major factor leading to NCCLs. Occlusal loads were applied to high resolution finite element models of lower second premolars (P2) to demonstrate that slightly worn P2s envisage high tensile stresses in the buccal cervical region, but when worn down artificially in the laboratory the pattern of stress distribution changes and the tensile stresses decrease, matching the results obtained in naturally worn P2s. In the modern industrialized world, individuals at advanced ages show very moderate dental wear when compared to past societies, and teeth are exposed to high tensile stresses at the buccal cervical region for decades longer. This is the most likely mechanism explaining enamel loss in the cervical region, and may favor the activity of other disruptive processes such as biocorrosion. Because of the lack of dental abrasion, our masticatory apparatus faces new challenges that can only be understood in an evolutionary perspective. © 2013 Benazzi et al.",,"adaptation; article; cheek; corrosion; finite element analysis; human; human tissue; malocclusion; mastication; molecular evolution; morphology; premolar tooth; stress; tooth brushing; tooth disease; Adaptation, Physiological; Computer Simulation; Dental Occlusion; Dental Stress Analysis; Female; Humans; Male; Models, Biological; Tensile Strength; Tooth Diseases; Tooth Wear",Article,"Final",Open Access,Scopus,2-s2.0-84876584680
"Pei J.X.","","Thermoluminescence of the Peking Man site and other caves",1985,"Multi-disciplinary Study of the Peking Man Site at Zhoukoudian",,,,"256","260",,19,,,,"Pei, J.X.",[No abstract available],,,,,,Scopus,2-s2.0-0002787344
"Zhou C., Liu Z., Wang Y., Huang Q.","7403346603;7406673225;35604860600;55467510100;","Climatic cycles investigated by sediment analysis in Peking Man's cave, Zhoukoudian, China",2000,"Journal of Archaeological Science","27","2",,"101","110",,18,"10.1006/jasc.1999.0428","https://www.scopus.com/inward/record.uri?eid=2-s2.0-0034035210&doi=10.1006%2fjasc.1999.0428&partnerID=40&md5=83caf3c56a4de20555dcd3c1d05ded99","Geo-science College, Nanjing Normal University, Nanjing, 210097, China; Department of Geography, Xuzou Normal University, Xuzou, 221001, China","Zhou, C., Geo-science College, Nanjing Normal University, Nanjing, 210097, China; Liu, Z., Geo-science College, Nanjing Normal University, Nanjing, 210097, China; Wang, Y., Geo-science College, Nanjing Normal University, Nanjing, 210097, China; Huang, Q., Department of Geography, Xuzou Normal University, Xuzou, 221001, China","The cave sediments at Locality 1 in Zhoukoudian, which are more than 40 m thick, have been divided into 17 layers. According to recent dating by thermal ionization mass spectrometry (TIMS), the age of the sediments has been increased by about 200 ka. On the basis of cluster and factor analyses of mammal fossils and sporopollen in the cave sediments and of the vicarious paleoclimatic indexes, such as the weathering index and content of trace elements, the paleoclimatic cycles recorded by the cave sediments have been quantitatively established. Based on the age of Layer 2 (410 ka BP by TIMS) and the occurrence of the Brunhes/Matuyana palaeomagnetic boundary in the upper part of Layer 14, Layers 1-14 of the cave sediments may be recorrelated with Stages 11-19 of the δ18O curve of deep-sea cores or S4-S7 of the loess sequences in China. The secondary climatic variations in each paleoclimatic cycle may be correlated to one another to some extent. According to deep-sea core chronology the Upper Culture Layer (Layer 4), the Lower Culture Layer (Layer 8-9) and the Bottom Culture Layer (Layer 10) were formed between about 470 and 670 ka BP and Peking Man should be at least 400 ka old.","Cave sediments; Climatic cycles; Peking Man; Synthetic index; Tims dating; Zhoukoudian","climate cycle; paleoclimate; sediment analysis; Beijing; China; Zhoukoudian",Article,"Final",,Scopus,2-s2.0-0034035210
"Zanolli C., Grine F.E., Kullmer O., Schrenk F., Macchiarelli R.","35410978200;35431800400;6508188094;6603042411;6701717392;","Brief Communication: The early Pleistocene deciduous hominid molar FS-72 from the Sangiran dome of Java, Indonesia: A taxonomic reappraisal based on its comparative endostructural characterization",2015,"American Journal of Physical Anthropology","157","4",,"666","674",,16,"10.1002/ajpa.22748","https://www.scopus.com/inward/record.uri?eid=2-s2.0-84947044726&doi=10.1002%2fajpa.22748&partnerID=40&md5=cbc8aecdaca074ed0607d16933d8b37b","Multidisciplinary Laboratory, International Centre for Theoretical Physics, via Beirut 31, Trieste, 34014, Italy; Department of Anthropology, Stony Brook University, Stony Brook, NY, United States; Department of Anatomical Sciences, Stony Brook University, Stony Brook, NY, United States; Department of Palaeoanthropology, Senckenberg Research Institute, Frankfurt Am Main, Germany; Department of Vertebrate Paleontology, Johann Wolfgang Goethe University, Frankfurt, Germany; Département de Préhistoire, UMR 7194, Muséum National d'Histoire Naturelle, Paris, France; Département Géosciences, Université de Poitiers, Poitiers, France","Zanolli, C., Multidisciplinary Laboratory, International Centre for Theoretical Physics, via Beirut 31, Trieste, 34014, Italy; Grine, F.E., Department of Anthropology, Stony Brook University, Stony Brook, NY, United States, Department of Anatomical Sciences, Stony Brook University, Stony Brook, NY, United States; Kullmer, O., Department of Palaeoanthropology, Senckenberg Research Institute, Frankfurt Am Main, Germany; Schrenk, F., Department of Palaeoanthropology, Senckenberg Research Institute, Frankfurt Am Main, Germany, Department of Vertebrate Paleontology, Johann Wolfgang Goethe University, Frankfurt, Germany; Macchiarelli, R., Département de Préhistoire, UMR 7194, Muséum National d'Histoire Naturelle, Paris, France, Département Géosciences, Université de Poitiers, Poitiers, France","Objectives: Among the ten fossil hominid deciduous teeth reported so far from the Pleistocene sediments of the Sangiran Dome of Java are two isolated lower second molars: specimens PCG.2 from the Kabuh Formation and FS-72 from the Pucangan Formation. While PCG.2 appears to be certainly attributable to Homo erectus, FS-72 is somewhat more problematic, even though it is commonly listed within the Indonesian H. erectus hypodigm. Largely because of its large size, it was originally attributed to Meganthropus paleojavanicus. Subsequent study highlighted a set of metric and nonmetric crown features also found in Australopith and African early Homo (notably H. habilis) homologues. An additional problem with the taxonomic assignment of isolated teeth from the Pleistocene of Java is the presence of Pongo in these same deposits. Methods: To assess the taxonomic affinity of FS-72, we investigated its inner structure (tissue proportions and enamel-dentine junction morphology) by using techniques of 2-3D virtual imaging coupled with geometric morphometric analyses. Results: The results show that FS-72 has thinner enamel compared to fossil and recent humans and that its topographic repartition more closely follows the pongine pattern. It also exhibits a Pongo-like elongated morphology of the enamel-dentine junction, with proportionally lower and mesiodistally spaced dentine horns. Conclusions: Given the morphological and metric similarities between fossil orangutan and H. erectus molars, we tested the hypothesis that its internal morphology more closely resembles the patterns evinced by PCG.2 and modern humans than Pongo. Accordingly, we consider that FS-72 more likely represents a dm2 of Pongo rather than Homo. © 2015 Wiley Periodicals, Inc.","deciduous molar FS-72; Early Pleistocene; hominid paleobiodiversity; internal structure; Sangiran Dome","animal tissue; Article; comparative anatomy; controlled study; deciduous tooth; enamel; fossil hominid; Indonesia; morphometrics; nonhuman; quantitative analysis; structure analysis; taxonomic identification; anatomy and histology; animal; classification; fossil; hominid; human; molar tooth; orangutan; physical anthropology; three dimensional imaging; Animals; Dental Enamel; Fossils; Hominidae; Humans; Imaging, Three-Dimensional; Indonesia; Molar; Paleodontology; Pongo",Article,"Final",,Scopus,2-s2.0-84947044726
"Rich P.V., Hou L.H., Ono K., Baird R.F.","6602183345;56210559100;24445838800;36794342900;","A review of the fossil birds of China, Japan and Southeast Asia",1986,"Geobios","19","6",,"755","772",,16,"10.1016/S0016-6995(86)80106-1","https://www.scopus.com/inward/record.uri?eid=2-s2.0-0022916496&doi=10.1016%2fS0016-6995%2886%2980106-1&partnerID=40&md5=3c8ddcf215a15396863d000ebae417ae","Earth Sciences Department, Monash University, Clayton, Victoria 3168 and Museum of Victoria, Melbourne, Vic. 3000, Australia; Zoology Department, Monash University, Clayton, Victoria 3168 and Museum of Victoria, Melbourne, Vic. 3000, Australia; Institute of Vertebrate Paleontology and Paleoanthropology, Academia Sinica, P.O. Box, 643 Beijing, China; National Science Museum of Japan, Shinjuku, Tokyo, Japan; Earth Sciences Department, Monash University, Clayton, Vic. 3168, Australia","Rich, P.V., Earth Sciences Department, Monash University, Clayton, Victoria 3168 and Museum of Victoria, Melbourne, Vic. 3000, Australia, Institute of Vertebrate Paleontology and Paleoanthropology, Academia Sinica, P.O. Box, 643 Beijing, China, National Science Museum of Japan, Shinjuku, Tokyo, Japan; Hou, L.H., Zoology Department, Monash University, Clayton, Victoria 3168 and Museum of Victoria, Melbourne, Vic. 3000, Australia, National Science Museum of Japan, Shinjuku, Tokyo, Japan; Ono, K., Institute of Vertebrate Paleontology and Paleoanthropology, Academia Sinica, P.O. Box, 643 Beijing, China, National Science Museum of Japan, Shinjuku, Tokyo, Japan; Baird, R.F., National Science Museum of Japan, Shinjuku, Tokyo, Japan, Earth Sciences Department, Monash University, Clayton, Vic. 3168, Australia","To date very little is known of the history of birds in China, Japan and all of Southeast Asia (Brodkorb 1963, 1964, 1967, 1971, 1978; Kurotchkin 1976; Young 1932, 1975). Early Cretaceous birds have been recovered from Gansu Province in western China. A single bird bone has also been recovered marine Cretaceous sediments in Japan. Most of the early Cenozoic records are of gruiform birds, while late Cenozoic records constitute a variety of taxa, including some forms closely related to, or congeneric with, Struthio, as well as ducks (Anatidae), game birds (Galliformes), a few birds of prey (Falconiformes) and doves (Columbidae), so the length of the record is long, though not particularly rich. Recently work by Hou has vastly increased thediversity of Pleistocene birds from China, particularly from the Peking Man Site (Zhoukoudian) in North China. Yeh's analysis of four nearly complete avian skeletons from Miocene-aged caldera lake deposits of Shandong Province in central China, has given a better idea of whole animal biology of several groups of birds in the Oriental Realm, especially for the game birds. Hasegawa's, Ono's, and Olson's work on Japanese fossil birds is rapidly adding to knowledge from that area as well. Because of the current increased field activity, refined field techniques, and developing interest in fossil birds in both China and Japan, the quality of the record has increased markedly in the last five years. Fossil birds are extremely rare in the remainder ofSoutheast Asia and most are of Pleistocene age. Reanalysis of Protoplotus beauforti from early to mid-Cenozoic lacustrine sediments of Sumatra, by, van Tets, Rich, & Marino, suggests that it belongs in a family of its own within the Pelecaniformes. © 1986.","Avian Palaeobiogeography; Fossil Birds; Oriental Realm","Avian Paleobiogeography; Ratites",Review,"Final",,Scopus,2-s2.0-0022916496
"Martin R.M.G., Hublin J.-J., Gunz P., Skinner M.M.","57192948122;6602606027;6506472733;35724424000;","The morphology of the enamel–dentine junction in Neanderthal molars: Gross morphology, non-metric traits, and temporal trends",2017,"Journal of Human Evolution","103",,,"20","44",,15,"10.1016/j.jhevol.2016.12.004","https://www.scopus.com/inward/record.uri?eid=2-s2.0-85009345401&doi=10.1016%2fj.jhevol.2016.12.004&partnerID=40&md5=682d0386322764df4e3d4d1e161cb430","Department of Anthropology, University of Toronto, 19 Russell Street, Toronto, M5S 2S2, Canada; Department of Human Evolution, Max Planck Institute for Evolutionary Anthropology, Deutscher Platz 6, Leipzig, 04103, Germany; School of Anthropology and Conservation, University of Kent, Canterbury, CT2 7NZ, United Kingdom","Martin, R.M.G., Department of Anthropology, University of Toronto, 19 Russell Street, Toronto, M5S 2S2, Canada; Hublin, J.-J., Department of Human Evolution, Max Planck Institute for Evolutionary Anthropology, Deutscher Platz 6, Leipzig, 04103, Germany; Gunz, P., Department of Human Evolution, Max Planck Institute for Evolutionary Anthropology, Deutscher Platz 6, Leipzig, 04103, Germany; Skinner, M.M., Department of Human Evolution, Max Planck Institute for Evolutionary Anthropology, Deutscher Platz 6, Leipzig, 04103, Germany, School of Anthropology and Conservation, University of Kent, Canterbury, CT2 7NZ, United Kingdom","This study explores the morphological differences between the enamel–dentine junction (EDJ) of maxillary and mandibular molars of Neanderthals (n = 150) and recent modern humans (n = 106), and between an earlier Neanderthal sample (consisting of Pre-Eemian and Eemian Neanderthals dating to before 115 ka) and a later Neanderthal sample (consisting of Post-Eemian Neanderthals dating to after 115 ka). The EDJ was visualised by segmenting microtomographic scans of each molar. A geometric morphometric methodology compared the positioning of the dentine horns, the shape of the marginal ridge between the dentine horns, and the shape of the cervix. We also examined the manifestation of non-metric traits at the EDJ including the crista obliqua, cusp 5, and post-paracone tubercle. Furthermore, we report on additional morphological features including centrally placed dentine horn tips and twinned dentine horns. Our results indicate that EDJ morphology can discriminate with a high degree of reliability between Neanderthals and recent modern humans at every molar position, and discriminate between the earlier and the later Neanderthal samples at every molar position, except for the M3 in shape space. The cervix in isolation can also discriminate between Neanderthals and recent modern humans, except at the M3 in form space, and is effective at discriminating between the earlier and the later Neanderthal samples, except at the M2/M2 in form space. In addition to demonstrating the taxonomic valence of the EDJ, our analysis reveals unique manifestations of dental traits in Neanderthals and expanded levels of trait variation that have implications for trait definitions and scoring. © 2016 Elsevier Ltd","Dental morphology; EDJ; MicroCT; Molars; Neanderthal; Non-metric dental traits","dentition; Eemian; enamel; morphology; Neanderthal; Permian; taxonomy; trend analysis; anatomy and histology; animal; comparative study; dentin; enamel; fossil; Homo neanderthalensis; human; image processing; mandible; maxilla; molar tooth; Animals; Dental Enamel; Dentin; Fossils; Humans; Image Processing, Computer-Assisted; Mandible; Maxilla; Molar; Neanderthals",Article,"Final",,Scopus,2-s2.0-85009345401
"Pan L., Dumoncel J., de Beer F., Hoffman J., Thackeray J.F., Duployer B., Tenailleau C., Braga J.","55539634900;55840120800;7005506523;55748479200;35312606600;54580864700;6507243161;7004881640;","Further morphological evidence on South African earliest Homo lower postcanine dentition: Enamel thickness and enamel dentine junction",2016,"Journal of Human Evolution","96",,,"82","96",,15,"10.1016/j.jhevol.2016.05.003","https://www.scopus.com/inward/record.uri?eid=2-s2.0-84973325965&doi=10.1016%2fj.jhevol.2016.05.003&partnerID=40&md5=d73807b9f50a8b1f77dd818dc7db9108","Computer-Assisted Palaeoanthropology Team, UMR 5288 CNRS-Université de Toulouse (Paul Sabatier), 37 Allées Jules Guesde, Toulouse, 31000, France; Key Laboratory of Vertebrate Evolution and Human Origins of Chinese Academy of Sciences, Institute of Vertebrate Paleontology and Paleoanthropology, Chinese Academy of Sciences, Beijing, 100044, China; South African Nuclear Energy Corporation, Pelindaba, North West Province, South Africa; Evolutionary Studies Institute, University of the Witwatersrand, PO WITS, Johannesburg, 2050, South Africa; Centre Inter-universitaire de Recherche et d'Ingénierie des Matériaux, UMR 5085 CNRS-Université de Toulouse (Paul Sabatier), 118 route de Narbonne, Toulouse Cedex 9, 31062, France","Pan, L., Computer-Assisted Palaeoanthropology Team, UMR 5288 CNRS-Université de Toulouse (Paul Sabatier), 37 Allées Jules Guesde, Toulouse, 31000, France, Key Laboratory of Vertebrate Evolution and Human Origins of Chinese Academy of Sciences, Institute of Vertebrate Paleontology and Paleoanthropology, Chinese Academy of Sciences, Beijing, 100044, China; Dumoncel, J., Computer-Assisted Palaeoanthropology Team, UMR 5288 CNRS-Université de Toulouse (Paul Sabatier), 37 Allées Jules Guesde, Toulouse, 31000, France; de Beer, F., South African Nuclear Energy Corporation, Pelindaba, North West Province, South Africa; Hoffman, J., South African Nuclear Energy Corporation, Pelindaba, North West Province, South Africa; Thackeray, J.F., Evolutionary Studies Institute, University of the Witwatersrand, PO WITS, Johannesburg, 2050, South Africa; Duployer, B., Centre Inter-universitaire de Recherche et d'Ingénierie des Matériaux, UMR 5085 CNRS-Université de Toulouse (Paul Sabatier), 118 route de Narbonne, Toulouse Cedex 9, 31062, France; Tenailleau, C., Centre Inter-universitaire de Recherche et d'Ingénierie des Matériaux, UMR 5085 CNRS-Université de Toulouse (Paul Sabatier), 118 route de Narbonne, Toulouse Cedex 9, 31062, France; Braga, J., Computer-Assisted Palaeoanthropology Team, UMR 5288 CNRS-Université de Toulouse (Paul Sabatier), 37 Allées Jules Guesde, Toulouse, 31000, France, Evolutionary Studies Institute, University of the Witwatersrand, PO WITS, Johannesburg, 2050, South Africa","The appearance of the earliest members of the genus Homo in South Africa represents a key event in human evolution. Although enamel thickness and enamel dentine junction (EDJ) morphology preserve important information about hominin systematics and dietary adaptation, these features have not been sufficiently studied with regard to early Homo. We used micro-CT to compare enamel thickness and EDJ morphology among the mandibular postcanine dentitions of South African early hominins (N = 30) and extant Homo sapiens (N = 26), with special reference to early members of the genus Homo. We found that South African early Homo shows a similar enamel thickness distribution pattern to modern humans, although three-dimensional average and relative enamel thicknesses do not distinguish australopiths, early Homo, and modern humans particularly well. Based on enamel thickness distributions, our study suggests that a dietary shift occurred between australopiths and the origin of the Homo lineage. We also observed that South African early Homo postcanine EDJ combined primitive traits seen in australopith molars with derived features observed in modern human premolars. Our results confirm that some dental morphological patterns in later Homo actually occurred early in the Homo lineage, and highlight the taxonomic value of premolar EDJ morphology in hominin species. © 2016 Elsevier Ltd.","Australopiths; Dental evolution; Dietary adaptation; Geometric morphometric; Taxonomic discrimination","dentition; diet; hominid; human evolution; morphometry; taxonomy; South Africa; Homo sapiens; anatomy and histology; animal; dentin; enamel; evolution; fossil; hominid; human; micro-computed tomography; molar tooth; premolar tooth; South Africa; Animals; Bicuspid; Biological Evolution; Dental Enamel; Dentin; Fossils; Hominidae; Humans; Molar; South Africa; X-Ray Microtomography",Article,"Final",,Scopus,2-s2.0-84973325965
"Guo S., Liu S., Sun S., Zhang F., Shou S., Hao X., Hu R., Meng W., Xhang P., Liu J.","","Fission track dating of 4th layer of the Peking Man site",1991,"Acta Anthropologica Sinica","10","1",,"73","77",,15,,,,"Guo, S.; Liu, S.; Sun, S.; Zhang, F.; Shou, S.; Hao, X.; Hu, R.; Meng, W.; Xhang, P.; Liu, J.",[No abstract available],,,,"Final",,Scopus,2-s2.0-0003016866
