Authors,Author(s) ID,Title,Year,Source title,Volume,Issue,Art. No.,Page start,Page end,Page count,Cited by,DOI,Link,Affiliations,Authors with affiliations,Abstract,Author Keywords,Index Keywords,Document Type,Publication Stage,Access Type,Source,EID
"Zanolli C.","35410978200;","Additional Evidence for Morpho-Dimensional Tooth Crown Variation in a New Indonesian H. erectus Sample from the Sangiran Dome (Central Java)",2013,"PLoS ONE","8","7", e67233,"","",,37,"10.1371/journal.pone.0067233","https://www.scopus.com/inward/record.uri?eid=2-s2.0-84879765922&doi=10.1371%2fjournal.pone.0067233&partnerID=40&md5=c797ecec69e5430bdeb94ba7089a6d10","Multidisciplinary Laboratory, International Centre for Theoretical Physics, Trieste, Italy; Département de Préhistoire, UMR 7194, MNHN Paris, France","Zanolli, C., Multidisciplinary Laboratory, International Centre for Theoretical Physics, Trieste, Italy, Département de Préhistoire, UMR 7194, MNHN Paris, France","This contribution reports fifteen human fossil dental remains found during the last two decades in the Sangiran Dome area, in Central Java, Indonesia. Among this sample, only one of the specimens had already been briefly described, with the other fourteen remaining unreported. Seven of the fifteen isolated teeth were found in a secured stratigraphic context in the late Lower-early Middle Pleistocene Kabuh Formation. The remaining elements were surface finds which, based on coincidental sources of information, were inferred as coming from the Kabuh Formation. Mainly constituted of permanent molars, but also including one upper incisor and one upper premolar, this dental sample brings additional evidence for a marked degree of size variation and time-related structural reduction in Javanese H. erectus. This is notably expressed by a significant decrease of the mesiodistal diameter, frequently associated to the reduction or even loss of the lower molar distal cusp (hypoconulid) and to a more square occlusal outline. In addition to the hypoconulid reduction or loss, this new sample also exhibits a low frequency of the occlusal Y-groove pattern, with a dominance of the X and, to a lesser extent, of the+patterns. This combination is rare in the Lower and early Middle Pleistocene paleoanthropological record, including in the early Javanese dental assemblage from the Sangiran Dome. On the other hand, similar dental features are found in Chinese H. erectus and in H. heidelbergensis. As a whole, this new record confirms the complex nature of the intermittent exchanges that occurred between continental and insular Southeast Asia through the Pleistocene. © 2013 Clément Zanolli.",,"anatomical variation; article; dental cusp; fossil human; human; human tissue; incisor; Indonesia; Middle Pleistocene; molar tooth; premolar tooth; tooth crown; Fossils; Geography; Humans; Indonesia; Paleodontology; Tooth Crown",Article,"Final",Open Access,Scopus,2-s2.0-84879765922
"Macchiarelli R., Bayle P., Bondioli L., Mazurier A., Zanolli C.","","From outer to inner structural morphology in dental anthropology. The integration of the third dimension in the visualization and quantitative analysis of fossil remains",2013,"Anthropological Perspectives on Tooth Morphology. Genetics, Evolution, Variation",,,,"250","277",,36,,,,"Macchiarelli, R.; Bayle, P.; Bondioli, L.; Mazurier, A.; Zanolli, C.",[No abstract available],,,,"Final",,Scopus,2-s2.0-84884414853
"Macchiarelli R., Bondioli L., Mazurier A.","","Virtual dentitions: Touching the hidden evidence",2008,"Technique and Application in Dental Anthropology",,,,"426","448",,36,,,,"Macchiarelli, R.; Bondioli, L.; Mazurier, A.",[No abstract available],,,,"Final",,Scopus,2-s2.0-56349089697
"Xing S., Martinón-Torres M., De Castro J.M.B., Zhang Y., Fan X., Zheng L., Huang W., Liu W.","35195151700;6505967345;7003670066;36441960900;57158022500;56058944600;14833884300;28567979400;","Middle pleistocene hominin teeth from Longtan Cave, Hexian, China",2014,"PLoS ONE","9","12", e114265,"","",,35,"10.1371/journal.pone.0114265","https://www.scopus.com/inward/record.uri?eid=2-s2.0-84923078893&doi=10.1371%2fjournal.pone.0114265&partnerID=40&md5=958b21f2bcaaf6e5883704f36e883779","Key Laboratory of Vertebrate Evolution and Human Origins, Institute of Vertebrate Paleontology and Paleoanthropology, Chinese Academy of Sciences, Beijing, China; National Research Center on Human Evolution (CENIEH), Burgos, Spain; Hexian Museum of Anhui Province, Hexian, China; Anhui Museum, Hefei, China; Chongqing Three Gorges Institute of Paleoanthropology, China Three Gorges Museum, Chongqing, China","Xing, S., Key Laboratory of Vertebrate Evolution and Human Origins, Institute of Vertebrate Paleontology and Paleoanthropology, Chinese Academy of Sciences, Beijing, China; Martinón-Torres, M., National Research Center on Human Evolution (CENIEH), Burgos, Spain; De Castro, J.M.B., National Research Center on Human Evolution (CENIEH), Burgos, Spain; Zhang, Y., Key Laboratory of Vertebrate Evolution and Human Origins, Institute of Vertebrate Paleontology and Paleoanthropology, Chinese Academy of Sciences, Beijing, China; Fan, X., Hexian Museum of Anhui Province, Hexian, China; Zheng, L., Anhui Museum, Hefei, China; Huang, W., Chongqing Three Gorges Institute of Paleoanthropology, China Three Gorges Museum, Chongqing, China; Liu, W., Key Laboratory of Vertebrate Evolution and Human Origins, Institute of Vertebrate Paleontology and Paleoanthropology, Chinese Academy of Sciences, Beijing, China","Excavations at the Longtan Cave, Hexian, Anhui Province of Eastern China, have yielded several hominin fossils including crania, mandibular fragments, and teeth currently dated to 412±25 ka. While previous studies have focused on the cranial remains, there are no detailed analyses of the dental evidence. In this study, we provide metric and morphological descriptions and comparisons of ten teeth recovered from Hexian, including microcomputed tomography analyses. Our results indicate that the Hexian teeth are metrically and morphologically primitive and overlap with H. ergaster and East Asian Early and mid-Middle Pleistocene hominins in their large dimensions and occlusal complexities. However, the Hexian teeth differ from H. ergaster in features such as conspicuous vertical grooves on the labial/buccal surfaces of the central incisor and the upper premolar, the crown outline shapes of upper and lower molars and the numbers, shapes, and divergences of the roots. Despite their close geological ages, the Hexian teeth are also more primitive than Zhoukoudian specimens, and resemble Sangiran Early Pleistocene teeth. In addition, no typical Neanderthal features have been identified in the Hexian sample. Our study highlights the metrical and morphological primitive status of the Hexian sample in comparison to contemporaneous or even earlier populations of Asia. Based on this finding, we suggest that the primitive-derived gradients of the Asian hominins cannot be satisfactorily fitted along a chronological sequence, suggesting complex evolutionary scenarios with the coexistence and/or survival of different lineages in Eurasia. Hexian could represent the persistence in time of a H. erectus group that would have retained primitive features that were lost in other Asian populations such as Zhoukoudian or Panxian Dadong. Our study expands the metrical and morphological variations known for the East Asianhominins before the mid-Middle Pleistocene and warns about the possibility that the Asian hominin variability may have been taxonomically oversimplified. Copyright: © 2014 Xing et al. This is an openaccess article distributed under the terms of the Creative Commons Attribution License, which permits unrestricted use, distribution, and reproduction in any medium, provided the original author and source are credited.",,"Asian; cheek; incisor; Lower Pleistocene; micro-computed tomography; Middle Pleistocene; molar tooth; premolar tooth; tooth; anatomy and histology; animal; archeology; cave; China; fossil; hominid; image processing; molecular evolution; radiography; tooth; Animals; Archaeology; Caves; China; Evolution, Molecular; Fossils; Hominidae; Image Processing, Computer-Assisted; Tooth; X-Ray Microtomography",Article,"Final",Open Access,Scopus,2-s2.0-84923078893
"Kaifu Y.","9740969200;","Advanced dental reduction in Javanese Homo erectus",2006,"Anthropological Science","114","1",,"35","43",,35,"10.1537/ase.040729","https://www.scopus.com/inward/record.uri?eid=2-s2.0-33645881066&doi=10.1537%2fase.040729&partnerID=40&md5=ec4b6ba41843183a9e60690f6d7e1b56","Department of Anthropology, National Science Museum, 3-23-1 Hyakunin-cho, Shinjuku-ku, Tokyo, 169-0073, Japan","Kaifu, Y., Department of Anthropology, National Science Museum, 3-23-1 Hyakunin-cho, Shinjuku-ku, Tokyo, 169-0073, Japan","The postcanine tooth crowns of late Early Pleistocene Homo erectus from Sangiran, Java, have been considered to be significantly smaller than those of older H. erectus remains of the same region. In this study, the degree of dental reduction in the former was examined by comparing their postcanine crown size with that of various regional groups of recent H. sapiens. The results show that overall crown size and degree of posterior molar reduction of Javanese H. erectus of the late Early Pleistocene was within the range of variation of recent H. sapiens. The position of this H. erectus group in the general trend of dental reduction in Early to Middle Pleistocene Asian archaic Homo is discussed. Implications for the phylogenetic discontinuity hypothesis between H. erectus and H. sapiens in Australasia are presented. In contrast to their reduced crown size, the Javanese H. erectus remains exhibit robust root systems, presumably a primitive retention. This observation indicates that reduction in crown size preceded reduction of the roots during evolution of Homo, at least in the Sunda region. © 2005 The Anthropological Society of Nippon.","Dental reduction; Homo erectus; Root morphology; Sangiran; Tooth size",,Article,"Final",Open Access,Scopus,2-s2.0-33645881066
"Zanolli C.","35410978200;","Brief communication: Molar crown inner structural organization in javanese homo erectus",2015,"American Journal of Physical Anthropology","156","1",,"148","157",,34,"10.1002/ajpa.22611","https://www.scopus.com/inward/record.uri?eid=2-s2.0-84919459924&doi=10.1002%2fajpa.22611&partnerID=40&md5=2a351640856902661c7976d4340216da","Multidisciplinary Laboratory, International Centre for Theoretical Physics, via Beirut 31, Trieste, 34014, Italy","Zanolli, C., Multidisciplinary Laboratory, International Centre for Theoretical Physics, via Beirut 31, Trieste, 34014, Italy","This contribution investigates the inner organizational pattern (tooth tissue proportions and enamel-dentine junction morphology) of seven Homo erectus permanent molar crowns from the late Lowerearly Middle Pleistocene Kabuh Formation of the Sangiran Dome (Central Java, Indonesia). The previous study of their external characteristics confirmed the degree of time-related structural reduction occurred in Javanese H. erectus, and also revealed a combination of nonmetric features which are rare in the Lower and early Middle Pleistocene dental record, but more frequently found in recent humans. In accordance with their outer occlusal morphology, the specimens exhibit a set of derived internal features, such as thick to hyperthick enamel, an incomplete expression of the crest patterns at the enamel-dentine junction (EDJ) level, a sharp EDJ topography. As a whole, these features differ from those expressed in some penecontemporaneous specimens/samples representing African H. erectus/ ergaster and H. heidelbergensis, as well as in Neanderthals, but occur in recent human populations. Further research in virtual dental paleoanthropology to be developed at macroregional scale would clarify the polarity and intensity of the intermittent exchanges between continental and insular Southeast Asia around the Lower to Middle Pleistocene boundary, as well as should shed light on the still poorly understood longitudinal evolutionary dynamics across continental Asia. © 2014 Wiley Periodicals, Inc.","Internal structure; Javanese Homo erectus; Permanent molars; Sangiran Dome","Africa; Article; controlled study; dentin; enamel; Homo erectus; Homo heidelbergensis; Homo neanderthalensis; human; Indonesia; medical record; Middle Pleistocene; molar crown; molar tooth; nonhuman; paleoanthropology; Southeast Asia; anatomy and histology; animal; hominid; molar tooth; physical anthropology; tooth crown; Animals; Anthropology, Physical; Dental Enamel; Dentin; Hominidae; Indonesia; Molar; Tooth Crown",Article,"Final",,Scopus,2-s2.0-84919459924
"Toussaint M., Olejniczak A.J., El Zaatari S., Cattelain P., Flas D., Letourneux C., Pirson S.","7006246177;6603542852;8512089300;26033096800;26424970300;57204410833;24171480600;","The Neandertal lower right deciduous second molar from Trou de l'Abîme at Couvin, Belgium",2010,"Journal of Human Evolution","58","1",,"56","67",,33,"10.1016/j.jhevol.2009.09.006","https://www.scopus.com/inward/record.uri?eid=2-s2.0-70549113548&doi=10.1016%2fj.jhevol.2009.09.006&partnerID=40&md5=6c21ccd3a68695386925a4f4ec3a5b2e","Direction de l'Archéologie, Service Public de Wallonie, 1 rue des Brigades d 'Irlande, B-5100 Namur, Belgium; Department of Human Evolution, Max Planck Institute for Evolutionary Anthropology, Deutscher Platz 6, D-04103 Leipzig, Germany; Musée du Malgré-Tout, CEDARC, rue de la Gare, 28, B-5670 Treignes, Belgium; Musées royaux d'Art et d'Histoire, parc du Cinquantenaire, B-1000 Brussels, Belgium; Direction de l'Archéologie, Service Public de Wallonie, 1 rue des Brigades d'Irlande, B-5100 Namur, Belgium","Toussaint, M., Direction de l'Archéologie, Service Public de Wallonie, 1 rue des Brigades d 'Irlande, B-5100 Namur, Belgium; Olejniczak, A.J., Department of Human Evolution, Max Planck Institute for Evolutionary Anthropology, Deutscher Platz 6, D-04103 Leipzig, Germany; El Zaatari, S., Department of Human Evolution, Max Planck Institute for Evolutionary Anthropology, Deutscher Platz 6, D-04103 Leipzig, Germany; Cattelain, P., Musée du Malgré-Tout, CEDARC, rue de la Gare, 28, B-5670 Treignes, Belgium; Flas, D., Musées royaux d'Art et d'Histoire, parc du Cinquantenaire, B-1000 Brussels, Belgium; Letourneux, C., Department of Human Evolution, Max Planck Institute for Evolutionary Anthropology, Deutscher Platz 6, D-04103 Leipzig, Germany; Pirson, S., Direction de l'Archéologie, Service Public de Wallonie, 1 rue des Brigades d'Irlande, B-5100 Namur, Belgium","A human lower right deciduous second molar was discovered in 1984 at the entrance of Trou de l'Abîme at Couvin (Belgium). In subsequent years the interpretation of this fossil remained difficult for various reasons: (1) the lack of taxonomically diagnostic elements which would support its attribution to either Homo (sapiens) neanderthalensis or H. s. sapiens; (2) the absence of any reliable chronostratigraphic interpretation of the sedimentary sequence of the site; (3) the contradiction between archaeological interpretations, which attributed the lithic industry to a transitional facies between the Middle and Early Upper Palaeolithic, and the radiocarbon date of 46,820 ± 3,290 BP obtained from animal bone remains associated with the tooth and the flint tools. Thanks to recent progress regarding these three aspects, the tooth from Trou de l'Abîme may now be studied in detail. Analyses of the morphology and enamel thickness of the fossil yielded diagnostic characters consistent with an attribution to Neandertals. Re-examination of the lithic industry of Couvin shows that it corresponds to the late Middle Palaeolithic rather than a transitional facies. Furthermore, a new analysis of the site stratigraphy indicates that the unit situated above the archaeological layer in which the tooth was found is probably a palaeosol of brown soil type. Comparison with the regional cave sequences as well as with the reference sequence from the Belgian loess belt tends to show that the most recent palaeosol of this type is dated between 42,000 and 40,000 BP. This is consistent with both a recently obtained AMS result at 44,500 BP and the published conventional date. © 2009 Elsevier Ltd. All rights reserved.","Couvin; Deciduous lower molar; Enamel thickness; Middle Palaeolithic; Neandertals","accelerator mass spectrometry; archaeology; bone; enamel; fossil; morphology; Neanderthal; Paleolithic; paleosol; radiocarbon dating; Belgium; Benelux; Eurasia; Europe; Western Europe; Animalia; Homo sapiens neanderthalensis",Article,"Final",,Scopus,2-s2.0-70549113548
"Chang C.-H., Kaifu Y., Takai M., Kono R.T., Grün R., Matsu'Ura S., Kinsley L., Lin L.-K.","7407036007;9740969200;7202740624;7005548164;7005143323;8901887800;6602388758;55753288300;","The first archaic Homo from Taiwan",2015,"Nature Communications","6",, 6037,"","",,32,"10.1038/ncomms7037","https://www.scopus.com/inward/record.uri?eid=2-s2.0-84923115968&doi=10.1038%2fncomms7037&partnerID=40&md5=07f3f4aa18e08beb69be45a0ad4dae73","Department of Geology, National Museum of Natural Science, 1, Guancian Road, Taichung, 40453, Taiwan; Department of Anthropology, National Museum of Nature and Science, 4-1-1 Amakubo, Tsukuba-shi, Ibaraki, 305-0005, Japan; Department of Biological Sciences, University of Tokyo, 3-1-1 Hongo, Bunkyo-ku, Tokyo, 113-0033, Japan; Primate Research Institute, Kyoto University, 41-2 Kanrin, Inuyama, Aichi, 484-8506, Japan; Research School of Earth Sciences, Australian National University, Mills Road Building 142, Canberra Australian Capital Territory, 0200, Australia; Laboratory of Physical Anthropology, Ochanomizu University, 2-1-1 Otsuka, Bunkyo-ku, Tokyo, 112-8610, Japan; Department of Life Science, Tunghai University, Sector 3, Taichung Port Road, Taichung, 40704, Taiwan","Chang, C.-H., Department of Geology, National Museum of Natural Science, 1, Guancian Road, Taichung, 40453, Taiwan; Kaifu, Y., Department of Anthropology, National Museum of Nature and Science, 4-1-1 Amakubo, Tsukuba-shi, Ibaraki, 305-0005, Japan, Department of Biological Sciences, University of Tokyo, 3-1-1 Hongo, Bunkyo-ku, Tokyo, 113-0033, Japan; Takai, M., Primate Research Institute, Kyoto University, 41-2 Kanrin, Inuyama, Aichi, 484-8506, Japan; Kono, R.T., Department of Anthropology, National Museum of Nature and Science, 4-1-1 Amakubo, Tsukuba-shi, Ibaraki, 305-0005, Japan; Grün, R., Research School of Earth Sciences, Australian National University, Mills Road Building 142, Canberra Australian Capital Territory, 0200, Australia; Matsu'Ura, S., Laboratory of Physical Anthropology, Ochanomizu University, 2-1-1 Otsuka, Bunkyo-ku, Tokyo, 112-8610, Japan; Kinsley, L., Research School of Earth Sciences, Australian National University, Mills Road Building 142, Canberra Australian Capital Territory, 0200, Australia; Lin, L.-K., Department of Life Science, Tunghai University, Sector 3, Taichung Port Road, Taichung, 40704, Taiwan","Recent studies of an increasing number of hominin fossils highlight regional and chronological diversities of archaic Homo in the Pleistocene of eastern Asia. However, such a realization is still based on limited geographical occurrences mainly from Indonesia, China and Russian Altai. Here we describe a newly discovered archaic Homo mandible from Taiwan (Penghu 1), which further increases the diversity of Pleistocene Asian hominins. Penghu 1 revealed an unexpectedly late survival (younger than 450 but most likely 190-10 thousand years ago) of robust, apparently primitive dentognathic morphology in the periphery of the continent, which is unknown among the penecontemporaneous fossil records from other regions of Asia except for the mid-Middle Pleistocene Homo from Hexian, Eastern China. Such patterns of geographic trait distribution cannot be simply explained by clinal geographic variation of Homo erectus between northern China and Java, and suggests survival of multiple evolutionary lineages among archaic hominins before the arrival of modern humans in the region. © 2014 Macmillan Publishers Limited. All rights reserved.",,"chronology; fossil record; geographical distribution; geographical variation; hominid; Pleistocene; species diversity; survival; Article; Asia; China; fossil hominin; human; human tissue; Indonesia; mandible; Middle Pleistocene; Pleistocene; survival; Taiwan; anatomy and histology; animal; chemistry; geography; hominid; principal component analysis; radiometric dating; China; Greater Sunda Islands; Java; Sunda Isles; Taiwan; Homo erectus; fluorine; sodium; Animals; Fluorine; Geography; Hominidae; Humans; Mandible; Principal Component Analysis; Radiometric Dating; Sodium; Taiwan",Article,"Final",Open Access,Scopus,2-s2.0-84923115968
"Smith T.M., Olejniczak A.J., Kupczik K., Lazzari V., De Vos J., Kullmer O., Schrenk F., Hublin J.-J., Jacob T., Tafforeau P.","","Taxonomic assessment of the Trinil molars using non-destructive 3D structural and development analysis",2009,"PaleoAnthropol","2009",,,"117","129",,32,,,,"Smith, T.M.; Olejniczak, A.J.; Kupczik, K.; Lazzari, V.; De Vos, J.; Kullmer, O.; Schrenk, F.; Hublin, J.-J.; Jacob, T.; Tafforeau, P.",[No abstract available],,,,"Final",,Scopus,2-s2.0-78649475916
"Glaunès J., Joshi S.","","Template estimation from unlabeled point set data and surfaces for computational anatomy",2006,"Template Estimation from Unlabeled Point Set Data and Surfaces for Computational Anatomy",,,,"29","39",,32,,,,"Glaunès, J.; Joshi, S.",[No abstract available],,,,"Final",,Scopus,2-s2.0-68949175361
"Black D.","","On a lower molar hominid tooth from the Chou Kou Tien deposit",1927,"Pal. Sinica","7","1",,"1","28",,32,,,,"Black, D.",[No abstract available],,,,"Final",,Scopus,2-s2.0-0002748936
"Skinner M.M., Alemseged Z., Gaunitz C., Hublin J.-J.","35724424000;6508325822;57201657646;6602606027;","Enamel thickness trends in Plio-Pleistocene hominin mandibular molars",2015,"Journal of Human Evolution","85",,,"35","45",,31,"10.1016/j.jhevol.2015.03.012","https://www.scopus.com/inward/record.uri?eid=2-s2.0-84937971910&doi=10.1016%2fj.jhevol.2015.03.012&partnerID=40&md5=7d58dafeeebe723bb6aa645c889b1058","School of Anthropology and Conservation, University of Kent, Canterbury, CT2 7NR, United Kingdom; Department of Human Evolution, Max Planck Institute for Evolutionary Anthropology, Deutscher Platz 6, Leipzig, 04103, Germany; Evolutionary Studies Institute, Centre for Excellence in PaleoSciences, University of the Witwatersrand, Private Bag 3, Wits, 2050, South Africa; Department of Anthropology, California Academy of Sciences, San Francisco, 94118, United States","Skinner, M.M., School of Anthropology and Conservation, University of Kent, Canterbury, CT2 7NR, United Kingdom, Department of Human Evolution, Max Planck Institute for Evolutionary Anthropology, Deutscher Platz 6, Leipzig, 04103, Germany, Evolutionary Studies Institute, Centre for Excellence in PaleoSciences, University of the Witwatersrand, Private Bag 3, Wits, 2050, South Africa; Alemseged, Z., Department of Anthropology, California Academy of Sciences, San Francisco, 94118, United States; Gaunitz, C., Department of Human Evolution, Max Planck Institute for Evolutionary Anthropology, Deutscher Platz 6, Leipzig, 04103, Germany; Hublin, J.-J., Department of Human Evolution, Max Planck Institute for Evolutionary Anthropology, Deutscher Platz 6, Leipzig, 04103, Germany","Enamel thickness continues to be an important morphological character in hominin systematics and is frequently invoked in dietary reconstructions of Plio-Pleistocene hominin taxa. However, to date, the majority of published data on molar enamel thickness of Pliocene and early Pleistocene hominins derive from naturally fractured random surfaces of a small number of specimens. In this study we systematically analyze enamel thickness in a large sample of Plio-Pleistocene fossil hominins (n=99), extant hominoids (n=57), and modern humans (n=30). Based on analysis of 2D mesial planes of section derived from microtomography, we examine both average and relative enamel thickness, and the distribution of enamel across buccal, occlusal, and lingual components of mandibular molars. Our results confirm the trend of increasing enamel thickness during the Pliocene that culminates in the thick enamel of the robust Australopithecus species, and then decreases from early Homo to recent modern humans. All hominin taxa share a regional average enamel thickness pattern of thick occlusal enamel and greater buccal than lingual enamel thickness. Pan is unique in exhibiting the thinnest average enamel thickness in the occlusal basin. Statistical analysis indicates that among Pliocene hominins enamel thickness is a weak taxonomic discriminator. The data underlying these results are included in a table in the Supplementary Online Material. © 2015 Elsevier Ltd.","Australopithecus; Average enamel thickness; Homo; microCT; Paranthropus; Relative enamel thickness","enamel; fossil; hominid; Pliocene-Pleistocene boundary; taxonomy; Australopithecus; Homo; Paranthropus; anatomy and histology; animal; enamel; fossil; hominid; mandible; micro-computed tomography; molar tooth; physical anthropology; radiography; Animals; Dental Enamel; Fossils; Hominidae; Mandible; Molar; Paleodontology; X-Ray Microtomography",Article,"Final",,Scopus,2-s2.0-84937971910
