Authors,Author(s) ID,Title,Year,Source title,Volume,Issue,Art. No.,Page start,Page end,Page count,Cited by,DOI,Link,Affiliations,Authors with affiliations,Abstract,Author Keywords,Index Keywords,Document Type,Publication Stage,Access Type,Source,EID
"Kupczik K., Hublin J.-J.","15757528400;6602606027;","Mandibular molar root morphology in Neanderthals and Late Pleistocene and recent Homo sapiens",2010,"Journal of Human Evolution","59","5",,"525","541",,70,"10.1016/j.jhevol.2010.05.009","https://www.scopus.com/inward/record.uri?eid=2-s2.0-77958189205&doi=10.1016%2fj.jhevol.2010.05.009&partnerID=40&md5=3ca38e399d02c8a0a136510ff5c9bbe3","Department of Human Evolution, Max Planck Institute for Evolutionary Anthropology, Deutscher Platz 6, 04103 Leipzig, Germany","Kupczik, K., Department of Human Evolution, Max Planck Institute for Evolutionary Anthropology, Deutscher Platz 6, 04103 Leipzig, Germany; Hublin, J.-J., Department of Human Evolution, Max Planck Institute for Evolutionary Anthropology, Deutscher Platz 6, 04103 Leipzig, Germany","Neanderthals have a distinctive suite of dental features, including large anterior crown and root dimensions and molars with enlarged pulp cavities. Yet, there is little known about variation in molar root morphology in Neanderthals and other recent and fossil members of Homo. Here, we provide the first comprehensive metric analysis of permanent mandibular molar root morphology in Middle and Late Pleistocene Homo neanderthalensis, and Late Pleistocene (Aterian) and recent Homo sapiens. We specifically address the question of whether root form can be used to distinguish between these groups and assess whether any variation in root form can be related to differences in tooth function. We apply a microtomographic imaging approach to visualise and quantify the external and internal dental morphologies of both isolated molars and molars embedded in the mandible (n=127). Univariate and multivariate analyses reveal both similarities (root length and pulp volume) and differences (occurrence of pyramidal roots and dental tissue volume proportion) in molar root morphology among penecontemporaneous Neanderthals and Aterian H. sapiens. In contrast, the molars of recent H. sapiens are markedly smaller than both Pleistocene H. sapiens and Neanderthals, but share with the former the dentine volume reduction and a smaller root-to-crown volume compared with Neanderthals. Furthermore, we found the first molar to have the largest average root surface area in recent H. sapiens and Neanderthals, although in the latter the difference between M1 and M2 is small. In contrast, Aterian H. sapiens root surface areas peak at M2. Since root surface area is linked to masticatory function, this suggests a distinct occlusal loading regime in Neanderthals compared with both recent and Pleistocene H. sapiens. © 2010 Elsevier Ltd.","Aterian Homo sapiens; Dental morphology; Homo neanderthalensis; Microtomography; Taurodontism; Tooth function","human evolution; imaging method; morphology; morphometry; Neanderthal; Pleistocene; tomography; tooth; visualization; Homo sapiens; Homo sapiens neanderthalensis",Article,"Final",,Scopus,2-s2.0-77958189205
"Smith T.M., Olejniczak A.J., Zermeno J.P., Tafforeau P., Skinner M.M., Hoffmann A., Radovčić J., Toussaint M., Kruszynski R., Menter C., Moggi-Cecchi J., Glasmacher U.A., Kullmer O., Schrenk F., Stringer C., Hublin J.-J.","8756438300;6603542852;36697217400;6507952614;35724424000;24597717300;6507687978;7006246177;23047069500;6506762997;57201496783;6701753648;6508188094;6603042411;7005875885;6602606027;","Variation in enamel thickness within the genus Homo",2012,"Journal of Human Evolution","62","3",,"395","411",,69,"10.1016/j.jhevol.2011.12.004","https://www.scopus.com/inward/record.uri?eid=2-s2.0-84858071926&doi=10.1016%2fj.jhevol.2011.12.004&partnerID=40&md5=c7349bb0351ecb54421c20d7b95821ed","Department of Human Evolutionary Biology, Harvard University, 11 Divinity Avenue, Cambridge, MA 02138, United States; Department of Human Evolution, Max Planck Institute for Evolutionary Anthropology, Deutscher Platz 6, D-04103 Leipzig, Germany; European Synchrotron Radiation Facility, 6 Rue Jules Horowitz, BP 220, 38043 Grenoble Cedex, France; Museum für Vor- und Frühgeschichte, Schloss Charlottenburg - Langhansbau, Spandauer Damm 22, D-14059 Berlin, Germany; Croatian Natural History Museum, Demetrova 1, 10000 Zagreb, Croatia; Direction de l'Archéologie, Service Public de Wallonie, 5100 Namur, Belgium; Department of Palaeontology, The Natural History Museum, London SW7 5BD, United Kingdom; Department of Anthropology and Development Studies, University of Johannesburg, PO Box 524, Auckland Park 2006, South Africa; Dipartimento di Biologia Evoluzionistica Leo Pardi, Università di Firenze, Via del Proconsolo, 12, 50122 Firenze, Italy; Institute of Earth Sciences, Ruprecht Karl University Heidelberg, D-69120 Heidelberg, Germany; Department of Paleoanthropology and Messel Research, Senckenberg Research Institute, D-60325 Frankfurt, Germany; Department of Vertebrate Paleontology, Institute for Ecology, Evolution and Diversity, Johann Wolfgang Goethe University, Frankfurt, Germany","Smith, T.M., Department of Human Evolutionary Biology, Harvard University, 11 Divinity Avenue, Cambridge, MA 02138, United States, Department of Human Evolution, Max Planck Institute for Evolutionary Anthropology, Deutscher Platz 6, D-04103 Leipzig, Germany; Olejniczak, A.J., Department of Human Evolution, Max Planck Institute for Evolutionary Anthropology, Deutscher Platz 6, D-04103 Leipzig, Germany; Zermeno, J.P., Department of Human Evolutionary Biology, Harvard University, 11 Divinity Avenue, Cambridge, MA 02138, United States; Tafforeau, P., European Synchrotron Radiation Facility, 6 Rue Jules Horowitz, BP 220, 38043 Grenoble Cedex, France; Skinner, M.M., Department of Human Evolution, Max Planck Institute for Evolutionary Anthropology, Deutscher Platz 6, D-04103 Leipzig, Germany; Hoffmann, A., Museum für Vor- und Frühgeschichte, Schloss Charlottenburg - Langhansbau, Spandauer Damm 22, D-14059 Berlin, Germany; Radovčić, J., Croatian Natural History Museum, Demetrova 1, 10000 Zagreb, Croatia; Toussaint, M., Direction de l'Archéologie, Service Public de Wallonie, 5100 Namur, Belgium; Kruszynski, R., Department of Palaeontology, The Natural History Museum, London SW7 5BD, United Kingdom; Menter, C., Department of Anthropology and Development Studies, University of Johannesburg, PO Box 524, Auckland Park 2006, South Africa; Moggi-Cecchi, J., Dipartimento di Biologia Evoluzionistica Leo Pardi, Università di Firenze, Via del Proconsolo, 12, 50122 Firenze, Italy; Glasmacher, U.A., Institute of Earth Sciences, Ruprecht Karl University Heidelberg, D-69120 Heidelberg, Germany; Kullmer, O., Department of Paleoanthropology and Messel Research, Senckenberg Research Institute, D-60325 Frankfurt, Germany; Schrenk, F., Department of Vertebrate Paleontology, Institute for Ecology, Evolution and Diversity, Johann Wolfgang Goethe University, Frankfurt, Germany; Stringer, C., Department of Palaeontology, The Natural History Museum, London SW7 5BD, United Kingdom; Hublin, J.-J., Department of Human Evolution, Max Planck Institute for Evolutionary Anthropology, Deutscher Platz 6, D-04103 Leipzig, Germany","Recent humans and their fossil relatives are classified as having thick molar enamel, one of very few dental traits that distinguish hominins from living African apes. However, little is known about enamel thickness in the earliest members of the genus Homo, and recent studies of later Homo report considerable intra- and inter-specific variation. In order to assess taxonomic, geographic, and temporal trends in enamel thickness, we applied micro-computed tomographic imaging to 150 fossil Homo teeth spanning two million years. Early Homo postcanine teeth from Africa and Asia show highly variable average and relative enamel thickness (AET and RET) values. Three molars from South Africa exceed Homo AET and RET ranges, resembling the hyper thick Paranthropus condition. Most later Homo groups (archaic European and north African Homo, and fossil and recent Homo sapiens) possess absolutely and relatively thick enamel across the entire dentition. In contrast, Neanderthals show relatively thin enamel in their incisors, canines, premolars, and molars, although incisor AET values are similar to H. sapiens. Comparisons of recent and fossil H. sapiens reveal that dental size reduction has led to a disproportionate decrease in coronal dentine compared with enamel (although both are reduced), leading to relatively thicker enamel in recent humans. General characterizations of hominins as having 'thick enamel' thus oversimplify a surprisingly variable craniodental trait with limited taxonomic utility within a genus. Moreover, estimates of dental attrition rates employed in paleodemographic reconstruction may be biased when this variation is not considered. Additional research is necessary to reconstruct hominin dietary ecology since thick enamel is not a prerequisite for hard-object feeding, and it is present in most later Homo species despite advances in technology and food processing. © 2012 Elsevier Ltd.","Archaic Homo; Dental morphology; Early Homo; Hominin tooth structure; Human evolution; Neanderthal","enamel; fossil record; human evolution; morphology; Neanderthal; tomography; Asia; South Africa; Homo sapiens; Homo sapiens neanderthalensis; Paranthropus",Article,"Final",,Scopus,2-s2.0-84858071926
"Kaifu Y., Aziz F., Baba H.","9740969200;7004727148;7201934098;","Hominid mandibular remains from Sangiran: 1952-1986 Collection",2005,"American Journal of Physical Anthropology","128","3",,"497","519",,69,"10.1002/ajpa.10427","https://www.scopus.com/inward/record.uri?eid=2-s2.0-27744603562&doi=10.1002%2fajpa.10427&partnerID=40&md5=3c059806a7ce821d6bbd99ca8591ebe5","Department of Anthropology, National Science Museum, Tokyo 169-0073, Japan; Geological Research and Development Centre, Bandung 40122, Indonesia; Department of Biological Science, University of Tokyo, Tokyo 113-0033, Japan; Department of Anthropology, National Science Museum, 3-23-1 Hyakunincho, Shinjuku-ku, Tokyo 169-0073, Japan","Kaifu, Y., Department of Anthropology, National Science Museum, Tokyo 169-0073, Japan, Department of Anthropology, National Science Museum, 3-23-1 Hyakunincho, Shinjuku-ku, Tokyo 169-0073, Japan; Aziz, F., Geological Research and Development Centre, Bandung 40122, Indonesia; Baba, H., Department of Anthropology, National Science Museum, Tokyo 169-0073, Japan, Department of Biological Science, University of Tokyo, Tokyo 113-0033, Japan","Eight hominid mandibular and associated dental remains discovered between 1952-1986 from the Early Pleistocene deposits of Sangiran, Central Java, are described. Although the specimens are surface finds, their original stratigraphic positions can be reasonably inferred on the basis of coincidental sources of information. These specimens significantly increase the dentognathic sample available for intensive morphological investigation of the earliest Javanese hominids. © 2005 Wiley-Liss, Inc.","H. erectus; Hominid evolution; Java; Mandible; Pleistocene; Teeth","hominid; human; mandible; physical anthropology; Pleistocene; review; stratigraphy; tooth; Animals; Dentition; Fossils; History, Ancient; Hominidae; Indonesia; Mandible; Paleodontology",Review,"Final",,Scopus,2-s2.0-27744603562
"Binford L.R., Ho C.K.","","Taphonomy at a distance: Zhoukoudian, ""the cave home of Beijing man?""",1985,"Current Anthropology","26","4",,"413","442",,69,,,,"Binford, L.R.; Ho, C.K.",[No abstract available],,,,"Final",,Scopus,2-s2.0-0000246799
"Olejniczak A.J., Smith T.M., Skinner M.M., Grine F.E., Feeney R.N.M., Thackeray J.F., Hublin J.-J.","6603542852;8756438300;35724424000;35431800400;23484751000;35312606600;6602606027;","Three-dimensional molar enamel distribution and thickness in Australopithecus and Paranthropus",2008,"Biology Letters","4","4",,"406","410",,62,"10.1098/rsbl.2008.0223","https://www.scopus.com/inward/record.uri?eid=2-s2.0-46949098557&doi=10.1098%2frsbl.2008.0223&partnerID=40&md5=5d14c64b6df8b0d804fef6370d5b8b36","Department of Human Evolution, Max Planck Institute for Evolutionary Anthropology, 04103 Leipzig, Germany; Departments of Anthropology and Anatomical Sciences, Stony Brook University, Stony Brook, NY 11794, United States; Leverhulme Centre for Human Evolutionary Studies, University of Cambridge, Fitzwilliam Street, Cambridge CB2 1QH, United Kingdom; Human Origins and Past Environments Programme, Transvaal Museum, Box 413, Paul Kruger Street, Pretoria, Gauteng 0001, South Africa","Olejniczak, A.J., Department of Human Evolution, Max Planck Institute for Evolutionary Anthropology, 04103 Leipzig, Germany; Smith, T.M., Department of Human Evolution, Max Planck Institute for Evolutionary Anthropology, 04103 Leipzig, Germany; Skinner, M.M., Department of Human Evolution, Max Planck Institute for Evolutionary Anthropology, 04103 Leipzig, Germany; Grine, F.E., Departments of Anthropology and Anatomical Sciences, Stony Brook University, Stony Brook, NY 11794, United States, Leverhulme Centre for Human Evolutionary Studies, University of Cambridge, Fitzwilliam Street, Cambridge CB2 1QH, United Kingdom; Feeney, R.N.M., Department of Human Evolution, Max Planck Institute for Evolutionary Anthropology, 04103 Leipzig, Germany; Thackeray, J.F., Human Origins and Past Environments Programme, Transvaal Museum, Box 413, Paul Kruger Street, Pretoria, Gauteng 0001, South Africa; Hublin, J.-J., Department of Human Evolution, Max Planck Institute for Evolutionary Anthropology, 04103 Leipzig, Germany","Thick molar enamel is among the few diagnostic characters of hominins which are measurable in fossil specimens. Despite a long history of study and characterization of Paranthropus molars as relatively 'hyper-thick', only a few tooth fragments and controlled planes of section (designed to be proxies of whole-crown thickness) have been measured. Here, we measure molar enamel thickness in Australopithecus africanus and Paranthropus robustus using accurate microtomographic methods, recording the whole-crown distribution of enamel. Both taxa have relatively thick enamel, but are thinner than previously characterized based on two-dimensional measurements. Three-dimensional measurements show that P. robustus enamel is not hyper-thick, and A. africanus enamel is relatively thinner than that of recent humans. Interspecific differences in the whole-crown distribution of enamel thickness influence cross-sectional measurements such that enamel thickness is exaggerated in two-dimensional sections of A. africanus and P. robustus molars. As such, two-dimensional enamel thickness measurements in australopiths are not reliable proxies for the three-dimensional data they are meant to represent. The three-dimensional distribution of enamel thickness shows different patterns among species, and is more useful for the interpretation of functional adaptations than single summary measures of enamel thickness. © 2008 The Royal Society.","Enamel distribution; Hominin evolution; Microtomography","dentition; enamel; evolution; fossil; hominid; measurement method; tomography; accuracy; article; australopithecus; Australopithecus africanus; enamel; microtomography; molar tooth; nonhuman; Paranthropus; Paranthropus robustus; physiology; priority journal; thickness; three dimensional imaging; tomography; Australopithecus; Australopithecus africanus; Paranthropus; Paranthropus robustus",Article,"Final",,Scopus,2-s2.0-46949098557
"Shen G., Ku T.-L., Cheng H., Edwards R.Lawrence, Yuan Z., Wang Q.","7401966814;7006238881;7404285341;22947166500;7401476966;35265604500;","High-precision U-series dating of Locality 1 at Zhoukoudian, China",2001,"Journal of Human Evolution","41","6",,"679","688",,62,"10.1006/jhev.2001.0516","https://www.scopus.com/inward/record.uri?eid=2-s2.0-0035544220&doi=10.1006%2fjhev.2001.0516&partnerID=40&md5=e8d9139f1b7c825f4ca7869eb1dba01e","Institute for Coastal and Quaternary Studies, Nanjing Normal University, Nanjing, Jiangsu, 210097, China; Department of Earth Sciences, University of Southern California, Los Angeles, CA, 90089-0740, United States; Department of Geology and Geophysics, University of Minnesota, Minneapolis, MN, 55455, United States; Institute of Vertebrate Paleontology and Paleoanthropology, Academia Sinica, Beijing, 100044, China","Shen, G., Institute for Coastal and Quaternary Studies, Nanjing Normal University, Nanjing, Jiangsu, 210097, China; Ku, T.-L., Department of Earth Sciences, University of Southern California, Los Angeles, CA, 90089-0740, United States; Cheng, H., Department of Geology and Geophysics, University of Minnesota, Minneapolis, MN, 55455, United States; Edwards, R.Lawrence, Department of Geology and Geophysics, University of Minnesota, Minneapolis, MN, 55455, United States; Yuan, Z., Institute of Vertebrate Paleontology and Paleoanthropology, Academia Sinica, Beijing, 100044, China; Wang, Q., Institute of Vertebrate Paleontology and Paleoanthropology, Academia Sinica, Beijing, 100044, China","Thermal ionization mass spectrometric 230Th/234U dating has been carried out on intercalated speleothem samples from the limestone cave occupied by Homo erectus at Zhoukoudian, China. The samples were recently collected in proper stratigraphic context after detailed field examinations. The results show that the age of the No. 5 Skull from Layer 3 is &gt;400 ka, possibly in the range of about 400-500 ka, and that the hominid fossils from the lower strata are at least 600 ka and possibly &gt;800 ka, much older than previously thought. The near-equilibrium 230Th/234U ratios and internal consistency of the dates and stratigraphy lend credence to the results and allow us to comment on their important implications for human evolution.","Homo erectus; Locality 1; Speleothem calcite; TIMS U-series dating; Zhoukuodian","calcite; evolution; Holocene; speleothem; uranium series dating; Beijing; China; Zhoukoudian; Hominidae; Homo; Homo erectus; Homo erectus; Vertebrata; thorium; uranium; animal; article; fossil; hominid; human; methodology; physical anthropology; sensitivity and specificity; time; Animals; Anthropology, Physical; Fossils; Hominidae; Humans; Sensitivity and Specificity; Thorium; Time Factors; Uranium",Article,"Final",,Scopus,2-s2.0-0035544220
"Grün R., Huang P.-H., Wu X., Stringer C.B., Thorne A.G., McCulloch M.","7005143323;7403659261;7407061389;7005875885;7006115162;7102869538;","ESR analysis of teeth from the palaeoanthropological site of Zhoukoudian, China",1997,"Journal of Human Evolution","32","1",,"83","91",,61,"10.1006/jhev.1996.0094","https://www.scopus.com/inward/record.uri?eid=2-s2.0-0030979865&doi=10.1006%2fjhev.1996.0094&partnerID=40&md5=05c6000a59233e282472aa86a94360ff","Quaternary Dating Research Centre, Australian National University, Canberra, ACT 0200, Australia; Dept. of Earth and Space Sciences, Univ. of Sci. and Technol. of China, Hefei, 230026, China; Inst. Vertebrate Palaeontology P., Academia Sinica, P.O. Box 643, Beijing 100044, China; Natural History Museum, Department of Palaeontology, Cromwell Road, London SW7 5BD, United Kingdom; Div. of Archaeo. and Natural History, Australian National University, Canberra, ACT 0200, Australia; Research School of Earth Sciences, Australian National University, Canberra, ACT 0200, Australia","Grün, R., Quaternary Dating Research Centre, Australian National University, Canberra, ACT 0200, Australia; Huang, P.-H., Dept. of Earth and Space Sciences, Univ. of Sci. and Technol. of China, Hefei, 230026, China; Wu, X., Inst. Vertebrate Palaeontology P., Academia Sinica, P.O. Box 643, Beijing 100044, China; Stringer, C.B., Natural History Museum, Department of Palaeontology, Cromwell Road, London SW7 5BD, United Kingdom; Thorne, A.G., Div. of Archaeo. and Natural History, Australian National University, Canberra, ACT 0200, Australia; McCulloch, M., Research School of Earth Sciences, Australian National University, Canberra, ACT 0200, Australia","An ESR dating study on teeth collected from layers 3, 6/7 and 10 at Locality 1, Zhoukoudian provides results that are in general agreement with an earlier multi-dating study and confirm an age range of 300-550 ka for the Homo erectus remains in the Peking Man Cave. Uncertainties due to U-uptake and the external gamma dose rates do not allow very precise age estimates for the respective layers. © 1997 Academic Press Limited.","ESR dating; Homo erectus; Zhoukoudian","electron spin resonance dating; Homo erectus; tooth; Zhoukoudian; animal; article; China; electron spin resonance; histology; history; hominid; human; physical anthropology; tooth; Animals; China; Electron Spin Resonance Spectroscopy; History, Ancient; Hominidae; Humans; Paleodontology; Tooth; China; Animalia; Hominidae; Homo erectus",Article,"Final",,Scopus,2-s2.0-0030979865
"Xing S., Martinón-Torres M., Bermúdez De Castro J.M., Wu X., Liu W.","35195151700;6505967345;7003670066;22735420900;28567979400;","Hominin teeth from the early late pleistocene site of Xujiayao, Northern China",2015,"American Journal of Physical Anthropology","156","2",,"224","240",,57,"10.1002/ajpa.22641","https://www.scopus.com/inward/record.uri?eid=2-s2.0-84920774451&doi=10.1002%2fajpa.22641&partnerID=40&md5=140ceafab107572649b4a7c9ba65140d","Key Laboratory of Vertebrate Evolution and Human Origins of Chinese Academy of Sciences, Institute of Vertebrate Paleontology and Paleoanthropology, Chinese Academy of Sciences, Beijing, 100044, China; Centro Nacional de Investigación Sobre la Evolución Humana (CENIEH), Burgos, 09002, Spain","Xing, S., Key Laboratory of Vertebrate Evolution and Human Origins of Chinese Academy of Sciences, Institute of Vertebrate Paleontology and Paleoanthropology, Chinese Academy of Sciences, Beijing, 100044, China; Martinón-Torres, M., Centro Nacional de Investigación Sobre la Evolución Humana (CENIEH), Burgos, 09002, Spain; Bermúdez De Castro, J.M., Centro Nacional de Investigación Sobre la Evolución Humana (CENIEH), Burgos, 09002, Spain; Wu, X., Key Laboratory of Vertebrate Evolution and Human Origins of Chinese Academy of Sciences, Institute of Vertebrate Paleontology and Paleoanthropology, Chinese Academy of Sciences, Beijing, 100044, China; Liu, W., Key Laboratory of Vertebrate Evolution and Human Origins of Chinese Academy of Sciences, Institute of Vertebrate Paleontology and Paleoanthropology, Chinese Academy of Sciences, Beijing, 100044, China","It is generally accepted that from the late Middle to the early Late Pleistocene (∼340-90 ka BP), Neanderthals were occupying Europe and Western Asia, whereas anatomically modern humans were present in the African continent. In contrast, the paucity of hominin fossil evidence from East Asia from this period impedes a complete evolutionary picture of the genus Homo, as well as assessment of the possible contribution of or interaction with Asian hominins in the evolution of Homo sapiens and Homo neanderthalensis. Here we present a comparative study of a hominin dental sample recovered from the Xujiayao site, in Northern China, attributed to the early Late Pleistocene (MIS 5 to 4). Our dental study reveals a mosaic of primitive and derived dental features for the Xujiayao hominins that can be summarized as follows: i) they are different from archaic and recent modern humans, ii) they present some features that are common but not exclusive to the Neanderthal lineage, and iii) they retain some primitive conformations classically found in East Asian Early and Middle Pleistocene hominins despite their young geological age. Thus, our study evinces the existence in China of a population of unclear taxonomic status with regard to other contemporary populations such as H. sapiens and H. neanderthalensis. The morphological and metric studies of the Xujiayao teeth expand the variability known for early Late Pleistocene hominin fossils and suggest the possibility that a primitive hominin lineage may have survived late into the Late Pleistocene in China. © 2014 Wiley Periodicals, Inc.","Dental variability; Fossil; Mosaic; Teeth","Article; China; comparative anatomy; controlled study; East Asian; evolution; fossil hominin; Homo neanderthalensis; human; human tissue; micro-computed tomography; Middle Pleistocene; molar tooth; premolar tooth; tooth; Upper Pleistocene; anatomy and histology; animals; Fossils; history; History, Ancient; Hominidae; Paleodontology; Tooth; Animals; China; Fossils; History, Ancient; Hominidae; Paleodontology; Tooth",Article,"Final",,Scopus,2-s2.0-84920774451
