Authors,Author(s) ID,Title,Year,Source title,Volume,Issue,Art. No.,Page start,Page end,Page count,Cited by,DOI,Link,Affiliations,Authors with affiliations,Abstract,Author Keywords,Index Keywords,Document Type,Publication Stage,Access Type,Source,EID
"Schneider C.A., Rasband W.S., Eliceiri K.W.","55274348500;6505761888;6602334481;","NIH Image to ImageJ: 25 years of image analysis",2012,"Nature Methods","9","7",,"671","675",,19294,"10.1038/nmeth.2089","https://www.scopus.com/inward/record.uri?eid=2-s2.0-84863205849&doi=10.1038%2fnmeth.2089&partnerID=40&md5=27f8386cad59f4df66133961b6164bae","Laboratory for Optical and Computational Instrumentation, University of Wisconsin at Madison, Madison, WI, United States; Section on Instrumentation, US National Institutes of Health, Bethesda, MD, United States","Schneider, C.A., Laboratory for Optical and Computational Instrumentation, University of Wisconsin at Madison, Madison, WI, United States; Rasband, W.S., Section on Instrumentation, US National Institutes of Health, Bethesda, MD, United States; Eliceiri, K.W., Laboratory for Optical and Computational Instrumentation, University of Wisconsin at Madison, Madison, WI, United States",[No abstract available],,"autoradiography; bioinformatics; computer; computer assisted tomography; computer program; history; image analysis; image processing; imaging; imaging system; microscopy; note; positron emission tomography; priority journal; X ray; Computational Biology; History, 20th Century; History, 21st Century; Image Processing, Computer-Assisted; National Institutes of Health (U.S.); Software; United States",Note,"Final",,Scopus,2-s2.0-84863205849
"R Development Core Team","",[No title available],2006,"R: A Language and Environment for Statistical Computing",,,,"","",,16451,,,,"R Development Core Team",[No abstract available],,,,"Final",,Scopus,2-s2.0-5344244656
"Bookstein F.L.","",[No title available],1991,"Morphometric Tools for Landmark Data: Geometry and Biology",,,,"","",,3980,,,,"Bookstein, F.L.",[No abstract available],,,,,,Scopus,2-s2.0-0003597817
"Pebesma E.J.","6603459366;","Multivariable geostatistics in S: The gstat package",2004,"Computers and Geosciences","30","7",,"683","691",,1371,"10.1016/j.cageo.2004.03.012","https://www.scopus.com/inward/record.uri?eid=2-s2.0-3342878970&doi=10.1016%2fj.cageo.2004.03.012&partnerID=40&md5=89d097272524e308eb956f133484dc46","Department of Physical Geography, Utrecht University, P.O. Box 80.115, Utrecht, TC 3508, Netherlands","Pebesma, E.J., Department of Physical Geography, Utrecht University, P.O. Box 80.115, Utrecht, TC 3508, Netherlands","This paper discusses advantages and shortcomings of the S environment for multivariable geostatistics, in particular when extended with the gstat package, an extension package for the S environments (R, S-Plus). The gstat S package provides multivariable geostatistical modelling, prediction and simulation, as well as several visualisation functions. In particular, it makes the calculation, simultaneous fitting, and visualisation of a large number of direct and cross (residual) variograms very easy. Gstat was started 10 years ago and was released under the GPL in 1996; gstat.org was started in 1998. Gstat was not initially written for teaching purposes, but for research purposes, emphasising flexibility, scalability and portability. It can deal with a large number of practical issues in geostatistics, including change of support (block kriging), simple/ordinary/universal (co)kriging, fast local neighbourhood selection, flexible trend modelling, variables with different sampling configurations, and efficient simulation of large spatially correlated random fields, indicator kriging and simulation, and (directional) variogram and cross variogram modelling. The formula/models interface of the S language is used to define multivariable geostatistical models. This paper introduces the gstat S package, and discusses a number of design and implementation issues. It also draws attention to a number of papers on integration of spatial statistics software, GIS and the S environment that were presented on the spatial statistics workshop and sessions during the conference Distributed Statistical Computing 2003. © 2004 Elsevier Ltd. All rights reserved.","Cokriging; Kriging; Linear model of coregionalisation; Open source software; S language; Stochastic simulation","Computer simulation; Computer software; Sampling; Statistical methods; Visualization; Cross variogram modeling; Geostatistics; Geologic models; geostatistics; kriging; software",Article,"Final",,Scopus,2-s2.0-3342878970
"Voris H.K.","7003637127;","Maps of Pleistocene sea levels in Southeast Asia: Shorelines, river systems and time durations",2000,"Journal of Biogeography","27","5",,"1153","1167",,1162,"10.1046/j.1365-2699.2000.00489.x","https://www.scopus.com/inward/record.uri?eid=2-s2.0-0034492377&doi=10.1046%2fj.1365-2699.2000.00489.x&partnerID=40&md5=fbf81392ae0baf8c7b82894552379d46","Field Museum of Natural History, Chicago, IL, United States; Department of Zoology, Field Museum of Natural History, 1400 S. Lake Shore Drive, Chicago, IL 60605-2496, United States","Voris, H.K., Field Museum of Natural History, Chicago, IL, United States, Department of Zoology, Field Museum of Natural History, 1400 S. Lake Shore Drive, Chicago, IL 60605-2496, United States","Aim: Glaciation and deglaciation and the accompanying lowering and rising of sea levels during the late Pleistocene are known to have greatly affected land mass configurations in Southeast Asia. The objective of this report is to provide a series of maps that estimate the areas of exposed land in the Indo-Australian region during periods of the Pleistocene when sea levels were below present day levels. Location: The maps presented here cover tropical Southeast Asia and Austral-Asia. The east-west coverage extends 8000 km from Australia to Sri Lanka. The north-south coverage extends 5000 km from Taiwan to Australia. Methods: Present-day bathymetric depth contours were used to estimate past shore lines and the locations of the major drowned river systems of the Sunda and Sahul shelves. The timing of sea level changes associated with glaciation over the past 250,000 years was taken from multiple sources that, in some cases, account for tectonic uplift and subsidence during the period in question. Results: This report provides a series of maps that estimate the areas of exposed land in the Indo-Australian region during periods of 17,000, 150,000 and 250,000 years before present. The ancient shorelines are based on present day depth contours of 10, 20, 30, 40, 50, 75, 100 and 120 m. On the maps depicting shorelines at 75, 100 and 120 m below present levels the major Pleistocene river systems of the Sunda and Sahul shelves are depicted. Estimates of the number of major sea level fluctuation events and the duration of time that sea levels were at or below the illustrated level are provided. Main conclusions: Previous reconstructions of sea-level change during the Pleistocene have emphasized the maximum lows. The perspective provided here emphasizes that sea levels were at their maximum lows for relatively short periods of time but were at or below intermediate levels (e.g. at or below 40 m below present-day levels) for more than half of each of the time periods considered.","Biogeography; Maps; Palaeogeography; Pleistocene; Sea levels; Southeast Asia","deglaciation; glaciation; Pleistocene; river system; sea level change; shoreline change; timescale; Asia",Article,"Final",,Scopus,2-s2.0-0034492377
"Scott G.R., Turner II C.G.","",[No title available],1997,"The Anthropology of Modern Human Teeth",,,,"","",,531,,,,"Scott, G.R.; Turner II, C.G.",[No abstract available],,,,,,Scopus,2-s2.0-0003436555
"Smith B.H.","56379121300;","Patterns of molar wear in hunter–gatherers and agriculturalists",1984,"American Journal of Physical Anthropology","63","1",,"39","56",,531,"10.1002/ajpa.1330630107","https://www.scopus.com/inward/record.uri?eid=2-s2.0-0021345272&doi=10.1002%2fajpa.1330630107&partnerID=40&md5=c5685e1c82e81ecdb5f21fd850de5205","Center for Human Growth and Development, University of Michigan, Ann Arbor, Michigan, 48109, United States","Smith, B.H., Center for Human Growth and Development, University of Michigan, Ann Arbor, Michigan, 48109, United States","Tooth wear records valuable information on diet and methods of food preparation in prehistoric populations or extinct species. In this study, samples of modern and prehistoric hunter–gatherers and agriculturalists are used to test the hypothesis that there are systematic differences in patterns of tooth wear related to major differences in subsistence and food preparation. Flatness of molar wear is compared for five groups of hunter–gatherers (N = 298) and five groups of early agriculturalists (N = 365). Hunter–gatherers are predicted to develop flatter molar wear due to the mastication of tough and fibrous foods, whereas agriculturalists should develop oblique molar wear due to an increase in the proportion of ground and prepared food in the diet. A method is presented for the quantitative measurement and analysis of flatness of molar wear. Comparisons of wear plane angle are made between teeth matched for the same stage of occlusal surface wear, thus standardizing all groups to the same rate of wear. Agriculturalists develop highly angled occlusal wear planes on the entire molar dentition. Their wear plane angles tend to exceed hunter–gatherers by about 10° in advanced wear. Wear plane angles are similar within subsistence divisions despite regional differences in particular foods. This approach can be used to provide supporting evidence of change in human subsistence and to test dietary hypotheses in hominoid evolution. Copyright © 1984 Wiley‐Liss, Inc., A Wiley Company","Agriculturalists; Dental Attrition; Hunter–Gatherers","ecology; ethnic or racial aspects; geographic distribution; human; molar tooth; normal human; tooth; tooth disease; Agriculture; Animal; Anthropology, Physical; Comparative Study; Diet; Fossils; Haplorhini; Human; Mastication; Molar; Paleontology; Support, U.S. Gov't, Non-P.H.S.",Article,"Final",,Scopus,2-s2.0-0021345272
"Baddeley A., Rubak E., Turner R.","","Spatial Point Patterns: Methodology and Applications with R",2015,"Spatial Point Patterns: Methodology and Applications with R",,,,"","",,509,,,,"Baddeley, A.; Rubak, E.; Turner, R.",[No abstract available],,,,"Final",,Scopus,2-s2.0-84956692466
"Turner II C.G., Nichol C.R., Scott G.R.","","Scoring procedures for key morphological traits of the permanent dentition: The Arizona State University dental anthropology system",1991,"Advances in Dental Anthropology",,,,"13","31",,502,,,,"Turner II, C.G.; Nichol, C.R.; Scott, G.R.",[No abstract available],,,,,,Scopus,2-s2.0-0001811734
"Weidenreich F.","","The skull of Sinanthropus pekinensis: A comparative study on a primitive hominid skull",1943,"Palaeontologia Sinica","10",,,"1","484",,339,,,,"Weidenreich, F.",[No abstract available],,,,,,Scopus,2-s2.0-0003115952
"Antón S.C.","7005809473;","Natural History of Homo erectus",2003,"American Journal of Physical Anthropology","122","SUPPL. 46",,"126","170",,310,"10.1002/ajpa.10399","https://www.scopus.com/inward/record.uri?eid=2-s2.0-0942301483&doi=10.1002%2fajpa.10399&partnerID=40&md5=1b397b1c832190d7131ea68dfe735edf","Department of Anthropology, New York University, New York, NY 10003, United States; Department of Anthropology, New York University, 25 Waverly Place, New York, NY 10003, United States","Antón, S.C., Department of Anthropology, New York University, New York, NY 10003, United States, Department of Anthropology, New York University, 25 Waverly Place, New York, NY 10003, United States","Our view of H. erectus is vastly different today than when Pithecanthropus erectus was described in 1894. Since its synonimization into Homo, views of the species and its distribution have varied from a single, widely dispersed, polytypic species ultimately ancestral to all later Homo, to a derived, regional isolate ultimately marginal to later hominin evolution. A revised chronostratigraphic framework and recent work bearing either directly or indirectly on reconstructions of life-history patterns are reviewed here and, together with a review of the cranial and postcranial anatomy of H. erectus, are used to generate a natural history of the species. Here I argue that H. erectus is a hominin, notable for its increased body size, that originates in the latest Pliocene/earliest Pleistocene of Africa and quickly disperses into Western and Eastern Asia. It is also an increasingly derived hominin with several regional morphs sustained by intermittent isolation, particularly in Southeast Asia. This view differs from several current views, most especially that which recognizes only a single hominin species in the Pleistocene, H. sapiens, and those which would atomize H. erectus into a multiplicity of taxa. Following Jolly ([2001] Yrbk Phys Anthropol 44:177-204), the regional morphs of H. erectus may be productively viewed as geographically replacing allotaxa, rather than as the focus of unresolvable species debates. Such a view allows us to focus on the adaptations and biology of local groups, including questions of biogeographic isolation and local adaptation. A number of issues remain unresolved, including the significance of diversity in size and shape in the early African and Georgian records. © 2003 Wiley-Liss, Inc.","Africa; China; Dispersal; H. ergaster; Indonesia; Life history","anatomical variation; anatomy; biodiversity; biogeographic region; chronosequence; evolution; evolutionary adaptation; geographic distribution; history; hominid; homo erectus; human; life history; Pliocene; review; stratigraphy; Homo erectus; Homo sapiens; Pithecanthropus",Review,"Final",,Scopus,2-s2.0-0942301483
"Spoor C.F., Zonneveld F.W., Macho G.A.","6701714814;7004905270;7003284673;","Linear measurements of cortical bone and dental enamel by computed tomography: Applications and problems",1993,"American Journal of Physical Anthropology","91","4",,"469","484",,295,"10.1002/ajpa.1330910405","https://www.scopus.com/inward/record.uri?eid=2-s2.0-0027162186&doi=10.1002%2fajpa.1330910405&partnerID=40&md5=c09bc0c345ed41923ea30824c93b9bd5","Hominid Palaeontology Research Group, Department of Human Anatomy and Cell Biology, University of Liverpool, Liverpool, L69 3BX, United Kingdom; Department of Radiology, Utrecht University Hospital, Netherlands","Spoor, C.F., Hominid Palaeontology Research Group, Department of Human Anatomy and Cell Biology, University of Liverpool, Liverpool, L69 3BX, United Kingdom; Zonneveld, F.W., Department of Radiology, Utrecht University Hospital, Netherlands; Macho, G.A., Hominid Palaeontology Research Group, Department of Human Anatomy and Cell Biology, University of Liverpool, Liverpool, L69 3BX, United Kingdom","This paper explores the potential of high‐resolution computed tomography (CT) as a morphometric tool in paleoanthropology. The accuracy of linear measurements of enamel thickness and cortical bone thickness taken from CT scans is evaluated by making comparison with measurements taken directly from physical sections. The measurements of cortical bone are taken on extant and fossil specimens with and without attached matrix, and the dental specimens studied include a sample of 12 extant human molars. Local CT numbers (representing X‐ray, attenuation) are used to determine the exact position of the boundaries of a structure. Using this technique most studied dimensions, including four of human molar enamel thickness, could be obtained from CT scans with a maximum error range of ±0.1 mm. The limitations of the method are discussed with special reference to problems associated with highly mineralized fossils. © 1993 Wiley‐Liss, Inc. Copyright © 1993 Wiley‐Liss, Inc., A Wiley Company","CT scans; Dimensions; Fossils; Long bones; Morphometry; Teeth","article; computer assisted tomography; controlled study; enamel; fossil; human; human tissue; long bone; molar tooth; morphometrics; paleoanthropology; tooth; Animal; Anthropology, Physical; Anthropometry; Bone and Bones; Cuspid; Dental Enamel; Fossils; Human; Humerus; Incisor; Molar; Tibia; Tomography, X-Ray Computed",Article,"Final",,Scopus,2-s2.0-0027162186
"Mitteroecker P., Bookstein F.","6507135382;7004606384;","Linear Discrimination, Ordination, and the Visualization of Selection Gradients in Modern Morphometrics",2011,"Evolutionary Biology","38","1",,"100","114",,258,"10.1007/s11692-011-9109-8","https://www.scopus.com/inward/record.uri?eid=2-s2.0-79952312407&doi=10.1007%2fs11692-011-9109-8&partnerID=40&md5=a203885ed176c161d1e98b742aeefbfc","Department of Theoretical Biology, University of Vienna, Althanstrasse 14, 1091 Vienna, Austria; Department of Anthropology, University of Vienna, Althanstrasse 14, 1091 Vienna, Austria; Department of Statistics, University of Washington, Padelford B-207, Seattle, WA 98195-4322, United States","Mitteroecker, P., Department of Theoretical Biology, University of Vienna, Althanstrasse 14, 1091 Vienna, Austria; Bookstein, F., Department of Anthropology, University of Vienna, Althanstrasse 14, 1091 Vienna, Austria, Department of Statistics, University of Washington, Padelford B-207, Seattle, WA 98195-4322, United States","Linear discriminant analysis (LDA) is a multivariate classification technique frequently applied to morphometric data in various biomedical disciplines. Canonical variate analysis (CVA), the generalization of LDA for multiple groups, is often used in the exploratory style of an ordination technique (a low-dimensional representation of the data). In the rare case when all groups have the same covariance matrix, maximum likelihood classification can be based on these linear functions. Both LDA and CVA require full-rank covariance matrices, which is usually not the case in modern morphometrics. When the number of variables is close to the number of individuals, groups appear separated in a CVA plot even if they are samples from the same population. Hence, reliable classification and assessment of group separation require many more organisms than variables. A simple alternative to CVA is the projection of the data onto the principal components of the group averages (between-group PCA). In contrast to CVA, these axes are orthogonal and can be computed even when the data are not of full rank, such as for Procrustes shape coordinates arising in samples of any size, and when covariance matrices are heterogeneous. In evolutionary quantitative genetics, the selection gradient is identical to the coefficient vector of a linear discriminant function between the populations before vs. after selection. When the measured variables are Procrustes shape coordinates, discriminant functions and selection gradients are vectors in shape space and can be visualized as shape deformations. Except for applications in quantitative genetics and in classification, however, discriminant functions typically offer no interpretation as biological factors. © 2011 Springer Science+Business Media, LLC.","Canonical variate analysis; Linear discriminant function; Ordination; Principal component analysis; Procrustes; Selection gradient",,Article,"Final",,Scopus,2-s2.0-79952312407
"Macchiarelli R., Bondioli L., Debénath A., Mazurier A., Tournepiche J.-F., Birch W., Dean M.C.","6701717392;56013040100;6603070223;15725533700;6505766948;15724592300;7201596226;","How Neanderthal molar teeth grew",2006,"Nature","444","7120",,"748","751",,178,"10.1038/nature05314","https://www.scopus.com/inward/record.uri?eid=2-s2.0-33845660692&doi=10.1038%2fnature05314&partnerID=40&md5=2f5f1e2c99276d53d15616fbcc86b9e7","Laboratoire de Géobiologie, Biochronologie et Paléontologie Humaine, UMR 6046 CNRS, Université de Poitiers, 86022 Poitiers, France; Sezione di Antropologia, Museo Nazionale Preistorico Etnografico 'L. Pigorini', 00144 Rome, Italy; Université de Perpignan, 66000 Perpignan, France; Etudes Recherches Matériaux, 86022 Poitiers, France; Musée d'Angoulême, 16000 Angoulême, France; UMR 5199 CNRS, Université Bordeaux 1, 33405 Bordeaux, France; Department of Anatomy and Developmental Biology, University College London, London WC1E 6BT, United Kingdom","Macchiarelli, R., Laboratoire de Géobiologie, Biochronologie et Paléontologie Humaine, UMR 6046 CNRS, Université de Poitiers, 86022 Poitiers, France; Bondioli, L., Sezione di Antropologia, Museo Nazionale Preistorico Etnografico 'L. Pigorini', 00144 Rome, Italy; Debénath, A., Université de Perpignan, 66000 Perpignan, France; Mazurier, A., Laboratoire de Géobiologie, Biochronologie et Paléontologie Humaine, UMR 6046 CNRS, Université de Poitiers, 86022 Poitiers, France, Etudes Recherches Matériaux, 86022 Poitiers, France; Tournepiche, J.-F., Musée d'Angoulême, 16000 Angoulême, France, UMR 5199 CNRS, Université Bordeaux 1, 33405 Bordeaux, France; Birch, W., Department of Anatomy and Developmental Biology, University College London, London WC1E 6BT, United Kingdom; Dean, M.C., Department of Anatomy and Developmental Biology, University College London, London WC1E 6BT, United Kingdom","Growth and development are both fundamental components of demographic structure and life history strategy. Together with information about developmental timing they ultimately contribute to a better understanding of Neanderthal extinction. Primate molar tooth development tracks the pace of life history evolution most closely, and tooth histology reveals a record of birth as well as the timing of crown and root growth. High-resolution micro-computed tomography now allows us to image complex structures and uncover subtle differences in adult tooth morphology that are determined early in embryonic development. Here we show that the timing of molar crown and root completion in Neanderthals matches those known for modern humans but that a more complex enamel-dentine junction morphology and a late peak in root extension rate sets them apart. Previous predictions about Neanderthal growth, based only on anterior tooth surfaces, were necessarily speculative. These data are the first on internal molar microstructure; they firmly place key Neanderthal life history variables within those known for modern humans. ©2006 Nature Publishing Group.",,"embryonic development; growth rate; histology; morphology; primate; tomography; tooth; article; computer assisted tomography; deciduous tooth; dentin; enamel; growth curve; hominid; human; image reconstruction; molar tooth; neanderthal; paleoanthropology; priority journal; three dimensional imaging; tissue structure; tooth development; tooth root; Benelux; Eurasia; Europe; Netherlands; Western Europe; Primates",Article,"Final",,Scopus,2-s2.0-33845660692
"van der Geer A., Lyras G., de Vos J., Dermitzakis M.","8977071200;6508217046;35950638700;6602552579;","Evolution of Island Mammals: Adaptation and Extinction of Placental Mammals on Islands",2010,"Evolution of Island Mammals: Adaptation and Extinction of Placental Mammals on Islands",,,,"","",479,164,"10.1002/9781444323986","https://www.scopus.com/inward/record.uri?eid=2-s2.0-84865236073&doi=10.1002%2f9781444323986&partnerID=40&md5=35487c96f18c421a7a2f5f515e460294","Netherlands Centre for Biodiversity Naturalis, Postbus 9517, 2300 RA Leiden, Netherlands; Museum of Geology and Paleontology, National and Kapodistrian, University of Athens, Panepistimiopolis, 15784 Zografou, Greece","van der Geer, A., Netherlands Centre for Biodiversity Naturalis, Postbus 9517, 2300 RA Leiden, Netherlands; Lyras, G., Museum of Geology and Paleontology, National and Kapodistrian, University of Athens, Panepistimiopolis, 15784 Zografou, Greece; de Vos, J., Netherlands Centre for Biodiversity Naturalis, Postbus 9517, 2300 RA Leiden, Netherlands; Dermitzakis, M., Museum of Geology and Paleontology, National and Kapodistrian, University of Athens, Panepistimiopolis, 15784 Zografou, Greece","Evolution on islands differs in a number of important ways from evolution on mainland areas. Over millions of years of isolation, exceptional and sometimes bizarre mammals evolved on islands, such as pig-sized elephants and hippos, giant rats and gorilla-sized lemurs that would have been formidable to their mainland ancestors. This timely and innovative book is the first to offer a much-needed synthesis of recent advances in the exciting field of the evolution and extinction of fossil insular placental mammals. It provides a comprehensive overview of current knowledge on fossil island mammals worldwide, ranging from the Oligocene to the onset of the Holocene. The book addresses evolutionary processes and key aspects of insular mammal biology, exemplified by a variety of fossil species. The authors discuss the human factor in past extinction events and loss of insular biodiversity. This accessible and richly illustrated textbook is written for graduate level students and professional researchers in evolutionary biology, palaeontology, biogeography, zoology, and ecology. © 2010 Alexandra van der Geer, George Lyras, John de Vos, Michael Dermitzakis.",,,Book,"Final",,Scopus,2-s2.0-84865236073
