Authors,Author(s) ID,Title,Year,Source title,Volume,Issue,Art. No.,Page start,Page end,Page count,Cited by,DOI,Link,Affiliations,Authors with affiliations,Abstract,Author Keywords,Index Keywords,Document Type,Publication Stage,Access Type,Source,EID
"Bookstein F.L.","",[No title available],1991,"Morphometric Tools for Landmark Data: Geometry and Biology",,,,"","",,3980,,,,"Bookstein, F.L.",[No abstract available],,,,,,Scopus,2-s2.0-0003597817
"Dryden I.L., Mardia K.V.","",[No title available],1998,"Statistical Shape Analysis",,,,"","",,2639,,,,"Dryden, I.L.; Mardia, K.V.",[No abstract available],,,,,,Scopus,2-s2.0-0003489720
"Klingenberg C.P.","7004588456;","MorphoJ: An integrated software package for geometric morphometrics",2011,"Molecular Ecology Resources","11","2",,"353","357",,1769,"10.1111/j.1755-0998.2010.02924.x","https://www.scopus.com/inward/record.uri?eid=2-s2.0-78650839801&doi=10.1111%2fj.1755-0998.2010.02924.x&partnerID=40&md5=d30b5ebcfc053aa3854553146529e97f","Faculty of Life Sciences, University of Manchester, Michael Smith Building, Manchester M13 9PT, United Kingdom","Klingenberg, C.P., Faculty of Life Sciences, University of Manchester, Michael Smith Building, Manchester M13 9PT, United Kingdom","Increasingly, data on shape are analysed in combination with molecular genetic or ecological information, so that tools for geometric morphometric analysis are required. Morphometric studies most often use the arrangements of morphological landmarks as the data source and extract shape information from them by Procrustes superimposition. The MorphoJ software combines this approach with a wide range of methods for shape analysis in different biological contexts. The program offers an integrated and user-friendly environment for standard multivariate analyses such as principal components, discriminant analysis and multivariate regression as well as specialized applications including phylogenetics, quantitative genetics and analyses of modularity in shape data. MorphoJ is written in Java and versions for the Windows, Macintosh and Unix/Linux platforms are freely available from © 2010 Blackwell Publishing Ltd.","Geometric morphometrics; Multivariate statistics; Phylogeny; Procrustes superimposition; Quantitative genetics; Shape","article; computer interface; computer program; genetic procedures; instrumentation; multivariate analysis; phylogeny; Genetic Techniques; Multivariate Analysis; Phylogeny; Software; User-Computer Interface",Article,"Final",,Scopus,2-s2.0-78650839801
"Binford L.R.","",[No title available],1981,"Bones: Ancient Men and Modern Myths",,,,"","",,1763,,,,"Binford, L.R.",[No abstract available],,,,,,Scopus,2-s2.0-0003747768
"Core Team R.","",[No title available],2014,"R: A Language and Environment for Statistical Computing",,,,"","",,1305,,,,"Core Team, R.",[No abstract available],,,,"Final",,Scopus,2-s2.0-84965039431
"James Rohlf F., Marcus L.F.","24518567800;7005305240;","A revolution morphometrics",1993,"Trends in Ecology and Evolution","8","4",,"129","132",,1268,"10.1016/0169-5347(93)90024-J","https://www.scopus.com/inward/record.uri?eid=2-s2.0-0242462501&doi=10.1016%2f0169-5347%2893%2990024-J&partnerID=40&md5=14afd83efbc93ae5f62d49a4829a5597","Dept of Ecology and Evolution, State University of New York, Stony Brook, NY 11794-5245, United States; Dept of Biology, Queen's College, CUNY, Flushing, NY 11367, United States","James Rohlf, F., Dept of Ecology and Evolution, State University of New York, Stony Brook, NY 11794-5245, United States; Marcus, L.F., Dept of Biology, Queen's College, CUNY, Flushing, NY 11367, United States","We are now in the midst of a revolution in morphometric methodology. The new approaches are more effective in capturing information about the shape of an organism and result in more powerful statistical procedures for testing for differences in s shape. They are also more effective in enabling a researcher to visualize differences in shape and in suggesting simple traditional measurements that could be used in future studies. In this review we emphasize applications to exploratory studies in taxonomy and evolution. © 1993.",,,Review,"Final",,Scopus,2-s2.0-0242462501
"Bookstein F.L.","7004606384;","Principal Warps: Thin-Plate Splines and the Decomposition of Deformations",1989,"IEEE Transactions on Pattern Analysis and Machine Intelligence","11","6",,"567","585",,1257,"10.1109/34.24792","https://www.scopus.com/inward/record.uri?eid=2-s2.0-79957563017&doi=10.1109%2f34.24792&partnerID=40&md5=cff712aaae68443780d2a30c89a6fd7d","Center for Human Growth and Development, University of Michigan, Ann Arbor, MI 48109, United States","Bookstein, F.L., Center for Human Growth and Development, University of Michigan, Ann Arbor, MI 48109, United States","One conventional tool for interpolating surfaces over scattered data, the thin-plate spline, has an elegant algebra expressing the dependence of the physical bending energy of a thin metal plate on point constraints. For interpolation of a surface over a fixed set of nodes in the plane, the bending energy is a quadratic form in the heights assigned to the surface. The spline is the superposition of eigenvectors of the bending energy matrix, of successively larger physical scales, over a tilted flat plane having no bending energy at all. When these splines are paired, one representing the x-coordinate of another form and the other the y-coordinate, they aid greatly in the modeling of biological shape change as deformation. In this context, the pair becomes an interpolation map from R2 to R2 relating two sets of landmark points. The spline maps decompose, in the same way as the spline surfaces, into a linear part (an affine transformation) together with the superposition of principal warps, which are geometrically independent, affine-free deformations of progressively smaller geometrical scales. The warps decompose an empirical deformation into orthogonal features more or less as a conventional orthogonal functional analysis decomposes the single scene. This paper demonstrates the decomposition of deformations by principal warps, extends the method to deal with curving edges between landmarks, relates this formalism to other applications of splines current in computer vision, and indicates how they might aid in the extraction of features for analysis, comparison, and diagnosis of biological and medical images. © 1989 IEEE","Affine transformations; biharmonic equation; biomedical image analysis; deformation; principal warps; quadratic variation; shape; thin-plate splines; warping",,Article,"Final",,Scopus,2-s2.0-79957563017
"Goodall C.","","Procrustes methods in the statistical analysis of shape",1991,"J. R. Statist. Soc. B","53","2",,"285","339",,1199,,,,"Goodall, C.",[No abstract available],,,,,,Scopus,2-s2.0-0000142472
"Lyell C.","",[No title available],1830,"Principles of Geology",,,,"","",,994,,,,"Lyell, C.",[No abstract available],,,,,,Scopus,2-s2.0-0003982758
"Leakey M.D.","",[No title available],1971,"Olduvai Gorge: Excavations in Beds I and II, 1960-1963","3",,,"","",,555,,,,"Leakey, M.D.",[No abstract available],,,,,,Scopus,2-s2.0-0003471652
"Rohlf F.J.","7003281107;","Shape statistics: Procrustes superimpositions and tangent spaces",1999,"Journal of Classification","16","2",,"197","223",,537,"10.1007/s003579900054","https://www.scopus.com/inward/record.uri?eid=2-s2.0-0033235691&doi=10.1007%2fs003579900054&partnerID=40&md5=afe1b218ad4917ce57cf2dee9936bc68","State University of New York, Stony Brook, NY, United States; Department of Ecology and Evolution, State University of New York, Stony Brook, NY 11794-5245, United States","Rohlf, F.J., State University of New York, Stony Brook, NY, United States, Department of Ecology and Evolution, State University of New York, Stony Brook, NY 11794-5245, United States","The shape of a set of labeled points corresponds to those attributes of the configuration that are invariant to the effects of translation, rotation, and scale. Procrustes distance may be used to compare different shapes and also serve as a metric that may be used to define multidimensional shape spaces. This paper demonstrates that the preshape space of planar triangles Procrustes aligned to a reference triangle corresponds to a unit hemisphere. An overview of methods used as linear approximations of D. G. Kendall's non-Euclidean shape space is given, and the equivalence of several methods based on orthogonal projections is shown. Some problems with approximations based on stereographic projections are also discussed. A simple example using artificial data is included.","Kendall shape space; Multivariate analysis; Partial warps; Preshape space; Tangent space",,Article,"Final",,Scopus,2-s2.0-0033235691
"Rohlf F.J., Corti M.","7003281107;56232198800;","Use of two-block partial least-squares to study covariation in shape",2000,"Systematic Biology","49","4",,"740","753",,459,"10.1080/106351500750049806","https://www.scopus.com/inward/record.uri?eid=2-s2.0-0034351393&doi=10.1080%2f106351500750049806&partnerID=40&md5=f5aaf8597bd3c13104f1b4468125b0ee","Department of Ecology and Evolution, State University of New York, Stony Brook, NY 11794-5245, United States; Dipto. di Biol. Animale e dell'Uomo, Universita' di Roma La Sapienza, via Borelli 50, 00161 Roma, Italy","Rohlf, F.J., Department of Ecology and Evolution, State University of New York, Stony Brook, NY 11794-5245, United States; Corti, M., Dipto. di Biol. Animale e dell'Uomo, Universita' di Roma La Sapienza, via Borelli 50, 00161 Roma, Italy","The relatively new two-block partial least-squares method for analyzing the covariance between two sets of variables is described and contrasted with the well-known method of canonical correlation analysis. Their statistical properties, types of answers, and visualization techniques are discussed. Examples are given to show its usefulness in comparing two sets of variables - especially when one or both of the sets of variables are shape variables from a geometric morphometric study.","Canonical correlation; Covariance; Morphometrics; Mus musculus domesticus; Partial least squares; Plethodon; Visualization","analysis of variance; animal; article; bone; classification; fibula; genetics; histology; humerus; mouse; regression analysis; skull; tibia; ulna; Analysis of Variance; Animals; Bone and Bones; Fibula; Humerus; Least-Squares Analysis; Mice; Skull; Tibia; Ulna",Article,"Final",Open Access,Scopus,2-s2.0-0034351393
"Merton R.K.","",[No title available],1967,"On Theoretical Sociology: Five Essays, Old and New",,,,"","",,410,,,,"Merton, R.K.",[No abstract available],,,,"Final",,Scopus,2-s2.0-0003690534
"Binford L.R.","","Post-Pleistocene adaptations",1968,"New Perspectives in Archaeology",,,,"313","341",,403,,,,"Binford, L.R.",[No abstract available],,,,,,Scopus,2-s2.0-0002888809
"Potts R.","",[No title available],1988,"Early Hominid Activities at Olduvai",,,,"","",,361,,,,"Potts, R.",[No abstract available],,,,,,Scopus,2-s2.0-0004102231
"Blumenschine R.J., Marean C.W., Capaldo S.D.","6602434690;6701351179;6602666562;","Blind tests of inter-analyst correspondence and accuracy in the identification of cut marks, percussion marks, and carnivore tooth marks on bone surfaces",1996,"Journal of Archaeological Science","23","4",,"493","507",,329,"10.1006/jasc.1996.0047","https://www.scopus.com/inward/record.uri?eid=2-s2.0-0000445678&doi=10.1006%2fjasc.1996.0047&partnerID=40&md5=4c7df40a3364740fe2fd6a27de08599e","Department of Anthropology, Rutgers University, P.O. Box 270, New Brunswick, NJ 08903, United States; Department of Anthropology, SUNY at Stony Brook, Stony Brook, NY 11794-4364, United States","Blumenschine, R.J., Department of Anthropology, Rutgers University, P.O. Box 270, New Brunswick, NJ 08903, United States; Marean, C.W., Department of Anthropology, SUNY at Stony Brook, Stony Brook, NY 11794-4364, United States; Capaldo, S.D., Department of Anthropology, Rutgers University, P.O. Box 270, New Brunswick, NJ 08903, United States","We show through blind tests that marks inflicted on bone surfaces by carnivore teeth, hammerstone percussion, and metal knife cutting and scraping can be distinguished with near perfect reliability without scanning electron microscopy or consideration of only conspicuous marks. Using low-cost and high-volume hand lens and low-power light microscope techniques, we determined the presence or absence of conspicuous and inconspicuous marks with 97% three-way correspondence, and diagnosed marks of known origin to actor and effector with 99% accuracy. Novices with less than 3 h training on control collections correctly diagnosed 86% of classic but mainly inconspicuous marks. Novices spending several more hours studying control specimens elevated their diagnostic accuracy on morphologically representative marks to near-expert levels of 95%. Our results show that published cautions about mimicry among cut marks, percussion marks, and carnivore tooth marks are overstated. All types of marks examined can be identified reliably, regardless of conspicuousness. As such, fully standardized comparisons of mark frequencies can be drawn among assemblages, even those documented by different analysts. However, such robust interpretations can be attained only if analysts base diagnoses on (a) a firm familiarity with bones marked under strictly controlled conditions, (b) the systematic application of published morphological and contextual criteria, and (c) the use of prescribed low-power magnification techniques. © 1996 Academic Press Limited.","Blind tests; Bone modification; Cut marks; Percussion marks; Taphonomy; Tooth marks; Zooarchaeology",,Article,"Final",,Scopus,2-s2.0-0000445678
"Kendall D.G.","23064672000;","A survey of the statistical theory of shape",1989,"Statistical Science","4","2",,"87","99",,313,"10.1214/ss/1177012582","https://www.scopus.com/inward/record.uri?eid=2-s2.0-84972538798&doi=10.1214%2fss%2f1177012582&partnerID=40&md5=0b9fc9f1245e9bdf6540916542f6448c","Churchill College, Department of Pure Mathematics and Mathematical Statistics, University of Cambridge, United Kingdom","Kendall, D.G., Churchill College, Department of Pure Mathematics and Mathematical Statistics, University of Cambridge, United Kingdom","This is a review of the current state of the ""theory of shape"" introduced by the author in 1977. It starts with a definition of ""shape"" for a set of k points in m dimensions. The first task is to identify the shape spaces in which such objects naturally live, and then to examine the probability structures induced on such a shape space by corresponding structures in Rm. Against this theoretical background one formulates and solves statistical problems concerned with shape characteristics of empirical sets of points. Some applications (briefly sketched here) are to archeology, astronomy, geography and physical chemistry. We also outline more recent work on ""size-and-shape,"" on shapes of sets of points in riemannian spaces, and on shape-theoretic aspects of random Delaunay tessellations. © 1989, Institute of Mathematical Statistics. All Rights Reserved.","Central place theory; Convex polygon; Delaunay tessellation; Galaxy; Quasar; Riemannian submersion; Singular tessellation; Spherical triangle; Stochastic physical chemistry; Void",,Article,"Final",Open Access,Scopus,2-s2.0-84972538798
"Behrensmeyer A.K., Gordon K.D., Yanagi G.T.","6701561561;7202357942;6506234638;","Trampling as a cause of bone surface damage and pseudo-cutmarks",1986,"Nature","319","6056",,"768","771",,298,"10.1038/319768a0","https://www.scopus.com/inward/record.uri?eid=2-s2.0-0022473304&doi=10.1038%2f319768a0&partnerID=40&md5=1d2da030c4edd87f00e55eeb11dc880c","Department of Paleobiology, NHB-E207 MRC 121, Smithsonian Institution, Washington, DC 20560, United States; Department of Anthropology, NHB-363 MRC 112, Smithsonian Institution, Washington, DC 20650, United States","Behrensmeyer, A.K., Department of Paleobiology, NHB-E207 MRC 121, Smithsonian Institution, Washington, DC 20560, United States; Gordon, K.D., Department of Anthropology, NHB-363 MRC 112, Smithsonian Institution, Washington, DC 20650, United States; Yanagi, G.T., Department of Paleobiology, NHB-E207 MRC 121, Smithsonian Institution, Washington, DC 20560, United States","There have been many recent observations of trampling and its effect on bone surfaces1-8 as well as some experimental investigation of the process9-14. Although there is known to be a relationship between trampling and scratches on bones, there has been no detailed microscopic comparison with marks made by stone tools. As distinguishing cutmarks from other types of surface features is important in interpreting early hominid behaviour9,14-18 and the entry of humans into the New World 7,19-20, we have examined possible mimics caused by trampling in an attempt to define diagnostic criteria for cutmarks. We find that microscopic features alone are not sufficient evidence to distinguish human-generated cutmarks from the results of trampling. We suggest different lines of evidence which together may achieve this goal. © 1986 Nature Publishing Group.",,"archaeology; experimental investigation; hominid behaviour; New World",Article,"Final",,Scopus,2-s2.0-0022473304
"Olsen S.L., Shipman P.","7202565798;7004475336;","Surface modification on bone: Trampling versus butchery",1988,"Journal of Archaeological Science","15","5",,"535","553",,292,"10.1016/0305-4403(88)90081-7","https://www.scopus.com/inward/record.uri?eid=2-s2.0-0024158146&doi=10.1016%2f0305-4403%2888%2990081-7&partnerID=40&md5=590f523c497b98cf9a67c6b32ae65fb3","Department of Cell Biology and Anatomy, The Johns Hopkins University School of Medicine, 725 North Wolfe Street, Baltimore, MD 21205, United States","Olsen, S.L., Department of Cell Biology and Anatomy, The Johns Hopkins University School of Medicine, 725 North Wolfe Street, Baltimore, MD 21205, United States; Shipman, P., Department of Cell Biology and Anatomy, The Johns Hopkins University School of Medicine, 725 North Wolfe Street, Baltimore, MD 21205, United States","Previous researchers have reported difficulties in distinguishing between surface marks on bone formed by sedimentary abrasion and those inflicted while butchering. Trampling by large ungulates and humans has been credited with producing pseudocut marks: natural alterations to the bone that mimic cultural ones. The purposes of this research are: (1) to re-examine trampling as a taphonomic process, and (2) to suggest criteria useful for distinguishing sedimentary abrasion, including trampling, from butchery. Macroscopic and microscopic comparison of experimentally trampled bones and those which have had soft tissue removed with a flint tool demonstrate significant differences between the surface modifications produced by the two processes. © 1988.","butchery; cut marks; scanning electron microscopy; striations; taphonomy; trampling","bone; butchery; scanning electron microscopy; taphonomy; trampling",Article,"Final",,Scopus,2-s2.0-0024158146
"O'Higgins P., Jones N.","7004722122;57199321878;","Facial growth in Cercocebus torquatus: An application of three-dimensional geometric morphometric techniques to the study of morphological variation",1998,"Journal of Anatomy","193","2",,"251","272",,277,"10.1017/S0021878298003975","https://www.scopus.com/inward/record.uri?eid=2-s2.0-0031724058&doi=10.1017%2fS0021878298003975&partnerID=40&md5=06ba008cc284c3597335154d2f2920d8","Evolutionary Anatomy Unit, Dept. of Anat. and Devmtl. Biology, University College, London, United Kingdom; Dept. of Anat. and Devmtl. Biology, University College London, Rockefeller Building, University Street, London WC1E 6JJ, United Kingdom","O'Higgins, P., Evolutionary Anatomy Unit, Dept. of Anat. and Devmtl. Biology, University College, London, United Kingdom, Dept. of Anat. and Devmtl. Biology, University College London, Rockefeller Building, University Street, London WC1E 6JJ, United Kingdom; Jones, N., Evolutionary Anatomy Unit, Dept. of Anat. and Devmtl. Biology, University College, London, United Kingdom","This paper presents a study of 3-dimensional growth in the facial skeleton of the mangabey, Cercocebus torquatus. The pattern of facial cortical remodelling in this species is already well mapped from an earlier study. In this paper we consider the extent to which these remodelling maps relate to ontogenetic changes in size and shape of the face. This study is based on 31 facial landmarks taken from 49 adult and subadult faces. Our analysis draws on some of the tools of geometric morphometrics and we take this opportunity to describe our implementation of these tools for 3D data. The geometric analysis permits the known remodelling maps to be interpreted in the context of the general pattern of facial growth in this species. We are also able to examine sexual dimorphism in the face of this species and consider the extent to which males and females share similar ontogenetic allometries. Our findings indicate that the general pattern of size-related shape variation during facial growth is more or less identical for males and females up to eruption of the third permanent maxillary molar (M3). After this, ontogenetic allometries appear to diverge. The finding of a common growth allometry that is well approximated for younger specimens by a simple linear model is consistent with the earlier findings of a consistent pattern of facial remodelling up to M3 eruption. We consider the implications of these findings in terms of the potential for these approaches in the study of comparative growth in related species.","Facial remodelling; Geometric morphometrics; Thin plate spline analysis","age; allometry; article; cercocebus; controlled study; craniofacial morphology; face growth; female; geometry; male; molar tooth; nonhuman; ontogeny; priority journal; sex difference; statistical model; three dimensional imaging; Animals; Anthropometry; Bone Remodeling; Cercocebus; Facial Bones; Female; Male; Models, Anatomic; Sex Characteristics; Cercocebus; Cercocebus torquatus",Article,"Final",,Scopus,2-s2.0-0031724058
"Domínguez-Rodrigo M., de Juana S., Galán A.B., Rodríguez M.","6603679662;11839691900;25723149700;57197402162;","A new protocol to differentiate trampling marks from butchery cut marks",2009,"Journal of Archaeological Science","36","12",,"2643","2654",,256,"10.1016/j.jas.2009.07.017","https://www.scopus.com/inward/record.uri?eid=2-s2.0-70349783751&doi=10.1016%2fj.jas.2009.07.017&partnerID=40&md5=a373b089296c5023568181278b5f2d5a","Department of Prehistory, Complutense University, c/Prof. Aranguren s/n, 28040 Madrid, Spain","Domínguez-Rodrigo, M., Department of Prehistory, Complutense University, c/Prof. Aranguren s/n, 28040 Madrid, Spain; de Juana, S., Department of Prehistory, Complutense University, c/Prof. Aranguren s/n, 28040 Madrid, Spain; Galán, A.B., Department of Prehistory, Complutense University, c/Prof. Aranguren s/n, 28040 Madrid, Spain; Rodríguez, M., Department of Prehistory, Complutense University, c/Prof. Aranguren s/n, 28040 Madrid, Spain","Microscopic signatures have previously been used to emphasize the similarities of butchery and trampling marks. The experimental background applied to differentiate both types of marks has been rather limited and authors have sometimes reached conflicting conclusions. This is partly due to methodological reasons: some authors have used very high magnification to examine microscopic features, whereas others have relied on more reduced magnification. Likewise, some experiments have exposed bones to trampling for reduced periods (minutes) whereas others have used longer time periods (hours). The present study stresses that the use of a scanning electronic microscope is not practical for identifying the impact of butchery and trampling marks in complete bone assemblages. It also emphasizes that previous studies have not addressed all the possible variables that could potentially be used to discriminate these marks, nor have they quantified the morphological patterns of each type of mark. Here we present a multivariate analysis of more than a dozen variables and show that butchery and trampling marks have very distinctive microscopic morphology. We advocate the use of a low magnification approach (≤40×), which can enable the analysis of complete assemblages using either hand lenses or binocular lenses. We also show the morphological criteria that differentiate butchery cut marks made with simple and retouched tools. We show that whereas complete discrimination of marks is impossible due to some degree of overlap, the list of criteria derived through multivariate analyses can be confidently used to correctly differentiate butchery and trampling marks in more than 90% of cases. © 2009 Elsevier Ltd. All rights reserved.","Butchery; Cut marks; Equifinality; Multivariate analysis; Retouched flakes; Simple flakes; Trampling marks","archaeological evidence; multivariate analysis; scanning electron microscopy; trampling",Article,"Final",,Scopus,2-s2.0-70349783751
