Authors,Author(s) ID,Title,Year,Source title,Volume,Issue,Art. No.,Page start,Page end,Page count,Cited by,DOI,Link,Affiliations,Authors with affiliations,Abstract,Author Keywords,Index Keywords,Document Type,Publication Stage,Access Type,Source,EID
"Bello S.M., De Groote I., Delbarre G.","10139236300;35791611100;55609071600;","Application of 3-dimensional microscopy and micro-CT scanning to the analysis of Magdalenian portable art on bone and antler",2013,"Journal of Archaeological Science","40","5",,"2464","2476",,46,"10.1016/j.jas.2012.12.016","https://www.scopus.com/inward/record.uri?eid=2-s2.0-84874404546&doi=10.1016%2fj.jas.2012.12.016&partnerID=40&md5=ca02d0ca058114b2039361e0ef6fdcf1","Department of Earth Sciences, The Natural History Museum, Cromwell Road, London SW7 5BD, United Kingdom; Research Centre in Evolutionary Anthropology and Palaeoecology, School of Natural Sciences and Psychology, Liverpool John Moores University, Byrom Street, Liverpool L3 3AF, United Kingdom","Bello, S.M., Department of Earth Sciences, The Natural History Museum, Cromwell Road, London SW7 5BD, United Kingdom; De Groote, I., Department of Earth Sciences, The Natural History Museum, Cromwell Road, London SW7 5BD, United Kingdom, Research Centre in Evolutionary Anthropology and Palaeoecology, School of Natural Sciences and Psychology, Liverpool John Moores University, Byrom Street, Liverpool L3 3AF, United Kingdom; Delbarre, G., Department of Earth Sciences, The Natural History Museum, Cromwell Road, London SW7 5BD, United Kingdom","The appearance of portable artistic objects during the Upper Palaeolithic is characterised by a combination of a wide choice of techniques, use of different materials and a diversity of iconographic expression, with many objects made of bone and antler decorated with animal representations. Taphonomic and experimental approaches have been systematically applied in an effort to understand the technical and artistic procedures followed. In this study, we applied a new combination of 3-dimensional microscopy (focus variation optical microscope) and micro-CT scanning to the analysis of two Magdalenian engraved specimens: a reindeer antler from the site of Neschers (France), engraved with the partial image of a horse in left profile, and a horse metatarsal from Courbet Cave, Penne (France), engraved with a horse head also in left profile. Results of the analysis suggest that both the Neschers and Courbet Cave engravings had been prepared before being carved. The overall contours of the horse body/head were incised first, while anatomical features were added afterwards. In the Neschers case, the incision resulted from the repeated scratching of a previously made incision in order to enlarge the engraving, possibly reflecting the engraver's aesthetic sense. The combination of the techniques used in this study is applicable to fragile or unique archaeological specimens. Micro-CT scanning, in particular, provides non-invasive means for identifying engravings that are obscured by encrusted sediment. The application of these techniques can potentially open new avenues for the authentication, technical and gestural recognition and interpretation of incised forms and artistic creativity. © 2013 Elsevier Ltd.","Courbet Cave; Engraving; Focus variation microscopy; Magdalenian portable art; Micro-CT; Neschers","archaeological evidence; art; bone; Paleolithic; taphonomy; France; Animalia; Equidae; Rangifer tarandus",Article,"Final",,Scopus,2-s2.0-84874404546
"de la Torre I., Benito-Calvo A., Arroyo A., Zupancich A., Proffitt T.","6602367706;16425343900;55356918200;55357114300;55356895900;","Experimental protocols for the study of battered stone anvils from Olduvai Gorge (Tanzania)",2013,"Journal of Archaeological Science","40","1",,"313","332",,46,"10.1016/j.jas.2012.08.007","https://www.scopus.com/inward/record.uri?eid=2-s2.0-84867910797&doi=10.1016%2fj.jas.2012.08.007&partnerID=40&md5=20a2f2536ce2d8709b4a95cc062c9282","Institute of Archaeology, University College London, 31-34 Gordon Square, London WC1H 0PY, United Kingdom; Centro Nacional de Investigación sobre Evolución Humana (CENIEH), Paseo Sierra de Atapuerca S/N, 09002 Burgos, Spain","de la Torre, I., Institute of Archaeology, University College London, 31-34 Gordon Square, London WC1H 0PY, United Kingdom; Benito-Calvo, A., Centro Nacional de Investigación sobre Evolución Humana (CENIEH), Paseo Sierra de Atapuerca S/N, 09002 Burgos, Spain; Arroyo, A., Institute of Archaeology, University College London, 31-34 Gordon Square, London WC1H 0PY, United Kingdom; Zupancich, A., Institute of Archaeology, University College London, 31-34 Gordon Square, London WC1H 0PY, United Kingdom; Proffitt, T., Institute of Archaeology, University College London, 31-34 Gordon Square, London WC1H 0PY, United Kingdom","Percussive activities are highly relevant in the economy of modern hunter-gatherer societies and other primates, and are likely to have been equally important during the Palaeolithic. Despite the potential relevance of percussive activities in the Early Stone Age, attempts to study battered artefacts are still rare. In order to establish protocols of analysis of battered tools, this paper pursues an interdisciplinary approach combining techno-typological, refit, use-wear and GIS studies of experimental anvils from Olduvai Gorge (Tanzania). The main aim is to classify types of damage on battered artefacts according to the percussive task performed, and hence identify patterns that can be used to interpret the Oldowan and Acheulean evidence. Our results indicate that abrasion marks on anvil surfaces are typical of nut cracking, while bone breaking leaves characteristic scars and abrasion marks on the edges of anvils. Pounding of soft materials such as meat and plants also causes battering of anvils, producing morphological and spatial patterns that can be discerned from the heavy breakage of anvils during bipolar flaking. By integrating macroscopic, microscopic and spatial analyses of experimental stone tools, this paper contributes to create a referential framework in which Early Stone Age battered artefacts can be interpreted. © 2012 Elsevier Ltd.","Battered tools; Early Stone Age; GIS; Lithic use wear; Olduvai; Stone anvils","artifact; GIS; hunter-gatherer; morphology; Paleolithic; primate; spatial analysis; Stone Age; tool use; Arusha [Tanzania]; Olduvai Gorge; Tanzania; Primates",Article,"Final",,Scopus,2-s2.0-84867910797
"Braun D.R., Pobiner B.L., Thompson J.C.","23972180300;16319816400;7405817918;","An experimental investigation of cut mark production and stone tool attrition",2008,"Journal of Archaeological Science","35","5",,"1216","1223",,38,"10.1016/j.jas.2007.08.015","https://www.scopus.com/inward/record.uri?eid=2-s2.0-40849127166&doi=10.1016%2fj.jas.2007.08.015&partnerID=40&md5=c4d595a42d093f5c83af50889728db13","Department of Archaeology, University of Cape Town, Private Bag, Rondebosch 7701, South Africa; Department of Anthropology, National Museum of Natural History, Smithsonian Institution, 10th and Constitution Avenue, Washington, DC 20560-0112, United States; School of Human Evolution and Social Change, Arizona State University, Box 872402, Tempe, AZ 85287-2402, United States","Braun, D.R., Department of Archaeology, University of Cape Town, Private Bag, Rondebosch 7701, South Africa; Pobiner, B.L., Department of Anthropology, National Museum of Natural History, Smithsonian Institution, 10th and Constitution Avenue, Washington, DC 20560-0112, United States; Thompson, J.C., School of Human Evolution and Social Change, Arizona State University, Box 872402, Tempe, AZ 85287-2402, United States","In discussions of Paleolithic hominin behavior it is often assumed that cut marks are an unwanted byproduct of butchery activities, and that their production causes the dulling of stone tool edges. It is also presumed that Paleolithic butchers would have refrained from making cut marks to extend the use life of their tools. We conducted a series of butchery experiments designed to test the hypothesis that cut marks affect the use life of tools. Results suggest cut marks are not associated with edge attrition of simple flake tools, and therefore it is unlikely that Paleolithic butchers would have avoided contact between bone surfaces and tool edges. Edge attrition is, however, significantly greater during skinning and disarticulation than during defleshing. This suggests that skinning and disarticulation activities would require more tool edges relative to butchery events focused purely on defleshing. Differences between the number of cut-marked bones relative to the number of stone artifacts deposited at taphonomically comparable archaeological localities may be explicable in terms of different types of butchery activities conducted there, rather than strictly the timing of carcass access by hominins. Archaeological localities with higher artifact discard rates relative to raw material availability may represent an emphasis on activities associated with higher edge attrition (e.g. skinning or disarticulation). © 2007 Elsevier Ltd. All rights reserved.","Actualistic study; Butchery; Cut marks; Stone tools; Use life","experimental study; hominid; hypothesis testing; Paleolithic; tool use",Article,"Final",,Scopus,2-s2.0-40849127166
"Hiscock P.","","Looking the other way. A materialist/technological approach to classifying tools and implements, cores and retouched flakes",2007,"Tools Versus Cores: Alternative Approaches to Stone Tool Analysis",,,,"198","222",,38,,,,"Hiscock, P.",[No abstract available],,,,"Final",,Scopus,2-s2.0-43449086719
"Yravedra J., Maté-González M.Á., Palomeque-González J.F., Aramendi J., Estaca-Gómez V., San Juan Blazquez M., García Vargas E., Organista E., González-Aguilera D., Arriaza M.C., Cobo-Sánchez L., Gidna A., Uribelarrea Del Val D., Baquedano E., Mabulla A., Domínguez-Rodrigo M.","56962776200;56780291300;56780262200;55827562600;57188553158;57192960468;57192955709;55839096100;24477009700;56786056800;55826172800;55123224100;6507093504;36237883200;18133831000;6603679662;","A new approach to raw material use in the exploitation of animal carcasses at BK (Upper Bed II, Olduvai Gorge, Tanzania): a micro-photogrammetric and geometric morphometric analysis of fossil cut marks",2017,"Boreas","46","4",,"860","873",,37,"10.1111/bor.12224","https://www.scopus.com/inward/record.uri?eid=2-s2.0-85009477629&doi=10.1111%2fbor.12224&partnerID=40&md5=4397bdf09c627b4a8fea02d8f62d6e9b","Department of Prehistory, Complutense University, Prof. Aranguren s/n, Madrid, 28040, Spain; IDEA (Institute of Evolution in Africa), Covarrubias 36, Madrid, 28010, Spain; Department of Cartography and Terrain Engineering, Polytechnic School of Avila, University of Salamanca, Hornos Caleros 50, Avila, 05003, Spain; C.A.I. Arqueometría y Análisis Arqueológico, Complutense University, Prof. Aranguren s/n, Madrid, 28040, Spain; Archaeology Museum, Dar es Salaam, Tanzania; Department of Geodynamic, Complutense University, Avda. Complutense, Madrid, Spain; Museo Arqueológico Regional, Plaza de las Bernardas s/n, Alcalá de Henares, Madrid, 28801, Spain; Archaeology Unit, University of Dar es Salaam, P.O. Box 35050, Dar es Salaam, Tanzania","Yravedra, J., Department of Prehistory, Complutense University, Prof. Aranguren s/n, Madrid, 28040, Spain, IDEA (Institute of Evolution in Africa), Covarrubias 36, Madrid, 28010, Spain; Maté-González, M.Á., Department of Cartography and Terrain Engineering, Polytechnic School of Avila, University of Salamanca, Hornos Caleros 50, Avila, 05003, Spain, C.A.I. Arqueometría y Análisis Arqueológico, Complutense University, Prof. Aranguren s/n, Madrid, 28040, Spain; Palomeque-González, J.F., Department of Prehistory, Complutense University, Prof. Aranguren s/n, Madrid, 28040, Spain; Aramendi, J., Department of Prehistory, Complutense University, Prof. Aranguren s/n, Madrid, 28040, Spain, IDEA (Institute of Evolution in Africa), Covarrubias 36, Madrid, 28010, Spain; Estaca-Gómez, V., Department of Prehistory, Complutense University, Prof. Aranguren s/n, Madrid, 28040, Spain; San Juan Blazquez, M., Department of Prehistory, Complutense University, Prof. Aranguren s/n, Madrid, 28040, Spain; García Vargas, E., Department of Prehistory, Complutense University, Prof. Aranguren s/n, Madrid, 28040, Spain; Organista, E., Department of Prehistory, Complutense University, Prof. Aranguren s/n, Madrid, 28040, Spain, IDEA (Institute of Evolution in Africa), Covarrubias 36, Madrid, 28010, Spain; González-Aguilera, D., Department of Cartography and Terrain Engineering, Polytechnic School of Avila, University of Salamanca, Hornos Caleros 50, Avila, 05003, Spain; Arriaza, M.C., IDEA (Institute of Evolution in Africa), Covarrubias 36, Madrid, 28010, Spain; Cobo-Sánchez, L., Department of Prehistory, Complutense University, Prof. Aranguren s/n, Madrid, 28040, Spain, IDEA (Institute of Evolution in Africa), Covarrubias 36, Madrid, 28010, Spain; Gidna, A., Archaeology Museum, Dar es Salaam, Tanzania; Uribelarrea Del Val, D., Department of Geodynamic, Complutense University, Avda. Complutense, Madrid, Spain; Baquedano, E., IDEA (Institute of Evolution in Africa), Covarrubias 36, Madrid, 28010, Spain, Museo Arqueológico Regional, Plaza de las Bernardas s/n, Alcalá de Henares, Madrid, 28801, Spain; Mabulla, A., Archaeology Unit, University of Dar es Salaam, P.O. Box 35050, Dar es Salaam, Tanzania; Domínguez-Rodrigo, M., Department of Prehistory, Complutense University, Prof. Aranguren s/n, Madrid, 28040, Spain, IDEA (Institute of Evolution in Africa), Covarrubias 36, Madrid, 28010, Spain","The use of innovative techniques such as micro-photogrammetry and geometric morphometrics may have a major impact on the differentiation of cut marks made with different raw materials and, thus, link butchering processes with stone tool reduction sequences. This work focuses on a sample of cut-marked bones from the Bell's Korongo (BK) site (Upper Bed II, Olduvai Gorge, Tanzania), which is an emblematic early Pleistocene site where a large faunal assemblage, including a diverse megafauna, occurs in association with quartzite and basalt industries. We present a detailed study of a sample of 58 cut marks identified on a set of recently excavated BK fossils, using a micro-photogrammetric and geometric morphometric approach, with the aim of identifying the raw materials used in the butchery of carcasses. In order to carry out this study, we previously carried out an experimental analysis to characterize cut marks and their morphology according to the types of raw material found at BK, namely quartzite and basalt. The results from the experimental study show that there is a good fit between raw material type and cut mark morphology, enabling us to confidently apply this method to the analysis of the cut marks of the BK fossil assemblage. The present study shows that most of the BK cut marks were created by the use of quartzite tools. The efficiency of this type of raw material is emphasized, which explains its curation over the landscape by hominins. © 2017 Collegium Boreas. Published by John Wiley & Sons Ltd",,"fauna; fossil record; hominid; morphology; morphometry; photogrammetry; Pleistocene; Arusha [Tanzania]; Olduvai Gorge; Tanzania; Animalia",Article,"Final",,Scopus,2-s2.0-85009477629
"Monteiro L.R., Bordin B., Furtado dos Reis S.","7103010498;6505819110;7004642148;","Shape distances, shape spaces and the comparison of morphometric methods",2000,"Trends in Ecology and Evolution","15","6",,"217","220",,33,"10.1016/S0169-5347(99)01775-9","https://www.scopus.com/inward/record.uri?eid=2-s2.0-0034115377&doi=10.1016%2fS0169-5347%2899%2901775-9&partnerID=40&md5=d8fac2531302a3fb82b09826cc8a8d83","Laboratório de Ciências Ambientais-CBB, Universidade Estadual do Norte Fluminense, Fluminense, Av. Alberto Lamego 2000 Horto, Campos dos Goytacazes Rio de Janeiro, 28015-620, Brazil; Departamento de Matemática, Universidade Estadual de Campinas, Caixa Postal 6065, 13083-970 Campinas São Paulo, Brazil; Departamento de Parasitologia, Universidade Estadual de Campinas, Caixa Postal 6109, 13083-970 Campinas São Paulo, Brazil","Monteiro, L.R., Laboratório de Ciências Ambientais-CBB, Universidade Estadual do Norte Fluminense, Fluminense, Av. Alberto Lamego 2000 Horto, Campos dos Goytacazes Rio de Janeiro, 28015-620, Brazil; Bordin, B., Laboratório de Ciências Ambientais-CBB, Universidade Estadual do Norte Fluminense, Fluminense, Av. Alberto Lamego 2000 Horto, Campos dos Goytacazes Rio de Janeiro, 28015-620, Brazil, Departamento de Matemática, Universidade Estadual de Campinas, Caixa Postal 6065, 13083-970 Campinas São Paulo, Brazil; Furtado dos Reis, S., Departamento de Parasitologia, Universidade Estadual de Campinas, Caixa Postal 6109, 13083-970 Campinas São Paulo, Brazil",[No abstract available],,"geometry; mathematical analysis; measurement; morphogenesis; morphometrics; note; simulation",Short Survey,"Final",,Scopus,2-s2.0-0034115377
"Arriaza M.C., Yravedra J., Domínguez-Rodrigo M., Mate-González M.Á., García Vargas E., Palomeque-González J.F., Aramendi J., González-Aguilera D., Baquedano E.","56786056800;56962776200;6603679662;56780291300;57192955709;56780262200;55827562600;24477009700;36237883200;","On applications of micro-photogrammetry and geometric morphometrics to studies of tooth mark morphology: The modern Olduvai Carnivore Site (Tanzania)",2017,"Palaeogeography, Palaeoclimatology, Palaeoecology","488",,,"103","112",,32,"10.1016/j.palaeo.2017.01.036","https://www.scopus.com/inward/record.uri?eid=2-s2.0-85013104677&doi=10.1016%2fj.palaeo.2017.01.036&partnerID=40&md5=3213d5495d4aa07af2429d75ced9d9cb","School of Geography, Archaeology and Environmental Studies, Evolutionary Studies Institute, University of the Witwatersrand, Private Bag 32050, South Africa; Institute of Evolution in Africa (IDEA), Covarrubias 36, Madrid, 28010, Spain; Department of Prehistory, Complutense University, Madrid, 28040, Spain; Real Colegio Complutense at Harvard, 26 Trowbridge Street, Cambridge, MA  02138, United States; C.A.I. Arqueometry and Archaeological Analysis, Complutense University, Profesor Aranguren s/n, Madrid, 28040, Spain; Department of Cartographic and Land Engineering, Polytechnic School of Avila, University of Salamanca, Hornos Caleros 50, Avila, 05003, Spain; Museo Arqueológico Regional, Plaza de las Bernardas, Alcalá de Henares, Madrid, Spain","Arriaza, M.C., School of Geography, Archaeology and Environmental Studies, Evolutionary Studies Institute, University of the Witwatersrand, Private Bag 32050, South Africa, Institute of Evolution in Africa (IDEA), Covarrubias 36, Madrid, 28010, Spain; Yravedra, J., Institute of Evolution in Africa (IDEA), Covarrubias 36, Madrid, 28010, Spain, Department of Prehistory, Complutense University, Madrid, 28040, Spain; Domínguez-Rodrigo, M., Institute of Evolution in Africa (IDEA), Covarrubias 36, Madrid, 28010, Spain, Department of Prehistory, Complutense University, Madrid, 28040, Spain, Real Colegio Complutense at Harvard, 26 Trowbridge Street, Cambridge, MA  02138, United States; Mate-González, M.Á., C.A.I. Arqueometry and Archaeological Analysis, Complutense University, Profesor Aranguren s/n, Madrid, 28040, Spain, Department of Cartographic and Land Engineering, Polytechnic School of Avila, University of Salamanca, Hornos Caleros 50, Avila, 05003, Spain; García Vargas, E., Department of Prehistory, Complutense University, Madrid, 28040, Spain; Palomeque-González, J.F., Department of Prehistory, Complutense University, Madrid, 28040, Spain; Aramendi, J., Institute of Evolution in Africa (IDEA), Covarrubias 36, Madrid, 28010, Spain, Department of Prehistory, Complutense University, Madrid, 28040, Spain; González-Aguilera, D., Department of Cartographic and Land Engineering, Polytechnic School of Avila, University of Salamanca, Hornos Caleros 50, Avila, 05003, Spain; Baquedano, E., Institute of Evolution in Africa (IDEA), Covarrubias 36, Madrid, 28010, Spain, Museo Arqueológico Regional, Plaza de las Bernardas, Alcalá de Henares, Madrid, Spain","Recent application of photogrammetric and geometric morphometric approaches to the study of cut marks on bones has yielded positive results in discriminating different types of tools and even some raw materials. Here, we apply this analytical technique to the study of carnivore tooth scores. The goal is twofold: on the one hand, we intend to differentiate carnivore types and on the other one, we show the application of this approach to a sample of tooth scores from long bones documented at the modern assemblage of the Olduvai Carnivore Site (OCS). Previous taphonomic work at OCS suggested that this bone assemblage constituted a good evidence of a carcass accumulation behavior by lions, followed by hyena ravaging. The application of these 3D techniques to the selected sample of tooth marks shows that lions, as well as spotted hyenas, did indeed impart marks on the OCS assemblage. This reinforces the dual nature of the assemblage and the implication of lions in its formation. © 2017 Elsevier B.V.","Den; Hyena; Lion; Score; Taphonomy","analytical method; bone; felid; fossil assemblage; geometry; morphology; morphometry; Olduvai event; paleoecology; photogrammetry; taphonomy; tooth; Tanzania; Crocuta crocuta",Article,"Final",,Scopus,2-s2.0-85013104677
"Merritt S.R.","56600134900;","Factors affecting Early Stone Age cut mark cross-sectional size: Implications from actualistic butchery trials",2012,"Journal of Archaeological Science","39","9",,"2984","2994",,32,"10.1016/j.jas.2012.04.036","https://www.scopus.com/inward/record.uri?eid=2-s2.0-84862125000&doi=10.1016%2fj.jas.2012.04.036&partnerID=40&md5=071a55b67deec03f86091355cf5a656d","Department of Anthropology, Rutgers University, Ruth Adams Building, 3rd Floor, 131 George St., New Brunswick, NJ 09801-1414, United States","Merritt, S.R., Department of Anthropology, Rutgers University, Ruth Adams Building, 3rd Floor, 131 George St., New Brunswick, NJ 09801-1414, United States","Early Stone Age cut marks are byproducts of hominins' tool-assisted animal carcass consumption and provide a potential avenue of inference into the paleoecology of hominin carnivory. If diagnostic cut mark characteristics can be linked to flake and core tool use or the completion of distinct butchery actions, it may be possible to infer ancient tool preferences, reconstruct the consumption of specific muscular tissues, and illuminate landscape-scale stone resource use. Recently, diagnostic morphological criteria including cut mark width and depth have been used to identify marks made by different classes of experimental and archaeological stone tools (Bello, S.M., Parfitt, S.A., Stringer, C., 2009. Quantitative micromorphological analyses of cut marks produced by ancient and modern handaxes. Journal of Archaeological Science 36: 1869-1880; de Juana, S., Galan, A.B., Dominguez-Rodrigo, M., 2010. Taphonomic identification of cut marks made with lithic handaxes: an experimental study. Journal of Archaeological Science 37: 1841-1850; Dominguez-Rodrigo, M., de Juana, S., Galan, A. B., Rodriguez, M., 2009. A new protocol to differentiate trampling marks from butchery cut marks. Journal of Archaeological Science 36: 2643-2654). The work presented here adds to this experimental butchery database by using measurements of cut mark cross-section taken from bone surface molds to investigate how stone tool characteristics including flake versus core tool type, edge angle, and tool weight, influence cut mark width and depth, ultimately testing whether cut mark size is a useful indicator of tool identity. Additionally, these experiments investigate the influence of contextual factors, including butchery action, carcass size, and bone density on cut mark size. An experienced butcher used replicated Oldowan flakes and bifacial core tools in experimental trials that isolated skinning, bulk and scrap muscle defleshing, and element disarticulation cut marks on goat and cow skeletons. This sample explores cut mark traces generated under realistic butchery scenarios and suggests the following results: 1) Core and flake tools were equally efficient at completing all butchery tasks in size 1 and 3 bovid carcasses. 2) Samples of cut mark width and depth produced by core and flake tools were similar and cut marks could not be accurately classified to a known tool type. 3) Skinning and disarticulation activities produced significantly wider and deeper marks than defleshing activities. 4) Cut marks on cows tended to be wider and deeper than those on goats. 5) Cut mark width is negatively correlated with bone density when carcass size and bone portion are taken into consideration. These results suggest that a general quantitative model for inferring tool type or edge characteristics from archaeological cut mark size is not warranted. © 2012 Elsevier Ltd.","Actualism; Bone density; Butchery action; Cutmarks; ESA tool type; Experimental butchery; Oldowan","archaeological evidence; archaeology; bone; carnivory; database; hominid; morphology; paleoecology; Stone Age; tool use; Animalia; Bovidae; Capra hircus",Article,"Final",,Scopus,2-s2.0-84862125000
