Authors,Author(s) ID,Title,Year,Source title,Volume,Issue,Art. No.,Page start,Page end,Page count,Cited by,DOI,Link,Affiliations,Authors with affiliations,Abstract,Author Keywords,Index Keywords,Document Type,Publication Stage,Access Type,Source,EID
"Yravedra J., Diez-Martín F., Egeland C.P., Maté-González M.Á., Palomeque-González J.F., Arriaza M.C., Aramendi J., García Vargas E., Estaca-Gómez V., Sánchez P., Fraile C., Duque J., de Francisco Rodríguez S., González-Aguilera D., Uribelarrea D., Mabulla A., Baquedano E., Domínguez-Rodrigo M.","56962776200;24823717300;6602411276;56780291300;56780262200;56786056800;55827562600;57192955709;57188553158;24825724000;55274005700;56581502800;57209072932;24477009700;6507093504;18133831000;36237883200;6603679662;","FLK West (Lower Bed II, Olduvai Gorge, Tanzania): a new early Acheulean site with evidence for human exploitation of fauna",2017,"Boreas","46","4",,"816","830",,23,"10.1111/bor.12243","https://www.scopus.com/inward/record.uri?eid=2-s2.0-85017230012&doi=10.1111%2fbor.12243&partnerID=40&md5=a282454942a952065c447146a2b08895","Department of Prehistory, Complutense University, Prof. Aranguren s/n, Madrid, 28040, Spain; IDEA (Institute of Evolution in Africa), Covarrubias 36, Madrid, 28010, Spain; Department of Prehistory and Archaeology, University of Valladolid, Pza. del Campus, s/n, Valladolid, 47011, Spain; Department of Anthropology, University of North Carolina at Greensboro, Greensboro, NC, United States; Department of Cartography and Terrain Engineering, Polytechnic School of Avila, University of Salamanca, Hornos Caleros 50, Avila, 05003, Spain; C.A.I. Arqueometría y Análisis Arqueológico, Complutense University, Prof. Aranguren s/n, Madrid, 28040, Spain; Department of Geodynamic, Complutense University, Avda. Complutense, Madrid, Spain; Archaeology Unit, University of Dar es Salaam, P.O. Box 35050, Dar es Salaam, Tanzania; Museo Arqueológico Regional, Plaza de las Bernardas s/n, Alcalá de Henares, Madrid, 28801, Spain","Yravedra, J., Department of Prehistory, Complutense University, Prof. Aranguren s/n, Madrid, 28040, Spain, IDEA (Institute of Evolution in Africa), Covarrubias 36, Madrid, 28010, Spain; Diez-Martín, F., Department of Prehistory and Archaeology, University of Valladolid, Pza. del Campus, s/n, Valladolid, 47011, Spain; Egeland, C.P., Department of Anthropology, University of North Carolina at Greensboro, Greensboro, NC, United States; Maté-González, M.Á., Department of Cartography and Terrain Engineering, Polytechnic School of Avila, University of Salamanca, Hornos Caleros 50, Avila, 05003, Spain, C.A.I. Arqueometría y Análisis Arqueológico, Complutense University, Prof. Aranguren s/n, Madrid, 28040, Spain; Palomeque-González, J.F., Department of Prehistory, Complutense University, Prof. Aranguren s/n, Madrid, 28040, Spain; Arriaza, M.C., IDEA (Institute of Evolution in Africa), Covarrubias 36, Madrid, 28010, Spain; Aramendi, J., Department of Prehistory, Complutense University, Prof. Aranguren s/n, Madrid, 28040, Spain, IDEA (Institute of Evolution in Africa), Covarrubias 36, Madrid, 28010, Spain; García Vargas, E., Department of Prehistory, Complutense University, Prof. Aranguren s/n, Madrid, 28040, Spain; Estaca-Gómez, V., Department of Prehistory, Complutense University, Prof. Aranguren s/n, Madrid, 28040, Spain; Sánchez, P., Department of Prehistory and Archaeology, University of Valladolid, Pza. del Campus, s/n, Valladolid, 47011, Spain; Fraile, C., Department of Prehistory and Archaeology, University of Valladolid, Pza. del Campus, s/n, Valladolid, 47011, Spain; Duque, J., Department of Prehistory and Archaeology, University of Valladolid, Pza. del Campus, s/n, Valladolid, 47011, Spain; de Francisco Rodríguez, S., Department of Prehistory and Archaeology, University of Valladolid, Pza. del Campus, s/n, Valladolid, 47011, Spain; González-Aguilera, D., Department of Cartography and Terrain Engineering, Polytechnic School of Avila, University of Salamanca, Hornos Caleros 50, Avila, 05003, Spain; Uribelarrea, D., Department of Geodynamic, Complutense University, Avda. Complutense, Madrid, Spain; Mabulla, A., Archaeology Unit, University of Dar es Salaam, P.O. Box 35050, Dar es Salaam, Tanzania; Baquedano, E., IDEA (Institute of Evolution in Africa), Covarrubias 36, Madrid, 28010, Spain, Museo Arqueológico Regional, Plaza de las Bernardas s/n, Alcalá de Henares, Madrid, 28801, Spain; Domínguez-Rodrigo, M., Department of Prehistory, Complutense University, Prof. Aranguren s/n, Madrid, 28040, Spain, IDEA (Institute of Evolution in Africa), Covarrubias 36, Madrid, 28010, Spain","This paper presents a detailed taphonomic study of the faunal assemblage from FLK West (Olduvai Gorge, Tanzania), a site with an Acheulean component that dates to 1.7 Ma. The faunal sample analysed here is distributed in different archaeological levels and is associated with a significant lithic accumulation including several large format tools and handaxes. The fauna indicates the proliferation of open environments similar to those found in other Bed II and late Bed I sites. Evidence of anthropogenic activity (e.g. defleshing activities and marrow consumption) has been identified in the form of cut and percussion marks. A photogrammetric and morphometric analysis suggests that these marks were produced with quartzite flakes and not with handaxes. Evidence of interaction with carnivores was also noted; tooth marks were observed on some bones. Such interaction indicates the existence of competition between humans and carnivores for the same ecological niche, and might lead us to reflect on the survival strategies of Lower Pleistocene hominins. © 2017 Collegium Boreas. Published by John Wiley & Sons Ltd",,"Acheulean; archaeology; exploitation; fauna; hominid; human activity; Pleistocene; taphonomy; Arusha [Tanzania]; Olduvai Gorge; Tanzania",Article,"Final",,Scopus,2-s2.0-85017230012
"Sharpe K., Van Gelder L.","36953623800;15752374800;","Evidence for cave marking by Palaeolithic children",2006,"Antiquity","80","310",,"937","947",,23,"10.1017/S0003598X00094527","https://www.scopus.com/inward/record.uri?eid=2-s2.0-33845763926&doi=10.1017%2fS0003598X00094527&partnerID=40&md5=c441ec6f16734e060988766aadf9a1bf","Graduate College, Union Institute and University, Cincinnati, OH, United States; Harris Manchester College, University of Oxford, Oxford, United Kingdom; 10 Shirelake Close, Oxford OX1 1SN, United Kingdom; Walden University, Minneapolis, MN, United States","Sharpe, K., Graduate College, Union Institute and University, Cincinnati, OH, United States, Harris Manchester College, University of Oxford, Oxford, United Kingdom, 10 Shirelake Close, Oxford OX1 1SN, United Kingdom; Van Gelder, L., Walden University, Minneapolis, MN, United States","Amongst the numerous images found on the walls of Palaeolithic caves, fluted lines, made by fingers dragged through a skin of wet clay remain some of the most intriguing. In their study of images at Rouffignac, the authors undertook experiments with a range of modern subjects who replicated the flutings with their hands. Comparing the dimensions of the experimental flutings with the originals, they conclude that the patterns on the roof of Chamber A1 at Rouffignac were made by the fingers of children aged hetween 2 and 5 years old. Given the current height of the chamber, such children would have needed to be hoisted aloft hy adults. Who knows what lessons in art or ritual were thereby imparted to the young persons...","Cave art; Finger flutings; Palaeolithic; Rouffignac cave","archaeological evidence; art; cave; cultural history; Paleolithic",Article,"Final",,Scopus,2-s2.0-33845763926
"Bonney H.","56016996900;","An investigation of the use of discriminant analysis for the classification of blade edge type from cut marks made by metal and bamboo blades",2014,"American Journal of Physical Anthropology","154","4",,"575","584",,21,"10.1002/ajpa.22558","https://www.scopus.com/inward/record.uri?eid=2-s2.0-84904042270&doi=10.1002%2fajpa.22558&partnerID=40&md5=b73fd110bfd32a88a01871fa98bbed44","Department of Earth Sciences, Natural History Museum, Cromwell Road, London SW7 5BD, United Kingdom","Bonney, H., Department of Earth Sciences, Natural History Museum, Cromwell Road, London SW7 5BD, United Kingdom","Analysis of cut marks in bone is largely limited to two dimensional qualitative description. Development of morphological classification methods using measurements from cut mark cross sections could have multiple uses across palaeoanthropological and archaeological disciplines, where cutting edge types are used to investigate and reconstruct behavioral patterns. An experimental study was undertaken, using porcine bone, to determine the usefulness of discriminant function analysis in classifying cut marks by blade edge type, from a number of measurements taken from their cross-sectional profile. The discriminant analysis correctly classified 86.7% of the experimental cut marks into serrated, non-serrated and bamboo blade types. The technique was then used to investigate a series of cut marks of unknown origin from a collection of trophy skulls from the Torres Strait Islands, to investigate whether they were made by bamboo or metal blades. Nineteen out of twenty of the cut marks investigated were classified as bamboo which supports the non-contemporaneous ethnographic accounts of the knives used for trophy taking and defleshing remains. With further investigation across a variety of blade types, this technique could prove a valuable tool in the interpretation of cut mark evidence from a wide variety of contexts, particularly in forensic anthropology where the requirement for presentation of evidence in a statistical format is becoming increasingly important. © 2014 Wiley Periodicals, Inc.","infinite focus microscopy; Torres Strait Islands; trophy skulls","metal; accuracy; adult; animal tissue; article; bamboo; classification; discriminant analysis; experimental pig; experimental study; island (geological); laceration; measurement; nonhuman; rib; skull; tool use; animal; Australia; biological model; cannibalism; child; devices; discriminant analysis; ethnology; female; human; male; mandible; pathology; physical anthropology; preschool child; swine; technology; weapon; Adult; Animals; Anthropology, Physical; Australia; Cannibalism; Child; Child, Preschool; Discriminant Analysis; Female; Humans; Male; Mandible; Models, Biological; Ribs; Skull; Swine; Technology; Weapons",Article,"Final",,Scopus,2-s2.0-84904042270
"Bunge M.","24789898900;","Analogy between systems",1981,"International Journal of General Systems","7","4",,"221","223",,21,"10.1080/03081078108934823","https://www.scopus.com/inward/record.uri?eid=2-s2.0-0019728525&doi=10.1080%2f03081078108934823&partnerID=40&md5=be6264963d0de46320717a188d04f952","Foundations & Philosophy of Science Unit, McGill University, Montreal, Canada","Bunge, M., Foundations & Philosophy of Science Unit, McGill University, Montreal, Canada","Although analogy is rampant in all cognitive fields, it is seldom defined except as isomorphism a far too special case. The purpose of this paper is to introduce qualitative and quantitative concepts of analogy that can be applied to any pair of systems of known or conjectured composition, environment, and structure. The net result is a definition of the degree of substantial, environmental, and structural analogy between any two concrete systems. The definition is then given a methodological application. © 1981, Taylor & Francis Group. All rights reserved.","Analogy; correct analogy; environmental analogy; structural analogy; substantial analogy; system; total analogy","SYSTEMS SCIENCE AND CYBERNETICS",Article,"Final",,Scopus,2-s2.0-0019728525
"Potter S.L.","","The physics of cutmarks",2005,"Journal of Taphonomy","3","2",,"91","106",,20,,,,"Potter, S.L.",[No abstract available],,,,"Final",,Scopus,2-s2.0-34250847047
"Maté-González M.Á., Yravedra J., Martín-Perea D.M., Palomeque-González J., San-Juan-Blazquez M., Estaca-Gómez V., Uribelarrea D., Álvarez-Alonso D., Cuartero F., González-Aguilera D., Domínguez-Rodrigo M.","56780291300;56962776200;57192089446;56780262200;57192960468;57188553158;6507093504;55320183200;36476024800;24477009700;6603679662;","Flint and Quartzite: Distinguishing Raw Material Through Bone Cut Marks",2018,"Archaeometry","60","3",,"437","452",,18,"10.1111/arcm.12327","https://www.scopus.com/inward/record.uri?eid=2-s2.0-85028314535&doi=10.1111%2farcm.12327&partnerID=40&md5=7935fac98e936d7ec89bc21b83e7d8a2","Department of Cartography and Terrain Engineering, Polytechnic School of Avila, University of Salamanca, Hornos Caleros 50, Avila, 05003, Spain; C.A.I. Arqueometry and Archaeological Analysis, Complutense University, Profesor Aranguren s/n, Madrid, 28040, Spain; Department of Prehistory, Complutense University, Profesor Aranguren s/n, Madrid, 28040, Spain; IDEA (Institute of Evolution in Africa), Origins Museum, Plaza de San Andrés 2, Madrid, 28005, Spain; Geodynamics Department, Complutense University of Madrid, José Antonio Novais 12, Madrid, 28040, Spain; Department of Prehistory, UNED, Madrid, Spain; Department of Archaeology, Autonomous University, Madrid, Spain","Maté-González, M.Á., Department of Cartography and Terrain Engineering, Polytechnic School of Avila, University of Salamanca, Hornos Caleros 50, Avila, 05003, Spain, C.A.I. Arqueometry and Archaeological Analysis, Complutense University, Profesor Aranguren s/n, Madrid, 28040, Spain; Yravedra, J., Department of Prehistory, Complutense University, Profesor Aranguren s/n, Madrid, 28040, Spain, IDEA (Institute of Evolution in Africa), Origins Museum, Plaza de San Andrés 2, Madrid, 28005, Spain; Martín-Perea, D.M., Geodynamics Department, Complutense University of Madrid, José Antonio Novais 12, Madrid, 28040, Spain; Palomeque-González, J., Department of Prehistory, Complutense University, Profesor Aranguren s/n, Madrid, 28040, Spain; San-Juan-Blazquez, M., Department of Prehistory, Complutense University, Profesor Aranguren s/n, Madrid, 28040, Spain; Estaca-Gómez, V., Department of Prehistory, Complutense University, Profesor Aranguren s/n, Madrid, 28040, Spain; Uribelarrea, D., Geodynamics Department, Complutense University of Madrid, José Antonio Novais 12, Madrid, 28040, Spain; Álvarez-Alonso, D., Department of Prehistory, UNED, Madrid, Spain; Cuartero, F., Department of Archaeology, Autonomous University, Madrid, Spain; González-Aguilera, D., C.A.I. Arqueometry and Archaeological Analysis, Complutense University, Profesor Aranguren s/n, Madrid, 28040, Spain; Domínguez-Rodrigo, M., Department of Prehistory, Complutense University, Profesor Aranguren s/n, Madrid, 28040, Spain, IDEA (Institute of Evolution in Africa), Origins Museum, Plaza de San Andrés 2, Madrid, 28005, Spain","Since the 1980s, several experimental analyses have been able to differentiate some lithic tool types and some of their raw materials according to the morphology of cut marks imprinted by such tools when used for butchering activities. Thus, metal tool use has been differentiated in contexts with an abundance of lithic tools, or even the use of hand axes has been documented in carcass processing, in contrast with simple unretouched or retouched flakes. As important as this information is, there are still other important aspects to be analysed. Can cut marks produced with different lithic raw material types be differentiated? Can cut marks made with different types of the same raw material type be characterized and differentiated? The objective of this study is to evaluate if cut marks resulting from the use of different flints and different quartzites are distinguishable from each other. In the present work, an experimental analysis of hundreds of cut marks produced by five types of flint and five varieties of quartzite was carried out. Microphotogrammetry and geometric–morphometric techniques were applied to analyse these cut marks. The results show that flint cut marks and quartzite cut marks can be characterized at the assemblage level. Different types of flint produced cut marks that were not significantly different from each other. Cut marks made with Olduvai Gorge quartzite were significantly different from those produced with a set comprising several other types of quartzites. Crystal size, which is larger in Olduvai Gorge quartzites (0.5 mm) than Spanish quartzites (177–250 μm), is discussed as being the main reason for these statistically significant differences. This documented intra-sample and inter-sample variance does not hinder the resolution of the approach to differentiate between these two generic raw material types and opens the door for the application of this method in archaeological contexts. © 2017 University of Oxford","cut marks; flint; micro-morphometry; micro-photogrammetry; quartzite; raw materials","archaeology; flint; lithic fragment; morphometry; photogrammetry; quartzite; tool use",Article,"Final",,Scopus,2-s2.0-85028314535
"Moretti E., Arrighi S., Boschin F., Crezzini J., Aureli D., Ronchitelli A.","57062036800;14068468600;52263086000;20435708700;47061191200;6508035886;","Using 3D microscopy to analyze experimental cut marks on animal bones produced with different stone tools",2015,"Ethnobiology Letters","6","2",,"267","275",,18,"10.14237/ebl.6.2.2015.349","https://www.scopus.com/inward/record.uri?eid=2-s2.0-84954512333&doi=10.14237%2febl.6.2.2015.349&partnerID=40&md5=b4512b7b8ae636efc10cd1e048ecd51c","Università degli Studi di Siena, Dipartimento di Scienze Fisiche, Della Terra e Dell'Ambiente, Unità di Ricerca Preistoria e Antropologia, Via Laterina 8, Siena, 53100, Italy; CeSQ, Centro Studi Sul Quaternario ONLUS, Via Nuova dell'Ammazzatoio 7, Sansepolcro, Arezzo  I - 52037, Italy; Université Paris Ouest Nanterre La Défense, UMR 7041 - ArScAn, Equipe AnTET, Maison René Ginouvès (MAE), boite no32, 21 allée de l'université, Nanterre Cedex, F-92023, France","Moretti, E., Università degli Studi di Siena, Dipartimento di Scienze Fisiche, Della Terra e Dell'Ambiente, Unità di Ricerca Preistoria e Antropologia, Via Laterina 8, Siena, 53100, Italy; Arrighi, S., Università degli Studi di Siena, Dipartimento di Scienze Fisiche, Della Terra e Dell'Ambiente, Unità di Ricerca Preistoria e Antropologia, Via Laterina 8, Siena, 53100, Italy, CeSQ, Centro Studi Sul Quaternario ONLUS, Via Nuova dell'Ammazzatoio 7, Sansepolcro, Arezzo  I - 52037, Italy; Boschin, F., Università degli Studi di Siena, Dipartimento di Scienze Fisiche, Della Terra e Dell'Ambiente, Unità di Ricerca Preistoria e Antropologia, Via Laterina 8, Siena, 53100, Italy, CeSQ, Centro Studi Sul Quaternario ONLUS, Via Nuova dell'Ammazzatoio 7, Sansepolcro, Arezzo  I - 52037, Italy; Crezzini, J., Università degli Studi di Siena, Dipartimento di Scienze Fisiche, Della Terra e Dell'Ambiente, Unità di Ricerca Preistoria e Antropologia, Via Laterina 8, Siena, 53100, Italy, CeSQ, Centro Studi Sul Quaternario ONLUS, Via Nuova dell'Ammazzatoio 7, Sansepolcro, Arezzo  I - 52037, Italy; Aureli, D., Università degli Studi di Siena, Dipartimento di Scienze Fisiche, Della Terra e Dell'Ambiente, Unità di Ricerca Preistoria e Antropologia, Via Laterina 8, Siena, 53100, Italy, Université Paris Ouest Nanterre La Défense, UMR 7041 - ArScAn, Equipe AnTET, Maison René Ginouvès (MAE), boite no32, 21 allée de l'université, Nanterre Cedex, F-92023, France; Ronchitelli, A., Università degli Studi di Siena, Dipartimento di Scienze Fisiche, Della Terra e Dell'Ambiente, Unità di Ricerca Preistoria e Antropologia, Via Laterina 8, Siena, 53100, Italy","This study uses a combination of digital microscopic analysis and experimental archaeology to assess stone tool cut marks on animal bones. We used two un-retouched flint flakes and two burins to inflict cut marks on fresh, boiled, and dry ungulate bones. The experiment produced three series of three engravings on each bone with each of the experimental tools. The first series involved one single stroke; the second, two strokes in the same direction; and the third, multiple strokes using a to-and-fro movement. We analyzed the striations using a Hirox 3D digital microscope (KH-7700) and collected metric and profile data on the morphology of the cut marks. In order to describe the shape of each cross section, we calculated the ratio between the breadth at the top and the breadth at the floor of cut marks. Preliminary results show that both the tool type and the method of creating the cut mark influence the shape of the resulting groove. In our experiment, morphological parameters can be used to differentiate between marks produced using un-retouched flint flakes and those produced using burins. However, neither morphological nor morphometric analysis allows us to identify the mechanical motion used to produce the cuts, nor the state of the bone (fresh, boiled, or dry) at the moment of marking. © 2015 Society of Ethnobiology.","3D imaging; Cut marks; Digital microscopy; Taphonomy; Zooarchaeology",,Article,"Final",Open Access,Scopus,2-s2.0-84954512333
"Van Gelder L.","15752374800;","Counting the children: The role of children in the production of finger flutings in four upper palaeolithic caves",2015,"Oxford Journal of Archaeology","34","2",,"119","138",,18,"10.1111/ojoa.12052","https://www.scopus.com/inward/record.uri?eid=2-s2.0-84962428749&doi=10.1111%2fojoa.12052&partnerID=40&md5=3a4d5b5b3e7dceffe6b8f2b6b5897f0e","Richard W. Riley College of Education and Leadership, Walden University, Minneapolis, MI, United States","Van Gelder, L., Richard W. Riley College of Education and Leadership, Walden University, Minneapolis, MI, United States","Children and young adults are believed to have represented up to 40 per cent of Upper Palaeolithic populations, yet little is known of their engagement in deep caves besides evidence of their hand and footprints. In this study we examine finger flutings, lines drawn with fingers in soft surfaces, in 12 Franco-Cantabrian Upper Palaeolithic caves to look for forensic evidence of unique individuals. We find evidence of children as finger fluters in four caves (El Castillo, Las Chimeneas, Rouffignac and Gargas). We discuss the types, locations and frequency of their flutings, as well as the relationship between their flutings and those made by non-children in the same caves and chambers. The small number of participants calls into question past theories of children's engagement in ritual and initiation in these particular caves. © 2015 John Wiley & Sons Ltd.",,"archaeological evidence; art; cave; child; Paleolithic; prehistoric; Cantabria; France; Spain",Article,"Final",,Scopus,2-s2.0-84962428749
"Güth A.","55234210500;","Using 3D scanning in the investigation of Upper Palaeolithic engravings: First results of a pilot study",2012,"Journal of Archaeological Science","39","10",,"3105","3114",,18,"10.1016/j.jas.2012.04.029","https://www.scopus.com/inward/record.uri?eid=2-s2.0-84864388370&doi=10.1016%2fj.jas.2012.04.029&partnerID=40&md5=f1b4ba26ba95a9b61cd250fbacda636e","Forschungsinstitut für Archäologie, Römisch-Germanisches Zentralmuseum, Archaeological Research Centre and Museum for the Evolution of Hominin Behaviour, Schloss Monrepos, D- 56567 Neuwied, Germany","Güth, A., Forschungsinstitut für Archäologie, Römisch-Germanisches Zentralmuseum, Archaeological Research Centre and Museum for the Evolution of Hominin Behaviour, Schloss Monrepos, D- 56567 Neuwied, Germany","This paper deals with the reinvestigation of selected engravings on slate plaquettes from the Late Upper Palaeolithic site of Gönnersdorf, Germany, by applying new 3D scanning methods for the first time. The aim of this method is to obtain further information about stylistic aspects of the depictions as well as to identify an inner chronology and interrelationship of the lines. In addition new options of 3D photography are tested as a further visual support of investigation and documentation. Previously analyses were subjective whereas the new interpretation uses impartial metric methods. In the future the more objective results will allow the comparison of engravings and their details, with the aim of discerning different artists as well as obtaining a better understanding of the art of former hunter- gatherer societies. © 2012 Elsevier Ltd.","3D scanning; Engravings; Gönnersdorf; Upper Palaeolithic art","archaeological evidence; art; hunter-gatherer; Paleolithic; photography; three-dimensional modeling; Germany",Article,"Final",,Scopus,2-s2.0-84864388370
